symbol,_id,address,business_scope,chairman,city,descrpt,email,main_business,manager,province,reg_capital,secretary,setup_date,website,company,dividend_startyear,exchange,exchange_,group,groupcode,index_stockid,industry,industrycode,mktcap_norm_cny,pchange_12w,pchange_ytd,price,sector,sectorcode,share_percentage,shares,value,position,change,share_change,impact,abs_impact,split_factor,price_max,price_min,price_avg,change_from_average,portdate,action,comment,oid
002157,2020Q4_1751679,江西省南昌市高新技术开发区艾溪湖一路569号,畜禽饲料、预混料、饲料添加剂的研发、生产和销售(限分支机构经营)(添加剂预混合饲料生产许可证有效期至2025年4月20日止)；畜禽及水产品养殖、加工和销售；粮食收购；饲料原料贸易。(依法须经批准的项目，经相关部门批准后方可开展经营活动),林峰,南昌市,公司是一家以农业为基础、在农业产业化领域内不断进行产业拓展经营的农牧企业，分设饲料、养殖、种植、物流、金融等产业集团，以种猪育种、商品猪养殖、种鸭繁育、农作物优良新品种选育、肉食品加工、饲料、兽药、生物农药、芳樟种植及芳樟产品加工、油茶种植及油茶产品加工、大米加工、相关产品的销售与技术服务以及基于农业产业链的贷款、担保、融资租赁、资产管理为主营业务。正邦饲料获得中国名牌称号，正邦商标荣获中国驰名商标。集团设立了国家博士后科研工作站、院士工作站、正邦农业科学院，拥有国家企业技术中心、省工程技术研究中心等技术研发平台，承担了包括国家“863计划”——生态福利养猪关键技术研究在内的国家及省市科研项目。,zqb@zhengbang.com,"主营业务:猪饲料,禽饲料,水产料,其他料,种猪及商品猪.饲料生产及销售.",林峰,江西,314808.61,祝建霞,19960926,www.zhengbang.com,正邦科技,2019,SZSE,SZSE,农副加工食品,20525,-,农产品,20525020,34821047000,-13.74,-31.46,¥10.72,非周期性消费,205,0.0,0,0.0,0.0,-10000.0,-259700,-1.65,1.65,1.0,19.8,16.32,17.7,-39.44,2020-12-31T05:00:00Z,{5_trade_sell},{trade_sell},2020Q4_1751679
600584,2020Q4_1751667,江苏省江阴市滨江中路275号,研制、开发、生产、销售半导体、电子原件、专用电子电气装置，道路普通货物运输，销售本企业自产机电产品及成套设备，自营和代理各类商品及技术的进出口业务，开展本企业进料加工和“三来一补”业务。,郑力,无锡市,公司全球知名的集成电路封装测试企业。公司面向全球提供封装设计、产品开发及认证，以及从芯片中测、封装到成品测试及出货的全套专业生产服务。长电科技致力于可持续发展战略，崇尚员工、企业、客户、股东和社会和谐发展，合作共赢之理念，先后被评定为国家重点高新技术企业，中国电子百强企业，集成电路封装技术创新战略联盟理事长单位，中国出口产品质量示范企业等，拥有国内高密度集成电路国家工程实验室、国家级企业技术中心、博士后科研工作站等。公司生产、研发和销售网络已覆盖全球主要半导体市场。公司具有广泛的技术积累和产品解决方案，包括有自主知识产权的Fan-out eWLB、WLCSP、Bump、PoP、fcBGA、SiP、PA等封装技术，另外引线框封装及自主品牌的分立器件也深受客户褒奖。,IR@jcetglobal.com,"主营业务:集成电路封装测试,分立器件制造销售.",郑力,江苏,160287.46,吴宏鲲,19981106,www.jcetglobal.com,长电科技,0,SHSE,SHSE,半导体,31130,-,半导体,31130020,67389362000,7.04,-10.36,¥37.51,科技,311,0.0,0,0.0,0.0,-10000.0,-138900,-1.58,1.58,1.0,46.11,34.97,40.58,-7.57,2020-12-31T05:00:00Z,{5_trade_sell},{trade_sell},2020Q4_1751667
600309,2020Q4_1751665,山东省烟台市经济技术开发区三亚路3号,安全生产许可证范围内危险化学品的生产；食品添加剂的研发、生产和销售；许可证范围内铁路专用线经营；丙烷、正丁烷的带有存储设施的经营、仓储经营(以上经营项目有效期限以许可证为准)；聚氨酯及助剂、异氰酸酯及衍生产品的开发、技术服务及相关技术人员培训；批准范围内的自营进出口业务；化工产品(仅限化工园区内经营)(不含危险化学品)的研发、生产、销售及技术服务咨询。(依法须经批准的项目，经相关部门批准后方可开展经营活动)。,廖增太,烟台市,公司是一家全球化运营的化工新材料公司，依托不断创新的核心技术、产业化装置及高效的运营模式，为客户提供更具竞争力的产品及解决方案。公司业务涵盖MDI、TDI、聚醚多元醇等聚氨酯产业集群，丙烯酸及酯、环氧丙烷等石化产业集群，水性PUD、PA乳液、TPU、ADI系列等功能化学品及材料产业集群。所服务的行业主要包括：生活家居、运动休闲、汽车交通、建筑工业和电子电器等。在生产领域，国内烟台、宁波、珠海等地生产基地稳定运营。在研发领域，烟台、北京、佛山、上海等地的研发中心已逐渐成型，北美技术中心在休斯敦正式投入使用。另外，万华化学在欧洲、美国、日本等多个国家和地区均设有公司和办事处。公司将“为客户创造价值”作为第一使命，致力于为客户提供稳定的、高质量的、有竞争力的产品和快速高效的服务，做负责任的供应商和行业领袖。,stocks@whchem.com;lmli@whchem.com;mhxiao@whchem.com,"主要产品:纯MDI,聚合MDI.",寇光武,山东,313974.66,李立民,19981216,www.whchem.com,万华化学,2020,SHSE,SHSE,化工,10130,-,化学制品,10130010,397911266000,25.1,43.62,¥124.70,基础材料,101,0.0,0,0.0,0.0,-10000.0,-85000,-1.55,1.55,1.0,91.95,53.6,75.35,65.49,2020-12-31T05:00:00Z,{5_trade_sell},{trade_sell},2020Q4_1751665
601888,2020Q4_1751681,北京市东城区东直门外小街甲2号A座8层,旅游服务及旅游商品相关项目的投资与管理，旅游服务配套设施的开发、改造与经营，旅游产业研究与咨询服务等。,彭辉,北京市,公司所属行业为旅游业，目前主要从事旅行社业务和免税业务，其中旅行社业务主要包括入境游、出境游、国内游、会奖旅游、签证服务、商旅服务、航空服务、电子商务等业务；免税业务主要包括烟酒、香化等免税商品的批发、零售等业务。此外，公司还从事旅游综合项目开发业务，主要包括旅游综合项目投资开发、旅游景区景点投资开发和旅游股权投资等业务。公司下属全资子公司国旅总社、中免公司及国旅投资公司分别负责公司的旅行社业务、免税业务、旅游综合项目投资开发业务。,citszq@citsgroup.com.cn,旅行社业务和免税业务.,陈国强,北京,195247.55,常筑军,20080328,www.citsgroup.net,中国中免,2011,SHSE,SHSE,旅游和娱乐,10290,-,旅游服务,10290050,554230378000,1.01,1.23,¥275.50,周期性消费,102,0.0,0,0.0,0.0,-10000.0,-27100,-1.52,1.52,1.0,282.45,166.14,207.58,32.72,2020-12-31T05:00:00Z,{5_trade_sell},{trade_sell},2020Q4_1751681
002128,2020Q4_1751676,内蒙古自治区霍林河露天煤业股份有限公司机关办公楼,"煤炭产品生产、销售；土石方剥离；地质勘探；工程与地籍测绘测量，煤炭经营；道路普通货物运输；矿山设备、工程机械、发动机、电机、建材,化工产品(危险化学品除外)，金属材料(除专营)销售；电器安装与维修；普通机械制造；机电、机械配件加工及经销；疏干及防排水设计及施工；水资源再利用；仓储；房屋、机电产品、机械设备租赁；技术服务、信息咨询；腐植酸生产与销售；分布式光伏发电；风力发电、太阳能发电、风电供热等清洁能源项目的开发、投资、建设、运营、管理。煤矿工程建设咨询；招投标代理；工程质量检测；热力购销(冷水、热水、蒸汽)。(法律、行政法规、国务院决定规定应经许可的，未获许可不得生产经营)。",刘建平,通辽市,公司前身是霍林河矿务局，是全国94家国有重点局矿之一，是全国五大露天之一。公司主营业务为煤炭产品生产、加工及销售。煤炭生产采用单斗汽车-半固定式破碎站-带式输送机半连续工艺，剥离生产采用单斗汽车间断工艺、单斗汽车-半固定式破碎站-带式输送机-排土机工艺，机械化程度100%。公司先后荣获“质量标准化二级矿井”、“质量标准化一级矿井”、“质量标准化特优级矿井”、“现代化露天煤矿”、“全国煤炭工业双十佳煤矿”、“高产高效煤矿”、“全国五一劳动奖状”、“先进基层党组织”、“模范职工之家”、“自治区级文明单位”等荣誉称号。2018年，公司购买霍煤鸿骏51%股权。霍煤鸿骏主要从事电解铝的生产及销售，公司快速进入电解铝业务领域，并通过上市公司平台为霍煤鸿骏的发展提供支持，以期将电解铝业务打造为公司未来重要的业务增长点，形成“煤——电——铝”联动。,ltmy@vip.163.com,"主营业务:本公司的主营业务为煤炭产品的生产,加工和销售.",陈建国,内蒙古,192157.35,温泉,20011218,,露天煤业,2014,SZSE,SZSE,其他能源,30920,-,燃煤,30920010,19259281000,2.03,-3.56,¥10.22,能源,309,0.0,0,0.0,0.0,-10000.0,-524100,-1.48,1.48,1.0,12.17,9.69,10.85,-5.81,2020-12-31T05:00:00Z,{5_trade_sell},{trade_sell},2020Q4_1751676
601009,2020Q4_1751675,江苏省南京市玄武区中山路288号,"公司经营范围包括：吸收公众存款;发放短期、中期、和长期贷款;办理国内外结算;办理票据承兑与贴现;发行金融债券;代理发行、代理兑付、承销政府债券;买卖政府债券、金融债券;从事同业拆借;买卖、代理买卖外汇;从事银行卡业务;提供信用证服务及担保;代理收付款项及代理保险业务;提供保管箱服务;经中国银行业监督管理委员会批准的其它业务。(依法须经批准的项目,经相关部门批准后方可开展经营活动)",胡升荣,南京市,"南京银行诞生于中国金融体制改革和资本市场蓬勃发展的浪潮之中，乘着中国改革开放、经济腾飞的东风，一路乘风破浪砥砺前行。1996年公司完成了股份制改造，2001年引入境外战略投资者国际金融公司(IFC)，2005年引入境外战略投资者法国巴黎银行(BNP)，成为一家由国有法人股份、中资法人股份、外资股份和众多自然人股份共同组成的混合所有制商业银行；2007年初首家异地分行泰州分行开业，成为国内首批跨区域发展的城商行；2007年7月在上交所挂牌交易，是国内首家在上交所主板上市的城商行。公司秉承“为社会铸诚信品质、为客户创卓越服务、为股东谋持久回报”的核心价值观，立足服务实体经济，坚持解放思想、锐意进取、开拓创新、稳健发展的经营理念，实现业务规模稳步增长、基础管理扎实有效、风险管控不断强化、资产质量保持稳定、经营效益持续优良、综合实力日益提升。截至2018年末，公司资产规模12,432.69亿元，员工人数10,721人，经营网点实现京沪杭及江苏省内地区全覆盖，设有17家分行和191家支行。",boardoffice@njcb.com.cn,"主营业务:商业银行业务是本行的核心业务,主要包括公司银行业务,个人银行业务及资金运营业务.",林静然,江苏,1000701.7,江志纯,19960206,www.njcb.com.cn,南京银行,2016,SHSE,SHSE,银行,10320,-,区域性银行,10320020,100783545000,15.42,31.84,¥10.12,金融服务,103,0.0,0,0.0,0.0,-10000.0,-554400,-1.48,1.48,1.0,9.0,7.59,8.2,23.41,2020-12-31T05:00:00Z,{5_trade_sell},{trade_sell},2020Q4_1751675
002126,2020Q4_1751677,浙江省台州市天台县福溪街道始丰东路8号,实业投资；汽车零部件、船用配件、摩托车配件、机械配件、电子产品、基础工程设备、化工设备的设计、制造、销售，商用车、金属材料的销售；机械技术服务；经营进出口业务(国家法律法规禁止、限制的除外)。,徐小敏,台州市,公司是一家专业研发、制造和销售各种热交换器及尾气后处理等产品的国家级高新技术企业。目前公司是中国内燃机标准化技术委员会热交换器行业标准的牵头制订单位，建有国家级企业技术中心、省级重点企业研究院、省级工程实验室和国家级博士后科研工作站。公司在浙江、上海、湖北、山东等地建有生产基地和研发中心、并在北美、欧洲等地建有生产基地和研发分中心。公司主要产品有：新能源汽车热管理相关的高低温水箱、Chiller(电池深冷器)、电池冷却板、电机冷却器、电控冷却器、前端冷却模块、PTC加热器等，广泛应用于汽车、工程机械、农业机械、压缩机、风力发电、火车机车、轮船等热交换及尾气后处理领域。多年来，公司将自己的专业技术发展到新的应用领域，使其业务不断向农业机械、压缩机、船舶、风力发电、发电机组、火车机车及工业、民用等热交换领域市场拓展和延伸。公司已由简单的为客户提供产品发展到能以客户为中心提供换热解决方案，正被全球范围内越来越多的主机厂商肯定和认可，成为其在中国甚至全球热系统首选供应商。公司愿景是成为提供高效换热解决方案的世界级优秀企业。,002126@yinlun.cn,"主要产品::新能源汽车热管理相关的高低温水箱,Chiller(电池深冷器),电池冷却板,电机冷却器,电控冷却器,前端冷却模块,PTC加热器等.主要业务:研发,制造和销售各种热交换器及尾气后处理等产品.",夏军,浙江,79209.51,陈敏,19990310,www.yinlun.cn,银轮股份,2012,SZSE,SZSE,汽车和配件,10200,-,汽车配件,10200030,8483971000,7.3,-22.08,¥10.59,周期性消费,102,0.0,0,0.0,0.0,-10000.0,-324300,-1.45,1.45,1.0,13.88,11.09,12.47,-15.08,2020-12-31T05:00:00Z,{5_trade_sell},{trade_sell},2020Q4_1751677
300122,2020Q4_1751687,重庆市江北区金源路7号25层,批发生物制品；境外疫苗代理进口及销售；生物技术研究开发、技术咨询服务；货物及技术进出口；仓储服务(不含危险品)；生物制品市场推广宣传服务；普通货运、货物专用运输(冷藏保鲜)、国内货物运输代理。,蒋仁生,重庆市,公司系一家集疫苗研发、生产、销售、配送及进出口为一体的生物高科技企业，主营的人用疫苗为国家七大战略性新兴产业，发展前景广阔。现在售产品包括AC群脑膜炎球菌(结合)b型流感嗜血杆菌(结合)联合疫苗(喜贝康)、b型流感嗜血杆菌结合疫苗(喜菲贝)、A、C、Y、W135群脑膜炎球菌多糖疫苗(盟威克)、注射用母牛分枝杆菌(微卡)、A群C群脑膜炎球菌多糖结合疫苗(盟纳康)等自主产品及统一销售默沙东授权的23价肺炎球菌多糖疫苗、甲型肝炎灭活疫苗(人二倍体细胞)、四价人乳头瘤病毒疫苗(酿酒酵母)、九价人乳头瘤病毒疫苗(酿酒酵母)、口服五价重配轮状病毒减毒活疫苗(Vero细胞)等所有进口疫苗。公司荣获全国非公有制企业双强百佳党组织、重庆市精神文明单位、全国“守合同重信用”企业、全国商务诚信试点企业、重庆市创新型企业、重庆市制造企业百强等荣誉称号。,IRM@zhifeishengwu.com;office1@zhifeishengwu.com,"主营业务为疫苗,生物制品的研发,生产和销售.自主产品包括:A群C群脑膜炎球菌多糖结合疫苗,ACYW135群脑膜炎球菌多糖疫苗,微卡(注射用母牛分枝杆菌)等;独家买断代理产品包括:Hib疫苗,甲肝减毒活疫苗等.",蒋仁生,重庆,160000.0,秦菲,19950720,www.zhifeishengwu.com,智飞生物,2017,SZSE,SZSE,生物科技,20610,-,生物科技,20610010,300091060000,3.98,27.1,¥186.80,医疗保健,206,0.0,0,0.0,0.0,-10000.0,-39100,-1.43,1.43,1.0,190.0,95.5,140.44,33.01,2020-12-31T05:00:00Z,{5_trade_sell},{trade_sell},2020Q4_1751687
601628,2020Q4_1751678,北京市西城区金融大街16号,人寿保险、健康保险、意外伤害保险等各类人身保险业务；人身保险的再保险业务；国家法律、法规允许或国务院批准的资金运用业务；各类人身保险服务、咨询和代理业务；证券投资基金销售业务；国家保险监督管理部门批准的其他业务。,王滨,北京市,公司是国内寿险行业的龙头企业。公司作为《财富》世界500强和世界品牌500强企业的核心成员，公司以悠久的历史、雄厚的实力、专业领先的竞争优势及世界知名的品牌赢得了社会最广泛客户的信赖，始终占据国内保险市场领导者的地位，被誉为中国保险业的“中流砥柱”。公司是中国最大的人寿保险公司，拥有由保险营销员、团险销售人员以及专业和兼业代理机构组成的中国最广泛的分销网络。公司提供个人人寿保险、团体人寿保险、意外险和健康险等产品与服务，是中国领先的个人和团体人寿保险与年金产品、意外险和健康险供应商。,ir@e-chinalife.com;liyh@e-chinalife.com,"主营业务:在中国境内向个人和团体提供人寿保险,意外伤害保险和健康保险等产品与服务.同时,本公司还经营保险资产管理业务,主要通过本公司控股60%的资产管理公司进行.",苏恒轩,北京,2826470.5,利明光,20030630,www.e-chinalife.com,中国人寿,2019,SHSE,SHSE,保险,10340,-,人身保险,10340010,734582982000,6.31,-17.06,¥30.99,金融服务,103,0.0,0,0.0,0.0,-10000.0,-126300,-1.25,1.25,1.0,51.96,30.04,42.09,-26.37,2020-12-31T05:00:00Z,{5_trade_sell},{trade_sell},2020Q4_1751678
600383,2020Q4_1751674,广东省深圳市福田区福田街道岗厦社区深南大道2007号金地中心32层,从事房地产开发经营业务；兴办各类实体(具体项目需另报)；经营进出口业务；信息咨询(不含限制项目)。,凌克,深圳市,公司是中国最早上市并完成全国化布局的房地产企业之一。公司目前的业务包括住宅开发与销售及装修、商用地产开发与销售及持有运营、房地产金融、物业服务与社区经营、以网球为特色的国际教育及体育产业运营等。公司以“科学筑家”为使命，30年来秉持“科学筑家，智美精工”的产品理念，为中国家庭提供标准化、系列化的住宅与社区商业产品，是中国建设系统企业信誉AAA单位、房地产开发企业国家一级资质单位。以客户认可、市场认同、企业信誉和业绩为基础，公司获得多项殊荣。公司将以价值创造为目的，以效益与规模的平衡均好发展为导向，向“做中国最有价值的国际化企业”的宏伟愿景持续迈进。,ir@gemdale.com,"主要业务:房地产开发与经营,物业租赁和物业管理.",黄俊灿,广东,451458.36,徐家俊,19880120,www.gemdale.com,金地集团,2018,SHSE,SHSE,房地产,10410,-,房地产开发,10410010,44244557000,-8.17,-21.78,¥9.90,房地产,104,0.0,0,0.0,0.0,-10000.0,-246200,-1.23,1.23,1.0,17.43,13.26,14.58,-32.1,2020-12-31T05:00:00Z,{5_trade_sell},{trade_sell},2020Q4_1751674
300750,2020Q4_1751695,福建省宁德市蕉城区漳湾镇新港路2号,锂离子电池、锂聚合物电池、燃料电池、动力电池、超大容量储能电池、超级电容器、电池管理系统及可充电电池包、风光电储能系统、相关设备仪器的开发、生产和销售及售后服务；对新能源行业的投资；锂电池及相关产品的技术服务、测试服务以及咨询服务。(依法须经批准的项目，经相关部门批准后方可开展经营活动),周佳,宁德市,公司是全球领先的动力电池系统提供商，专注于新能源汽车动力电池系统、储能系统的研发、生产和销售，致力于为全球新能源应用提供一流解决方案。公司在电池材料、电池系统、电池回收等产业链关键领域拥有核心技术优势及可持续研发能力，形成了全面、完善的生产服务体系。公司拥有国际一流的研发团队，设立了“福建省院士专家工作站”，拥有锂离子电池企业省级重点实验室、中国合格评定国家认可委员会(CNAS)认证的测试验证中心，参与了《电动客车安全技术条件》、《电动汽车用锂离子动力蓄电池安全要求》、《电力储能用锂离子电池》等多个国家、行业规范及标准的制定。公司承担了“十二五”国家新能源汽车产业技术创新工程项目、“十三五”国家重点研发计划新能源汽车专项项目和智能电网与装备专项项目、国家火炬计划产业化示范项目等国家级项目，为首批入选工信部《汽车动力蓄电池行业规范条件》目录的十家动力电池企业之一、《锂离子电池行业规范条件》目录的八家锂离子电池企业之一。公司曾获得中国化学与物理电源行业协会“中国动力和储能用锂离子电池前10强企业”、中国储能网“中国储能产业最具影响力企业”、工信部和财政部“2017年国家技术创新示范企业”等多项荣誉。,CATL-IR@catl.com,"公司是全球领先的动力电池系统提供商,专注于新能源汽车动力电池系统,储能系统的研发,生产和销售,致力于为全球新能源应用提供一流解决方案.公司在电池材料,电池系统,电池回收等产业链关键领域拥有核心技术优势及可持续研发能力,形成了全面,完善的生产服务体系.公司主要产品包括动力电池系统,储能系统和锂电池材料.",周佳,福建,232900.78,蒋理,20111216,www.catlbattery.com/www.catl.com,宁德时代,2019,SZSE,SZSE,工业制品,31070,-,电子器械和零件,31070060,1288158083000,67.96,61.21,¥532.06,工业,310,0.0,0,0.0,0.0,-10000.0,-19300,-1.23,1.23,1.0,351.11,167.43,229.14,132.2,2020-12-31T05:00:00Z,{5_trade_sell},{trade_sell},2020Q4_1751695
600048,2020Q4_1751671,广东省广州市海珠区阅江中路832号保利发展广场,项目投资；房地产开发经营；物业管理；房屋租赁；建筑物拆除(不含爆破作业)；房屋建筑工程设计服务；铁路、道路、隧道和桥梁工程建筑；建筑工程后期装饰、装修和清理；土石方工程服务；建筑物空调设备、通风设备系统安装服务；酒店管理；商品批发贸易(许可审批类商品除外)；商品零售贸易(许可审批类商品除外)。,宋广菊,广州市,公司是一家专注于房地产开发及销售的大型企业集团，拥有国家一级房地产开发资质。在20余年专业开发过程中，公司培养了以商品住宅开发销售为主、经营性物业开发持有为辅的综合开发能力；以“和者筑善”为价值理念，致力于创造自然、建筑、人文交融的人居生活，打造了康居、善居、逸居、尊居四大品牌系列，包含花园系、心语系、香槟系、公馆系、林语系、康桥系、十二橡树系等多种品类，涵盖住宅、写字楼、星级酒店、购物中心、商贸会展、高端休闲地产等多种业态；形成了覆盖珠三角、长三角、环渤海、中部、西南主要经济圈、遍布全国60个主流城市的战略布局。在房地产开发主业快速发展的同时，公司还积极拓展了建筑设计、工程施工、销售代理、物业管理、商业运营、会展服务、健康养老、房地产金融等相关行业，形成了以房地产开发为主、相关行业稳步发展的业务格局。,stock@polycn.com,"主营业务:房地产开发,销售,租赁及其物业管理.",刘平,广东,1196949.33,黄海,19920914,www.polycn.com,保利地产,2017,SHSE,SHSE,房地产,10410,-,房地产开发,10410010,141000631000,-17.66,-25.41,¥11.78,房地产,104,0.0,0,0.0,0.0,-10000.0,-224900,-1.21,1.21,1.0,17.4,15.36,16.25,-27.51,2020-12-31T05:00:00Z,{5_trade_sell},{trade_sell},2020Q4_1751671
002311,2020Q4_1751683,广东省广州市番禺区南村镇万博四路42号海大大厦2座701,饲料、添加剂的生产和技术开发、技术服务，畜牧、水产品的养殖、加工和技术开发、技术服务；以上产品及饲料原料、农副产品的批发、佣金代理(拍卖除外)及进出口业务(涉及配额许可证管理、专项规定管理的商品按照国家有关规定办理)，粮食收购。,薛华,广州市,公司是一家集研发、生产和销售水产饲料、畜禽饲料和水产饲料预混料以及健康养殖为主营业务的高科技型上市公司，核心业务是水产饲料、水产苗种和动保产品。公司已经实现了在全国重点水产养殖区域的生产和销售。公司资金充足，银行信誉评级为AAA级。集团积极倡导绿色健康养殖，所属分子公司均通过了ISO9000、HACCP认证。多年来，公司先后获得“中国名牌”、“广东省著名商标”、“广东省名牌产品”等殊荣，海大集团被认定为“农业产业化国家重点龙头企业”、“国家农产品加工技术研发专业分中心”、“高新技术企业”等。,zqbgs@haid.com.cn,"水产预混料,水产配合饲料和畜禽配合饲料的研发,生产和销售.",薛华,广东,166116.11,黄志健,20040108,www.haid.com.cn,海大集团,2018,SZSE,SZSE,农副加工食品,20525,-,加工食品,20525040,122002694000,-2.07,13.66,¥71.81,非周期性消费,205,0.0,0,0.0,0.0,-10000.0,-65100,-1.13,1.13,1.0,74.0,47.31,61.33,17.09,2020-12-31T05:00:00Z,{5_trade_sell},{trade_sell},2020Q4_1751683
