symbol,_id,address,business_scope,chairman,city,descrpt,email,main_business,manager,province,reg_capital,secretary,setup_date,website,company,dividend_startyear,exchange,exchange_,group,groupcode,index_stockid,industry,industrycode,mktcap_norm_cny,pchange_12w,pchange_ytd,price,sector,sectorcode,share_percentage,shares,value,position,change,share_change,impact,abs_impact,split_factor,price_max,price_min,price_avg,change_from_average,portdate,action,comment,oid
000661,2020Q4_1751582,吉林省长春市同志街2400号火炬大厦5层,高新技术产品的开发、生产、销售及服务基础设施的开发建设、新药开发、技术转让、咨询服务；物业管理；高新成果转让及中介服务；商业供销业(国家有专项限制经营的商品除外)；餐饮、娱乐、旅馆(办时需许可)；培训；集中供热；产业投资(医药产业)(以上各项仅限分公司、子公司持证经营)。绿化景观工程设计、施工及维护、企业营销策划、广告策划、社会经济信息咨询、房地产中介服务、房屋销售代理(仅限分支机构持证经营)；企业管理咨询(以上各项国家法律法规禁止的不得经营；应经专项审批的项目未获得批准之前不得经营)*,马骥,长春市,公司于1993年6月成立，是东北地区最早的一批上市公司之一。公司主营业务以生物制药、中成药生产及销售为主，辅以房地产开发、物业管理等。上市多年来，公司凝炼并秉持“创新、专注、包容、共享”的发展理念，坚持以科技创新为源动力，主导产业成功实现由服务于开发区基础设施建设向生物制药及健康产业的转型，随着医药产业项目的成功孵化并壮大，支撑了经营业绩的快速增长，目前公司已成为国内生物医药领域具有一定技术领先优势的上市公司。,zds000661@163.com;zds@ccht.jl.cn;000661@ccht.jl.cn,"主要产品:基因重组人生长素,血栓心脉宁,冠脉宁.",姜云涛,吉林,40472.03,张德申,19930610,www.ccht.jl.cn,长春高新,2013,SZSE,SZSE,医药制造,20620,-,专用医药制造,20620020,156738684000,-12.65,-12.45,¥379.99,医疗保健,206,0.01,40800,18316900.0,3.66,127.93,22900,2.05,2.05,1.0,503.22,329.98,412.5,-7.88,2020-12-31T05:00:00Z,{2_trade_add},{trade_add} 127.93 %,2020Q4_1751582
000858,2020Q4_1751584,四川省宜宾市翠屏区岷江西路150号,主营：酒类产品及相关辅助产品(瓶盖、商标、标识及包装制品)的生产经营；兼营：饮料、药品、水果种植、农业种植、进出口业务、物业管理、投资管理等。,曾从钦,宜宾市,公司是以五粮液及其系列酒的生产、销售为主要产业，同时生产经营精密塑胶制品、大中小高精尖注射和冲压模具现代制造产业，以及生物工程为发展产业，药业工业、印刷业、电子器件产业、物流运输和相关的服务业的具有深厚企业文化的现代化企业集团。公司现已系统研制开发了五粮春、五粮神、五粮醇等几十种不同档次、不同口味，满足不同区域、不同文化背景、不同层次消费者需求的系列产品。数年来“五粮液”品牌连续在中国白酒制造业和食品行业“最有价值品牌”中排位居前，具有领导市场的影响力。目前公司根据消费者的个性化需求，进一步细分、微分市场，新设计开发国宝五粮液、人民大会堂国宴五粮液等，丰富和完善产品线，加快新产品开发步伐，有效地支持了公司经营业绩持续增长。,000858-wly@sohu.com;lixinyi@wuliangye.com.cn,主要产品:五粮液系列酒.,,四川,388160.8,彭智辅,19980421,www.wuliangye.com.cn,五粮液,2015,SZSE,SZSE,酒精饮料,20510,-,其他酒类,20510020,1079600995000,10.79,-2.89,¥277.48,非周期性消费,205,0.0,98200,28652700.0,5.73,84.24,44900,2.62,2.62,1.0,291.85,188.73,238.44,16.37,2020-12-31T05:00:00Z,{2_trade_add},{trade_add} 84.24 %,2020Q4_1751584
600519,2020Q4_1751633,贵州省仁怀市茅台镇,茅台酒系列产品的生产与销售；饮料、食品、包装材料的生产、销售；防伪技术开发、信息产业相关产品的研制、开发；酒店经营管理、住宿、餐饮、娱乐、洗浴及停车场管理服务(具体内容以工商核定登记为准)。,高卫东,遵义市,公司是国内白酒行业的标志性企业，主要生产销售世界三大名酒之一的茅台酒，同时进行饮料、食品、包装材料的生产和销售，防伪技术开发，信息产业相关产品的研制开发。茅台酒历史悠久，源远流长，是酱香型白酒的典型代表，享有“国酒”的美称。目前，公司茅台酒年生产量已突破一万吨，43°、38°、33°茅台酒拓展了茅台酒家族低度酒的发展空间，茅台王子酒、茅台迎宾酒满足了中低档消费者的需求，15年、30年、50年、80年陈年茅台酒填补了我国极品酒、年份酒、陈年老窖的空白，在国内独创年代梯级式的产品开发模式。公司产品形成了低度、高中低档、极品三大系列70多个规格品种，全方位跻身市场，从而占据了白酒市场制高点，称雄于中国极品酒市场。,mtdm@moutaichina.com,"主要产品:高度茅台酒(含陈年茅台酒),低度茅台酒.",李静仁,贵州,125619.78,刘刚,19991120,www.moutaichina.com,贵州茅台,2014,SHSE,SHSE,酒精饮料,20510,-,其他酒类,20510020,2482710431000,0.08,0.97,¥1951.95,非周期性消费,205,0.0,17000,33914100.0,6.78,45.3,5300,2.11,2.11,1.0,1998.0,1541.79,1721.71,13.37,2020-12-31T05:00:00Z,{2_trade_add},{trade_add} 45.30 %,2020Q4_1751633
600988,2020Q4_1751637,内蒙古自治区赤峰市红山区学院北路金石明珠写字楼A座9层,从事货物与技术的进出口业务；稀贵金属、有色金属购销；对采矿业及其他国家允许投资的行业的投资与管理。,王建华,赤峰市,公司是A股主板上市公司，股票代码600988。公司位于内蒙古赤峰市境内，主要从事黄金采选及资源综合回收利用业务，主要产品为黄金、白银、铋、钯、铑等多种稀贵金属。公司注重法人治理，坚持规范运营，在注重经济效益、以丰厚的业绩回报社会及广大投资者的同时，更加注重社会效益、企业文化发展及生态文明建设，积极承担社会责任。公司将通过不断创新管理机制，坚持低成本运营，加大对黄金资源的收购整合力度，推动黄金企业规模化、集约化发展，大力开展资源综合回收利用和其他环保技术的推广和应用，实现资源的有效利用、合理开发，借助国家“一带一路”政策，立足国内，放眼世界，努力打造国内先进、国际知名的黄金矿业上市公司。,A600988@126.com,"主要从事黄金采选及资源综合回收利用业务,主要产品为黄金,白银,铋,钯,铑等多种稀贵金属.",吕晓兆,内蒙古,166391.14,周新兵,19980622,www.600988.com.cn,赤峰黄金,0,SHSE,SHSE,金属与开采,10150,-,金,10150040,26022287000,3.84,-12.34,¥15.40,基础材料,101,0.03,441400,7905500.0,1.58,38.67,123100,0.44,0.44,1.0,23.65,11.58,17.88,-13.87,2020-12-31T05:00:00Z,{2_trade_add},{trade_add} 38.67 %,2020Q4_1751637
601799,2020Q4_1751641,江苏省常州市新北区秦岭路182号,汽车车灯、摩托车车灯、塑料工业配件的制造及销售；模具的开发、制造、销售；九座及九座以上的乘用车及商务汽车的销售；自营和代理各类商品及技术的进出口业务(国家限定公司经营和国家禁止进出口的商品及技术除外)。许可项目：道路货物运输(不含危险货物)。(依法须经批准的项目，经相关部门批准后方可开展经营活动，具体经营项目以相关部门批准文件或许可证件为准)。,周晓萍,常州市,公司主要经营汽车灯具的研发、设计、制造和销售，是我国较大的内资车灯总成制造商和设计方案提供商。公司产品覆盖德系、日系、美系、法系和中国多家自主品牌整车企业，客户涵盖欧系、日系、美系和中国多家自主品牌整车企业，主要包括一汽集团(一汽大众、一汽丰田、一汽轿车、一汽解放、一汽丰越、一汽吉林)、上汽大众、上汽通用、上汽通用五菱、广汽乘用车、广汽丰田、广州本田、东风日产、东风本田、长安福特、长安马自达、北京宝沃、奇瑞汽车、吉利汽车、蔚来汽车、众泰汽车、神龙汽车、德国宝马、沃尔沃、捷豹路虎等主要整车制造企业。公司通过TS16949国际质量标准体系认证、ISO14001环境管理体系认证，通过QS9000和VDA6.1质量标准体系认证，并于2007年6月份通过了ISO17025国家实验室认可，是全国汽车标委会汽车灯具分标委委员。,xingyu@xyl.cn;lishujun@xyl.cn;zhangxiwu@xyl.cn,"主营业务为汽车(主要是乘用车)灯具的研发,设计,制造和销售.主要产品包括:汽车前照灯,后组合灯,雾灯及其他汽车灯具等.",周晓萍,江苏,27615.99,李树军,20000518,www.xyl.cn,星宇股份,2016,SHSE,SHSE,汽车和配件,10200,-,汽车配件,10200030,60670701000,21.09,10.37,¥213.71,周期性消费,102,0.02,46000,9219000.0,1.84,28.85,10300,0.41,0.41,1.0,201.28,124.3,165.52,29.11,2020-12-31T05:00:00Z,{2_trade_add},{trade_add} 28.85 %,2020Q4_1751641
000333,2020Q4_1751580,广东省佛山市顺德区北滘镇美的大道6号美的总部大楼,生产经营家用电器、电机及其零部件；从事家用电器、家电原材料及零配件的进出口、批发及加工业务(不设店铺，不涉及国营贸易管理商品，涉及配额、许可证管理商品的按国家规定办理)；信息技术服务；为企业提供投资顾问及管理服务；计算机软件、硬件开发；家电产品的安装、维修及售后服务；工业产品设计；酒店管理；广告代理；物业管理；企业所需的工程和技术研究、开发及其销售和推广；对金融业进行投资。(经营范围涉及行政许可的项目须凭有效许可证或批准证明经营),方洪波,佛山市,公司是一家消费电器、暖通空调、机器人与自动化系统、智能供应链(物流)的科技集团，提供多元化的产品种类与服务，包括以厨房家电、冰箱、洗衣机、及各类小家电为核心的消费电器业务；以家用空调、中央空调、供暖及通风系统为核心的暖通空调业务；以库卡集团、美的机器人公司等为核心的机器人及自动化系统业务;以安得智联为集成解决方案服务平台的智能供应链业务。公司以“科技尽善，生活尽美”为企业愿景，将“联动人与万物，启迪美的世界”作为使命，恪守“敢知未来——志存高远、务实奋进、包容共协、变革创新”的价值观，整合全球资源，推动技术创新，每年为全球超过3亿用户、及各领域的重要客户与战略合作伙伴提供满意的产品和服务，致力创造美好生活。,IR@midea.com,"以家电产业为主,涉足电机,物流等领域,旗下分为四大业务板块,分别为大家电,小家电,电机及物流",方洪波,广东,704515.93,江鹏,20000407,www.midea.com,美的集团,2014,SZSE,SZSE,家具制造,10220,-,家具制造,10220010,504918392000,-9.25,-26.09,¥69.80,周期性消费,102,0.0,227500,22399600.0,4.48,20.37,38500,0.76,0.76,1.0,98.44,61.19,76.9,-9.23,2020-12-31T05:00:00Z,{2_trade_add},{trade_add} 20.37 %,2020Q4_1751580
600036,2020Q4_1751629,广东省深圳市福田区深南大道7088号,吸收公众存款；发放短期、中期和长期贷款；办理结算；办理票据贴现；发行金融债券；代理发行、代理兑付、承销政府债券；买卖政府债券；同业拆借；提供信用证服务及担保；代理收付款项及代理保险业务；提供保管箱服务。外汇存款；外汇贷款；外汇汇款；外币兑换；国际结算；结汇、售汇；同业外汇拆借；外汇票据的承兑和贴现；外汇借款；外汇担保；买卖和代理买卖股票以外的外币有价证券；发行和代理发行股票以外的外币有价证券；自营和代客外汇买卖；资信调查、咨询、见证业务；离岸金融业务。经国务院银行业监督管理机构批准的其他业务。,缪建民,深圳市,公司是中国境内第一家完全由企业法人持股的股份制商业银行、国家从体制外推动银行业改革的第一家试点银行，也是一家拥有商业银行、金融租赁、基金管理、人寿保险、境外投行等金融牌照的银行集团。近年来，公司聚焦移动优先策略，拥抱金融科技(Fintech)，率先推出闪电贷、刷脸取款、“一闪通”支付等创新服务，招商银行手机银行、掌上生活两大App已成行业翘楚，月活量均稳居金融行业前十。经过多年创新发展，招商银行部分业务领域已成为国内商业银行的标杆，连续多年获得境内外权威媒体评选的“中国最佳零售银行”“中国最佳私人银行”“中国最佳交易银行”等殊荣。,cmb@cmbchina.com,"主要业务:贷款拆借,存放同业业务债券投资.",田惠宇,广东,2521984.56,王良,19870331,www.cmbchina.com,招商银行,2009,SHSE,SHSE,银行,10320,-,区域性银行,10320020,1297118188000,5.79,19.01,¥51.00,金融服务,103,0.0,439800,19330700.0,3.87,3.39,14400,0.13,0.13,1.0,46.8,34.25,39.82,28.08,2020-12-31T05:00:00Z,{2_trade_add},{trade_add} 3.39 %,2020Q4_1751629
300059,2020Q4_1751595,上海市徐汇区宛平南路88号东方财富大厦,第二类增值电信业务中的呼叫中心业务和信息服务业务(以经营许可证为准)，企业投资咨询、策划，商务咨询，会务会展咨询服务，计算机软硬件及网络系统的技术开发、技术服务、技术咨询、技术转让，设计、制作、发布、代理国内外各类广告，自有房屋租赁，计算机软件销售。,其实,上海市,公司是国内领先的互联网金融服务平台综合运营商，通过以“东方财富网”为核心，集互联网财经门户平台、金融电子商务平台、金融终端平台及移动端平台等为一体的互联网金融服务大平台，向海量用户提供基于互联网平台应用的产品和服务。公司运营的以“东方财富网”为核心的互联网金融服务大平台已成为我国用户访问量最大、用户黏性最高的互联网金融服务平台之一，“天天基金网”和“股吧”在各自细分领域中均具有市场领先地位，在用户数量和用户黏性方面长期保持竞争优势，形成了公司的核心竞争力。,dongmi@eastmoney.com,"主营业务:公司通过“东方财富网”网站平台提供专业的,及时的,海量的资讯信息,满足广大互联网用户对于财经资讯和金融信息需求.公司主营业务属于网络财经信息服务业,向用户提供专业的,及时的,海量的资讯信息,满足其对于财经资讯和金融信息的需求.业务内容主要包括互联网广告服务以及金融数据服务.",郑立坤,上海,1033576.38,其实,20050120,www.eastmoney.com,东方财富,2018,SZSE,SZSE,交互式媒体,30830,-,互联网和相关服务,30830010,337781706000,39.3,28.25,¥32.42,通信服务,308,0.0,314880,8134700.0,1.63,-6.39,-21480,-0.13,0.13,1.2,25.83,18.33,21.53,50.58,2020-12-31T05:00:00Z,{4_trade_reduce},{trade_reduce} 6.39 %,2020Q4_1751595
002142,2020Q4_1751586,浙江省宁波市鄞州区宁东路345号,(一)吸收公众存款；(二)发放短期、中期和长期贷款；(三)办理国内外结算；(四)办理票据承兑与贴现；(五)发行金融债券；(六)代理发行、代理兑付、承销政府债券；(七)买卖政府债券、金融债券；(八)从事同业拆借；(九)从事银行卡业务；(十)提供信用证服务及担保；(十一)代理收付款项及代理保险业务；(十二)提供保管箱服务；(十三)经中国银行业监督管理机构、中国人民银行和国家外汇管理机关批准的其他业务。,陆华裕,宁波市,公司成立于1997年4月10日，2007年7月19日成为国内首家在深圳证券交易所挂牌上市的城市商业银行。公司前两大股东分别是宁波市政府和新加坡华侨银行，新加坡华侨银行是东南亚第二大金融服务集团，是国际上具有最高评级的银行之一，拥有穆迪Aa1级评级。公司以“了解的市场，熟悉的客户”为准入原则，坚持“门当户对”的经营策略，以为客户提供多元化金融服务为目标，打造“公司银行、零售公司、个人银行、金融市场、信用卡、票据业务、投资银行、资产托管、资产管理”九大利润中心，初步形成多元化的业务增长模式和良好的品牌形象。,dsh@nbcb.com.cn,"主要产品:公司贷款,个人贷款,房屋贷款是本行个人贷款.",罗孟波,浙江,562832.95,俞罡,19970410,www.nbcb.com.cn,宁波银行,2017,SZSE,SZSE,银行,10320,-,区域性银行,10320020,222110887000,-2.31,5.38,¥37.00,金融服务,103,0.0,265700,9389300.0,1.88,-19.02,-62400,-0.6,0.6,1.0,38.0,27.89,33.6,10.12,2020-12-31T05:00:00Z,{4_trade_reduce},{trade_reduce} 19.02 %,2020Q4_1751586
600031,2020Q4_1751628,北京市昌平区北清路8号,生产建筑工程机械、起重机械、停车库、通用设备及机电设备(其中特种设备制造须凭本企业行政许可)、金属制品、橡胶制品、电子产品、钢丝增强液压橡胶软管和软管组合件、客车(不含小轿车)和改装车；建筑工程机械、起重机械、停车库、通用设备及机电设备的销售与维修；金属制品、橡胶制品及电子产品、钢丝增强液压橡胶软管和软管组合件的销售；客车(不含小轿车)和改装车的销售(凭审批机关许可文件经营)；五金及法律法规允许的矿产品、金属材料的销售；提供建筑工程机械租赁服务；经营商品和技术的进出口业务(国家法律法规禁止和限制的除外)。,梁稳根,北京市,公司是全球装备制造业领先企业之一。公司产品包括混凝土机械、挖掘机械、起重机械、桩工机械、筑路机械、建筑装配式预制结构构件。公司拥有ISO9000质量体系认证、ISO14001环境管理体系认证、GB/T28001职业健康安全管理体系认证和中国CCC认证、美国UL认证、德国TUV认证、欧盟CE认证等国际认证。公司凭借技术创新实力，先后三次荣获“国家科技进步奖”，两次荣获“国家技术发明奖”。通过自主创新，三一混凝土泵车三次刷新长臂架泵车世界纪录，三一高压力混凝土输送泵多次创造世界单泵垂直泵送世界新高。,xyl@sany.com.cn;zhoulk@sany.com.cn;sanyir@sany.com.cn,"主要业务:拖式混凝土输送泵,混凝土泵车等混凝土施工机械,全液压振动压路机,摊铺机等高等级路面施工机械的制造及销售.",向文波,北京,761650.4,肖友良,19941122,www.sanyhi.com,三一重工,2016,SHSE,SHSE,农用和重型工程机械,31050,-,农用和重型工程机械,31050010,217489529000,-17.32,-25.21,¥25.01,工业,310,0.0,323500,11315400.0,2.26,-20.2,-81900,-0.56,0.56,1.0,34.98,20.22,25.6,-2.3,2020-12-31T05:00:00Z,{4_trade_reduce},{trade_reduce} 20.20 %,2020Q4_1751628
600030,2020Q4_1751627,广东省深圳市福田区中心三路8号中信证券大厦/北京市朝阳区亮马桥路48号中信证券大厦,证券经纪（限山东省、河南省、浙江省天台县、浙江省苍南县以外区域）；证券投资咨询；与证券交易、证券投资活动有关的财务顾问；证券承销与保荐；证券自营；证券资产管理；融资融券；证券投资基金代销； 为期货公司提供中间介绍业务； 代销金融产品；股票期权做市。,张佑君,深圳市,公司是国内规模最大的证券公司。主营业务范围为：证券经纪；证券投资咨询；与证券交易、证券投资活动有关的财务顾问；证券承销与保荐；证券自营；证券资产管理；融资融券；证券投资基金代销；为期货公司提供中间介绍业务。中信证券在若干业务领域保持或取得领先地位。公司紧紧围绕服务实体经济这一个中心，进一步完善融资安排者、财富管理者、交易服务与流动性提供者、市场重要投资者和风险管理者五大角色，不断重塑并巩固核心竞争力。公司依托第一大股东与中信银行、中信信托、信诚人寿保险等公司共同组成中信控股之综合经营模式，并与中信国际金融控股共同为客户提供境内外全面金融服务。,ir@citics.com,"1,投资银行:股权融资业务,债券及结构化融资业务,财务顾问业务.2,经纪业务.3,交易4,资产管理5,投资6,研究业务",杨明辉,广东,1211690.84,王俊锋,19951025,www.cs.ecitic.com,中信证券,2019,SHSE,SHSE,资本市场,10330,-,资本市场,10330010,286839150000,1.24,-19.49,¥23.82,金融服务,103,0.0,229600,6750400.0,1.35,-30.76,-102000,-0.9,0.9,1.0,33.5,26.06,30.18,-21.07,2020-12-31T05:00:00Z,{4_trade_reduce},{trade_reduce} 30.76 %,2020Q4_1751627
002475,2020Q4_1751686,广东省东莞市清溪镇北环路313号,生产经营连接线、连接器、电脑周边设备、塑胶五金制品。,王来春,深圳市,"公司是一家技术导向公司，公司专注于连接线、连接器的研发、生产和销售，产品主要应用于3C(计算机、通讯、消费电子)和汽车、医疗等领域。产品主要应用于3C(电脑、通讯、消费电子)、汽车和通讯等领域，核心产品电脑连接器已树立了优势地位，台式电脑连接器覆盖全球20%以上的台式电脑，并快速扩大笔记本电脑连接器的生产，公司已经开发出DP、eDP、USB3.0、ESATA等新产品，同时公司正逐步进入汽车连接器、通讯连接器和高端消费电子连接器领域，拓展新的产品市场,确立了自身的竞争优势。公司是USB、HDMI、SATA等协会的会员。公司拥有自主产品的核心技术和知识产权，已申请多项发明专利，实用新型专利及外观设计专利超过百项。后公司实验室通过国家认可委认证，并获“深圳市测试平台”称号。",David.Huang@luxshare-ict.com;Public@luxshare-ict.com;Ray.Li@luxshare-ict.com,"公司专注于连接器的研发,生产和销售,产品主要应用于3C(电脑,通讯,消费电子),汽车和通讯设备等领域.主要生产电脑连接器产品,包括台式电脑连接器及笔记本电脑连接器,并专注于生产附加价值高的电脑内部连接器.",王来春,广东,703542.64,黄大伟,20040524,www.luxshare-ict.com,立讯精密,2014,SZSE,SZSE,硬件,31120,-,电子元件,31120040,292233670000,26.58,-24.47,¥41.25,科技,311,0.0,0,0.0,0.0,-10000.0,-149300,-2.79,2.79,1.0,61.99,49.81,55.11,-25.15,2020-12-31T05:00:00Z,{5_trade_sell},{trade_sell},2020Q4_1751686
300760,2020Q4_1751696,广东省深圳市南山区高新技术产业园区科技南十二路迈瑞大厦1-4层,生产经营医疗电子仪器及其配套试剂及产品的软件开发(不含国家限制项目)；自产产品售后服务，自有房屋租赁。,李西廷,深圳市,公司是中国领先的高科技医疗设备研发制造厂商，为全球市场提供医疗器械产品。公司的主营业务覆盖生命信息与支持、体外诊断、医学影像三大领域，通过前沿技术创新，提供更完善的产品解决方案，帮助世界改善医疗条件、提高诊疗效率。公司始终致力于临床医疗设备的研发和制造，产品涵盖生命信息与支持、临床检验及试剂、数字超声、放射影像四大领域，将性能与价格完美平衡的医疗电子产品带到世界每一角落。,ir@mindray.com,"主营业务:公司主要从事医疗器械的研发,制造,营销及服务,主要产品涵盖三大领域:生命信息与支持,体外诊断以及医学影像,目前已拥有丰富的产品品类.",吴昊,广东,121569.13,李文楣,19990125,www.mindray.com,迈瑞医疗,2019,SZSE,SZSE,医疗器械,20650,-,医疗设备,20650010,548906596000,15.47,7.75,¥433.60,医疗保健,206,0.0,0,0.0,0.0,-10000.0,-24100,-2.68,2.68,1.0,426.0,290.82,347.05,24.94,2020-12-31T05:00:00Z,{5_trade_sell},{trade_sell},2020Q4_1751696
