symbol,_id,address,business_scope,chairman,city,descrpt,email,main_business,manager,province,reg_capital,secretary,setup_date,website,company,dividend_startyear,exchange,exchange_,group,groupcode,index_stockid,industry,industrycode,mktcap_norm_cny,pchange_12w,pchange_ytd,price,sector,sectorcode,share_percentage,shares,value,position,change,share_change,impact,abs_impact,split_factor,price_max,price_min,price_avg,change_from_average,portdate,action,comment,oid
300919,2020Q4_1751621,贵州省铜仁市玉屏侗族自治县大龙经济开发区2号干道与1号干道交汇处,法律、法规、国务院决定规定禁止的不得经营；法律、法规、国务院决定规定应当许可(审批)的，经审批机关批准后凭许可(审批)文件经营;法律、法规、国务院决定规定无需许可(审批)的，市场主体自主选择经营。(新材料、电池及新能源的研发、生产、加工与销售，从事货物及技术的进出口业务。),邓伟明,铜仁市,公司主要从事锂电池正极材料前驱体的研发、生产、加工及销售，主要产品包括三元前驱体、四氧化三钴，分别用于生产三元正极材料、钴酸锂正极材料。三元正极材料、钴酸锂正极材料进一步加工制造成锂电池，最终应用于新能源汽车、储能及消费电子等领域。公司所属产业为战略性新兴产业。为进一步增强锂电池正极材料前驱体主要原材料的保障能力，公司向产业链上游延伸，已形成了镍、钴中间品湿法加工硫酸镍、硫酸钴以及锂离子电池循环回收产能，与前驱体产业形成了良好的产业链协同优势。公司凭借优异的技术研发实力、严苛的品质管控要求、快速的产业化能力，前驱体产销量稳居全球前三，与LG化学、厦门钨业、当升科技、振华新材、天津巴莫、北大先行等国内外一流正极材料客户建立了稳定合作关系。,cngrir@cngrgf.com.cn,"主要从事锂电池正极材料前驱体的研发,生产,加工及销售,主要产品包括三元前驱体,四氧化三钴,分别用于生产三元正极材料,钴酸锂正极材料.",邓伟明,贵州,56965.0,廖恒星,20140915,www.cngrgf.com.cn,中伟股份,0,SZSE,SZSE,化工,10130,-,特种化学制品,10130020,81834653000,77.03,79.43,¥151.97,基础材料,101,0.0,500,29500.0,0.01,10000.0,500,0.01,0.01,1.0,86.12,73.25,80.15,89.61,2020-12-31T05:00:00Z,{1_trade_buy},{trade_buy},2020Q4_1751621
300898,2020Q4_1751614,浙江省温州市苍南县灵溪镇建兴东路650-668号,食品生产销售、食品经营(含销售预包装)、乳制品生产销售、食品添加剂生产销售、饮料生产、农副产品销售、金属包装容器及材料制造、金属材料销售、货物进出口、道路货物运输、技术服务、技术开发、技术咨询、技术交流、技术转让、技术推广。,李作恭,温州市,公司自成立以来一直运营“熊猫”牌系列炼乳产品，经过多年的发展，公司目前已成为国内炼乳领域的领军企业，公司的“熊猫”牌炼乳最早于2006年获评为“浙江名牌产品”，公司“熊猫”品牌于2010年获评为“浙江老字号”，于2015年被认定为“浙江省著名商标”，于2016年被认定为“驰名商标”，在国内乳制品行业具有较高的影响力和知名度。公司的炼乳产品获得了国内众多知名食品生产企业的认可，公司与香飘飘、蒙牛乳业、达能乳业、江中食疗等公司建立并保持了良好的业务关系。根据中国乳制品工业协会统计，2016年公司炼乳产品销售规模仅次于雀巢，是国内市场第二大炼乳品牌。,300898@pandairy.com,"浓缩乳制品的研发,生产,销售",李锡安,浙江,12400.0,徐笑宇,19960103,www.pandadairy.com,熊猫乳品,0,SZSE,SZSE,农副加工食品,20525,-,加工食品,20525040,4508399000,-3.81,-22.6,¥35.88,非周期性消费,205,0.0,500,16400.0,0.0,10000.0,500,0.0,0.0,1.0,77.68,46.71,57.99,-38.13,2020-12-31T05:00:00Z,{1_trade_buy},{trade_buy},2020Q4_1751614
300909,2020Q4_1751615,广东省深圳市宝安区石岩街道爱群路同富裕工业区2-2栋,兴办实业(具体项目另行申报)；国内贸易；进出口业务；房屋租赁。(以上均不含法律、行政法规、国务院决定规定需前置审批和禁止的项目)。研发、生产、销售电子开关、金属薄膜按键、导光膜、背光模组、数码配件、皮套键盘。,李明,深圳市,"公司是国家级高新技术企业和深圳市高新技术企业,专注于导光结构微纳米热压印生产工艺的自主研发，具备较强的技术实力和研发能力,通过自身在光学微结构设计、微纳米压印模具开发、自动化制造等核心环节多年积累的技术优势，为公司产品在输入设备导光结构件及组件、精密按键开关结构件及组件等细分业务领域取得竞争优势奠定了坚实基础。公司的研发能力、生产管理水平、产品质量已得到了下游客户的广泛认可，在笔记本电脑输入设备背光领域先后通过了群光电子、达方电子、光宝科技、精元电脑等全球知名笔记本电脑键盘制造商的合格供应商认证，为其提供笔记本电脑键盘背光模组产品，并最终应用于联想、惠普、戴尔、华硕等全球主流笔记本电脑品牌；同时公司也为华为、OPPO、VIVO、诺基亚、小米、中兴等全球知名手机制造商提供导光膜、金属薄膜开关等功能性结构件、组件，并将金属薄膜开关应用领域延伸至Click Pad，得到了下游笔记本电脑键盘厂商的认可；公司成功研发生产了超小型防水轻触开关，突破了国外超小型防水轻触开关的技术壁垒，实现了国内相关产品的进口替代。",xuwenlong@cn-hcd.com;ir@cn-hcd.com;kangqin@cn-hcd.com,"研发,生产,销售电子开关,金属薄膜按键,导光膜,背光模组;数码配件;皮套键盘;兴办实业(具体项目另行申报);国内贸易,进出口业务;房屋租赁.(以上均不含法律,行政法规,国务院决定规定需前置审批和禁止的项目).",李明,广东,10090.67,许文龙,20040202,www.hcdtechnology.com,汇创达,0,SZSE,SZSE,工业制品,31070,-,电子器械和零件,31070060,4121021000,-6.02,-22.89,¥40.91,工业,310,0.0,400,15700.0,0.0,10000.0,400,0.0,0.0,1.0,90.17,52.01,67.09,-39.02,2020-12-31T05:00:00Z,{1_trade_buy},{trade_buy},2020Q4_1751615
300911,2020Q4_1751617,浙江省绍兴市嵊州市浦口街道浙锻路68号,生产、销售：消毒器械(用于餐饮具消毒的消毒器械)；制造、加工、销售：集成灶、油烟机、烤箱、水槽、集成水槽、热水器、洗碗机、集成洗碗机、集成烤箱、集成蒸箱、净水器、空气净化器、浴霸、燃气用具、燃气用具配件、汽车配件、酒柜、橱柜、卫浴设施、电子产品、壁挂炉；太阳能光伏发电；销售：灯具及灯具零配件。(依法须经批准的项目，经相关部门批准后方可开展经营活动),孙伟勇,绍兴市,公司专业从事集成灶等现代新型厨房电器产品的研发、生产和销售，是国内较早以自主品牌生产和销售侧吸下排式集成灶的企业之一。公司以“创建无害厨房环境”作为发展使命，始终致力于为消费者提供健康、环保、节能的厨房电器产品，持续提升顾客的厨房体验，为消费者带来安全健康的品质生活。公司始终坚持走高质量发展之路，近年来先后荣获包括浙江省著名商标、中国厨卫产品创新大奖、全国质量诚信优秀典型企业、浙江省知名商号等在内的多项荣誉，同时公司还是《集成灶》(ZZB032-2015)的起草单位之一。在由浙江省人民政府推动实施的“浙江制造”认证中，公司于2015年成为集成灶行业首家获得认证的企业，并荣获2017年度浙江省人民政府质量奖。经过多年发展，公司已形成了强大的集成灶研发体系、完善的产品生产线及覆盖广泛的多渠道销售网络，通过持续加强设计研发创新、不断改进产品生产工艺，公司集成灶产品的油烟处理性能和外观设计赢得了市场的认可，“亿田”品牌集成灶已成为深受消费者喜爱的厨房电器产品之一。,stock@entive.com,"公司专业从事集成灶等现代新型厨房电器产品的研发,生产和销售,公司主要产品为集成灶,此外公司还向消费者提供吸油烟机,燃气灶,集成水槽,洗碗机等其他厨房电器产品.",孙吉,浙江,10666.67,沈海苹,20030925,www.entive.com,亿田智能,0,SZSE,SZSE,家具制造,10220,-,家具制造,10220010,7038623000,25.33,61.63,¥62.14,周期性消费,102,0.0,300,10200.0,0.0,10000.0,300,0.0,0.0,1.0,64.09,39.12,47.84,29.89,2020-12-31T05:00:00Z,{1_trade_buy},{trade_buy},2020Q4_1751617
300925,2020Q4_1751623,广东省深圳市南山区西丽街道松坪山社区高新北六道15号昱大顺科技园B座1层-6层,一般经营项目：计算机软硬件、程序编制；互联网软件的技术开发、技术咨询、技术服务、技术转让；硬件嵌入式软件及系统周边的技术研发与系统集成、技术咨询；技术服务进出口；数据处理服务、企业管理服务；翻译咨询、翻译服务。许可经营项目：增值电信业务。,严华,深圳市,公司是一家致力于为客户提供专业的信息技术外包(ITO)服务的提供商。公司基于对信息技术的研究与开发，结合客户的业务场景，为客户在信息化和数字化进程中的不同需求提供软件技术外包服务。公司自设立以来，主营业务未发生重大变化。经过多年的研发技术积累、行业经验沉淀、组织管理优化和业务市场开拓，结合强有力的客户管理能力，公司已经与金融、互联网、软件、通信、房地产、航空物流、制造业、批发零售等多个行业的客户形成长期而稳定的合作关系。,zqtz@farben.com.cn,"公司基于对信息技术的研究与开发,结合客户的业务场景,为客户在信息化和数字化进程中的不同需求提供软件技术外包服务.",严华,广东,22009.92,黄照程,20061108,www.farben.com.cn,法本信息,0,SZSE,SZSE,软件,31110,-,软件和信息技术服务,31110010,5436166000,16.57,-7.54,¥24.55,科技,311,0.0,680,13200.0,0.0,10000.0,680,0.0,0.0,1.7,31.18,27.71,29.44,-16.61,2020-12-31T05:00:00Z,{1_trade_buy},{trade_buy},2020Q4_1751623
300922,2020Q4_1751622,河北省秦皇岛市海港区经济技术开发区雪山路5号,机电设备、电子专用设备生产与技术开发、打印机、海水淡化设备、水处理及环保专用设备、金属及非金属材料、复合材料的技术开发、技术咨询、技术服务、技术转让与生产；塑料制品、金属制品、复合材料制品及包装制品、计算机辅助设备的技术开发与生产、销售；打印机用墨水、墨粉、墨盒、硒鼓、打印丝的生产；模具设计、制造及维修、机械零配件的生产；水处理工程设计及施工；计算机外围设备、办公用机械、其他化工产品、五金产品、建材的销售；货物及技术进出口；帐篷及附属设备、睡袋、充气垫、饮水囊、软体储水罐、携行具、野营装备、伪装网、防护伪装器材、体育用品及器材、救生衣、救生圈、家具、货架、安防用具、取暖炉、机械零部件、箱包、冲锋舟配件、油桶、滑油注入器、无人机配件、金属箱的加工、设计、销售；金属丝绳及其制品、绳、索、缆制造、销售；计算机及软件、计算机辅助设备、电子产品、通讯终端设备、其他机械设备、发电机及发电机组、装卸搬运设备、通风除湿设备的销售；安全技术防范系统的设计、安装、维修；消防工程**(依法须经批准的项目，经相关部门批准后方可开展经营活动),宋金锁,秦皇岛市,公司立足防护装置的研发制造，始终坚持自主创新和高端制造的发展战略，积极响应国家“中国制造2025”、“军民融合”等战略规划，公司主要从事以高分子复合材料的新型加工和应用技术为核心的军用防护装置及装备零部件的研发、生产和销售，系军品防护领域的核心供应商，发行人所属行业为国家重点扶持的战略新兴产业。报告期内，公司主要收入来源于军品，主要产品及服务包括专用防护装置、装备零部件、技术服务及其他等，其中专用防护装置是公司最主要的产品。公司产品不仅广泛服务于陆、海、空及火箭军等多军种军工装备领域，也可应用于民用防护领域，属军民两用产品。公司为国家高新技术企业，且已获得军方及行业主管部门对从事军工配套业务相关的许可和认证。2015年，凭借对多项大口径弹药防护装置的技术攻关，公司被河北省国防科学技术协会、河北省兵工协会评为“兵工行业先进单位”；2016年，凭借公司研发团队多年的科研成果及公司整体在国防科技工业协作配套工作中的贡献，获得河北省总工会授予的“河北省五一劳动奖章”。,qhdtqgs@163.com,"主要从事高性能工程塑料及其制品,树脂基复合材料及其制品的设计,开发,生产与销售;主要产品包括专用防护装置和装备零部件.",张澎,河北,11200.8,王素荣,19960321,www.tianqin.net.cn,天秦装备,0,SZSE,SZSE,化工,10130,-,特种化学制品,10130020,3675734000,-8.29,-14.94,¥34.69,基础材料,101,0.0,300,9100.0,0.0,10000.0,300,0.0,0.0,1.0,40.32,35.8,38.07,-8.88,2020-12-31T05:00:00Z,{1_trade_buy},{trade_buy},2020Q4_1751622
300913,2020Q4_1751618,浙江省湖州市德清县新市镇士林工业区,一般项目：新材料技术研发；物联网技术研发；信息系统集成服务；技术服务、技术开发、技术咨询、技术交流、技术转让、技术推广；电子元器件制造；机械电气设备制造；通讯设备制造；计算机软硬件及外围设备制造；云计算设备制造；网络设备制造；光通信设备制造；智能车载设备制造；电子元器件零售；电线、电缆经营；光缆销售(除依法须经批准的项目外，凭营业执照依法自主开展经营活动)。许可项目：电线、电缆制造；发电、输电、供电业务；货物进出口；技术进出口(依法须经批准的项目，经相关部门批准后方可开展经营活动，具体经营项目以审批结果为准)。,姚金龙,湖州市,公司是专业从事数据电缆、专用电缆和连接产品设计、制造与销售的高新技术企业。自成立以来，公司凭借自身的技术沉淀、设计能力及品质优势，为境内外客户提供各类产品。公司产品销售覆盖中国大陆、欧洲、北美、中东、东南亚、澳大利亚等多个国家和地区，被广泛应用于网络结构化布线、智能安防、通信设备、数据中心、工业互联网、工业机器视觉、轨交机车和医疗器械等领域。根据中国机电产品进出口商会统计，2015年度、2016年度、2017年度、2018年度，公司产品出口额在全国同类产品的出口企业中连续4年排名第1位。,dmb@zhaolong.com.cn,"专业从事数据电缆,专用电缆和连接产品设计,制造与销售,主要产品为数据电缆,专用电缆及连接产品.",姚金龙,浙江,12250.0,姚云萍,19950821,www.zhaolong.com.cn,兆龙互连,0,SZSE,SZSE,工业制品,31070,-,电子器械和零件,31070060,3211185000,-3.05,-15.91,¥25.08,工业,310,0.0,600,15100.0,0.0,10000.0,600,0.0,0.0,1.0,49.56,30.26,37.11,-32.42,2020-12-31T05:00:00Z,{1_trade_buy},{trade_buy},2020Q4_1751618
300918,2020Q4_1751620,山东省烟台市龙口市东江镇南山工业园,高档织物面料的纺、织染及后整理加工和服装、服饰研发、生产(不含国家纺织品配额管理的商品)，羊毛洗毛、制条；特种劳动防护用品(防静电服、酸碱类化学品防护服、阻燃服)的生产；并销售及网上经营公司上述所列自产产品；新材料科技开发、技术开发、技术推广、技术转让；企业管理服务；国内展览展销服务；货物及技术的进出口业务(国家限定或禁止的除外)；仓储服务(不含危险化学品)；纺织原料与纺织品的检测检验。(依法须经批准的项目，经相关部门批准后方可开展经营活动),赵亮,烟台市,公司集纺织服饰智能制造与品牌运营为一体，主营业务为精纺呢绒及正装职业装的研发、设计、生产与销售。公司拥有完善的毛纺织服饰产业链，涵盖了集面料研发、毛条加工、染色、纺纱、织造、后整理于一体的精纺呢绒业务体系，以及集成衣研发、设计、制造、品牌运营于一体的服装业务体系。公司为国内精纺呢绒、正装职业装领军企业，“南山”牌精纺呢绒、“缔尔玛”牌职业装先后被国家工商总局认定为中国驰名商标。公司为精梳毛机织物单项冠军示范企业，“缔尔玛”牌职业装先后获评“中国职业装十大顶级品牌”、“中国服装成长品牌”。公司是国家级高新技术企业、中国纺织工业联合会认定的纺织技术创新示范企业，公司检测中心是中国合格评定国家认可委员会认可的实验室。公司凭借自身的科技实力与市场影响力，多次参与制定了纺织领域国家及行业技术标准。截至本招股说明书签署日，公司已形成专利71项，其中发明专利24项，获得山东省科技进步奖3次、中国纺织行业专利奖优秀奖2次。,zhaohoujie@nanshan.com.cn;rfzzqb@nanshan.com.cn,"主营业务为精纺呢绒及正装职业装的研发,设计,生产与销售.",赵亮,山东,36000.0,赵厚杰,20070429,www.nanshanchina.com,南山智尚,0,SZSE,SZSE,服饰加工,10240,-,纺织加工,10240010,3556793000,-14.77,-16.2,¥9.85,周期性消费,102,0.0,1100,9500.0,0.0,10000.0,1100,0.0,0.0,1.0,17.6,11.91,14.08,-30.04,2020-12-31T05:00:00Z,{1_trade_buy},{trade_buy},2020Q4_1751620
300882,2020Q4_1751605,浙江省台州市天台县福溪街道兴业东三街15号,智能化管理系统开发应用，智能化安装工程服务，架线和管道工程建筑施工，信息技术咨询服务，电子式智能电能表、用电信息采集产品，低压电力成套设备、电力监测及控制设备、配网自动化设备、智能水表、热量表、燃气仪表及设备、暖通仪表及设备、流量仪表、水电气热计量自动化管理终端、云平台的水、电、气、热能源收费服务系统、社会公共安全设备及器材、逆变器、智能电容器及无功补偿装置、电能计量箱、配电箱、计算机、通信和电子设备、充电设备、充电装置检测设备、智能断路器、智能开关、建筑安全用金属制品、智能插头、插座及产品组件的研发、制造、销售，物联网服务、信息系统集成、电力电气工程的安装施工和运维，货物和技术进出口。(依法须经批准的项目，经相关部门批准后方可开展经营活动),邬永强,台州市,公司是国家高新技术企业，主要从事智能电表、用电信息采集系统等产品的研发、生产和销售，致力于为国内外电力等行业客户提供专业化的计量产品，是国内电能仪表计量领域的领先企业之一，并积极进行智能水表、多表合一类产品的研发及应用。公司目前产品主要为包括单相智能表、三相智能表在内的智能电表以及包括集中器、采集器、专变采集终端等在内的用电信息采集系统产品，广泛应用于智能电网建设中的智能用电环节。智能电表是智能电网终端的重要组成部分，除具备传统电能表基本用电量的计量功能外，智能电表还具有多费率计量、用户端控制、预付费、防窃电、负荷记录、多种双向通讯方式等多项功能，实现智能电网和用户之间的双向沟通，并积极助力于国家智能电网实现“全覆盖、全采集、全费控”目标。2018年，公司在国家电网智能电表类产品的中标量总排名进入前五，其中，单相智能表中标量排名第四位。公司自2016年起，持续入围南方电网智能电表招标。发行人经过长期发展，凭借优秀的产品质量、先进的技术实力、良好的服务能力，成为国内智能电表和用电信息采集系统的重要供应商之一，并积极拓展国际市场。,irm@wellsun.com,"产品主要为包括单相智能表,三相智能表在内的智能电表以及包括集中器,采集器,专变采集终端等在内的用电信息采集系统产品,主要从事智能电表,用电信息采集系统等产品的研发,生产和销售.",邬永强,浙江,20442.94,陈东滨,19970721,www.wellsun.com,万胜智能,0,SZSE,SZSE,硬件,31120,-,科技仪器,31120060,3123761000,-9.54,-25.46,¥15.23,科技,311,0.0,520,11300.0,0.0,10000.0,520,0.0,0.0,1.3,0.0,0.0,0.0,0.0,2020-12-31T05:00:00Z,{1_trade_buy},{trade_buy},2020Q4_1751605
300881,2020Q4_1751604,江苏省常州市钟楼区邹区镇工业大道工业路48-1号,无缝钢管、不锈钢管、镍基合金制造及销售；自营和代理各类商品及技术的进出口业务(国家限定企业经营或禁止进出口的商品和技术除外)。(依法须经批准的项目，经相关部门批准后方可开展经营活动),周文庆,常州市,公司主要从事各类工业用能源设备类无缝钢管的生产、研发和销售，产品主要应用于电站锅炉设备制造、石油炼化等行业，客户包括上海锅炉厂、哈尔滨锅炉厂、东方锅炉等国内大型电站锅炉制造企业以及中石化、中海油等大型石油炼化企业。公司生产的无缝钢管按照材质分类，主要包括合金钢钢管、不锈钢钢管和碳钢钢管；产品外径覆盖16mm-159mm、长度覆盖6m-18m的各种型号。公司产品主要用于电站锅炉设备领域与石油炼化领域。公司2009年起连续被评为高新技术企业，目前在小口径电站锅炉用合金钢领域拥有很强的行业竞争力。根据中国钢结构协会钢管分会的数据，公司生产的小口径高压锅炉用无缝钢管产量2014年、2015年和2016年连续3年在国内同行业中排名第一。,webmaster@shengdechina.com,"公司主营业务包括研发,生产并销售合金钢,不锈钢和碳素钢无缝钢管以及钢格板类产品.公司生产的无缝钢管按照材质分类,主要包括合金钢钢管,不锈钢钢管和碳钢钢管.",缪一新,江苏,10000.0,周阳益,20011015,www.shengdechina.com,盛德鑫泰,0,SZSE,SZSE,钢铁和焦煤,10160,-,钢铁,10160020,3073659000,-14.54,-9.82,¥30.36,基础材料,101,0.0,300,9400.0,0.0,10000.0,300,0.0,0.0,1.0,77.99,31.75,42.11,-27.9,2020-12-31T05:00:00Z,{1_trade_buy},{trade_buy},2020Q4_1751604
300917,2020Q4_1751619,广东省深圳市福田区香蜜湖街道侨香路1010号特发文创广场五楼,一般经营项目：物业管理；水电工程；国内贸易；经济信息咨询；房地产经纪；为酒店提供管理服务；汽车零配件及汽车饰品的购销；自有物业租赁；园林绿化服务；绿化养护服务；花卉租摆；清洁服务；从事物业管理范围内的二次供水设施清洗消毒业务；建筑工程；投资兴办实业(具体项目另行申报)；经营电子商务。许可经营项目：游泳池经营；停车场经营；劳务派遣；餐饮服务；人力资源输出；人力资源开发与管理咨询；人才资源培训服务；企业人才的交流咨询；人力资源服务外包；人力资源管理软件；垃圾清运；道路清扫；园林设计；市政工程管理；“四害”防治；白蚁防治；环境消杀服务。,陈宝杰,深圳市,公司一直以综合设施管理服务为核心业务，致力于成为中国高端物业服务品牌供应商。公司所从事的服务内容包括综合设施管理、空间管理、安全保障、环境管理、高端接待、会议服务等，管理的项目涵盖高新科技园区、商业综合体、政府机关、学校、住宅等多种类型，主要客户包括华为、阿里巴巴、中国移动、国家电网等知名企业。公司相关业务已从珠三角经济圈辐射至国内的环渤海经济圈、长三角经济圈、西南经济圈、华中城市经济圈及海外的非洲等地。近年来，公司在提供物业管理服务的同时，还陆续拓展了政务服务、资产经营等业务，设立了特发楼宇、特发政务、特发商务、特发资产经营等子公司。凭借优质的服务质量，公司与主要客户建立了长期、稳定的服务关系。报告期内，公司多次受到核心客户及行业协会等相关单位的嘉奖，具体情况如下：2018年度深圳市物业管理行业协会优秀企业、2017年物业服务百强企业、中国企业信用评价AAA等。,sdgs@tefafuwu.com,"公司所从事的服务内容包括综合设施管理,空间管理,安全保障,环境管理,高端接待,会议服务等,管理的项目涵盖高新科技园区,商业综合体,政府机关,学校,住宅等多种类型.",崔平,广东,13000.0,陈宝杰,19930531,www.tefafuwu.com,特发服务,0,SZSE,SZSE,房地产,10410,-,房地产服务,10410020,3331872000,-8.92,-16.55,¥25.65,房地产,104,0.0,390,9000.0,0.0,10000.0,390,0.0,0.0,1.3,41.48,29.92,34.39,-25.41,2020-12-31T05:00:00Z,{1_trade_buy},{trade_buy},2020Q4_1751619
