symbol,_id,address,business_scope,chairman,city,descrpt,email,main_business,manager,province,reg_capital,secretary,setup_date,website,company,dividend_startyear,exchange,exchange_,group,groupcode,index_stockid,industry,industrycode,mktcap_norm_cny,pchange_12w,pchange_ytd,price,sector,sectorcode,share_percentage,shares,value,position,change,share_change,impact,abs_impact,split_factor,price_max,price_min,price_avg,change_from_average,portdate,action,comment,oid
000651,2020Q4_1747824,广东省珠海市前山金鸡西路,货物、技术的进出口；研发、制造、销售：泵、阀门、压缩机及类似机械，风机、包装设备等通用设备；电机、输配电及控制设备；电线、电缆、光缆及电工器材；家用制冷电器具，家用空气调节器及相关零部件；中央空调、制冷、空调设备、洁净空调、采暖设备、通风设备；空气源热泵热风机、热泵热水机、空调热水一体产品、燃气采暖热水炉设备、燃气供暖热水设备、热能节能设备、机电设备产品及相关零部件；新风及新风除霾设备；通讯终端设备及相关零部件；气体，液体分离及纯净设备及相关零部件；消毒器械；医疗器械、实验室设备；家用清洁卫生电器具、家用厨房电器具、家用通风电器具、其它家用电力器具及相关零部件；厨房用具、不锈钢制品、日用五金；炊具及配件、餐具及配件技术；建筑机电设备安装工程、泳池水处理、中央热水工程；新能源发电产品、储能系统及充电桩；电源、变流器、逆变器电力产品；直流电器及设备；节能产品、照明灯具制造、节能工程；电工仪器仪表；工业自动控制系统装置；能源信息集成管理系统；销售、安装及维护：中央空调、制冷、空调设备、洁净空调、采暖设备、通风设备；空气源热泵热风机、热泵热水机、空调热水一体产品、燃气采暖热水炉设备、燃气供暖热水设备、热能节能设备、新,董明珠,珠海市,公司成立初期，主要依靠组装生产家用空调，现已发展成为多元化的工业集团，产业覆盖空调、高端装备、生活品类、通信设备等领域，产品远销160多个国家和地区。公司拥有国家重点实验室、国家工程技术研究中心、国家级工业设计中心、国家认定企业技术中心、机器人工程技术研发中心各1个，同时成为国家通报咨询中心研究评议基地。公司加快推进产业布局转型升级，2013年起，相继进军智能装备、通信设备、模具等领域，目前格力智能装备已为家电、汽车、食品、3C数码、建材卫浴等众多行业提供服务，格力已经从专业的空调生产企业迈入多元化的高端技术产业时代。,gree@gree.com.cn;gree0651@cn.gree.com,主要产品:空气调节器.,董明珠,广东,601573.09,邓晓博,19891213,www.gree.com.cn,格力电器,2019,SZSE,SZSE,硬件,31120,-,消费类电子产品,31120030,297659591000,-18.32,-20.05,¥49.99,科技,311,0.0,0,0.0,0.0,-10000.0,-1192700,-2.05,2.05,1.0,69.53,54.71,62.52,-20.04,2020-12-31T05:00:00Z,{5_trade_sell},{trade_sell},2020Q4_1747824
600998,2020Q4_1747854,湖北省武汉市汉阳区龙阳大道特8号,批发中药饮片、中成药、中药材、化学药制剂、抗生素制剂、抗生素原料药、生化药品、生物制品、化学原料药、医疗用毒性药品(中西药)、精神药品(一类、二类)、体外诊断试剂、麻醉药品、蛋白同化剂、肽类激素；批发危险化学品；消毒品；销售一、二、三类医疗器械(含体外诊断试剂)；药品的包装材料和容器；医药中间体；化学试剂；中药材种植、中药研究、中药产业投资咨询(不含证券投资咨询)、批零兼营化妆品、日用百货、农副土特产品、日用家电、五金、玩具、酒类、电子和数码产品；销售预包装食品(含冷藏冷冻食品)；特殊食品销售(保健食品、特殊医学用途配方食品、婴幼儿配方乳粉、其他婴幼儿配方食品)；各类技术和商品的进出口(国家法律法规规定需要获得批准后方可经营的商品和技术除外)；仓储设施建设与经营、物流技术开发与服务、信息咨询与服务。租赁一、二、三类医疗器械(含体外)，医疗器械咨询、安装、检测、维修服务，自有房屋租赁、设备租赁，企业管理软件的销售与售后服务；添加剂的销售、农药销售；药用辅料和化工产品(不含危化品)热食类食品制售；互联网药品和医疗器械信息服务；汽车新车销售。(涉及许可经营项目，应取得相关部门许可后方可经营)。,刘长云,武汉市,公司是一家以西药、中药、器械为主要经营产品，以医疗机构、批发企业、零售药店为主要客户对象，并为客户提供信息、物流等各项增值服务的大型企业集团。公司坚持打造品牌中药材，建立中药产业集团，围绕“强品牌、强产品、强营销，重基础、重人才、重效益”的经营主线，推动中药产业链五大板块协同发展。公司秉持“技术让服务更卓越”的理念，并致力于现代物流技术和信息技术的开发和应用，通过自行设计、规划、系统集成，广泛使用了具有自主知识产权的仓储管理系统(LMIS)、设备控制系统(WCS)、运输管理系统(TMS)、第三方物流平台、药品监管码采集等系统，是具备独立整合物流规划、物流实施、系统集成能力的医药分销企业，并获得了“中国物流改革开放30年旗帜企业”的荣誉称号。公司近年来获得“国家5A级物流企业”、“湖北省守合同重信用企业”、“中国社会责任感优秀企业”、“湖北企业100强”、“中国民营企业服务业100强”、“中国企业500强”等多项荣誉称号。,lxy1777@vip.sina.com;believen@jztey.com,"主营业务为药品,医疗器械等产品的批发,零售连锁及药品生产和研发以及有关增值服务业务.主要产品多潘立酮片(吗丁啉),氯雷他定片(开瑞坦),复方氨基酸螯合钙胶囊(乐力),硝酸咪康唑乳膏(达克宁),硝苯地平缓释片Ⅱ(伲福达)等;健胃消食片,复方丹参滴丸,感冒灵颗粒,排毒养颜胶囊,脑心通胶囊(步长)等,阿胶,丹参,京牛黄,冬虫夏草,红花等,玻璃体温计(口腔型),电子血压计,康祝拔罐器,台式血压计,血糖仪等;左炔诺孕酮片(毓婷),米非司酮片,去氧孕烯炔雌醇片(妈富隆),米索前列醇片,壬苯醇醚栓(连德尔)等,哈药六牌钙加锌口服液,三精牌葡萄糖酸锌口服液,新盖中盖高钙片(低糖),碧生源常润茶,朴雪乳酸亚铁口服液,京都念慈菴蜜炼川贝枇杷膏,丁桂儿脐贴(宝宝一贴灵),桂林西瓜霜(喷剂),珠珀猴枣散,邦廸防水创可贴等;六神花露水,双飞人爽水,蛇脂维肤膏,半月清腋露等.",刘义常,湖北,187381.09,林新扬,19990309,www.jztey.com,九州通,0,SHSE,SHSE,医疗机构和服务,20645,-,医药零售,20645020,27601271000,-12.48,-16.19,¥14.57,医疗保健,206,0.0,0,0.0,0.0,-10000.0,-452000,-0.26,0.26,1.0,18.6,17.11,17.82,-18.24,2020-12-31T05:00:00Z,{5_trade_sell},{trade_sell},2020Q4_1747854
600600,2020Q4_1747852,山东省青岛市香港中路五四广场青啤大厦,生产啤酒；预包装食品销售；生产饮料、威士忌、蒸馏酒。,黄克兴,青岛市,公司经营范围是啤酒制造、销售以及与之相关的业务。目前公司在国内拥有62家全资和控股的啤酒生产企业，及2家联营及合营啤酒生产企业，分布于全国20个省、直辖市、自治区，规模和市场份额居国内啤酒行业领先地位。其生产的青岛啤酒为国际市场上最具知名度的中国品牌，已行销世界100个国家和地区。目前，青岛啤酒远销美国、加拿大、英国、法国、德国、意大利、澳大利亚、韩国、日本、丹麦、俄罗斯等世界90多个国家和区域。全球啤酒行业权威报告Barth Report依据产量排名，青岛啤酒为世界第五大啤酒厂商。,secretary@tsingtao.com.cn;info@tsingtao.com.cn,主要产品:啤酒.,,山东,136447.68,张瑞祥,19951227,www.tsingtao.com.cn,青岛啤酒,2017,SHSE,SHSE,酒精饮料,20510,-,啤酒,20510010,115203206000,16.86,2.22,¥98.41,非周期性消费,205,0.0,0,0.0,0.0,-10000.0,-98000,-0.23,0.23,1.0,107.52,74.15,88.91,10.68,2020-12-31T05:00:00Z,{5_trade_sell},{trade_sell},2020Q4_1747852
000002,2020Q4_1747822,广东省深圳市盐田区大梅沙环梅路33号万科中心,房地产开发；兴办实业(具体项目另行申报)；国内商业、物资供销业(不含专营、专控、专卖商品)；进出口业务(按深经发审证字第113号外贸企业审定证书规定办理)。,郁亮,深圳市,公司成立于1984年，1988年进入房地产行业，经过三十余年的发展，已成为国内领先的城市配套服务商，公司业务聚焦全国经济最具活力的三大经济圈及中西部重点城市。2014年万科第四个十年发展规划，已经把“三好住宅供应商”的定位延展为“城市配套服务商”。2018年万科将这一定位进一步迭代升级为“城乡建设与生活服务商”，并具体细化为四个角色：美好生活场景师，实体经济生力军，创新探索试验田，和谐生态建设者。2017年，深圳地铁集团成为本集团第一大股东，始终支持万科的混合所有制结构，支持万科城市配套服务商战略和事业合伙人机制，支持万科管理团队按照既定战略目标，实施运营和管理，支持深化“轨道+物业”发展模式。公司核心业务包括住宅开发、物业服务、长租公寓。2018年，公司将自身定位进一步迭代升级为“城乡建设与生活服务商”，所搭建的生态体系已初具规模，在巩固住宅开发和物业服务固有优势的基础上，业务已延伸至商业开发和运营、物流仓储服务、租赁住宅、产业城镇、冰雪度假、养老、教育等领域，为更好的服务人民美好生活需要、实现可持续发展奠定了良好基础。,ir@vanke.com,房地产开发和物业服务,祝九胜,广东,1161773.22,朱旭,19840530,www.vanke.com,万科Ａ,2020,SZSE,SZSE,房地产,10410,-,房地产开发,10410010,265596031000,-17.82,-18.05,¥23.95,房地产,104,0.0,0,0.0,0.0,-10000.0,-242000,-0.19,0.19,1.0,31.61,26.96,28.94,-17.24,2020-12-31T05:00:00Z,{5_trade_sell},{trade_sell},2020Q4_1747822
600132,2020Q4_1747847,重庆市九龙坡区马王乡龙泉村1号,啤酒、非酒精饮料(限制类除外)的生产、销售；啤酒设备、包装物、原辅材料的生产、销售；普通货运(不含危险品运输)。,Roland Arthur Lawrence,重庆市,公司前身为重庆啤酒厂，创建于1958年，始终致力于品牌文化建设，将品牌内涵与城市文化相融合，成为重庆一张重要的城市名片。经过60年的市场竞争，公司由建厂之初的60万资产，发展为拥有资产近35亿元，年销售啤酒近100万千升的西南领先啤酒企业，“中国十大啤酒集团”之一，连续二十年进入“重庆工业五十强”。1997年成为上市公司后，重啤股份发展更加迅猛，在立足重庆本土的基础上，通过兼并、合资、参股、资产重组等现代资本运作的方式，不断扩张。目前，重啤股份有15个生产基地，分布于重庆、四川、湖南等地。重啤股份也始终致力于引进国际资本、先进技术和管理经验，在中国啤酒企业中率先与世界啤酒巨头展开合作。2013年，全球第三大啤酒商、丹麦嘉士伯集团经过多年的增持，以60%的持股比例成为重啤股份第一大股东，重啤股份由此正式成为嘉士伯集团成员。,CBCSMIR@chongqinggroup.cn,主要产品:啤酒.,Lee Chee Kong,重庆,48397.12,邓炜,19931220,www.chongqingbeer.com,重庆啤酒,2012,SHSE,SHSE,酒精饮料,20510,-,啤酒,20510010,97125455000,64.37,70.86,¥199.49,非周期性消费,205,0.0,0,0.0,0.0,-10000.0,-79100,-0.18,0.18,1.0,122.0,99.87,109.59,82.03,2020-12-31T05:00:00Z,{5_trade_sell},{trade_sell},2020Q4_1747847
300326,2020Q4_1747836,上海市浦东新区张江高科技园东区瑞庆路528号23幢2楼,生物医学材料及制品的研发与生产，销售自产产品；生产医疗器械(以医疗器械生产许可证为限)；销售及进出口医疗器械(以医疗器械经营许可证为限)，并提供相关技术咨询和售后技术服务；生产并销售教具；在浦东新区张江高科技园区瑞庆路528号23幢内从事自有生产用房出租。在青浦区香花桥街道天辰路508号从事自有房屋租赁及相关物业管理；仪器仪表、电子产品、医用辅料的原材料、医疗用品及器材的批发与进出口，电子设备的维修。,袁征,上海市,公司是一家专业从事医疗器械科研、开发、生产和销售的高科技公司。主营业务为椎体成形微创介入手术系统的研发、生产和销售，产品主要用于因骨质疏松导致的椎体压缩性骨折的临床微创手术治疗，包括经皮椎体成形(PVP)手术系统和经皮球囊扩张椎体后凸成形(PKP)手术系统。公司产品曾先后荣获“上海市重点新产品”、“上海市自主创新产品”、“上海市专利新产品”等荣誉称号，并获得科技部“科技型中小企业技术创新基金”的支持，列入“上海市高新技术成果转化项目”。,KMC@shkmc.com.cn,"主要从事椎体成形微创介入手术系统的研发,生产和销售.",袁征,上海,72297.63,丁魁,20050331,www.kineticmedinc.com.cn,凯利泰,2020,SZSE,SZSE,医疗器械,20650,-,医疗设备,20650010,8589525000,26.67,-24.48,¥12.07,医疗保健,206,0.0,0,0.0,0.0,-10000.0,-173400,-0.15,0.15,1.0,23.63,14.49,17.46,-30.87,2020-12-31T05:00:00Z,{5_trade_sell},{trade_sell},2020Q4_1747836
300003,2020Q4_1747834,北京市昌平区超前路37号,医疗器械及其配件的技术开发、生产；销售自产产品；提供自产产品的技术咨询服务；上述产品的进出口；技术进出口；佣金代理(不含拍卖，涉及配额许可证管理、专项规定管理的商品按国家有关规定办理)。,蒲忠杰,北京市,公司是一家专业从事冠脉支架、PTCA球囊导管、中心静脉导管及压力传感器的研发、生产和销售的企业，国内高端医疗器械领域能够与国外产品形成强有力竞争的为数较少的企业之一。自成立以来，相继完成了支架、导管等多项介入医疗核心产品的研制开发和产业化工作，在业内第一个获得国家药监局颁发的“冠状动脉支架输送系统”产品注册证(III类)、第一个研发并试制成功抗感染“药物中心静脉导管”。公司具备了心血管介入、麻醉监护产品的工业化生产能力，PARTNER药物支架成功上市使公司为拥有雷帕霉素药物支架生产技术的公司。,zqb@lepumedical.com,"公司的主营业务包括医疗器械业务(含心脏病治疗产品,新型介入诊疗业务,体外诊断试剂和医疗产品代理配送),药品业务及海外业务三大板块.公司主要产品包括血管内药物(雷帕霉素)洗脱支架系统,冠脉支架输送系统,PTCA球囊扩张导管,药物中心静脉导管等.",张志斌,北京,180458.11,蒲忠杰,19990611,www.lepumedical.com,乐普医疗,2014,SZSE,SZSE,医疗器械,20650,-,医疗设备,20650010,54062607000,8.77,11.29,¥29.42,医疗保健,206,0.0,0,0.0,0.0,-10000.0,-134700,-0.15,0.15,1.0,35.43,26.3,29.88,-1.54,2020-12-31T05:00:00Z,{5_trade_sell},{trade_sell},2020Q4_1747834
603198,2020Q4_1747856,安徽省六安市霍山县佛子岭镇,白酒及其他酒研发、生产与销售；粮食等原辅料收购；饲料加工、销售。包装装潢、装订及其他印刷相关服务、纸制品制造与销售(分公司经营)；瓶罐、瓶盖、特种容器、药品包装材料、模具制造与销售(分公司经营)；酒店管理服务；餐饮服务；住宿服务；会议及展览服务(分公司经营)。自营和代理各类商品和技术的进出口(国家限定公司经营或禁止进出口的商品和技术除外)(经营范围最终以工商行政机关核准项目为准)。,倪永培,六安市,公司是迎驾集团的核心企业，是国家级绿色工厂中唯一的酒类企业，是全国酿酒骨干企业，是大别山革命老区的支柱产业，是北纬30度线中国名酒带上的明星企业。迎驾贡酒依托大别山自然保护区内的无污染山涧泉水，以中温包包曲为糖化发酵剂，运用多粮型传统工艺和现代科技手段精心酿造而成。公司是中国生态酿酒的倡导者与引领者，采用“生态产区、生态剐水、生态酿艺、生态循环、生态洞藏、生态消费”的全产业链生态模式，铸就了迎驾贡酒“绵、甜、醇、柔、香”的口感特征。迎驾贡酒先后获得“国家地理标志保护产品”、“中华老字号”等殊荣，迎驾酒传统酿造技艺被列入“非物质文化遗产名录”，迎驾酒厂被上海大世界基尼斯总部认定为“中国生态环境最美的酒厂”。,stock@yingjia.cn;yjgj@yingjia.cn,"公司主要从事白酒的研发,生产和销售,公司生产的迎驾国宾系列酒,生态年份系列酒,迎驾之星系列酒,百年迎驾贡系列酒,迎驾古坊系列酒,迎驾糟坊系列酒等白酒产品主要系浓香型白酒,具有“窖香幽雅,绵甜爽口”的鲜明风格.",杨照兵,安徽,80000.0,孙汪胜,20031128,www.yingjia.cn,迎驾贡酒,2015,SHSE,SHSE,酒精饮料,20510,-,其他酒类,20510020,32510035000,10.53,18.77,¥39.75,非周期性消费,205,0.0,0,0.0,0.0,-10000.0,-218600,-0.14,0.14,1.0,39.48,20.56,30.44,30.58,2020-12-31T05:00:00Z,{5_trade_sell},{trade_sell},2020Q4_1747856
000860,2020Q4_1747825,北京市顺义区站前街1号院1号楼顺鑫国际商务中心12层,粮食作物、经济作物、蔬菜、花卉、园艺作物、水果加工；肉类、肉制品及副产品加工与销售；种畜产品、农作物种子、蔬菜种子繁育与销售；白酒、速冻食品、配制酒、蒸馏酒、发酵酒制造与销售；销售定型包装食品、食用油、酒、饮料：以下项目仅限分公司经营：水产品、豆制品、蛋品加工与销售；米面制品、方便面及其他方便食品、糕点、面包、调味品制造与销售；货物专项运输(冷藏保鲜)；普通货物运输；调味料(半固态)、罐头(其他罐头)。一般经营项目：粮食作物、经济作物、蔬菜、花卉、园艺作物、水果种植与销售；畜禽养殖；淡水养殖；技术开发、技术服务、信息咨询；物流综合业务；销售粮食、百货、机械电器设备、建筑材料、饲料、种苗、农药、(不含危险化学品)、化肥；货物进出口、技术进出口、代理进出口、国际货运代理。粮食收购。出租办公用房。仓储服务。,李颖林,北京市,公司是北京市第一家农业类上市公司，公司从事的主要业务包括：白酒酿造与销售；种猪繁育、生猪养殖、屠宰及肉制品加工；房地产开发。公司现已形成了以白酒、猪肉为主的两大产业。白酒产业的主要产品以“牛栏山”和“宁诚”为代表，“牛栏山”现已形成清香型“二锅头”和浓香型“百年”两大系列白酒；“宁诚”现主要为绵香型宁城老窖白酒。公司种猪繁育、生猪养殖、屠宰及肉制品加工业务产品，主要包括“小店”牌种猪及商品猪、“鹏程”牌生鲜及熟食制品。牛栏山酒厂是北京地区保持自主酿造规模最大的白酒企业，是北京地区白酒行业中最早拥有“中华老字号”、“中国驰名商标”和“中国酿酒大师”(首届)的企业。,zhangxiaoyong@shunxinholdings.com;ayz001@sina.com;sxnygf000860@163.com,"主要业务:白酒的生产和销售;肉类产品的生产和销售;果蔬饮料的生产和销售;种畜产品,农作物种子,蔬菜种子的繁育和销售.",安元芝,北京,74176.7,安元芝,19980921,www.000860.com,顺鑫农业,2013,SZSE,SZSE,企业集团,31030,-,企业集团,31030010,28937616000,-19.64,-46.18,¥38.07,工业,310,0.0,0,0.0,0.0,-10000.0,-74400,-0.13,0.13,1.0,72.74,51.69,61.41,-38.01,2020-12-31T05:00:00Z,{5_trade_sell},{trade_sell},2020Q4_1747825
600009,2020Q4_1747845,上海市浦东新区启航路900号,"为国内外航空运输企业及旅客提供地面保障服务，经营出租机场内航空营业场所、商业场所和办公场所,国内贸易(除专项规定)；广告经营，货运代理、代理报关、代理报检业务，长途客运站，停车场管理及停车延伸服务,经营其它与航空运输有关的业务；综合开发，经营国家政策许可的其它投资项目。",莘澍钧,上海市,"公司是中国最大的三个国际中转枢纽航空港之一。公司的经营范围是为国内外航空运输企业及旅客提供地面保障服务，经营出租机场内航空营业场所、商业场所和办公场所,国内贸易(除专项规定)；广告经营，货运代理、代理报关、代理报检业务，长途客运站，停车场管理及停车延伸服务，经营其它与航空运输有关的业务；综合开发，经营国家政策许可的其它投资项目。经过04年的资产重组，公司绝大部分资产和业务从“上海虹桥机场”转移到“上海浦东机场”，拥有浦东机场的候机楼及一期跑道等资产，业务集中于浦东国际机场的经营管理与地面保障业务。公司借鉴国内外民航业的先进经验，结合自身安全工作特点，建立了安全管理体系，包含安全政策、风险管理、安全保证、安全促进等维度。公司拥有完善的全员创新机制，规范透明的内部管理，努力为中外旅客提供卓越的机场真情服务体验，积极推出“十大服务新举措”，提升浦东机场整体服务品质。",ir@shairport.com,"主营业务:航空性业务和非航空性业务,航空性业务指与飞机,旅客及货物服务直接关联的基础性业务;其余类似延伸的商业,办公室租赁,值机柜台出租等都属于非航空性业务.",胡稚鸿,上海,192695.84,黄晔,19980211,www.shairport.com,上海机场,2014,SHSE,SHSE,交通运输,31080,-,机场和航空服务,31080010,85510257000,-20.11,-40.93,¥45.19,工业,310,0.0,0,0.0,0.0,-10000.0,-55500,-0.12,0.12,1.0,81.9,63.15,73.49,-38.51,2020-12-31T05:00:00Z,{5_trade_sell},{trade_sell},2020Q4_1747845
600201,2020Q4_1747850,内蒙古自治区呼和浩特市经济技术开发区沙尔沁工业园区金宇大街1号,兽用生物药品制造和销售；兽用化学药品制剂制造和销售；化学试剂和助剂制造和销售；生物药品制剂制造和销售；生物技术开发、转让、咨询服务；先进医疗设备及器械制造和销售；货物进出口、技术进出口；物业管理。(依法须经批准的项目，经相关部门批准后方可开展经营活动),张翀宇,呼和浩特市,公司(原内蒙古金宇集团股份有限公司)成立于1993年3月，1999年1月在上海证券交易所上市，是A股生物制药板块绩优上市公司。公司主要从事兽用生物制品的研发、生产与销售，产品种类涵盖猪、禽、宠物和反刍类四大系列100余种动物疫苗。公司拥有口蹄疫和高致病性禽流感两大强制免疫疫苗农业部的定点生产资质，工艺技术和产品质量保持国内领先水平。同时，依托兽用疫苗国家工程实验室研发平台，凭借完善的销售渠道和全方位的技术服务，进而为养殖客户提供动物疫病防控整体解决方案。公司是国内首家采用悬浮培养和纯化浓缩技术生产口蹄疫疫苗的厂家，并牵头制定了口蹄疫疫苗抗原含量、杂蛋白含量和抗原杂蛋白检测三项行业新标准，公司拥有兽用疫苗国家工程实验室、农业部反刍动物生物制品重点实验室和国家高级别生物安全实验室三个国家级创新平台，并设有博士后科研工作站联合培养实验室，成为动物疫苗行业研发的制高点和技术创新平台。,stock@jinyu.com.cn;yangzhao@jinyu.com.cn,主要产品为生物药品.,张竞,内蒙古,112624.02,杨钊,19930313,www.jinyu.com.cn,生物股份,2020,SHSE,SHSE,生物科技,20610,-,生物科技,20610010,21252920000,-5.31,-8.62,¥19.00,医疗保健,206,0.0,0,0.0,0.0,-10000.0,-140000,-0.12,0.12,1.0,27.7,20.41,23.6,-19.49,2020-12-31T05:00:00Z,{5_trade_sell},{trade_sell},2020Q4_1747850
