symbol,_id,address,business_scope,chairman,city,descrpt,email,main_business,manager,province,reg_capital,secretary,setup_date,website,company,dividend_startyear,exchange,exchange_,group,groupcode,index_stockid,industry,industrycode,mktcap_norm_cny,pchange_12w,pchange_ytd,price,sector,sectorcode,share_percentage,shares,value,position,change,share_change,impact,abs_impact,split_factor,price_max,price_min,price_avg,change_from_average,portdate,action,comment,oid
003026,2020Q4_1747731,浙江省湖州市长兴县太湖街道陆汇路59号,晶体硅、电子元器件制造、销售，晶体硅及其制品、电子元器件及新型节能材料的开发、技术咨询及技术转让，电气机械设备设计及销售；货物进出口、技术进出口。(依法须经批准的项目，经相关部门批准后方可开展经营活动),徐一俊,湖州市,公司是一家专业从事硅材料研发、生产和销售的电子信息产业国家级高新技术企业。发行人是国家高新技术企业、全国半导体设备和材料标准化技术委员会成员单位，是中国半导体行业协会、中国电子材料行业协会会员单位，在半导体硅材料制造领域拥有多项核心技术和专利。发行人核心管理团队拥有二十多年的半导体行业从业经验，长期致力于半导体硅材料的研发与生产，在研发、生产工艺、质量控制等方面拥有完善的技术储备和强大的技术创新能力。经过近十年的发展，目前发行人在分立器件用半导体硅材料领域尤其是硅研磨片细分领域已具有领先的市场地位。,ir@mtcn.net,"主营业务为半导体硅材料的研发,生产和销售,主要产品为半导体硅片及半导体硅棒.",徐一俊,浙江,9976.0,李志萍,20100125,www.mtcn.net,中晶科技,0,SZSE,SZSE,半导体,31130,-,半导体仪器和材料,31130010,8265662000,2.22,81.91,¥82.98,科技,311,0.0,500,21700.0,0.0,10000.0,500,0.0,0.0,1.0,47.16,20.0,31.87,160.37,2020-12-31T05:00:00Z,{1_trade_buy},{trade_buy},2020Q4_1747731
300927,2020Q4_1747761,江苏省南通市开发区崇川区中央路16号,"多聚甲醛,甲醛,氯甲烷的生产,销售;第3类易燃液体,第4类易燃固体,自燃物品和遇湿自燃物品;第6类毒害品;第8类腐蚀品批发(以上化学危险品凭有效许可证生产经营,不得超范围经营危险化学品,不得经营剧毒化学品,成品油,一类易制毒品和监控化学品.经营场所及末经批准的其他场所均不得存放危险化学品).乙二醇半缩醛的生产,销售;多聚甲醛,甲醛,氯化烷及其下游产品的开发,技术咨询,技术培训(非学历,非职业技能培训);化工产品(除危险品)销售;自营和代理各类商品和技术的进出口业务,但国家限定公司经营或禁止进出口的商品和技术除外.(依法须经批准的项目,经相关部门批准后方可开展经营活动)",朱辉,南通市,"公司是按现代企业管理制度建立起来的以生产有机化工原料、中间体和新型材料为主的国有有限责任公司。公司是江苏省高新技术企业。公司专注于以甲醇下游深加工为产业链的高端专用精细化学品的研发、生产和销售。公司主要产品包括颗粒多聚甲醛、高浓度甲醛、超高纯氯甲烷及1,3,5-三丙烯酰基六氢-均三嗪等，目前公司产品应用于合成树脂、胶黏剂、混凝土外加剂、农药除草剂、香精香料、染料、电子化学品以及纺织染整助剂、表面活性剂等多个领域。公司具备突出的技术实力和研发能力，公司多年来一直注重产品生产技术的革新与工艺的改进优化，拥有7项发明专利和27项实用新型专利；公司生产的颗粒多聚甲醛、高浓度甲醛及超高纯氯甲烷被认定为高新技术产品，产品各项技术指标及生产工艺均处于行业领先水平。公司高度重视安全生产和环境保护，不断提升生产的绿色、智能及节能化水平，先后获得“安全生产标准化二级企业”、“江苏省节水型企业”、南通市环境信用评级“绿色等级企业”等资质及称号。",security@ntjtc.cn;chenmei@ntjtc.cn;shibin@ntjtc.cn,"公司专注于以甲醇下游深加工为产业链的高端专用精细化学品的研发,生产和销售.公司主要产品包括颗粒多聚甲醛,高浓度甲醛,超高纯氯甲烷及1,3,5-三丙烯酰基六氢-均三嗪等.",朱辉,江苏,8020.0,史彬,19991104,www.ntjtc.com,江天化学,0,SZSE,SZSE,化工,10130,-,化学制品,10130010,2631278000,-0.39,0.0,¥32.19,基础材料,101,0.0,2200,29000.0,0.0,10000.0,2200,0.0,0.0,1.0,0.0,0.0,0.0,0.0,2020-12-31T05:00:00Z,{1_trade_buy},{trade_buy},2020Q4_1747761
300925,2020Q4_1747759,广东省深圳市南山区西丽街道松坪山社区高新北六道15号昱大顺科技园B座1层-6层,一般经营项目：计算机软硬件、程序编制；互联网软件的技术开发、技术咨询、技术服务、技术转让；硬件嵌入式软件及系统周边的技术研发与系统集成、技术咨询；技术服务进出口；数据处理服务、企业管理服务；翻译咨询、翻译服务。许可经营项目：增值电信业务。,严华,深圳市,公司是一家致力于为客户提供专业的信息技术外包(ITO)服务的提供商。公司基于对信息技术的研究与开发，结合客户的业务场景，为客户在信息化和数字化进程中的不同需求提供软件技术外包服务。公司自设立以来，主营业务未发生重大变化。经过多年的研发技术积累、行业经验沉淀、组织管理优化和业务市场开拓，结合强有力的客户管理能力，公司已经与金融、互联网、软件、通信、房地产、航空物流、制造业、批发零售等多个行业的客户形成长期而稳定的合作关系。,zqtz@farben.com.cn,"公司基于对信息技术的研究与开发,结合客户的业务场景,为客户在信息化和数字化进程中的不同需求提供软件技术外包服务.",严华,广东,22009.92,黄照程,20061108,www.farben.com.cn,法本信息,0,SZSE,SZSE,软件,31110,-,软件和信息技术服务,31110010,5436166000,16.57,-7.54,¥24.48,科技,311,0.0,5950,162700.0,0.0,10000.0,5950,0.0,0.0,1.7,31.18,27.71,29.44,-16.85,2020-12-31T05:00:00Z,{1_trade_buy},{trade_buy},2020Q4_1747759
601686,2020Q4_1747775,天津市静海区大邱庄镇环湖南路1号,高频焊管、热镀锌钢管、钢塑复合管、不锈钢复合管、PP-R管、PE管、螺旋钢管制造、加工；金属材料、建筑材料、五金交电、铁精粉批发兼零售；货物及技术的进出口(法律、行政法规另有规定的除外)；机器设备租赁。(依法须经批准的项目，经相关部门批准后方可开展经营活动),李茂津,天津市,公司是国内最大的焊接钢管研发、生产、销售企业，公司主营产品包括焊接圆管、镀锌圆管、方矩焊管、方矩镀锌管、钢塑复合管和螺旋焊管等，广泛使用于供水、排水、供气、供热、消防工程、钢结构、建筑工程、装备制造等领域。2006年至2018年连续13年产销量排名全国第一；2006年至2018年，公司连续13年位列中国企业500强、中国制造业企业500强。公司秉承“共赢互利信为本，同心共进德为先”的价值理念，一向坚守诚信、注重品牌建设，通过多年的潜心经营，在行业内树立了良好形象，“友发”、“正金元”商标被先后认定为“中国驰名商标”，“友发”牌焊接圆管、镀锌圆管、方钜焊管、钢塑复合管连续多年被天津市政府授予“天津市名牌产品”称号，“正金元”牌钢管获得2016年河北省名牌产品称号。“友发”和“正金元”品牌成为公司重要的形象品牌，形成了产品品牌优势，增强了客户粘性，推动公司长期良性发展。,investor@yfgg.com;zhangyu@yfgg.com;duyunzhi@yfgg.com,"主营业务为焊接钢管的研发,生产与销售,主营产品包括焊接圆管,镀锌圆管,方矩焊管,方矩镀锌管,钢塑复合管和螺旋焊管等.",陈广岭,天津,143855.66,杜云志,20111226,www.yfgg.com,友发集团,0,SHSE,SHSE,钢铁和焦煤,10160,-,钢铁,10160020,15766606000,-9.7,-7.67,¥10.98,基础材料,101,0.0,2400,29400.0,0.0,10000.0,2400,0.0,0.0,1.0,18.52,12.18,14.42,-23.86,2020-12-31T05:00:00Z,{1_trade_buy},{trade_buy},2020Q4_1747775
300918,2020Q4_1747755,山东省烟台市龙口市东江镇南山工业园,高档织物面料的纺、织染及后整理加工和服装、服饰研发、生产(不含国家纺织品配额管理的商品)，羊毛洗毛、制条；特种劳动防护用品(防静电服、酸碱类化学品防护服、阻燃服)的生产；并销售及网上经营公司上述所列自产产品；新材料科技开发、技术开发、技术推广、技术转让；企业管理服务；国内展览展销服务；货物及技术的进出口业务(国家限定或禁止的除外)；仓储服务(不含危险化学品)；纺织原料与纺织品的检测检验。(依法须经批准的项目，经相关部门批准后方可开展经营活动),赵亮,烟台市,公司集纺织服饰智能制造与品牌运营为一体，主营业务为精纺呢绒及正装职业装的研发、设计、生产与销售。公司拥有完善的毛纺织服饰产业链，涵盖了集面料研发、毛条加工、染色、纺纱、织造、后整理于一体的精纺呢绒业务体系，以及集成衣研发、设计、制造、品牌运营于一体的服装业务体系。公司为国内精纺呢绒、正装职业装领军企业，“南山”牌精纺呢绒、“缔尔玛”牌职业装先后被国家工商总局认定为中国驰名商标。公司为精梳毛机织物单项冠军示范企业，“缔尔玛”牌职业装先后获评“中国职业装十大顶级品牌”、“中国服装成长品牌”。公司是国家级高新技术企业、中国纺织工业联合会认定的纺织技术创新示范企业，公司检测中心是中国合格评定国家认可委员会认可的实验室。公司凭借自身的科技实力与市场影响力，多次参与制定了纺织领域国家及行业技术标准。截至本招股说明书签署日，公司已形成专利71项，其中发明专利24项，获得山东省科技进步奖3次、中国纺织行业专利奖优秀奖2次。,zhaohoujie@nanshan.com.cn;rfzzqb@nanshan.com.cn,"主营业务为精纺呢绒及正装职业装的研发,设计,生产与销售.",赵亮,山东,36000.0,赵厚杰,20070429,www.nanshanchina.com,南山智尚,0,SZSE,SZSE,服饰加工,10240,-,纺织加工,10240010,3556793000,-14.77,-16.2,¥9.85,周期性消费,102,0.0,10600,123400.0,0.0,10000.0,10600,0.0,0.0,1.0,17.6,11.91,14.08,-30.04,2020-12-31T05:00:00Z,{1_trade_buy},{trade_buy},2020Q4_1747755
003019,2020Q4_1747729,福建省厦门市集美区杏林南路60号厂房,光电子器件及其他电子器件制造；计算机整机制造；计算机零部件制造；其他计算机制造；电子元件及组件制造；印制电路板制造；机器人及智能设备的设计、研发、制造及销售(不含须经许可审批的项目)；工程和技术研究和试验发展；软件开发；信息系统集成服务；信息技术咨询服务；数据处理和存储服务；集成电路设计；计算机、软件及辅助设备批发；其他机械设备及电子产品批发；经营各类商品和技术的进出口(不另附进出口商品目录)，但国家限定公司经营或禁止进出口的商品及技术除外；经营本企业自产产品的出口业务和本企业所需的机械设备、零配件、原辅材料的进口业务(不另附进出口商品目录)，但国家限定公司经营或禁止进出口的商品及技术除外。,孙大明,厦门市,公司是商用智能交互显示设备整体解决方案提供商，专注于定制化商用智能交互显示设备的研发、设计、生产和销售服务。公司产品主要包括智能交互显示器、智能交互一体机和智能交互显示设备零部件，广泛应用于零售、金融、工业自动化、医疗、餐饮、快递物流、游戏娱乐、交通运输、公共事业等终端领域。公司通过个性化的设计服务，能够满足上述领域客户对于产品广色域、色温、亮度、散热、防静电、防干扰、防强光、防误触摸、防尘、防水、抗暴性、防腐蚀等性能的需求，确保产品在各种环境下运行的稳定性、可靠性和耐久性。公司凭借业内领先的产品质量和服务水平，与Elo、NCR、Diebold、Mouse、Acrelec、长城信息、瑞迅、新北洋等国内外知名品牌商客户建立了长期、稳定的合作关系；公司产品目前已销往美洲、欧洲、亚洲等数十个国家及地区，得到了国内外客户的广泛认可。,IR@tes-tec.com,"主要产品包括智能交互显示器,智能交互一体机以及智能交互显示设备零部件.专注于定制化商用智能交互显示设备的研发,设计,生产和销售服务.",李明芳,福建,12800.0,钟柏安,20150414,www.tes-tec.com.cn,宸展光电,0,SZSE,SZSE,硬件,31120,-,电子元件,31120040,3294719000,-8.66,-13.03,¥25.83,科技,311,0.0,600,18100.0,0.0,10000.0,600,0.0,0.0,1.0,45.21,29.18,35.36,-26.95,2020-12-31T05:00:00Z,{1_trade_buy},{trade_buy},2020Q4_1747729
605277,2020Q4_1747795,浙江省温州市乐清市北白象镇温州大桥工业园区,研发、制造、销售：自动化办公设备、智能家居、消费电子精细线材，工业控制线材，精密医疗器械线材，机器人高柔性线材，新能源应用线材，信息设备、通讯传输、计算机及云服务器用高频高速数据线材，汽车和航空航天等行业应用线材；环保高分子材料(塑胶颗粒)；线材性能检测及技术咨询；环保检测、环保检测技术咨询及技术服务；货物进出口、技术进出口。(依法须经批准的项目，经相关部门批准后方可开展经营活动)。,赵战兵,温州市,公司一直致力于精细电子线材的研发、制造和销售。公司隶属于中国电子元件行业协会光电线缆及光器件分会，主要生产消费电子及工业控制线材、汽车电子线材、高频数据线材和特种线材等系列产品。公司主导产品广泛应用于家用电器、计算机、智能化办公、工业控制设备、汽车电子、数据服务器及新能源科技等领域。公司一贯坚持高端市场发展战略，面向国际知名终端客户，凭借自身可靠性优、一致性好和性价比高的产品，以及研发快速响应、持续改进、及时交货、精准服务等综合优势，逐步打破了精细电子线材高端市场由日立、住友、百通等国际品牌垄断的局面，实现进口替代，努力推动高端精细电子线材国产化进程。经过二十多年的发展历程，公司已成为中国消费电子线材细分行业的龙头企业。2018年，公司主导产品荣获中华人民共和国工业和信息化部、中国工业经济联合会颁发的《制造业单项冠军产品证书(2019年-2021年)》。,xyzqb@xinya-cn.com,"致力于精细电子线材的研发,制造和销售.主要生产消费电子及工业控制线材,汽车电子线材,高频数据线材和特种线材等系列产品.",赵战兵,浙江,13344.0,黄娟,19870407,www.xinya-cn.com,新亚电子,0,SHSE,SHSE,工业制品,31070,-,电子器械和零件,31070060,2700827000,-10.12,0.0,¥20.24,工业,310,0.0,500,8600.0,0.0,10000.0,500,0.0,0.0,1.0,0.0,0.0,0.0,0.0,2020-12-31T05:00:00Z,{1_trade_buy},{trade_buy},2020Q4_1747795
300917,2020Q4_1747754,广东省深圳市福田区香蜜湖街道侨香路1010号特发文创广场五楼,一般经营项目：物业管理；水电工程；国内贸易；经济信息咨询；房地产经纪；为酒店提供管理服务；汽车零配件及汽车饰品的购销；自有物业租赁；园林绿化服务；绿化养护服务；花卉租摆；清洁服务；从事物业管理范围内的二次供水设施清洗消毒业务；建筑工程；投资兴办实业(具体项目另行申报)；经营电子商务。许可经营项目：游泳池经营；停车场经营；劳务派遣；餐饮服务；人力资源输出；人力资源开发与管理咨询；人才资源培训服务；企业人才的交流咨询；人力资源服务外包；人力资源管理软件；垃圾清运；道路清扫；园林设计；市政工程管理；“四害”防治；白蚁防治；环境消杀服务。,陈宝杰,深圳市,公司一直以综合设施管理服务为核心业务，致力于成为中国高端物业服务品牌供应商。公司所从事的服务内容包括综合设施管理、空间管理、安全保障、环境管理、高端接待、会议服务等，管理的项目涵盖高新科技园区、商业综合体、政府机关、学校、住宅等多种类型，主要客户包括华为、阿里巴巴、中国移动、国家电网等知名企业。公司相关业务已从珠三角经济圈辐射至国内的环渤海经济圈、长三角经济圈、西南经济圈、华中城市经济圈及海外的非洲等地。近年来，公司在提供物业管理服务的同时，还陆续拓展了政务服务、资产经营等业务，设立了特发楼宇、特发政务、特发商务、特发资产经营等子公司。凭借优质的服务质量，公司与主要客户建立了长期、稳定的服务关系。报告期内，公司多次受到核心客户及行业协会等相关单位的嘉奖，具体情况如下：2018年度深圳市物业管理行业协会优秀企业、2017年物业服务百强企业、中国企业信用评价AAA等。,sdgs@tefafuwu.com,"公司所从事的服务内容包括综合设施管理,空间管理,安全保障,环境管理,高端接待,会议服务等,管理的项目涵盖高新科技园区,商业综合体,政府机关,学校,住宅等多种类型.",崔平,广东,13000.0,陈宝杰,19930531,www.tefafuwu.com,特发服务,0,SZSE,SZSE,房地产,10410,-,房地产服务,10410020,3331872000,-8.92,-16.55,¥25.69,房地产,104,0.0,3640,111100.0,0.0,10000.0,3640,0.0,0.0,1.3,41.48,29.92,34.39,-25.3,2020-12-31T05:00:00Z,{1_trade_buy},{trade_buy},2020Q4_1747754
605186,2020Q4_1747794,上海市浦东新区张衡路1000弄22号,从事信息技术、自动化设备领域的技术开发、技术咨询、技术服务、技术转让，电子产品、网络设备及配件、自动化设备、计算机、软件及辅助设备的批发、零售、自有设备租赁，计算机软件开发，计算机信息系统集成，第一类医疗器械销售，第二类医疗器械销售，第三类医疗器械经营。【依法须经批准的项目，经相关部门批准后方可开展经营活动】,戴建伟,上海市,"公司是一家医药自动化设备与医药信息化服务提供商，为医疗服务和医药流通行业的药品智能化管理提供相应的产品及服务，旨在提升相关机构的工作效率、服务质量和管理水平，减少患者排队等候时间,提升患者的就医体验，减少医务人员与危害药品的直接接触，改善医务人员的工作条件。公司拥有稳定的客户群体，与华润医药、国药控股、上海医药、柳药股份、重庆医药等大型医药流通企业和各医疗服务机构建立了良好的合作关系，同时已与阿里健康、平安健康和同仁堂等客户展开合作。公司为高新技术企业，已构建了完善的研发体系，与多家医院实施了各类智能化药品管理项目，包括北京协和医院、上海交通大学医学院附属瑞金医院、中山大学附属第一医院、复旦大学附属华山医院、北京大学第一医院、北京大学人民医院、南方医科大学南方医院、上海交通大学医学院附属仁济医院、山东大学齐鲁医院、郑州大学第一附属医院在内的等众多知名医疗机构均使用公司的产品。",stock@g-healthy.com,为医疗服务和医药流通行业的药品智能化管理提供相应的产品及服务,戴建伟,上海,13600.0,邱泓,20140711,www.g-healthy.com,健麾信息,0,SHSE,SHSE,医疗器械,20650,-,医疗设备,20650010,5316455000,72.34,42.2,¥39.57,医疗保健,206,0.0,600,17600.0,0.0,10000.0,600,0.0,0.0,1.0,32.95,22.5,27.95,41.57,2020-12-31T05:00:00Z,{1_trade_buy},{trade_buy},2020Q4_1747794
605179,2020Q4_1747792,浙江省温州市平阳县一鸣工业园,一般项目：家用电器销售；日用品销售；厨具卫具及日用杂品批发；玩具销售；塑料制品销售；印刷专用设备制造；塑料加工专用设备制造(除依法须经批准的项目外，凭营业执照依法自主开展经营活动)。许可项目：食品生产；食品经营；食品互联网销售；餐饮服务；包装装潢印刷品印刷；特定印刷品印刷(依法须经批准的项目，经相关部门批准后方可开展经营活动，具体经营项目以审批结果为准)。,朱立科,温州市,公司主要从事新鲜乳品与烘焙食品的研发、生产、销售及连锁经营业务。其中，乳品主要包括低温巴氏杀菌乳、风味发酵乳、低温调制乳及蛋奶、热奶等特色乳饮品，烘焙食品包括各式短保质期的面包、米制品、中式糕点等。公司产品以“新鲜、健康、营养”为定位，乳品保质期通常在15天以内、烘焙食品保质期通常在3天以内，公司产品主要通过“一鸣真鲜奶吧”专业食品连锁门店进行销售。公司以“新鲜健康的食品、真诚永远的服务”为品牌理念，始终专注于各式新鲜乳品与烘焙食品的研发、制造与销售，以及奶吧连锁经营模式的探索与升级。以“牛奶+面包”的“营养早餐”为起点，公司逐步增加各式鲜牛奶、风味酸奶、三明治等产品，如先后开发了满足营养需求的“真鲜蛋奶”、适于国人温热饮食习惯的“热奶”及可加热饮用的“温酸奶”等畅销创新产品。未来，公司将通过在特种菌株上的基础研发、微生物发酵技术上的工艺改良、饮食口味上的产品创新，持续推出新鲜、健康、营养并满足消费升级饮食需求的新产品。,82091418@qq.com;1009363539@qq.com;inmfood@yi-ming.cn,"主要从事新鲜乳品与烘焙食品的研发,生产,销售及连锁经营业务.其中,乳品主要包括低温巴氏杀菌乳,风味发酵乳,低温调制乳及蛋奶,热奶等特色乳饮品,烘焙食品包括各式短保质期的面包,米制品,中式糕点等.",朱立科,浙江,40100.0,林益雷,20050913,www.inm.cn,一鸣食品,0,SHSE,SHSE,农副加工食品,20525,-,加工食品,20525040,6941387000,-13.4,-0.85,¥17.17,非周期性消费,205,0.0,900,16600.0,0.0,10000.0,900,0.0,0.0,1.0,17.66,14.59,16.1,6.65,2020-12-31T05:00:00Z,{1_trade_buy},{trade_buy},2020Q4_1747792
605183,2020Q4_1747793,江苏省无锡市锡山区东港镇新材料产业园,研发、生产饲料添加剂(限二氧化硅(I))；研发、生产无机粉体填料(限白炭黑、二氧化硅、纳米二氧化硅)。(依法须经批准的项目，经相关部门批准后方可开展经营活动),阙伟东,无锡市,"公司是全球主要的沉淀水合二氧化硅(白炭黑)专业生产企业之一，拥有无锡东沃化能有限公司和安徽确成硅化学有限公司两个控股子公司,被评为江苏省高新技术企业和无锡市重点工业企业。确成公司通过节能减排、资源回收利用，在生产运营全过程贯彻绿色环保、可持续发展这一理念。确成公司利用制备硫酸所产生的余热生产蒸汽,通过发电机组生产电力。在不增加能源消耗的情况下,低温回收装置每年多生产的蒸汽,相当于减少二氧化碳排放2万吨/年。中国石油和化学工业联合会授予确成公司“十一五”全国石油和化工环保先进单位的称号。",info@quechen.com,"研发,生产饲料添加剂(限二氧化硅(I));研发,生产无机粉体填料(限白炭黑,二氧化硅,纳米二氧化硅)",阙伟东,江苏,41401.8,王今,20030128,www.quechen.com,XD确成股,0,SHSE,SHSE,化工,10130,-,化学制品,10130010,7484290000,10.59,10.79,¥17.88,基础材料,101,0.0,700,12600.0,0.0,10000.0,700,0.0,0.0,1.0,27.57,16.68,20.36,-12.18,2020-12-31T05:00:00Z,{1_trade_buy},{trade_buy},2020Q4_1747793
