symbol,_id,address,business_scope,chairman,city,descrpt,email,main_business,manager,province,reg_capital,secretary,setup_date,website,company,dividend_startyear,exchange,exchange_,group,groupcode,index_stockid,industry,industrycode,mktcap_norm_cny,pchange_12w,pchange_ytd,price,sector,sectorcode,share_percentage,shares,value,position,change,share_change,impact,abs_impact,split_factor,price_max,price_min,price_avg,change_from_average,portdate,action,comment,oid
300122,2020Q4_1747737,重庆市江北区金源路7号25层,批发生物制品；境外疫苗代理进口及销售；生物技术研究开发、技术咨询服务；货物及技术进出口；仓储服务(不含危险品)；生物制品市场推广宣传服务；普通货运、货物专用运输(冷藏保鲜)、国内货物运输代理。,蒋仁生,重庆市,公司系一家集疫苗研发、生产、销售、配送及进出口为一体的生物高科技企业，主营的人用疫苗为国家七大战略性新兴产业，发展前景广阔。现在售产品包括AC群脑膜炎球菌(结合)b型流感嗜血杆菌(结合)联合疫苗(喜贝康)、b型流感嗜血杆菌结合疫苗(喜菲贝)、A、C、Y、W135群脑膜炎球菌多糖疫苗(盟威克)、注射用母牛分枝杆菌(微卡)、A群C群脑膜炎球菌多糖结合疫苗(盟纳康)等自主产品及统一销售默沙东授权的23价肺炎球菌多糖疫苗、甲型肝炎灭活疫苗(人二倍体细胞)、四价人乳头瘤病毒疫苗(酿酒酵母)、九价人乳头瘤病毒疫苗(酿酒酵母)、口服五价重配轮状病毒减毒活疫苗(Vero细胞)等所有进口疫苗。公司荣获全国非公有制企业双强百佳党组织、重庆市精神文明单位、全国“守合同重信用”企业、全国商务诚信试点企业、重庆市创新型企业、重庆市制造企业百强等荣誉称号。,IRM@zhifeishengwu.com;office1@zhifeishengwu.com,"主营业务为疫苗,生物制品的研发,生产和销售.自主产品包括:A群C群脑膜炎球菌多糖结合疫苗,ACYW135群脑膜炎球菌多糖疫苗,微卡(注射用母牛分枝杆菌)等;独家买断代理产品包括:Hib疫苗,甲肝减毒活疫苗等.",蒋仁生,重庆,160000.0,秦菲,19950720,www.zhifeishengwu.com,智飞生物,2017,SZSE,SZSE,生物科技,20610,-,生物科技,20610010,300493867000,3.98,27.1,¥186.50,医疗保健,206,0.0,44700,6611600.0,0.15,29.94,10300,0.03,0.03,1.0,190.0,95.5,140.44,32.8,2020-12-31T05:00:00Z,{2_trade_add},{trade_add} 29.94 %,2020Q4_1747737
300760,2020Q4_1747748,广东省深圳市南山区高新技术产业园区科技南十二路迈瑞大厦1-4层,生产经营医疗电子仪器及其配套试剂及产品的软件开发(不含国家限制项目)；自产产品售后服务，自有房屋租赁。,李西廷,深圳市,公司是中国领先的高科技医疗设备研发制造厂商，为全球市场提供医疗器械产品。公司的主营业务覆盖生命信息与支持、体外诊断、医学影像三大领域，通过前沿技术创新，提供更完善的产品解决方案，帮助世界改善医疗条件、提高诊疗效率。公司始终致力于临床医疗设备的研发和制造，产品涵盖生命信息与支持、临床检验及试剂、数字超声、放射影像四大领域，将性能与价格完美平衡的医疗电子产品带到世界每一角落。,ir@mindray.com,"主营业务:公司主要从事医疗器械的研发,制造,营销及服务,主要产品涵盖三大领域:生命信息与支持,体外诊断以及医学影像,目前已拥有丰富的产品品类.",吴昊,广东,121569.13,李文楣,19990125,www.mindray.com,迈瑞医疗,2019,SZSE,SZSE,医疗器械,20650,-,医疗设备,20650010,548906596000,15.47,7.75,¥434.00,医疗保健,206,0.04,517100,220299500.0,4.98,11.42,53000,0.51,0.51,1.0,426.0,290.82,347.05,25.05,2020-12-31T05:00:00Z,{2_trade_add},{trade_add} 11.42 %,2020Q4_1747748
000333,2020Q4_1747712,广东省佛山市顺德区北滘镇美的大道6号美的总部大楼,生产经营家用电器、电机及其零部件；从事家用电器、家电原材料及零配件的进出口、批发及加工业务(不设店铺，不涉及国营贸易管理商品，涉及配额、许可证管理商品的按国家规定办理)；信息技术服务；为企业提供投资顾问及管理服务；计算机软件、硬件开发；家电产品的安装、维修及售后服务；工业产品设计；酒店管理；广告代理；物业管理；企业所需的工程和技术研究、开发及其销售和推广；对金融业进行投资。(经营范围涉及行政许可的项目须凭有效许可证或批准证明经营),方洪波,佛山市,公司是一家消费电器、暖通空调、机器人与自动化系统、智能供应链(物流)的科技集团，提供多元化的产品种类与服务，包括以厨房家电、冰箱、洗衣机、及各类小家电为核心的消费电器业务；以家用空调、中央空调、供暖及通风系统为核心的暖通空调业务；以库卡集团、美的机器人公司等为核心的机器人及自动化系统业务;以安得智联为集成解决方案服务平台的智能供应链业务。公司以“科技尽善，生活尽美”为企业愿景，将“联动人与万物，启迪美的世界”作为使命，恪守“敢知未来——志存高远、务实奋进、包容共协、变革创新”的价值观，整合全球资源，推动技术创新，每年为全球超过3亿用户、及各领域的重要客户与战略合作伙伴提供满意的产品和服务，致力创造美好生活。,IR@midea.com,"以家电产业为主,涉足电机,物流等领域,旗下分为四大业务板块,分别为大家电,小家电,电机及物流",方洪波,广东,704515.93,江鹏,20000407,www.midea.com,美的集团,2014,SZSE,SZSE,家具制造,10220,-,家具制造,10220010,504339523000,-9.25,-26.09,¥69.70,周期性消费,102,0.06,4546900,447592800.0,10.12,1.31,58900,0.13,0.13,1.0,98.44,61.19,76.9,-9.36,2020-12-31T05:00:00Z,{2_trade_add},{trade_add} 1.31 %,2020Q4_1747712
600519,2020Q4_1747765,贵州省仁怀市茅台镇,茅台酒系列产品的生产与销售；饮料、食品、包装材料的生产、销售；防伪技术开发、信息产业相关产品的研制、开发；酒店经营管理、住宿、餐饮、娱乐、洗浴及停车场管理服务(具体内容以工商核定登记为准)。,高卫东,遵义市,公司是国内白酒行业的标志性企业，主要生产销售世界三大名酒之一的茅台酒，同时进行饮料、食品、包装材料的生产和销售，防伪技术开发，信息产业相关产品的研制开发。茅台酒历史悠久，源远流长，是酱香型白酒的典型代表，享有“国酒”的美称。目前，公司茅台酒年生产量已突破一万吨，43°、38°、33°茅台酒拓展了茅台酒家族低度酒的发展空间，茅台王子酒、茅台迎宾酒满足了中低档消费者的需求，15年、30年、50年、80年陈年茅台酒填补了我国极品酒、年份酒、陈年老窖的空白，在国内独创年代梯级式的产品开发模式。公司产品形成了低度、高中低档、极品三大系列70多个规格品种，全方位跻身市场，从而占据了白酒市场制高点，称雄于中国极品酒市场。,mtdm@moutaichina.com,"主要产品:高度茅台酒(含陈年茅台酒),低度茅台酒.",李静仁,贵州,125619.78,刘刚,19991120,www.moutaichina.com,贵州茅台,2014,SHSE,SHSE,酒精饮料,20510,-,其他酒类,20510020,2488180637000,0.08,0.97,¥1955.90,非周期性消费,205,0.02,297700,594708700.0,13.45,0.37,1100,0.05,0.05,1.0,1998.0,1541.79,1721.71,13.6,2020-12-31T05:00:00Z,{2_trade_add},{trade_add} 0.37 %,2020Q4_1747765
603456,2020Q4_1747784,浙江省台州市椒江区外沙路99号,化学原料药、医药中间体、医药制剂的研发、生产(凭许可证经营)，创新药品、生物技术的技术开发、技术服务，新药、医药中间体及原料药的研发、销售(凭许可证经营)，化工原料(不含危险化学品及易制毒品)、机械设备的制造、销售，经营进出口业务。(依法须经批准的项目，经相关部门批准后方可开展经营活动),花莉蓉,台州市,公司是一家集研发、生产、销售医药原料药及中间体为一体的高新技术企业，主要产品类别包括专利原料药及中间体合同定制研发及生产业务(CDMO)、特色原料药及中间体业务(API)。公司建立了ISO9001管理体系、ISO14001环境管理体系、OHSAS18000职业健康安全管理体系。多个产品通过了国家GMP、美国FDA、欧洲COS等国家的官方认证，并与多家国际著名医药巨头建立了战略合作关系。公司先后获得全国医药行业百强企业、国家原料药出口龙头企业、国家高新技术企业、国家技术创新示范企业、中国制药工业百强企业、浙江省“三名”培育试点企业、浙江省创新型领军企业等荣誉，“九洲”品牌荣获“浙江省出口名牌”。,603456@jiuzhoupharma.com,"公司主要从事化学原料药及医药中间体的研发,生产与销售,主要产品类别包括特色原料药及中间体,专利药原料药及中间体.",花莉蓉,浙江,83138.61,林辉潞,19980713,www.jiuzhoupharma.com,九洲药业,2017,SHSE,SHSE,医药制造,20620,-,专用医药制造,20620020,37608370000,14.04,28.85,¥45.61,医疗保健,206,0.02,207000,7410600.0,0.17,0.0,0,0.0,0.0,1.0,37.1,28.29,32.41,40.73,2020-12-31T05:00:00Z,{3_not_change},-,2020Q4_1747784
300363,2020Q4_1747743,重庆市北碚区水土园区方正大道重庆博腾制药科技股份有限公司新药外包服务基地研发中心,原料药生产(按药品生产许可证核定事项和期限从事经营)；创新药品的技术开发、技术服务；化学原料药研究开发(含中小规模试剂)、技术转让、技术服务；医药中间体、精细化学品的生产、销售(不含许可证核定事项外的危险化学品)；采用生物工程技术的新型药物研发、生产(须取得相关行政许可或审批后方可从事经营)；生物工程与生物医学工程技术开发、技术转让、技术服务；化学药品制剂制造(须取得相关行政许可或审批后方可从事经营)；药品销售(须取得相关行政许可或审批后方可从事经营)；货物进出口、技术进出口。(依法禁止经营的不得经营，依法应经许可审批而未获许可批准前不得经营。除依法须经批准的项目外，凭营业执照依法自主开展经营活动。)以上经营范围以公司登记机关核定为准。,居年丰,重庆市,公司是一家按照国际标准为跨国制药公司和生物技术公司提供医药定制研发生产服务的国家级高新技术企业。公司已形成国内东西部以及海外的“3+3+1”生产、研发、技术基地协同布局，即以重庆为核心，以浙江上虞、江西宜春为驱动的三个生产基地；以重庆、成都和上海相辅相成的三大研发中心；以美国新泽西州为价值延伸的海外技术中心。公司的主要服务内容包括为创新药提供医药中间体的工艺研究开发、质量研究和安全性研究，以及为创新药提供医药中间体的定制生产服务，包括研发阶段的小规模生产服务到商业化阶段的大规模生产服务。公司主要服务于临床试验至专利药销售阶段的创新药，服务的药品治疗领域包括抗艾滋病、抗丙肝、降血脂、镇痛、抗糖尿病等。公司致力于成为世界创新药公司优选的一站式医药定制研发生产合作伙伴，助力世界新药发展。,porton.db@porton.cn,"主营业务:医药定制研发生产服务,主要产品是创新药医药中间体.",居年丰,重庆,54410.85,陶荣,20050707,www.porton.cn,博腾股份,2018,SZSE,SZSE,生物科技,20610,-,生物科技,20610010,47044952000,64.62,142.8,¥83.59,医疗保健,206,0.03,177500,6482300.0,0.15,0.0,0,0.0,0.0,1.0,39.65,29.25,34.31,143.63,2020-12-31T05:00:00Z,{3_not_change},-,2020Q4_1747743
002142,2020Q4_1747720,浙江省宁波市鄞州区宁东路345号,(一)吸收公众存款；(二)发放短期、中期和长期贷款；(三)办理国内外结算；(四)办理票据承兑与贴现；(五)发行金融债券；(六)代理发行、代理兑付、承销政府债券；(七)买卖政府债券、金融债券；(八)从事同业拆借；(九)从事银行卡业务；(十)提供信用证服务及担保；(十一)代理收付款项及代理保险业务；(十二)提供保管箱服务；(十三)经中国银行业监督管理机构、中国人民银行和国家外汇管理机关批准的其他业务。,陆华裕,宁波市,公司成立于1997年4月10日，2007年7月19日成为国内首家在深圳证券交易所挂牌上市的城市商业银行。公司前两大股东分别是宁波市政府和新加坡华侨银行，新加坡华侨银行是东南亚第二大金融服务集团，是国际上具有最高评级的银行之一，拥有穆迪Aa1级评级。公司以“了解的市场，熟悉的客户”为准入原则，坚持“门当户对”的经营策略，以为客户提供多元化金融服务为目标，打造“公司银行、零售公司、个人银行、金融市场、信用卡、票据业务、投资银行、资产托管、资产管理”九大利润中心，初步形成多元化的业务增长模式和良好的品牌形象。,dsh@nbcb.com.cn,"主要产品:公司贷款,个人贷款,房屋贷款是本行个人贷款.",罗孟波,浙江,562832.95,俞罡,19970410,www.nbcb.com.cn,宁波银行,2017,SZSE,SZSE,银行,10320,-,区域性银行,10320020,221751775000,-2.31,5.38,¥37.05,金融服务,103,0.0,162200,5731500.0,0.13,0.0,0,0.0,0.0,1.0,38.0,27.89,33.6,10.27,2020-12-31T05:00:00Z,{3_not_change},-,2020Q4_1747720
600036,2020Q4_1747762,广东省深圳市福田区深南大道7088号,吸收公众存款；发放短期、中期和长期贷款；办理结算；办理票据贴现；发行金融债券；代理发行、代理兑付、承销政府债券；买卖政府债券；同业拆借；提供信用证服务及担保；代理收付款项及代理保险业务；提供保管箱服务。外汇存款；外汇贷款；外汇汇款；外币兑换；国际结算；结汇、售汇；同业外汇拆借；外汇票据的承兑和贴现；外汇借款；外汇担保；买卖和代理买卖股票以外的外币有价证券；发行和代理发行股票以外的外币有价证券；自营和代客外汇买卖；资信调查、咨询、见证业务；离岸金融业务。经国务院银行业监督管理机构批准的其他业务。,缪建民,深圳市,公司是中国境内第一家完全由企业法人持股的股份制商业银行、国家从体制外推动银行业改革的第一家试点银行，也是一家拥有商业银行、金融租赁、基金管理、人寿保险、境外投行等金融牌照的银行集团。近年来，公司聚焦移动优先策略，拥抱金融科技(Fintech)，率先推出闪电贷、刷脸取款、“一闪通”支付等创新服务，招商银行手机银行、掌上生活两大App已成行业翘楚，月活量均稳居金融行业前十。经过多年创新发展，招商银行部分业务领域已成为国内商业银行的标杆，连续多年获得境内外权威媒体评选的“中国最佳零售银行”“中国最佳私人银行”“中国最佳交易银行”等殊荣。,cmb@cmbchina.com,"主要业务:贷款拆借,存放同业业务债券投资.",田惠宇,广东,2521984.56,王良,19870331,www.cmbchina.com,招商银行,2009,SHSE,SHSE,银行,10320,-,区域性银行,10320020,1298392121000,5.79,19.01,¥50.96,金融服务,103,0.0,58700,2581400.0,0.06,0.0,0,0.0,0.0,1.0,46.8,34.25,39.82,27.98,2020-12-31T05:00:00Z,{3_not_change},-,2020Q4_1747762
002064,2020Q4_1747719,浙江省温州市瑞安市瑞安经济开发区开发区大道1788号,氨纶、聚氨酯树脂等精细化学品的生产、研发、销售；己二酸等化工产品(不含危险化学品)的生产、研发、销售；货物进出口、技术进出口(依法须经批准的项目，经相关部门批准后方可开展经营活动)。,杨从登,温州市,公司专业从事氨纶纤维的生产、销售和技术开发，是全国最大的氨纶纤维制造企业之一，全国化纤行业效益十佳企业。公司氨纶产品的年生产能力从成立之初的1000吨发展到目前的17000吨，产品规格覆盖了15D—840D，可满足机织、经编、圆编等不同用户需求。产品性能、生产效率和盈利能力均居国内行业前列。公司生产的棉包芯用氨纶丝和30D以下细旦氨纶丝已成为国内替代进口的主要产品，“年产3000吨高透明度差别化氨纶纤维项目”被列入国家重点技术改造“双高一优”项目和国家火炬计划项目。公司以直销为主、经销结合，建立了完善的销售网络和售后服务系统，产品销售覆盖全国20多个省市。,hfal002064@huafeng.com;li.yilun@huafeng.com,主要产品为氨纶系列产品.,朱炫相,浙江,463351.92,李亿伦,19991215,www.spandex.com.cn,华峰化学,2018,SZSE,SZSE,化工,10130,-,特种化学制品,10130020,69132106000,31.15,48.56,¥15.53,基础材料,101,0.01,250000,2522500.0,0.06,0.0,0,0.0,0.0,1.0,10.88,5.25,8.06,92.68,2020-12-31T05:00:00Z,{3_not_change},-,2020Q4_1747719
688200,2020Q4_1747807,"北京市丰台区海鹰路1号院2号楼7层,10层",电子产品、仪器仪表、机械自动控制设备的制造(限分支机构经营)；技术开发、技术服务；销售自行开发后的产品；技术进出口、货物进出口。(企业依法自主选择经营项目，开展经营活动，依法须经批准的项目，经相关部门批准后依批准的内容开展经营活动；不得从事本市产业政策禁止和限制类项目的经营活动。),孙铣,北京市,"公司是国内最大的半导体测试机本土供应商，也是为数不多进入国际封测市场供应商体系的中国半导体设备厂商,主营业务为半导体自动化测试系统的研发、生产和销售，产品主要用于模拟及混合信号类集成电路的测试，产品销售区域覆盖中国大陆、中国台湾、美国、欧洲、日本、韩国等全球半导体产业发达的国家和地区,自成立以来，公司始终专注于半导体自动化测试系统领域，以其自主研发的产品实现了模拟及混合信号类集成电路自动化测试系统的进口替代。在普遍被国外设备垄断的半导体测试业，公司的测试机已占国内同类产品市场份额的50%，被国外知名IC厂商如TI，STM，Fairchild等考核通过，用于其产品在国内的量产，并已开始进入台湾、东南亚、及美国市场。目前，公司已在模拟器件测试、分立器件测试，数模混合系统测试方面，与美日测试设备公司在更高端的产品领域实现竞争。",ir@accotest.com,"半导体自动化测试系统的研发,生产和销售,主要产品为半导体自动化测试系统及测试系统配件.",蔡琳,北京,6132.88,孙镪,19930201,hftc.com.cn,华峰测控,0,SHSE,SHSE,半导体,31130,-,半导体,31130020,27594888000,56.37,23.48,¥450.00,科技,311,0.01,3800,1411900.0,0.03,0.0,0,0.0,0.0,1.0,373.53,241.79,285.0,57.89,2020-12-31T05:00:00Z,{3_not_change},-,2020Q4_1747807
688177,2020Q4_1747804,广东省广州市高新技术产业开发区科学城开源大道11号A6栋第五层,药品研发(人体干细胞、基因诊断与治疗技术除外);生物技术咨询、交流服务(我国稀有和特有的珍贵优良品种，国家保护的原产于我国的野生动、植物资源开发除外);生物技术开发服务(我国稀有和特有的珍贵优良品种，国家保护的原产于我国的野生动、植物资源开发除外);医学研究和试验发展(人体干细胞、基因诊断与治疗技术除外);生物药品制造;药品零售。,易贤忠,广州市,公司成立于2003年，是一家以创新药和生物类似药研发为核心的创新型生物制药企业。公司秉承“创新只为生命”的理念，坚持创新驱动发展战略，致力于开发新一代创新药和生物类似药，用于治疗肿瘤、自身免疫性疾病、心血管疾病以及其它危及人类生命或健康的重大疾病。公司始终以患者的福祉作为首要核心价值，通过创新研发为患者提供安全、有效、可负担的优质药物，以满足亟待解决的治疗需求。公司“百奥泰人源抗体创新药物孵化基地”课题于2013年获得“十二五”国家重大新药创制科技重大专项立项支持；公司“肿瘤治疗性抗体药物研发及全球临床Ⅲ期试验”课题于2018年获得重大新药创制科技重大专项立项支持；百奥泰生物科技研究院(承担单位为百奥泰有限)2016年度被广东省科学技术厅认定为广东省新型研发机构，广东省抗体偶联药物工程技术研究中心(依托单位为百奥泰有限)2016年度被广东省科学技术厅认定为广东省工程技术研究中心；2018年7月被广东省发展和改革委员会认定为广东省抗体药物偶联生物医药工程实验室(广东省工程实验室)。,IR@bio-thera.com,"主要从事创新药和生物类似药的研发,生产业务.",李胜峰,广东,41408.0,鱼丹,20030728,www.bio-thera.com,百奥泰,0,SHSE,SHSE,生物科技,20610,-,生物科技,20610010,9768589000,7.51,-25.28,¥23.66,医疗保健,206,0.01,30200,959000.0,0.02,0.0,0,0.0,0.0,1.0,71.9,30.22,45.91,-48.46,2020-12-31T05:00:00Z,{3_not_change},-,2020Q4_1747804
603239,2020Q4_1747780,浙江省台州市仙居县现代工业集聚区,车辆、飞机、轮船、家用电器的密封件、装饰件、汽车零部件的研发、设计、生产、销售，技术咨询服务，货物进出口，技术进出口。(依法须经批准的项目，经相关部门批准后方可开展经营活动),李起富,台州市,公司为国内主要的汽车密封条生产企业之一，汽车密封条的生产和销售规模处于行业前列。公司拥有高新技术企业、省级企业技术中心、省级高新技术企业研究开发中心、浙江省科技型中小企业等荣誉。通过多年的专注发展，公司已成功成为中国本土汽车密封条行业第一梯队的成员。一方面，公司与上海汽车、一汽、吉利、奇瑞、长安等本土优秀汽车整车厂继续维持长期稳定的合作关系；另一方面，公司还成功开拓了主要由外资厂商占据的合资汽车整车市场，成为了上海通用、上汽通用五菱的一级供应商，以及丰田、本田、日产、奔驰、现代起亚等品牌的二级供应商。,zjxtzqb@163.com;yifeng.li@xian-tong.com,"主营业务:一直从事汽车密封条等汽车零部件的研发,设计,生产和销售.主要产品:汽车密封条,主要包括前车门框密封条,门上密封条,背门框密封条,车门外水切,风挡外饰胶条,三角窗玻璃密封条,行李箱密封条,天窗密封条,车顶饰条,车门玻璃导槽等.",金桂云,浙江,27072.0,项青锋,19961125,www.zjxtgf.cn,浙江仙通,2019,SHSE,SHSE,汽车和配件,10200,-,汽车配件,10200030,4491241000,1.62,-5.37,¥16.62,周期性消费,102,0.02,50000,894000.0,0.02,0.0,0,0.0,0.0,1.0,18.7,14.21,16.43,1.16,2020-12-31T05:00:00Z,{3_not_change},-,2020Q4_1747780
688001,2020Q4_1747798,江苏省苏州市苏州工业园区青丘巷8号,TFT-LCD液晶测试系统、工业自控软件研发、生产、加工、检测；电子通讯产品，液晶显示及相关平面显示产品，银制品、电子电工材料及相关工具、模具销售和技术服务；通信及计算机网络相关产品研发、销售及相关技术服务；自营和代理各类商品及技术的进出口业务(国家限定企业经营或禁止进出口的商品和技术除外)。专用设备制造(不含许可类专业设备制造)；电子专用设备制造；电子专用设备销售；半导体器件专用设备制造；半导体器件专用设备销售；可穿戴智能设备制造；可穿戴智能设备销售；新能源汽车生产测试设备销售；机械设备研发；计算机软硬件及外围设备制造；第一类医疗器械生产；第一类医疗器械销售；第二类医疗器械销售；汽车零部件及配件制造；集成电路芯片及产品制造；集成电路芯片及产品销售；软件开发；电子元器件制造；电子测量仪器制造；工业自动控制系统装置制造。(依法须经批准的项目，经相关部门批准后方可开展经营活动),陈文源,苏州市,公司是国内领先的检测设备与整线检测系统解决方案提供商，主要从事平板显示及集成电路的检测设备研发、生产和销售，公司主要产品分为检测设备、检测治具。公司主要产品应用于LCD与OLED平板显示、集成电路、汽车电子等行业。公司在各类数字及模拟信号高速检测板卡、基于平板显示检测的机器视觉图像算法，以及配套各类高精度自动化与精密连接组件的设计制造能力等方面，具备较强的竞争优势和自主创新能力，在信号和图像算法领域具有多项自主研发的核心技术成果。,dongmiban@hyc.cn,"公司是国内领先的检测设备与整线检测系统解决方案提供商,主要从事平板显示及集成电路的检测设备研发,生产和销售,公司主要产品应用于LCD与OLED平板显示,集成电路,汽车电子等行业.",陈文源,江苏,43853.68,朱辰,20050615,www.hyc.cn,华兴源创,0,SHSE,SHSE,硬件,31120,-,电子元件,31120040,15105032000,5.87,-2.65,¥38.11,科技,311,0.0,21500,846900.0,0.02,0.0,0,0.0,0.0,1.0,53.4,36.82,42.37,-10.05,2020-12-31T05:00:00Z,{3_not_change},-,2020Q4_1747798
