symbol,_id,address,business_scope,chairman,city,descrpt,email,main_business,manager,province,reg_capital,secretary,setup_date,website,company,dividend_startyear,exchange,exchange_,group,groupcode,index_stockid,industry,industrycode,mktcap_norm_cny,pchange_12w,pchange_ytd,price,sector,sectorcode,share_percentage,shares,value,position,change,share_change,impact,abs_impact,split_factor,price_max,price_min,price_avg,change_from_average,portdate,action,comment,oid
003031,2020Q4_1748003,河北省石家庄市鹿泉经济开发区昌盛大街21号,电子封装及精细陶瓷的研发、生产、销售；电子元器件、半导体元器件、集成电路、汽车电子部件、零部件的研发、生产及销售；陶瓷材料、电子专用材料、金属制品的研发、生产及销售；半导体器件专用设备、电子专用设备的制造及销售；软件设计、技术咨询、技术服务、技术转让及进出口业务。,王强,石家庄市,公司是专业从事电子陶瓷系列产品研发、生产和销售的高新技术企业，致力于成为世界一流的电子陶瓷产品供应商，为客户提供创新、高品质、有竞争力的电子陶瓷产品。经过十年来的发展，公司已成为国内领先的电子陶瓷高新技术企业，拥有河北省企业技术中心、河北省工程技术中心，作为牵头单位承担国家科技重大专项、工业强基等多项国家和省市电子陶瓷领域的重大科技攻关和产业化项目，在国内电子陶瓷行业具有重要影响力。公司定位为高端的电子陶瓷外壳产品供应商，产品质量可靠，行业知名度较高。经过多年的积累，公司已成为大批国内外电子行业领先企业的供应商，甚至是核心供应商，并与其建立了长期、稳定的合作关系。在光通信领域，全球多家著名的光电器件厂商均是公司客户；在无线通信领域，NXP、Infineon等世界知名的半导体公司为公司客户；公司业与国内著名的通信厂商华为、中兴建立了合作关系，合作范围不断扩大。,zcdzzqb@sinopack.cc;dan.wang@sinopack.cc;hui.dong@sinopack.cc,"主要产品为电子陶瓷系列产品,分为四大系列:通信器件用电子陶瓷外壳,工业激光器用电子陶瓷外壳,消费电子陶瓷外壳及基板,汽车电子件,专业从事电子陶瓷系列产品研发,生产和销售.",付花亮,河北,14933.33,董惠,20090806,www.sinopack.com.cn,中瓷电子,0,SZSE,SZSE,工业制品,31070,-,电子器械和零件,31070060,7794265000,16.36,0.0,¥52.70,工业,310,0.0,400,5900.0,0.0,10000.0,400,0.0,0.0,1.0,0.0,0.0,0.0,0.0,2020-12-31T05:00:00Z,{1_trade_buy},{trade_buy},2020Q4_1748003
600031,2020Q4_1748052,北京市昌平区北清路8号,生产建筑工程机械、起重机械、停车库、通用设备及机电设备(其中特种设备制造须凭本企业行政许可)、金属制品、橡胶制品、电子产品、钢丝增强液压橡胶软管和软管组合件、客车(不含小轿车)和改装车；建筑工程机械、起重机械、停车库、通用设备及机电设备的销售与维修；金属制品、橡胶制品及电子产品、钢丝增强液压橡胶软管和软管组合件的销售；客车(不含小轿车)和改装车的销售(凭审批机关许可文件经营)；五金及法律法规允许的矿产品、金属材料的销售；提供建筑工程机械租赁服务；经营商品和技术的进出口业务(国家法律法规禁止和限制的除外)。,梁稳根,北京市,公司是全球装备制造业领先企业之一。公司产品包括混凝土机械、挖掘机械、起重机械、桩工机械、筑路机械、建筑装配式预制结构构件。公司拥有ISO9000质量体系认证、ISO14001环境管理体系认证、GB/T28001职业健康安全管理体系认证和中国CCC认证、美国UL认证、德国TUV认证、欧盟CE认证等国际认证。公司凭借技术创新实力，先后三次荣获“国家科技进步奖”，两次荣获“国家技术发明奖”。通过自主创新，三一混凝土泵车三次刷新长臂架泵车世界纪录，三一高压力混凝土输送泵多次创造世界单泵垂直泵送世界新高。,xyl@sany.com.cn;zhoulk@sany.com.cn;sanyir@sany.com.cn,"主要业务:拖式混凝土输送泵,混凝土泵车等混凝土施工机械,全液压振动压路机,摊铺机等高等级路面施工机械的制造及销售.",向文波,北京,761650.4,肖友良,19941122,www.sanyhi.com,三一重工,2016,SHSE,SHSE,农用和重型工程机械,31050,-,农用和重型工程机械,31050010,217229270000,-17.32,-25.21,¥25.04,工业,310,0.03,2490100,87102000.0,1.64,862.17,2231300,1.47,1.47,1.0,34.98,20.22,25.6,-2.19,2020-12-31T05:00:00Z,{2_trade_add},{trade_add} 862.17 %,2020Q4_1748052
002460,2020Q4_1747994,江西省新余市经济开发区龙腾路,危险化学品经营；货物进出口；基础化学原料制造(不含危险化学品等许可类化学品的制造)；化工产品销售(不含许可类化工产品)；常用有色金属冶炼；有色金属合金制造；有色金属合金销售；电池制造；资源再生利用技术研发；新材料技术推广服务；工程和技术研究和试验发展；以自有资金从事投资活动。,李良彬,新余市,公司是全球领先的锂化合物生产商及金属锂生产商。公司的产品广泛用于众多应用领域，尤其是在电动汽车、化学品及制药方面。公司完善的产品供应组合令公司能有效处理公司客户的独特且多元的产品需求。大部分客户均为各自行业的全球领袖并设有各式各样的要求和规格。公司拥有垂直整合的业务模式，业务涵盖上游锂提取、中游锂化合物及金属锂加工以及下游锂电池生产及回收等价值链的各重要环节。公司从中游锂化合物及金属锂制造商起步，并成功扩大到产业链的上下游，以取得具竞争力的锂原材料供应、确保成本及营运效益、于各个业务线间实现协同效应、收集最新的市场信息及发展顶尖技术。,ouyangming@ganfenglithium.com;liyichuan@ganfenglithium.com,"主营业务为深加工锂产品的研究,开发,生产与销售.主要产品包括金属锂(工业级,电池级),碳酸锂(电池级),氯化锂(工业级,催化剂级),丁基锂,氟化锂(工业级,电池级)等二十余种.",李良彬,江西,143747.89,欧阳明,20000302,www.ganfenglithium.com,赣锋锂业,2014,SZSE,SZSE,化工,10130,-,化学制品,10130010,217970568000,71.6,65.9,¥165.00,基础材料,101,0.15,2099500,212466300.0,4.0,458.97,1723900,3.28,3.28,1.0,108.88,46.85,65.16,153.22,2020-12-31T05:00:00Z,{2_trade_add},{trade_add} 458.97 %,2020Q4_1747994
601318,2020Q4_1748062,"广东省深圳市福田区益田路5033号平安金融中心47,48,108,109,110,111,112层",(一)投资保险企业；(二)监督管理控股投资企业的各种国内、国际业务；(三)开展保险资金运用业务；(四)经批准开展国内、国际保险业务；(五)经中国保险监督管理委员会及国家有关部门批准的其他业务。,马明哲,深圳市,公司于1988年诞生于深圳蛇口，是中国第一家股份制保险企业，至今已发展成为融保险、银行、投资三大主营业务为一体、核心金融与互联网金融业务并行发展的个人金融生活服务集团之一。公司致力于成为国际领先的个人金融生活服务提供商，坚持“科技引领金融，金融服务生活”的理念，通过“综合金融+互联网”和“互联网+综合金融”两个模式，聚焦“大金融资产”和“大医疗健康”两大产业，围绕保险、银行、资产管理、互联网金融四大板块，为客户创造“专业，让生活更简单”的品牌体验。公司是国内金融牌照最齐全、业务范围最广泛、控股关系最紧密的个人金融生活服务集团之一。平安集团旗下子公司包括平安寿险、平安产险、平安养老险、平安健康险、平安银行、平安信托、平安证券、平安大华基金等，涵盖金融业各个领域，已发展成为中国少数能为客户同时提供保险、银行及投资等全方位金融产品和服务的金融企业之一。,PR@pingan.com.cn;IR@pingan.com.cn,"主营业务:以保险业务为核心,以统一品牌向客户提供包括保险,银行,证券,信托等多元化金融服务",谢永林,广东,1828024.14,盛瑞生,19880321,www.pingan.cn,中国平安,2012,SHSE,SHSE,保险,10340,-,人身保险,10340010,1102420964000,-19.03,-29.43,¥59.70,金融服务,103,0.01,940300,81787300.0,1.54,97.92,465200,0.76,0.76,1.0,93.38,74.82,81.32,-26.59,2020-12-31T05:00:00Z,{2_trade_add},{trade_add} 97.92 %,2020Q4_1748062
002153,2020Q4_1747989,北京市石景山区玉泉路59号院2号楼燕保大厦6层;北京市东城区东水井胡同5号15层,技术开发、技术咨询、技术转让、技术服务、技术培训；销售开发后的产品、计算机及外围设备；提供信息源服务；网络技术服务；电子商务(未取得专项审批的项目除外)；安装计算机；货物进出口、技术进出口、代理进出口；法律、行政法规、国务院决定禁止的，不得经营；法律、行政法规、国务院决定应经许可的，经审批机关批准并经工商行政管理机关登记注册后方可经营；法律、行政法规、国务院决定未规定许可的，自主选择经营项目，开展经营活动。,李仲初,北京市,公司主要从事酒店信息管理系统软件的开发与销售、系统集成、技术支持与服务业务，是目前国内最主要的酒店信息管理系统全面解决方案提供商之一。公司全面整合了前台管理系统(PMS)、酒店餐饮信息系统(POS)、酒店后台管理系统(BO)以及其他管理系统(CRS、LPS、CRM、PGS等)，使公司的各类产品融合成为一个功能完整覆盖、技术全面领先的“石基数字饭(酒)店整体解决方案(IP Hotel)”，能够为从高星级到较低星级直至经济型连锁酒店提供全套完整的解决方案。公司是目前国内零售信息管理系统的主要供应商，能够为整个零售行业提供理念最新、技术先进、产品线全面、服务全面的从供应端到消费端无缝集成的一体化全程管理解决方案。公司的商品批发销售业务主要集中在中电器件，整个经营流程涉及采购、仓储、销售等环节。,IR@shijigroup.com;luofang@shijigroup.com;any.zhao@shijigroup.com,"主要产品:具有自主知识产权的“石基数字饭(酒)店信息管理系统平台(IPHotel)”.主营业务:酒店,餐饮及零售等旅游消费行业信息管理系统软件的开发与销售,系统集成,技术支持与服务业务.",李仲初,北京,149955.71,罗芳,19980206,www.shijigroup.com,石基信息,2020,SZSE,SZSE,软件,31110,-,软件应用,31110020,32613842000,0.0,-1.48,¥21.55,科技,311,0.23,3442880,76455500.0,1.44,59.14,1279460,0.54,0.54,1.4,30.16,21.54,25.62,-15.89,2020-12-31T05:00:00Z,{2_trade_add},{trade_add} 59.14 %,2020Q4_1747989
603887,2020Q4_1748071,上海市长宁区临虹路289号A座8楼,一般项目：环保工程，市政工程，基础工程，建筑工程，土方工程，送变电工程(除承装、承修、承试电力设施)，建筑装饰装潢，水电安装，设备租赁，建材、金属材料的销售，实业投资(除股权投资及股权投资管理)，互联网数据服务，信息系统集成、运行维护服务，信息处理和存储支持服务，信息技术咨询服务，从事计算机网络科技、计算机信息科技专业领域技术开发、技术转让、技术咨询、技术服务，计算机及通讯设备经营租赁。(除依法须经批准的项目外，凭营业执照依法自主开展经营活动),谢晓东,上海市,公司具有国家地基与基础专业施工一级资质，下属全资子公司具有岩土工程设计、勘察乙级资质和土建总承包资质。系国家高新技术企业，是国内绿色环保桩基围护新技术的开拓者和创导者。公司自有岩土技术研发中心后，长期与同济大学地基研究所建立了产学研基地，是行业内少数具有岩土设计、勘察及施工一体化能力的企业。公司先后申请了多项专利技术，其中混凝土管桩芯孔内掘土注浆封底工法(CLP工法)和五轴水泥土搅拌墙(FCW工法)已发布上海市建筑产品推荐性技术规程，并获得省部级工法认证。公司独创的先进施工技术，填补了国内空白，并将逐步淘汰国内几十多年未变的建筑主体桩基及围护搅拌桩传统施工技术，真正做到绿色建筑从基础开始。公司与金地、保利、恒大、万科、中海、绿地、复地、合景泰富、凯德置业、仁恒、旭辉、东方航空、中建、中铁、上海建工、龙元、上海城建等全国前十大开发商及建筑商均建立了良好的长期合作关系。2018年，公司通过收购增加IDC相关设备和解决方案、IDC系统集成以及IDC运营管理和增值服务业务，实现信息化时代上市公司向IDC这一互联网基础设施领域的转型升级。,shchengdi@163.com,"主营业务为桩基,基坑围护等地基与基础工程服务,具体包括静力压桩,钻孔灌注桩,水泥土搅拌桩等基础工程的施工服务,以及基坑围护挡土止水结构,地基加固改良,土石方工程施工等,业务领域涉及房地产,市政工程,公用设施,工业厂房等.",谢晓东,上海,45070.48,陈伟民,19970426,www.shcd.cc,城地香江,2020,SHSE,SHSE,建筑,31040,-,土木工程和建筑,31040010,4475637000,-17.55,-31.16,¥9.98,工业,310,2.02,9120000,132559000.0,2.5,57.46,3327960,0.91,0.91,1.2,20.33,15.98,17.71,-43.65,2020-12-31T05:00:00Z,{2_trade_add},{trade_add} 57.46 %,2020Q4_1748071
300750,2020Q4_1748011,福建省宁德市蕉城区漳湾镇新港路2号,锂离子电池、锂聚合物电池、燃料电池、动力电池、超大容量储能电池、超级电容器、电池管理系统及可充电电池包、风光电储能系统、相关设备仪器的开发、生产和销售及售后服务；对新能源行业的投资；锂电池及相关产品的技术服务、测试服务以及咨询服务。(依法须经批准的项目，经相关部门批准后方可开展经营活动),周佳,宁德市,公司是全球领先的动力电池系统提供商，专注于新能源汽车动力电池系统、储能系统的研发、生产和销售，致力于为全球新能源应用提供一流解决方案。公司在电池材料、电池系统、电池回收等产业链关键领域拥有核心技术优势及可持续研发能力，形成了全面、完善的生产服务体系。公司拥有国际一流的研发团队，设立了“福建省院士专家工作站”，拥有锂离子电池企业省级重点实验室、中国合格评定国家认可委员会(CNAS)认证的测试验证中心，参与了《电动客车安全技术条件》、《电动汽车用锂离子动力蓄电池安全要求》、《电力储能用锂离子电池》等多个国家、行业规范及标准的制定。公司承担了“十二五”国家新能源汽车产业技术创新工程项目、“十三五”国家重点研发计划新能源汽车专项项目和智能电网与装备专项项目、国家火炬计划产业化示范项目等国家级项目，为首批入选工信部《汽车动力蓄电池行业规范条件》目录的十家动力电池企业之一、《锂离子电池行业规范条件》目录的八家锂离子电池企业之一。公司曾获得中国化学与物理电源行业协会“中国动力和储能用锂离子电池前10强企业”、中国储能网“中国储能产业最具影响力企业”、工信部和财政部“2017年国家技术创新示范企业”等多项荣誉。,CATL-IR@catl.com,"公司是全球领先的动力电池系统提供商,专注于新能源汽车动力电池系统,储能系统的研发,生产和销售,致力于为全球新能源应用提供一流解决方案.公司在电池材料,电池系统,电池回收等产业链关键领域拥有核心技术优势及可持续研发能力,形成了全面,完善的生产服务体系.公司主要产品包括动力电池系统,储能系统和锂电池材料.",周佳,福建,232900.78,蒋理,20111216,www.catlbattery.com/www.catl.com,宁德时代,2019,SZSE,SZSE,工业制品,31070,-,电子器械和零件,31070060,1288158083000,67.96,61.21,¥531.07,工业,310,0.01,336300,118076200.0,2.23,40.95,97700,0.65,0.65,1.0,351.11,167.43,229.14,131.77,2020-12-31T05:00:00Z,{2_trade_add},{trade_add} 40.95 %,2020Q4_1748011
000333,2020Q4_1747975,广东省佛山市顺德区北滘镇美的大道6号美的总部大楼,生产经营家用电器、电机及其零部件；从事家用电器、家电原材料及零配件的进出口、批发及加工业务(不设店铺，不涉及国营贸易管理商品，涉及配额、许可证管理商品的按国家规定办理)；信息技术服务；为企业提供投资顾问及管理服务；计算机软件、硬件开发；家电产品的安装、维修及售后服务；工业产品设计；酒店管理；广告代理；物业管理；企业所需的工程和技术研究、开发及其销售和推广；对金融业进行投资。(经营范围涉及行政许可的项目须凭有效许可证或批准证明经营),方洪波,佛山市,公司是一家消费电器、暖通空调、机器人与自动化系统、智能供应链(物流)的科技集团，提供多元化的产品种类与服务，包括以厨房家电、冰箱、洗衣机、及各类小家电为核心的消费电器业务；以家用空调、中央空调、供暖及通风系统为核心的暖通空调业务；以库卡集团、美的机器人公司等为核心的机器人及自动化系统业务;以安得智联为集成解决方案服务平台的智能供应链业务。公司以“科技尽善，生活尽美”为企业愿景，将“联动人与万物，启迪美的世界”作为使命，恪守“敢知未来——志存高远、务实奋进、包容共协、变革创新”的价值观，整合全球资源，推动技术创新，每年为全球超过3亿用户、及各领域的重要客户与战略合作伙伴提供满意的产品和服务，致力创造美好生活。,IR@midea.com,"以家电产业为主,涉足电机,物流等领域,旗下分为四大业务板块,分别为大家电,小家电,电机及物流",方洪波,广东,704515.93,江鹏,20000407,www.midea.com,美的集团,2014,SZSE,SZSE,家具制造,10220,-,家具制造,10220010,504339523000,-9.25,-26.09,¥69.70,周期性消费,102,0.01,570400,56150200.0,1.06,36.75,153300,0.28,0.28,1.0,98.44,61.19,76.9,-9.36,2020-12-31T05:00:00Z,{2_trade_add},{trade_add} 36.75 %,2020Q4_1747975
603232,2020Q4_1748066,上海市静安区江场西路299弄5号601室,软件开发，软件生产，信息网络安全产品的研制、开发、销售，系统集成，专业四技服务(上述项目除专项规定)，自有房屋租赁。【依法须经批准的项目，经相关部门批准后方可开展经营活动】,孔令钢,上海市,公司是中国较早研制和推出公钥基础设施PKI(Public Key Infrastructure)平台的厂商之一，是国内首批商用密码产品定点生产与销售单位之一，是国家保密局批准认定的涉及国家秘密的计算机信息系统集成甲级资质单位，是全国信息安全标准化技术委员会的核心成员单位；公司是国家“863”计划信息安全示范工程金融子项目的责任承担单位，是国家科技支撑计划商用密码基础设施(ECC)项目的牵头单位之一。公司拥有全系列信息安全产品、安全服务和解决方案的提供能力，产品包括:“安全认证网关”、“可信边界安全网关”、“无线安全网关”、“电子签章系统”、“安全电子邮件系统”、“安全即时通系统”、“网络保险箱”、“终端保密系统”、“签名验证服务系统”、“局域网接入认证系统”、“打印管控系统”、“移动安全管理平台”、“云安全服务平台系统”、“移动介质管理系统等产品”。公司先后通过了CMMI3认证和ISO9001质量认证，为用户提供功能完善、质量可靠的PKI产品。同时，公司本着客户至上的宗旨为广大用户提供“专业、快捷、优质”的各类信息安全服务。,stock@koal.com,"公司自成立以来一直专注于信息安全行业PKI领域,主要从事以公钥基础设施PKI(Public Key Infrastructure)为核心的商用密码软件产品的研发,生产和销售及服务业务.主要产品是基于PKI的信息安全系列产品,安全服务和信息安全整体解决方案.",杨文山,上海,23172.2,顾峰,19980303,www.koal.com,格尔软件,2020,SHSE,SHSE,软件,31110,-,软件基础构架,31110030,3969411000,2.18,-22.6,¥17.25,科技,311,0.66,1522200,33654800.0,0.63,25.69,311160,0.13,0.13,1.2,37.43,21.65,26.9,-35.87,2020-12-31T05:00:00Z,{2_trade_add},{trade_add} 25.69 %,2020Q4_1748066
002013,2020Q4_1747983,北京市朝阳区曙光西里甲5号凤凰置地广场A座25层,主营：为各类飞行器、发动机配套的机载机电系统及设备的研制、生产、销售和服务，并为航天、兵器、船舶、电子信息等防务领域提供相应配套产品及服务。兼营：车船载系统、各类精冲制品及精密冲压模具、工业自动化与控制设备、机电设备及系统、电动车、制冷系统、信息系统及产品的研发、生产、销售及服务。经营本企业自产产品及技术的出口业务；经营本企业生产所需的原辅材料、仪器仪表、机械设备、零配件及技术的进口业务(国家限定公司经营和国家禁止进出口的商品及技术除外)；经营进料加工和“三来一补”业务。,王树刚,襄阳市,公司是中航工业旗下航空机电系统业务的专业化整合和产业化发展平台，经过几年发展，公司已经发展成为一个资产超百亿的大型企业。业务范围从研制、生产调角器、滑轨、拨叉等座椅精密调节装置及精冲制品、精密冲压模具等业务，扩大到航空机电系统业务范围，包括机载飞行控制子系统，机载悬挂与发射控制系统、机载电源分系统(交直流发电及控制、机上一次配电装置、应急发电子系统、变流/变压等装置)、航空机载燃油测量系统、机载液压作动装置、发动机点火系统及装置、无人机发射等系统的研发、制造和销售。公司的军用航空机电业务为我国在研在产的军用飞机提供配套产品和服务，产品研制能力基本达到了国外同等产品的水平；民用飞机机电系统方面，中航精机创新了民机项目组织模式，借助C919项目建立了民机项目组织管理体系，组建了电源、液压燃油、高升力等系统工作团队，为部分民用机型提供配套产品并开展适航取证研究，部分产品已经取得CTSOA适航证。,lib@avic.com;xiabq@avic.com;avicem@avic.com,航空机电产品,王树刚,湖北,388482.48,夏保琪,20001205,www.avicem.com,中航机电,2012,SZSE,SZSE,航空航天和国防,31010,-,航空航天和国防,31010010,37149814000,-1.32,-15.11,¥9.91,工业,310,0.37,14304000,163780700.0,3.09,16.0,1972900,0.43,0.43,1.0,12.75,8.09,10.76,-7.9,2020-12-31T05:00:00Z,{2_trade_add},{trade_add} 16.00 %,2020Q4_1747983
600416,2020Q4_1748054,湖南省湘潭市下摄司街302号,设计、生产、销售发电机、交直流电动机、特种电机、轨道交通车辆牵引控制系统、电气成套设备、变压器、互感器、混合动力汽车、风力和太阳能发电设备、新能源汽车及零部件；电机、电气产品的修理、改造、安装；各类模具、夹具、刃具、量具、非标、二类工装等设计、制造、修理；盘类、轴类、箱体类结构件加工；废旧物资和设备的回收处置；委托收集和处置危险废弃物、金属切削液、危化品；新能源项目与节能环保项目的开发、建设、运营、工程总承包、技术开发、技术转让及咨询服务；公司范围内的动能管理服务(不含动能的生产、经营)；动能设备设施的设计、安装、制作、维修；自营各类商品和技术的进出口，但国家限定公司经营或禁止进出口的商品和技术除外。(依法批准的项目，经相关部门批准后方可开展经营活动)。,周健君,湘潭市,公司是我国电工行业大型骨干企业，是国家重大技术装备国产化基地，是电工行业产品配套能力、科研开发能力最强的企业之一。公司的主营业务是大中型交直流电机(含特种电机)、水泵、矿用采运设备(含特种车辆)和城市轨道交通车辆及电气成套设备的生产和销售，主要产品有直流电机、直流牵引电机、特种电机、水泵等。“湘电”已经成为“中国驰名商标”，是我国电工行业的大型骨干企业和国务院确立的国家重大装备国产化研制基地、国家高技术产业基地和国家创新型企业。被誉为“中国电工产品摇篮”、“中国民族工业脊梁”。公司是中国机电行业最具价值的品牌之一，先后荣获全球100强新能源企业、中国新能源企业30强、中国制造企业500强等称号。,lyw1119@163.com;mail.xemc.com.cn;Lj1976@163.com;xemczq@163.com,"主要产品:交流电机,直流电机,车辆,水泵.",汤鸿辉,湖南,115495.19,李怡文,19991226,www.xemc.com.cn/xemc,湘电股份,0,SHSE,SHSE,工业制品,31070,-,特种工业机械,31070020,15000773000,-26.44,-37.27,¥13.61,工业,310,0.66,7612900,159718700.0,3.01,8.89,621400,0.25,0.25,1.0,22.48,12.99,17.59,-22.63,2020-12-31T05:00:00Z,{2_trade_add},{trade_add} 8.89 %,2020Q4_1748054
