symbol,_id,address,business_scope,chairman,city,descrpt,email,main_business,manager,province,reg_capital,secretary,setup_date,website,company,dividend_startyear,exchange,exchange_,group,groupcode,index_stockid,industry,industrycode,mktcap_norm_cny,pchange_12w,pchange_ytd,price,sector,sectorcode,share_percentage,shares,value,position,change,share_change,impact,abs_impact,split_factor,price_max,price_min,price_avg,change_from_average,portdate,action,comment,oid
300633,2020Q4_1748121,"广东省深圳市南山区粤海街道麻岭社区高新中区科技中2路1号深圳软件园(2期)12栋201,202",医疗器械的软件开发(不含国家限制项目)；生物技术开发、技术转让、技术服务、技术咨询；自产产品技术维护服务；自产产品售后服务；经营进出口业务(法律、行政法规、国务院决定禁止的项目除外，限制的项目须取得许可后方可经营)。生产经营医疗器械及其配套试剂及产品软件开发；生产经营显示器产品及电子产品。,陈志强,深圳市,公司主营业务为医疗诊断设备的自主研发、生产与销售。公司始终以客户需求为导向，致力于为全球医疗机构提供优质的产品和服务。主要产品包括医用超声诊断设备(主要为彩色多普勒超声诊断设备与B型超声诊断设备)、医用电子内窥镜设备、血液分析仪。公司立足自主技术创新和产品研发，是国内超声诊断设备领域较早独立掌握彩超设备核心技术与探头核心技术的生产企业，目前已掌握基于PC的Linux彩超软件技术，128通道彩超技术，嵌入式计算机技术，高密度、宽频带探头技术，单晶探头技术，特种应用探头技术等多项超声诊断设备领域专利技术。公司各类产品质量过硬，性能突出，多项产品通过FDA注册、CE认证，并得到国际认可。,ir@sonoscape.net;wangyang@sonoscape.net,"主要产品:医疗诊断设备,具体包括医用超声诊断设备和医用内窥镜设备等;主营业务:医疗诊断设备的研发,生产与销售",吴坤祥,广东,40576.0,李浩,20020927,www.sonoscape.com,开立医疗,2020,SZSE,SZSE,医疗器械,20650,-,医疗设备,20650010,12548264000,37.84,21.85,¥31.19,医疗保健,206,0.0,0,0.0,0.0,-10000.0,-920300,-0.78,0.78,1.0,28.08,22.33,25.12,24.16,2020-12-31T05:00:00Z,{5_trade_sell},{trade_sell},2020Q4_1748121
300502,2020Q4_1748119,四川省成都市双流区公兴镇物联西街127号,研究、开发、生产、销售计算机网络设备及零部件、通讯设备(不含无线电发射设备)及零部件并提供技术服务；自营商品进出口、技术进出口等(以上范围不含国家法律法规限制或禁止的项目，涉及许可的凭相关许可证开展经营活动)。,高光荣,成都市,公司是领先的光收发器解决方案和服务提供商，一直专注于光模块的研发、制造和销售；光模块在光纤终端完成光电信号转换，是光纤传输的最核心部件；光模块广泛应用于数据宽带、电信通讯、数据中心等行业。公司致力于围绕主业实施垂直整合，实现光器件芯片制造、光器件芯片封装、光器件封装和光模块制造环节全覆盖，力争抓住未来5G及数据中心市场良好的发展机会，努力开拓国内外市场，加强与主流通信设备制造商、经销商合作，实现公司产品升级转型，成为光通信模块、组件和子系统的核心供应商。目前，公司产品型号超过几千种，产品涵盖了多种标准的通信网络接口、传输速率、光波波长等技术指标，应用领域覆盖了数据宽带、电信通讯、数据中心、安防监控和智能电网等行业，产品销往全球各个国家和地区。公司有着严格的内控程序，并通过了ISO9001：2008质量体系认证。,ir@eoptolink.com;daniel.wang@eoptolink.com;vivi.wei@eoptolink.com,"主要产品:点对点光模块和PON光模块;主营业务:光模块的研发,制造和销售.",黄晓雷,四川,50708.62,王诚,20080415,www.eoptolink.com,新易盛,2017,SZSE,SZSE,硬件,31120,-,通讯设备,31120010,18982994000,28.97,-5.32,¥35.25,科技,311,0.0,0,0.0,0.0,-10000.0,-801643,-0.77,0.77,1.0,51.92,37.07,43.42,-18.82,2020-12-31T05:00:00Z,{5_trade_sell},{trade_sell},2020Q4_1748119
000157,2020Q4_1748086,湖南省长沙市银盆南路361号,开发、生产、销售工程机械、农业机械、环卫机械、汽车起重机及其专用底盘、消防车辆及其专用底盘、高空作业机械、应急救援装备、矿山机械、煤矿机械装备、物料输送设备、其它机械设备、金属与非金属材料、光机电一体化高新技术产品并提供租赁、售后技术服务；销售建筑装饰材料、工程专用车辆及金属材料、化工原料、化工产品(不含危化品和监控品)；润滑油、润滑脂、液压油的销售(不含危险化学品销售)；成品油零售(限分支机构凭许可证经营)；经营商品和技术的进出口业务；以自有资产进行房地产业投资(不得从事吸收存款、集资收款、受托贷款、发行票据、发放贷款等国家金融监管及财政信用业务)。二手车销售；废旧机械设备拆解、回收。(依法须经批准的项目，经相关部门批准后方可开展经营活动),詹纯新,长沙市,公司是一家装备制造企业，创立于1992年，主要从事工程机械、环境产业、农业机械等高新技术装备的研发制造。公司已覆盖全球多个国家和地区，在“一带一路”沿线均有市场布局。产品远销中东、南美、非洲、东南亚、俄罗斯以及欧美、澳大利亚等高端市场。公司在东亚、东南亚、欧洲等全球多个国家建有分子公司，在意大利、德国、巴西、印度、白俄罗斯投资建有工业园，并在全球设立多个常驻机构。以阿联酋、巴西为中心，正逐步建立全球物流网络和零配件供应体系。公司积极推进战略转型，打造集工程机械、农业机械和金融服务多位一体的高端装备制造企业。,157@zoomlion.com,"主要业务:混凝土机械,起重机械,环卫机械,路面机械,非开挖设备等基础设施重大装备及其配套部件的生产和销售.主要产品:混凝土机械,起重机械,环卫机械,路面机械.",詹纯新,湖南,867072.83,杨笃志,19990831,www.zoomlion.com,中联重科,2020,SZSE,SZSE,农用和重型工程机械,31050,-,农用和重型工程机械,31050010,68224703000,-30.22,-13.23,¥8.12,工业,310,0.0,0,0.0,0.0,-10000.0,-5525800,-0.76,0.76,1.0,10.82,7.24,8.64,-6.02,2020-12-31T05:00:00Z,{5_trade_sell},{trade_sell},2020Q4_1748086
300226,2020Q4_1748112,上海市宝山区园丰路68号,许可项目：测绘服务；第二类增值电信业务。(依法须经批准的项目，经相关部门批准后方可开展经营活动，具体经营项目以相关部门批准文件或许可证件为准)一般项目：计算机软件、网络技术的开发、销售，网络系统集成，金属材料、耐火材料、建材、化工原料(除危险品)、机电设备、橡胶制品、木材、黑色金属矿石、五金交电的销售，广告的设计，利用自有媒体发布广告，会展服务，市场信息咨询与调查(不得从事社会调查、社会调研、民意调查、民意测验)，附设分支机构，从事货物及技术的进出口业务，企业管理咨询，投资咨询，企业形象策划，市场营销策划。(除依法须经批准的项目外，凭营业执照依法自主开展经营活动),朱军红,上海市,公司是国内领先的立足黑色、有色、能源化工、农产品等大宗商品提供商业资讯服务、数据研究服务、电子商务服务及其增值服务的互联网平台综合运营商。公司围绕建设大宗商品电子商务生态体系的发展战略，逐步打造了以大数据为基础的网络综合资讯、上下游行业研究、专家团队咨询、电商交易平台、智能化云仓储、信息化物流、供应链服务为一体的互联网大宗商品闭环生态圈，并形成了以黑色金属为龙头，覆盖有色金属，能源化工，农产品等多领域的大宗商品产业链。公司先后荣获“上海市著名商标”、“中国行业电子商务网站TOP100”、“3A级信用企业”等称号。,public@mysteel.com,主营业务是以钢铁及相关行业信息服务为基础的B2B电子商务服务.,高波,上海,19093.06,李勇胜,20000430,www.mysteel.com,上海钢联,2019,SZSE,SZSE,交互式媒体,30830,-,互联网和相关服务,30830010,11422054000,-7.4,-8.95,¥58.70,通信服务,308,0.0,0,0.0,0.0,-10000.0,-454200,-0.76,0.76,1.0,69.45,61.0,64.52,-9.02,2020-12-31T05:00:00Z,{5_trade_sell},{trade_sell},2020Q4_1748112
002967,2020Q4_1748105,广东省广州市天河区黄埔大道西平云路163号,专业技术服务业。公司的经营范围：计量认证(具体范围见计量认证证书及其附表)；电子产品检测；实验室检测(涉及许可项目的需取得许可后方可从事经营)；针织品、纺织品、服装的检测；皮革检测服务；环境保护监测；水质检测服务；软件测试服务；无线通信网络系统性能检测服务；电能质量监测；无损检测；机动车性能检验服务；船舶检验；电气防火技术检测服务；公共设施安全监测服务；化工产品检测服务；生态监测；电气机械检测服务；贵金属检测服务；建筑材料检验服务；进出口商品检验鉴定；工程和技术研究和试验发展；工程和技术基础科学研究服务；化学工程研究服务；食品科学技术研究服务；信息电子技术服务；纺织科学技术研究服务；网络技术的研究、开发；电子、通信与自动控制技术研究、开发；材料科学研究、技术开发；安全生产技术服务；仪器仪表修理；计算机技术开发、技术服务；计量技术咨询服务；企业管理咨询服务；土壤修复；环保技术推广服务；信息技术咨询服务；施工现场质量检测；食品检测服务；劳务派遣服务；对外劳务合作；劳务承揽；接受委托从事劳务外包服务；人力资源培训；化学试剂和助剂销售(监控化学品、危险化学品除外)。,黄跃珍,广州市,公司是一家全国性、综合性的独立第三方计量检测服务机构，是国家火炬计划重点高新技术企业，主营业务是计量服务、检测服务、检测装备研发等专业技术服务。公司是国内极少数同时通过CNAS、DILAC、CMA、CMAF和总装军用实验室认可的质检机构之一，经营资质的全面性本身就代表领先且全面的技术能力。公司长期以来积累形成了一批重点、优势计量检测项目，在无线电计量、电磁计量、光通信计量、无线电检测、装备定型试验、汽车电子及零部件检测、能效检测、环境可靠性分析和失效分析等领域建立了技术优势。公司被评为2014年度亚洲品牌500强。,grgtestzqb@grgtest.com,"主营业务:计量服务,检测服务,检测装备研发等技术服务.",黄敦鹏,广东,57522.58,欧楚勤,20020524,www.grgtest.com,广电计量,0,SZSE,SZSE,商业服务,31020,-,咨询服务,31020020,21995698000,6.11,4.67,¥37.86,工业,310,0.0,0,0.0,0.0,-10000.0,-1269100,-0.74,0.74,1.0,36.65,25.23,29.53,28.21,2020-12-31T05:00:00Z,{5_trade_sell},{trade_sell},2020Q4_1748105
600276,2020Q4_1748134,江苏省连云港市经济技术开发区昆仑山路7号,片剂(含抗肿瘤药)、口服溶液剂、混悬剂、无菌原料药(抗肿瘤药)、原料药(含抗肿瘤药)、精神药品、软胶囊剂(含抗肿瘤药)、冻干粉针剂(含抗肿瘤药)、粉针剂(抗肿瘤药、头孢菌素类)、吸入粉雾剂、口服混悬剂、口服乳剂、大容量注射剂(含多层共挤输液袋、含抗肿瘤药)、小容量注射剂(含抗肿瘤药、含非最终灭菌)，生物工程制品(聚乙二醇重组人粒细胞刺激因子注射液)、硬胶囊剂(含抗肿瘤药)、颗粒剂(抗肿瘤药)、粉雾剂、膜剂、凝胶剂、乳膏剂的制造；中药前处理及提取；医疗器械的研发、制造与销售；一般化工产品的销售；自营和代理各类商品及技术的进出口业务，但国家限定公司经营或禁止进出口的商品和技术除外。,周云曙,连云港市,公司是一家从事医药创新和高品质药品研发、生产及推广的医药健康企业，致力于在抗肿瘤药、手术用药、内分泌治疗药、心血管药及抗感染药等领域的创新发展，并逐步形成品牌优势。公司是国内知名的抗肿瘤药、手术用药和造影剂的供应商，也是国家抗肿瘤药技术创新产学研联盟牵头单位，建有国家靶向药物工程技术研究中心、博士后科研工作站。公司先后被评为“全国医药系统先进集体”、“国家重点高新技术企业”，国家火炬计划新医药研究开发及产业化基地的骨干企业之一，“国家863计划成果产业化基地”，连续多年被国家统计局列为全国化学制药行业十佳效益企业。,ir@hengrui.com,"主要产品:抗肿瘤药,抗感染药.",周云曙,江苏,639747.76,刘笑含,19970428,www.hrs.com.cn,恒瑞医药,2019,SHSE,SHSE,医药制造,20620,-,通用医药制造,20620010,391901169000,-11.75,-34.93,¥60.10,医疗保健,206,0.0,0,0.0,0.0,-10000.0,-431040,-0.71,0.71,1.0,95.84,71.25,77.59,-22.54,2020-12-31T05:00:00Z,{5_trade_sell},{trade_sell},2020Q4_1748134
600745,2020Q4_1748137,浙江省嘉兴市南湖区亚中路777号,一般项目：智能机器人的研发；数字文化创意软件开发；电子专用材料研发；技术服务、技术开发、技术咨询、技术交流、技术转让、技术推广；人工智能基础软件开发；人工智能应用软件开发；软件开发；可穿戴智能设备制造；网络设备制造；通信设备制造；移动通信设备制造；移动终端设备制造；显示器件制造；智能家庭消费设备制造；数字家庭产品制造；智能车载设备制造；计算机软硬件及外围设备制造；电子元器件制造；电子专用材料制造；物业管理；酒店管理；电子产品销售；网络设备销售；智能家庭消费设备销售；软件销售；智能无人飞行器销售；智能车载设备销售；计算机软硬件及辅助设备批发；计算机软硬件及辅助设备零售；物联网设备销售；可穿戴智能设备销售；针纺织品及原料销售；服装服饰批发；服装服饰零售；金属材料销售；建筑材料销售；电子专用材料销售；化工产品销售(不含许可类化工产品)；电子元器件批发；电子元器件零售(除依法须经批准的项目外，凭营业执照依法自主开展经营活动)许可项目：货物进出口(依法须经批准的项目，经相关部门批准后方可开展经营活动，具体经营项目以相关部门批准文件或许可证件为准),张学政,黄石市,公司是中国领先的移动终端和智能硬件产业生态平台，业务领域涵盖移动终端、智能硬件、笔记本电脑、虚拟现实、车联网、汽车电子等物联网领域的研发设计和智能制造，客户群遍及全球各地，与行业大多数主流品牌保持着深度的合作关系，服务全球170多个国家和地区。公司客户均为华为、荣耀、小米、联想、MOTO、魅族、LG、华硕、360、中国移动等全球主流品牌。公司及下属的研发中心均为国家高新技术企业，坚持产学研相结合的方向，坚持研发先导战略，在全国建立四大研发中心，建有行业领先的研发实验室和测试实验室，具备较强的软件开发、硬件开发、专业测试等研发实力。现在的闻泰科技不仅是手机、VR、车联网、智能硬件、笔记本电脑等产品的研发制造商，更是一个移动智能终端及智能硬件产业平台和管道。以智能终端及物联网产业平台为产业基础，以上市公司为平台，闻泰正在构建庞大的移动终端和智能硬件千亿级产业生态链。,600745mail@wingtech.com,"主要产品:智能终端,虚拟现实,地产和酒店等",张学政,湖北,124493.77,周斌,19930111,www.wingtech.com,闻泰科技,2020,SHSE,SHSE,硬件,31120,-,通讯设备,31120010,118418393000,0.33,-2.66,¥93.29,科技,311,0.0,0,0.0,0.0,-10000.0,-259600,-0.7,0.7,1.0,126.86,93.0,105.26,-11.37,2020-12-31T05:00:00Z,{5_trade_sell},{trade_sell},2020Q4_1748137
002867,2020Q4_1748103,广东省深圳市罗湖区翠竹街道布心路3033号水贝壹号A座19-23楼,贵金属首饰、镶嵌首饰、珠宝玉石首饰及工艺美术品的生产、加工、设计、批发、零售、进出口(不含国营贸易管理商品，涉及配额、许可证管理及其它专项规定管理的商品，按国家有关规定办理申请)；收藏品、装帧流通人民币、金银纪念币、邮票、邮品、钱币(退出流通领域的)；首饰维修、旧金饰品的回收业务；技术进出口；企业品牌策划咨询；企业管理咨询；珠宝技术服务；以特许经营方式从事商业活动，佣金代理(不含拍卖)。,周宗文,深圳市,公司从事“周大生”品牌珠宝首饰的设计、推广和连锁经营，是国内最具规模的珠宝品牌运营商之一。“周大生”是全国中高端主流市场钻石珠宝领先品牌，主要产品包括钻石镶嵌首饰、素金首饰。公司连锁网络由营运管理网络、业务拓展网络、培训辅导网络、督导监察网络、整合营销网络、物流配送网络、ERP应用网络等7大网络构成，采取轻资产、整合运营型经营策略，专注于品牌运营、渠道管理、产品研发和供应链整合，不断提升品牌形象和影响力，实现公司的快速发展。公司始终坚持“为消费者传递美丽奉献爱心”的品牌理念，通过深入研究消费者情感文化、个性特征、装扮风格、场景需求，提出“引领情景风格珠宝新潮流”的全新产品定位，塑造周大生非凡的产品价值，为消费者带来驾驭多变情景的风格珠宝首饰。,szchowtaiseng@126.com,"主要产品包括钻石镶嵌首饰,素金首饰.主营业务:公司从事“周大生”品牌珠宝首饰的设计,推广和连锁经营,是国内最具规模的珠宝品牌运营商之一.",周宗文,广东,109622.34,何小林,20071015,www.chowtaiseng.com,周大生,2017,SZSE,SZSE,零售,10280,-,奢侈品,10280040,21369617000,-5.52,14.09,¥20.72,周期性消费,102,0.0,0,0.0,0.0,-10000.0,-2166600,-0.69,0.69,1.5,15.13,11.39,13.05,58.77,2020-12-31T05:00:00Z,{5_trade_sell},{trade_sell},2020Q4_1748103
002332,2020Q4_1748095,浙江省台州市仙居县福应街道现代工业集聚区丰溪西路15号,许可经营项目：药品生产(具体生产范围见药品生产许可证)，医药中间体制造，化工产品(危险品经营业务详见《危险化学品经营许可证》)，有效期至2016年6月9日一般经营项目：五金交电、包装材料销售，技术服务，设备安装，进出口业务(详见外经贸部门批文)。,张宇松,台州市,公司前身为仙居制药厂，创建于1972年，是国家计划生育药物定点生产厂家、国家火炬计划重点高新技术企业、全国守合同重信用企业等。公司产品独树一帜，主营业务为甾体原料药和制剂的研制、生产与销售。主要生产皮质激素类药物、性激素类药物(妇科及计生用药)和麻醉与肌松类药物等三大类。目前，公司全部产品均已通过国家GMP认证。匹多莫德原药及颗粒剂、糠酸莫米松及乳膏、噻托溴铵及粉雾剂、环索奈德及气雾剂、罗库溴铵及注射液被列入国家火炬计划；甲磺酸罗哌卡因、左炔诺孕酮肠溶胶囊、甲泼尼龙列入国家重点新产品计划；防复吸新药噻吩诺啡临床研究列入国家重大新药创制专项项目等。抗早孕药物“含珠停”和肌松药物“仙林”是浙江名牌产品。公司先后荣获中国原料药出口型品牌十强企业、中国化药制药品牌百强企业等。,dmb@xjpharma.com,"公司主营业务为甾体原料药和制剂的研制,生产与销售,主要产品分为皮质激素类药物,性激素类药物(妇科及计生用药)和麻醉与肌松类药物三大类.",张宇松,浙江,98920.49,张王伟,20000626,www.xjpharma.com,仙琚制药,2018,SZSE,SZSE,医药制造,20620,-,专用医药制造,20620020,12039611000,-11.39,-9.13,¥12.10,医疗保健,206,0.0,0,0.0,0.0,-10000.0,-1783300,-0.64,0.64,1.0,16.62,13.04,14.4,-15.97,2020-12-31T05:00:00Z,{5_trade_sell},{trade_sell},2020Q4_1748095
603712,2020Q4_1748143,天津市开发区西区北大街141号,许可项目：国防计量服务；检验检测服务。(依法须经批准的项目，经相关部门批准后方可开展经营活动，具体经营项目以相关部门批准文件或许可证件为准)。一般项目：通信设备制造；通信设备销售；通讯设备修理；集成电路芯片设计及服务；集成电路芯片及产品销售；集成电路芯片及产品制造；数据处理和存储支持服务；智能无人飞行器制造；智能无人飞行器销售；信息系统集成服务；信息系统运行维护服务；环境监测专用仪器仪表制造；环境监测专用仪器仪表销售；环境保护监测；计量服务；信息技术咨询服务；工程和技术研究和试验发展；技术服务、技术开发、技术咨询、技术交流、技术转让、技术推广；机动车改装服务；非居住房地产租赁。(除依法须经批准的项目外，凭营业执照依法自主开展经营活动),王宝,天津市,公司作为国家级高新技术企业是国内专网无线通信领域核心供应商。作为国内专用无线通信领域的奠基者和开拓者，公司创造了多项国内第一。新中国的第一台电视机就诞生在公司，被周恩来总理誉为“华夏第一屏”。公司率先研制成功第一代超短波通信电台，第一代航空抗干扰电台，第一代铁路列调电台、第一代海事自动识别系统等。以强大的科研团队为支撑，公司的产品被广泛应用于国内陆、海、空、火箭军及战略支援部队，遍布全国5大战区、500多个师团级单位。是我军无线通信装备的核心供应商与主要承制单位，是业内极少数可以实现全波段、全军种覆盖的企业。公司在产品研发和生产工艺研究领域积累了先进的理论与实践基础，深度参与通信体制和行业标准的制定，已掌握相应核心和关键技术。,712ir@712.cn,"公司的核心业务是无线通信终端产品业务及系统产品业务,受公司主营业务特点的影响,本公司流动资产主要为存货,应收账款和货币资金等.",庞辉,天津,77200.0,马海永,20041028,www.712.cn,七一二,2018,SHSE,SHSE,硬件,31120,-,通讯设备,31120010,25933909000,-5.04,-18.63,¥34.00,科技,311,0.0,0,0.0,0.0,-10000.0,-748700,-0.62,0.62,1.0,49.94,36.06,41.48,-18.03,2020-12-31T05:00:00Z,{5_trade_sell},{trade_sell},2020Q4_1748143
002475,2020Q4_1748099,广东省东莞市清溪镇北环路313号,生产经营连接线、连接器、电脑周边设备、塑胶五金制品。,王来春,深圳市,"公司是一家技术导向公司，公司专注于连接线、连接器的研发、生产和销售，产品主要应用于3C(计算机、通讯、消费电子)和汽车、医疗等领域。产品主要应用于3C(电脑、通讯、消费电子)、汽车和通讯等领域，核心产品电脑连接器已树立了优势地位，台式电脑连接器覆盖全球20%以上的台式电脑，并快速扩大笔记本电脑连接器的生产，公司已经开发出DP、eDP、USB3.0、ESATA等新产品，同时公司正逐步进入汽车连接器、通讯连接器和高端消费电子连接器领域，拓展新的产品市场,确立了自身的竞争优势。公司是USB、HDMI、SATA等协会的会员。公司拥有自主产品的核心技术和知识产权，已申请多项发明专利，实用新型专利及外观设计专利超过百项。后公司实验室通过国家认可委认证，并获“深圳市测试平台”称号。",David.Huang@luxshare-ict.com;Public@luxshare-ict.com;Ray.Li@luxshare-ict.com,"公司专注于连接器的研发,生产和销售,产品主要应用于3C(电脑,通讯,消费电子),汽车和通讯设备等领域.主要生产电脑连接器产品,包括台式电脑连接器及笔记本电脑连接器,并专注于生产附加价值高的电脑内部连接器.",王来春,广东,703542.64,黄大伟,20040524,www.luxshare-ict.com,立讯精密,2014,SZSE,SZSE,硬件,31120,-,电子元件,31120040,291315806000,26.58,-24.47,¥41.26,科技,311,0.0,0,0.0,0.0,-10000.0,-525400,-0.58,0.58,1.0,61.99,49.81,55.11,-25.13,2020-12-31T05:00:00Z,{5_trade_sell},{trade_sell},2020Q4_1748099
