symbol,_id,address,business_scope,chairman,city,descrpt,email,main_business,manager,province,reg_capital,secretary,setup_date,website,company,dividend_startyear,exchange,exchange_,group,groupcode,index_stockid,industry,industrycode,mktcap_norm_cny,pchange_12w,pchange_ytd,price,sector,sectorcode,share_percentage,shares,value,position,change,share_change,impact,abs_impact,split_factor,price_max,price_min,price_avg,change_from_average,portdate,action,comment,oid
300872,2020Q4_1748023,北京市朝阳区阜通东大街1号院3号楼9层2单元121005,软件技术开发、技术转让、技术咨询、技术服务；计算机系统服务；数据处理(数据处理中的银行卡中心、PUE值在1.5以上的云计算数据中心除外)；销售自行开发后的计算机软件产品；销售计算机软硬件及配件；计算机及配件的售后服务；计算机软硬件开发；计算机系统集成；计算机设备租赁。【依法须经批准的项目，经相关部门批准后方可经营该项目】,欧阳建平,拉萨市,公司专注为金融行业客户提供IT解决方案和服务，是金融IT业内颇具规模、成长最快、最具活力和创新精神的企业之一。基于金融IT和业务创新能力，公司正致力于成为国内领先的金融综合服务提供商，提供金融IT服务、金融信息服务和金融运营服务。公司从2003年创立以来，为央行和政策性银行、国有商业银行、股份制商业银行和地方性商业银行等近百家金融客户提供咨询、开发、测试、运维和系统集成等应用于全生命周期的服务。源于客户的业务创新和管理创新需求，公司在专业测试、对公金融(包括信贷、供应链金融、互联网金融、贸易金融和资金监管等)、商业智能与大数据应用、风险管理(信用风险、操作风险和市场风险)、信用卡、协同应用等专业领域研发了多种解决方案，在开发、测试和运行管理领域研发了业内领先的基础技术架构产品，积累了丰富的行业业务、IT技术知识、IT应用解决方案和专业服务人才。公司已拥有了一批优质、稳定的核心战略客户，同时公司也在积极拓展新客户，进一步完善客户和区域布局，创造新的业绩增长点。目前公司已经为两百多家银行客户提供了相关产品和服务，在行业内拥有较高的品牌声誉。,ir@tansun.com.cn,"公司是一家金融业IT解决方案及服务提供商,主要向以银行为主的金融机构提供IT解决方案,咨询服务,专业测试服务,运维服务和系统集成服务.",欧阳建平,西藏,22468.2,张庆勋,20030709,www.tansun.com.cn,天阳科技,0,SZSE,SZSE,软件,31110,-,软件和信息技术服务,31110010,8247458000,4.47,-5.37,¥36.09,科技,311,0.0,900,33000.0,0.0,10000.0,900,0.0,0.0,1.0,82.0,37.36,49.27,-26.75,2020-12-31T05:00:00Z,{1_trade_buy},{trade_buy},2020Q4_1748023
300871,2020Q4_1748022,湖北省武汉市东西湖区新沟街道办事处油纱路52号(107国道与油纱路口),许可项目：兽药生产；兽药经营；饲料添加剂生产。(依法须经批准的项目，经相关部门批准后方可开展经营活动，具体经营项目以相关部门批准文件或许可证件为准)一般项目：饲料添加剂销售；畜牧渔业饲料销售；肥料销售；专用化学产品销售(不含危险化学品)；技术服务、技术开发、技术咨询、技术交流、技术转让、技术推广；(以上经营范围不含特别管理措施)(除依法须经批准的项目外，凭营业执照依法自主开展经营活动),张卫元,武汉市,公司以“致力动保科技，提升生命质量”为使命，主要从事兽用药品(包括化药制剂、原料药、中药制剂)、饲料及添加剂的研发、生产和销售。兽药行业通过多年发展，建立并完善了动物健康成长的保护机制，在预防、治疗和控制各种动物疾病中发挥重要作用，为人类安全和可持续的食物供给提供了坚实保障。公司已建立了完备的产品质量控制体系，产品质量过硬，自2012年起连续6年在农业农村部组织的兽药质量监督抽检中，成为全国一千多家兽药企业中仅有的6家连续保持抽检不合格批次为零的企业之一。公司高度重视技术创新与产品研发在企业发展中的驱动作用，拥有包括7名高级技术职称人员和9名博士组成的研发团队，其中国务院政府特殊津贴专家1人，国家科技部专家库2人，中国兽药典委员1人。公司目前已取得专利35项，其中发明专利28项；已取得3个二类新兽药证书及2个三类新兽药证书；在研项目共计45项，其中一类新兽药项目2项、二类新兽药项目10项、三类及四类新兽药项目共12项；公司科研平台承担了科技部国家重点研发计划、国家科技支撑计划、国家创新基金支持、国家重点研发计划政府间国际科技合作重点专项等项目。,hvsen@whhsyy.com,"主要从事兽用药品(包括化药制剂,原料药,中药制剂),饲料及添加剂的研发,生产和销售.",张卫元,湖北,16576.05,杨凯杰,20020125,www.whhsyy.com,回盛生物,0,SZSE,SZSE,生物科技,20610,-,生物科技,20610010,5917655000,21.33,36.64,¥34.73,医疗保健,206,0.0,900,23900.0,0.0,10000.0,900,0.0,0.0,1.5,52.33,26.11,33.33,4.2,2020-12-31T05:00:00Z,{1_trade_buy},{trade_buy},2020Q4_1748022
300884,2020Q4_1748029,福建省厦门市海沧区火炬高新区火炬园创新路2号兴联电子大厦五楼,一般项目：物联网技术研发；软件开发；人工智能应用软件开发；软件销售；通信设备制造；通信设备销售；数字家庭产品制造；移动终端设备销售；人工智能硬件销售；物联网设备制造；物联网设备销售；物联网应用服务；智能家庭网关制造；智能家庭消费设备制造；智能家庭消费设备销售；配电开关控制设备研发；配电开关控制设备制造；配电开关控制设备销售；照明器具制造；照明器具销售；安防设备制造；安防设备销售；计算机软硬件及外围设备制造；计算机软硬件及辅助设备批发；工业控制计算机及系统制造；互联网数据服务；互联网销售（除销售需要许可的商品）；网络设备销售；集成电路设计；集成电路制造；集成电路芯片及产品销售；家用电器制造；机械电气设备销售；风机、风扇制造；风机、风扇销售；五金产品批发；五金产品研发；停车场服务；信息系统集成服务；交通安全、管制专用设备制造；电子元器件制造；电子元器件批发；广告制作；广告发布（非广播电台、电视台、报刊出版单位）；塑料制品制造；塑料制品销售；安全技术防范系统设计施工服务；货物进出口；技术进出口；工程管理服务；生活垃圾处理装备制造；生活垃圾处理装备销售。（除依法须经批准的项目外，凭营业执照依法自主开展经营活动）许可项,缪国栋,厦门市,公司以“领跑智慧生活理念，创造卓越生活品质”为使命，以打造“安全、舒适、健康、便捷”的智慧社区生活环境为己任，围绕智慧社区领域，通过不断的技术创新、产品升级和功能优化，形成了以楼宇对讲产品和智能家居产品为主的产品结构，同时开发了智能停车、新风系统、智能锁、行业对讲等多系列的智能化产品。公司主营楼宇对讲、智能家居等智慧社区安防智能化设备的研发设计、生产制造和销售。主要产品方面，公司的楼宇对讲产品具有呼叫对讲、远程开门、联动门禁、人脸识别、人证比对、支持梯控协议等功能以及识别速度快、准确率高、高稳定性和开放性的性能；智能家居产品支持有线无线联网，具有高稳定性和强兼容性等特点。经过多年的发展，在楼宇对讲和智能家居领域，公司与龙湖集团、世茂房地产、招商蛇口、绿地控股、中南集团、华润置地、雅居乐集团、时代中国控股、富力地产等大中型房地产商已经建立了良好、稳定的合作关系；依托良好的产品性能和不断完善的销售渠道，公司产品已遍布全国的各主要城市。,dnake@dnake.com,"公司主营楼宇对讲,智能家居等智慧社区安防智能化设备的研发设计,生产制造和销售.主要产品是楼宇对讲和智能家居产品.",缪国栋,福建,18000.0,林丽梅,20050429,www.dnake.com,狄耐克,0,SZSE,SZSE,工业制品,31070,-,电子器械和零件,31070060,4267810000,-9.71,-18.09,¥23.48,工业,310,0.0,750,16700.0,0.0,10000.0,750,0.0,0.0,1.5,51.07,28.02,37.74,-37.78,2020-12-31T05:00:00Z,{1_trade_buy},{trade_buy},2020Q4_1748029
300890,2020Q4_1748033,广东省深圳市龙华新区龙华街道清祥路1号宝能科技园9栋C座20楼J单元,改性石墨负极材料、锂离子电池负极材料的技术开发及销售，其它国内贸易(以上均不含法律、行政法规、国务院决定规定需前置审批和禁止的项目)；经营进出口业务(法律、行政法规、国务院决定禁止的项目除外，限制的项目须取得许可后方可经营)；新能源行业投资(具体投资项目另行申报)。,周鹏伟,深圳市,"公司是一家从事锂离子电池负极材料的研发、生产和销售的高新技术企业，是国内先进的锂电池负极材料供应商，主要产品分为天然石墨和人造石墨两大类，产品应用于包括动力(电动交通工具，如新能源汽车、电动自行车等)、3C消费电子和工业储能等锂离子电池领域。经过多年发展，公司建立了一支高素质的研发团队和专家顾问团队，主要成员来源于清华大学、中科院等高等院所，并成为清华大学、重庆大学等知名院校的研究生联合培养基地和产学研合作基地,公司“动力电池用新型高性能微膨石墨负极材料的研发项目”获得“深圳市科学技术奖——技术发明二等奖”；“动力电池长循环硅/碳复合负极材料的研发与产业化项目”被深圳市经信委列为2018年第一批战略性新兴产业和未来产业发展专项资金中的“创新链+产业链”融合专项扶持计划(直接资助类)；获批广东省科技型中小企业技术创新基金项目等多项荣誉。",public@xfhinc.com,"主要从事锂离子电池负极材料的研发,生产和销售的高新技术企业,是国内先进的锂电池负极材料供应商,主要产品分为天然石墨和人造石墨两大类,产品应用于包括动力(电动交通工具,如新能源汽车,电动自行车等),3C消费电子和工业储能等锂离子电池领域.",赵东辉,广东,10000.0,叶文国,20090612,www.xiangfenghua.com,翔丰华,0,SZSE,SZSE,化工,10130,-,特种化学制品,10130020,5684329000,36.22,7.33,¥58.75,基础材料,101,0.0,300,14000.0,0.0,10000.0,300,0.0,0.0,1.0,71.5,47.3,59.33,-0.98,2020-12-31T05:00:00Z,{1_trade_buy},{trade_buy},2020Q4_1748033
300876,2020Q4_1748025,广东省揭阳市揭东区揭东城西片工业区,生产、销售：超细旦纤维丝、高强纤维丝、各种化纤丝、化纤材料及其制品；货物进出口、技术进出口。(以上各项，法律、行政法规和国务院决定禁止的不得经营；法律、行政法规和国务院决定限制的须取得许可方可经营)。(依法须经批准的项目，经相关部门批准后方可开展经营活动)。,郭清海,揭阳市,公司专业从事聚丙烯纤维的研发、生产和销售，聚丙烯纤维商品名为丙纶。公司主要产品为丙纶长丝。凭借公司管理团队在聚丙烯纤维行业二十多年丰富的技术、生产经验和客户资源积累，公司产品应用已广泛覆盖了工业领域和民用领域。目前，公司产品在工业领域应用范围主要为工业滤布、工程土工布等，在民用领域应用范围主要为箱包织带、水管布套、门窗毛条、服装等。公司为高新技术企业，高度重视研发投入，研发了多种差别化丙纶长丝，获得了多项荣誉，具体如下：2018年“蒙泰丝”品牌细旦抑菌聚丙烯纤维入围“中国纤维流行趋势2018/2019”；2017年国家功能性聚丙烯纤维研发生产基地、2017年度中国纺织工业联合会产品开发贡献奖、广东省聚丙烯纤维新材料工程技术研究中心。,zqb@gdmtxw.com,"公司专业从事聚丙烯纤维的研发,生产和销售,聚丙烯纤维商品名为丙纶.公司主要产品为丙纶长丝.",郭清海,广东,9600.0,朱少芬,20130906,www.gdguangdong.com,蒙泰高新,0,SZSE,SZSE,服饰加工,10240,-,纺织加工,10240010,3491436000,9.3,-4.57,¥37.96,周期性消费,102,0.0,400,12800.0,0.0,10000.0,400,0.0,0.0,1.0,89.92,37.07,49.83,-23.82,2020-12-31T05:00:00Z,{1_trade_buy},{trade_buy},2020Q4_1748025
300868,2020Q4_1748019,广东省深圳市龙华区民治街道北站社区汇德大厦1号楼4201,货物及技术进出口；投资兴办实业。(不含法律、行政法规、国务院规定禁止及决定需前置审批的项目)，许可经营项目是：电子产品、通讯产品、智能电子产品、移动智能终端保护套、精密塑胶硅胶及皮具等时尚消费电子配件产品的研发、设计、生产及销售；五金制品、模具的研发、设计、生产及销售；新技术新材料的研发、设计、生产及销售。,黄新,深圳市,公司是一家专业从事移动智能终端配件的研发、设计、生产及销售的高新技术企业，产品类型以智能手机与平板电脑保护类配件为主，涵盖移动电源、数据线等其他配件。公司坚持以ODM/OEM与自有品牌相结合的方式开拓市场，坚持做大ODM/OEM业务、做强自有品牌的思路，为客户提供更优质的产品和服务。公司是国内较早从事移动智能终端配件产品ODM/OEM业务的企业之一，拥有成熟的开发设计团队和专业的制造技术，是业内为数不多的具有“研发设计—模具开发—生产制造—包装入库”全工序以及大规模生产能力的企业之一，能够针对客户需求，提供设计支持、快速样品、规模量产等方面的综合服务。凭借丰富的研发设计、多工艺生产经验，以及稳定、可靠的质量保证，公司与华为等智能终端制造商以及Targus、Pelican等国际知名智能终端配件品牌商建立了良好、稳定的合作关系，产品广泛应用于华为、苹果等品牌终端。公司已取得全球知名的Disney、Hello Kitty商标及卡通形象在其自有品牌产品中应用的授权许可，自有品牌产品系列丰富，主要客户已涵盖沃尔玛、亚马逊、Target、百思买等全球零售百强客户，产品销售遍及美国、欧洲及日本等多个国家或地区。,ir@jamepda.com;zhangyuhan@jamepda.com;zb@jamepda.com,"从事移动智能终端配件的研发,设计,生产及销售,主要产品:主要为智能手机,平板电脑等移动智能终端提供保护套产品.",黄新,广东,12800.0,周波,20060530,www.jamepda.com,杰美特,0,SZSE,SZSE,硬件,31120,-,电子元件,31120040,3791662000,-20.1,-33.93,¥28.88,科技,311,0.0,600,25700.0,0.0,10000.0,600,0.0,0.0,1.0,86.08,42.6,52.07,-44.54,2020-12-31T05:00:00Z,{1_trade_buy},{trade_buy},2020Q4_1748019
300926,2020Q4_1748049,江苏省苏州市昆山开发区龙江路88号,汽车用精密模具及高精密零部件等相关产品的研发、生产、销售；模具制造；冲压零部件、金属材料、五金交电、电子产品、塑料制品的销售；激光拼焊汽车转向支架、落料件、汽车天窗用包塑件、汽车门锁用包塑件的生产、销售，并提供售后技术支持和服务；道路普通货物运输(按许可证核定内容经营)；从事货物及技术的进出口业务。(前述经营项目中法律、行政法规规定前置许可经营、限制经营、禁止经营的除外)(依法须经批准的项目，经相关部门批准后方可开展经营活动),伍亚林,苏州市,公司是汽车精密零部件和精密模具的专业制造企业，主要从事汽车精密零部件和精密模具的研发、设计、生产和销售。公司注重技术研发与创新，掌握了模具设计与制造、冲压、激光焊接、注塑及装配等关键生产工艺和环节的技术。公司具有较强的精密模具开发、制造与销售能力，零部件产品种类丰富，覆盖了框架类、传动类、其他类等。公司是国家高新技术企业，通过了IATF16949:2016质量管理体系认证(认证范围：金属冲压件、金属焊接件和注塑件的制造，除8.3产品设计)、GB/T24001-2016/IOS14001:2015环境管理体系认证(认证范围：汽车零件的冲压、焊接、注塑生产)以及邓白氏注册认证。公司是“江苏省认定企业技术中心”、“江苏省民营科技企业”、“昆山市科技研发机构”和“苏州市博俊高精密汽车冲压模具工程技术研究中心”、“江苏省企业研究生工作站”。公司拥有严格的质量控制体系、完整的研发设计体系，致力于为客户提供高性能、专业化的精密零部件和精密模具。经过多年的发展和积累，公司在精密零部件和精密模具行业形成了一定的竞争优势。,ir@sh-bojun.com,"主要从事汽车精密零部件和精密模具的研发,设计,生产和销售.主要产品冲压零部件,模具盈利能力均较强.",伍亚林,江苏,14213.34,李晶,20110329,www.sh-bojun.com,博俊科技,0,SZSE,SZSE,汽车和配件,10200,-,汽车配件,10200030,2987783000,-8.6,0.0,¥21.33,周期性消费,102,0.0,3600,38600.0,0.0,10000.0,3600,0.0,0.0,1.0,0.0,0.0,0.0,0.0,2020-12-31T05:00:00Z,{1_trade_buy},{trade_buy},2020Q4_1748049
300889,2020Q4_1748032,广东省深圳市宝安区松岗街道松岗大道11号健仓科技园一栋,从事LED点光源、LED日光灯、灯光控制器的生产、研发和销售；从事光电产品、太阳能产品、电子产品、半导体、智能控制系统及软件的生产、研发和销售；智能化控制系统、智能照明、软件、计算机领域内的技术研发、咨询、服务；市政工程、园林绿化工程施工；城市及道路照明工程专业承包、智能化工程专业承包；照明工程设计、照明技术的开发；房屋租售、国内贸易(不含专营、专卖、专控商品)；经营进出口业务(法律、行政法规、国务院决定禁止的项目除外，限制的项目须取得许可后方可经营)。,谢明武,深圳市,公司是从事景观照明智能控制系统及LED景观照明灯具的研发、生产和销售的国家级高新技术企业，公司始终以客户需求为导向，致力于为客户提供稳定可靠的LED景观照明产品。公司专注于景观照明领域的技术研发、产品设计与生产制造，在智能控制系统和景观照明产品领域具备较强的产品开发和制造能力，能够满足客户大规模的定制化需求，已成为国内大型景观照明项目所需产品的核心供应商之一。公司产品成功应用于国内诸多大型城市整体亮化项目，包括深圳改革开放40周年庆典主题灯光秀项目、青岛上合组织峰会主题灯光秀项目、厦门金砖会议主题灯光秀项目、杭州G20峰会钱江新城主题灯光秀项目、武汉两江四岸长江灯光秀项目等。公司已被认定为广东省景观LED工程技术研究中心。公司产品被认定为广东省名牌产品，产品通过了CCC认证、CE认证、CQC认证及ROHS认证。,exc@exc-led.com,"从事景观照明智能控制系统及LED景观照明灯具的研发,生产和销售,主要产品为景观照明智能控制系统和LED景观照明灯具系列产品.",张锋斌,广东,15600.0,陈永建,20090918,www.exc-led.com,爱克股份,0,SZSE,SZSE,硬件,31120,-,电子元件,31120040,3528428000,-17.63,-27.32,¥22.39,科技,311,0.0,500,14400.0,0.0,10000.0,500,0.0,0.0,1.0,64.15,30.53,40.96,-45.34,2020-12-31T05:00:00Z,{1_trade_buy},{trade_buy},2020Q4_1748032
300887,2020Q4_1748031,北京市海淀区锦带路66号院1号楼4层至5层101,"技术开发、技术推广；技术检测；检验、检疫、验货、医疗器械检验的技术服务；计量服务；计量仪器与设备的技术咨询；货物进出口、技术进出口、代理进出口；环境监测；计算机技术培训；出租商业用房；出租办公用房；技术咨询、技术交流；清洁服务；认证服务；货物专用运输(冷藏保鲜)(道路运输经营许可证有效期至2021年09月11日)。(市场主体依法自主选择经营项目,开展经营活动；依法须经批准的项目,经相关部门批准后依批准的内容开展经营活动；不得从事国家和本市产业政策禁止和限制类项目的经营活动。)。",张英杰,北京市,公司是大型综合性检测机构，具备为客户提供综合化、一站式检测服务的能力，检测报告得到美国、英国、德国等71个国家和地区互认，具有国际公信力。公司可提供的检测服务范围涵盖健康与环保、贸易符合性、商品质量鉴定及安全保障等四大领域，涉及农林牧渔业，食品医药业，采矿业，制造业，电力、燃气及水的生产和供应业，建筑业，交通运输业，住宿和餐饮业，水利、环境和公共设施管理业等众多行业。公司为宝洁、摩托罗拉、三星、戴尔、可口可乐、肯德基、麦当劳等众多国际知名企业提供检测服务。公司是中国电子信息产品污染防治标准工作组成员，参与了多项国内RoHS检测方法、国家标准及行业标准的制定及修订工作，连续四年荣膺德勤“高科技、高成长中国50强”及“亚太区高科技、高成长500强”。,IR@ponytest.com,"主营业务为:检验检测,计量,认证及相关技术服务,业务范围涵盖健康与环保,电子及安规,消费品质量鉴定,安全保障等.",张英杰,北京,13680.0,李小冬,20020610,www.ponytest.com,谱尼测试,0,SZSE,SZSE,商业服务,31020,-,特种商业服务,31020010,10978843000,56.33,87.04,¥81.15,工业,310,0.0,360,15600.0,0.0,10000.0,360,0.0,0.0,1.8,65.72,42.11,53.06,52.94,2020-12-31T05:00:00Z,{1_trade_buy},{trade_buy},2020Q4_1748031
300886,2020Q4_1748030,安徽省安庆市潜山市舒州大道42号,香精、香料、油田助剂、炼油助剂、金属加工助剂、纺织助剂、水处理剂、精细化工产品(不含危险化学品)开发、生产、销售(涉及行政许可项目凭有效许可证经营)。,徐基平,安庆市,公司自设立以来，公司一直专注于经营香料业务，主要从事内酯系列合成香料的研发、生产和销售，主营业务突出。公司自设立以来，始终坚持以市场为导向，以客户为目标，以技术创新打造核心竞争力，坚持走“创新、协调、绿色、开放、共享”的发展道路，打造行业高端品牌。公司为国家高新技术企业，拥有省级认定的企业技术中心、安徽省院士工作站。公司通过技术研究、工艺绿色化改造、副产物开发、资源综合利用等集成创新实现了“传统产品+新工艺”，进一步提升了内酯类香料的市场竞争力，产品在国际市场上具有竞争优势。公司为中国香料香精化妆品工业协会副理事长单位，在由中国轻工业联合会发布的2017年度“中国轻工业香料行业十强企业”评选中，公司位列第七名；公司还被中国香化协会授予“中国香料香精化妆品行业优秀企业奖”、“2016年度香料香精优秀品牌企业”等荣誉称号。,info@anhuihuaye.com,"主要产品为丙位内酯,丁位内酯系列合成香料,主要从事内酯系列合成香料的研发,生产和销售.",徐基平,安徽,7455.5,付林,20020712,www.anhuihuaye.com,华业香料,0,SZSE,SZSE,化工,10130,-,化学制品,10130010,2227711000,-13.36,-19.19,¥29.69,基础材料,101,0.0,130,6700.0,0.0,10000.0,130,0.0,0.0,1.3,70.6,36.04,48.7,-39.03,2020-12-31T05:00:00Z,{1_trade_buy},{trade_buy},2020Q4_1748030
