symbol,_id,address,business_scope,chairman,city,descrpt,email,main_business,manager,province,reg_capital,secretary,setup_date,website,company,dividend_startyear,exchange,exchange_,group,groupcode,index_stockid,industry,industrycode,mktcap_norm_cny,pchange_12w,pchange_ytd,price,sector,sectorcode,share_percentage,shares,value,position,change,share_change,impact,abs_impact,split_factor,price_max,price_min,price_avg,change_from_average,portdate,action,comment,oid
003004,2020Q4_1749985,北京市海淀区永丰基地丰贤中路7号(孵化楼)4层,安全技术防范产品的技术开发、技术推广、技术转让、技术咨询、技术服务、技术中介服务；货物进出口、技术进出口、代理进出口；计算机系统服务；销售安全技术防范产品、机械设备、电子产品、计算机、软件及辅助设备、自行开发的产品；制造、组装监控报警系统。(企业依法自主选择经营项目，开展经营活动；依法须经批准的项目，经相关部门批准后依批准的内容开展经营活动；不得从事本市产业政策禁止和限制类项目的经营活动。),谭政,北京市,公司是一家有核心技术和关键产品的安防运营服务商，主要从事安防技术服务，安防产品研发、生产和销售，安防工程系统集成三大方面的业务，拥有北京、湖南、江苏、重庆、陕西等多家分子公司。公司是北京市安全防范报警与安检工程技术研究中心的依托单位，先后承担了国家863计划，“十五”科技攻关计划、“十二五”科技支撑计划等课题30余项，拥有50余项自主知识产权，主参编《城市监控报警联网系统》等国家、行业和地方系列标准40余项。与俄罗斯、德国、意大利、芬兰、日本、中科院、清华大学等国内外科研机构建立了长期广泛的合作关系，积极开展安防前沿技术研究和科研成果转化。,ir@telesound.com.cn,"声迅股份是一家拥有智能技术,关键产品和核心系统平台的安防服务提供商,主要从事智能监控报警系统和智能安检系统的技术研发,设备供应,系统集成和运营服务.公司自成立以来,致力于为金融,轨道交通等行业和城市公共安全等领域提供智能化,信息化,行业化的安防整体解决方案和在线式安防运营服务.依托于自主研发的关键产品和核心系统平台,公司提供的产品及服务主要集中于智能监控报警和智能安检两大业务领域.",谭政,北京,8184.0,刘建文,19940128,www.telesound.com.cn,声迅股份,0,SZSE,SZSE,商业服务,31020,-,安保服务,31020040,2160545000,-22.24,-17.71,¥26.28,工业,310,0.0,300,10000.0,0.0,10000.0,300,0.0,0.0,1.0,51.68,29.17,37.68,-30.25,2020-12-31T05:00:00Z,{1_trade_buy},{trade_buy},2020Q4_1749985
605007,2020Q4_1750044,浙江省衢州市衢江区通波北路1号,机制纸和纸制品的制造及销售；造纸专用设备的设计、制造、安装及相关技术服务；机械零部件加工及设备修理；纸浆销售；货物进出口(法律法规限制的除外，应当取得许可证的凭许可证经营)。,赵磊,衢州市,公司是国内规模较大的食品包装纸生产企业和国内重要的格拉辛纸、描图纸生产企业。公司食品包装纸的主要客户为顶正包材、禾康包装、永康包装、统奕包装、岸宝集团等，最终用户为康师傅、统一等大型的食品饮料公司；公司格拉辛纸的主要客户为Avery Dennison(艾利丹尼森)、冠豪高新等国内外知名标签纸生产企业；公司描图纸的主要客户为无锡尚瑞等国内知名企业。发行人设立之初便十分注重工艺技术创新，通过引进行业内的技术人才，快速提升公司的技术水平。公司目前拥有一支经验丰富的生产和研发团队，核心技术人员均有15年以上造纸工作经验，对产品研发和工艺创新有深刻的理解和认识，较高的起点使得发行人较早成为顶正包材、禾康包装、统奕包装、岸宝集团、Avery Dennison(艾利丹尼森)等大型集团的供应商。在与大型高端客户合作的过程中，为进一步增加客户粘性，保持行业领先地位，发行人的生产和研发团队持续改进生产工艺、丰富产品类型、提升产品质量。目前，发行人已经获得了2项发明专利，9项实用新型专利。,fivestarpaper@fivestarpaper.com,"主营业务为特种纸的研发,生产和销售.根据产品下游应用领域不同,公司专注于生产食品包装纸,格拉辛纸以及描图纸,根据客户需求提供优质的产品及服务.",赵磊,浙江,40001.0,张海峡,20080109,www.wztzzy.com,五洲特纸,0,SHSE,SHSE,林业,10140,-,造纸及纸制品,10140020,7568243000,-18.13,-20.46,¥18.98,基础材料,101,0.0,600,14500.0,0.0,10000.0,600,0.0,0.0,1.0,31.61,15.98,26.02,-27.06,2020-12-31T05:00:00Z,{1_trade_buy},{trade_buy},2020Q4_1750044
003027,2020Q4_1749989,安徽省合肥市包河区滨湖金融港B10栋,环保科技研发；除尘、脱硫、脱硝、污水处理、节能工程承包；除尘、脱硫、脱硝、输送设备的设计、制造、安装、调试；低压成套开关设备的生产及销售。(依法需经批准的项目经相关部门批准后方可经营),郑光明,马鞍山市,公司是国内知名的非电行业烟气治理综合服务商，主要为钢铁、焦化、建材等非电行业工业企业提供超低排放整体解决方案，包括除尘、脱硫、脱硝项目总承包及低温SCR脱硝催化剂。从工艺设计、设备开发与制造、组织施工、安装调试服务，到配套脱硝催化剂的生产等，公司业务涵盖了烟气治理全过程，是国内为数不多的能够同时提供烟气治理工程服务和低温脱硝催化剂、关键除尘、脱硫及脱硝系统设备的烟气治理综合服务商。公司低温SCR脱硝催化剂整体技术达到国际先进水平，制备技术达到国际领先水平，低温SCR脱硝工艺与装备技术达到国内领先水平。公司已成长成为国内知名的非电行业烟气治理综合服务商，在非电行业烟气治理市场占据领先地位。,1160815071@qq.com;txhbzqb@ahtxhb.com,"主要为钢铁,焦化,建材等非电行业工业企业提供超低排放整体解决方案,包括除尘,脱硫,脱硝项目总承包及低温SCR脱硝催化剂.",朱宁,安徽,13000.5,曾兴生,20060619,www.ahtxhb.com,同兴环保,0,SZSE,SZSE,垃圾处理,31090,-,垃圾处理,31090010,3472383000,-6.76,1.69,¥26.63,工业,310,0.0,450,14000.0,0.0,10000.0,450,0.0,0.0,1.5,38.51,26.68,29.74,-10.46,2020-12-31T05:00:00Z,{1_trade_buy},{trade_buy},2020Q4_1749989
003028,2020Q4_1749990,广东省深圳市光明区玉塘街道根玉路与南明路交汇处华宏信通工业园4栋1-6楼,电子产品、各类电子智能控制器、汽车电子产品、医疗电子产品、电机及其智能控制器、变频器、LED照明、开关电源、高压电源、电子自动化设备的研发及销售(不含限制项目)；动力电池产品、各类家电、电力设备、软件的技术开发、技术服务与销售(不含限制项目)；电子产品的信息咨询(不含限制项目)；国内贸易(不含专营、专卖、专控商品)；经营进出口业务(法律、行政法规、国务院决定禁止的项目除外，限制的项目须取得许可后方可经营)；兴办实业(具体项目另行申报)。(以上项目法律、行政法规、国务院决定禁止的项目除外，限制的项目须取得许可后方可经营)电子产品、各类电子智能控制器、汽车电子产品、医疗电子产品、电机及其智能控制器、变频器、LED照明、开关电源、高压电源、电子自动化设备的生产。,陈志杰,深圳市,公司是国家高新技术企业、深圳市自主创新百强中小企业、深圳市南山区领军企业。公司始终坚持以技术创新作为发展核心驱动力，积极发展高技术附加值、高品质附加值、节能环保、智能物联的产品，不断提升公司核心竞争力。公司研发中心拥有多个专业技术开发平台以及多个现代化实验室，建立了高效的研发组织架构和技术创新机制，培养了一批技术水平高、创新能力强、经验丰富的专业研发团队，形成了一系列先进的平台化技术，处于行业领先水平。2016年，公司“冰箱变频控制技术工程实验室”项目经深圳市政府批准，列入深圳市战略性新兴产业和未来产业发展专项资金扶持计划(节能环保产业类)；2018年，公司研发中心被广东省科技厅认定为嵌入式控制系统及电机变频控制器工程技术研究中心。,genbyte@genbytech.com,"公司系行业内知名的高端智能控制器,变频驱动器,数字电源以及智能物联模块供应商,产品主要用于终端设备中的电能变换,控制及应用.",唐娟,广东,10960.0,夏群波,19990715,www.genbytech.com,振邦智能,0,SZSE,SZSE,硬件,31120,-,电子元件,31120040,4616472000,-15.42,1.54,¥41.31,科技,311,0.0,400,18000.0,0.0,10000.0,400,0.0,0.0,1.0,41.69,31.32,36.34,13.68,2020-12-31T05:00:00Z,{1_trade_buy},{trade_buy},2020Q4_1749990
300892,2020Q4_1750021,上海市普陀区长寿路652号景源时尚产业园10号楼308室,食品流通，日用百货的销售，仓储(除危险品)，企业管理咨询，包装服务，供应链管理，商务信息咨询，企业形象策划、设计，从事货物及技术的进出口业务。【依法须经批准的项目，经相关部门批准后方可开展经营活动】,王牧,上海市,作为国内较早实现进口食品品牌运营的企业，公司始终秉持“通过世界美食，让大众更时尚、更健康”的使命，通过整合全球优质食品资源，全力打造“原装进口食品”的品牌发展战略，致力于将中国美食品牌与全球生产体系嫁接，将全球的健康美食和时尚生活方式带给中国消费者。经过多年发展，公司已成功自主开发和推广“德亚”、“瓦伦丁”、“亨利”、“雅娜”等自有品牌以及“品利”等合作品牌，品牌影响力逐年提升，在消费者中拥有较高的声誉和品牌辨识度。公司已成为国内知名的进口食品品牌运营商。报告期内，公司主要从事自有品牌食品的开发、进口、销售及国外食品的合作代理销售业务。目前，公司产品以自有品牌和合作品牌进口食品为主，主要聚焦于乳品、啤酒、粮油、谷物以及饼干点心类等五大食品品类。截止本招股说明书签署日，公司重点经营的自有品牌5款，合作品牌4款以及代理品牌1款。作为国内知名的进口食品品牌运营商，公司高度重视渠道建设工作，坚持线上渠道与线下渠道同时发展的营销策略，构建了包括大型商超，天猫商城、京东等电商平台以及各地经销商等在内的多元化销售体系。目前，公司销售渠道分为线下渠道和线上渠道。,securities@pinlive.com,"公司主要从事自有品牌食品的开发,进口,销售及国外食品的合作代理销售业务.公司产品以自有品牌和合作品牌进口食品为主,主要聚焦于乳品,啤酒,粮油,谷物以及饼干点心类等五大食品品类.",王牧,上海,10000.0,朱国辉,19970909,www.pinlive.com,品渥食品,0,SZSE,SZSE,零售 - 防守型,20550,-,食品分销,20550020,4554552000,-10.37,-29.67,¥44.40,非周期性消费,205,0.0,300,16300.0,0.0,10000.0,300,0.0,0.0,1.0,83.5,54.15,65.09,-31.79,2020-12-31T05:00:00Z,{1_trade_buy},{trade_buy},2020Q4_1750021
003026,2020Q4_1749988,浙江省湖州市长兴县太湖街道陆汇路59号,晶体硅、电子元器件制造、销售，晶体硅及其制品、电子元器件及新型节能材料的开发、技术咨询及技术转让，电气机械设备设计及销售；货物进出口、技术进出口。(依法须经批准的项目，经相关部门批准后方可开展经营活动),徐一俊,湖州市,公司是一家专业从事硅材料研发、生产和销售的电子信息产业国家级高新技术企业。发行人是国家高新技术企业、全国半导体设备和材料标准化技术委员会成员单位，是中国半导体行业协会、中国电子材料行业协会会员单位，在半导体硅材料制造领域拥有多项核心技术和专利。发行人核心管理团队拥有二十多年的半导体行业从业经验，长期致力于半导体硅材料的研发与生产，在研发、生产工艺、质量控制等方面拥有完善的技术储备和强大的技术创新能力。经过近十年的发展，目前发行人在分立器件用半导体硅材料领域尤其是硅研磨片细分领域已具有领先的市场地位。,ir@mtcn.net,"主营业务为半导体硅材料的研发,生产和销售,主要产品为半导体硅片及半导体硅棒.",徐一俊,浙江,9976.0,李志萍,20100125,www.mtcn.net,中晶科技,0,SZSE,SZSE,半导体,31130,-,半导体仪器和材料,31130010,8265662000,2.22,81.91,¥82.80,科技,311,0.0,500,21700.0,0.0,10000.0,500,0.0,0.0,1.0,47.16,20.0,31.87,159.81,2020-12-31T05:00:00Z,{1_trade_buy},{trade_buy},2020Q4_1749988
300886,2020Q4_1750016,安徽省安庆市潜山市舒州大道42号,香精、香料、油田助剂、炼油助剂、金属加工助剂、纺织助剂、水处理剂、精细化工产品(不含危险化学品)开发、生产、销售(涉及行政许可项目凭有效许可证经营)。,徐基平,安庆市,公司自设立以来，公司一直专注于经营香料业务，主要从事内酯系列合成香料的研发、生产和销售，主营业务突出。公司自设立以来，始终坚持以市场为导向，以客户为目标，以技术创新打造核心竞争力，坚持走“创新、协调、绿色、开放、共享”的发展道路，打造行业高端品牌。公司为国家高新技术企业，拥有省级认定的企业技术中心、安徽省院士工作站。公司通过技术研究、工艺绿色化改造、副产物开发、资源综合利用等集成创新实现了“传统产品+新工艺”，进一步提升了内酯类香料的市场竞争力，产品在国际市场上具有竞争优势。公司为中国香料香精化妆品工业协会副理事长单位，在由中国轻工业联合会发布的2017年度“中国轻工业香料行业十强企业”评选中，公司位列第七名；公司还被中国香化协会授予“中国香料香精化妆品行业优秀企业奖”、“2016年度香料香精优秀品牌企业”等荣誉称号。,info@anhuihuaye.com,"主要产品为丙位内酯,丁位内酯系列合成香料,主要从事内酯系列合成香料的研发,生产和销售.",徐基平,安徽,7455.5,付林,20020712,www.anhuihuaye.com,华业香料,0,SZSE,SZSE,化工,10130,-,化学制品,10130010,2227711000,-13.36,-19.19,¥29.61,基础材料,101,0.0,130,6700.0,0.0,10000.0,130,0.0,0.0,1.3,70.6,36.04,48.7,-39.2,2020-12-31T05:00:00Z,{1_trade_buy},{trade_buy},2020Q4_1750016
605377,2020Q4_1750049,浙江省杭州市临安区青山湖街道滨河北路18号,生产：新型材料，装饰纸。服务：新型材料、装饰纸的技术研发；批发、零售：新型材料，装饰纸；货物进出口(法律、行政法规禁止经营的项目除外，法律、行政法规限制经营的项目取得许可后方可经营)。(依法须经批准的项目，经相关部门批准后方可开展经营活动),张延成,杭州市,公司是国内从事装饰原纸生产的主要企业之一，主要从事可印刷装饰原纸和素色装饰原纸的研发、生产和销售业务，以及木浆的贸易业务。公司生产的装饰原纸广泛用于家具、地板、木门等产品的贴面装饰。多年来始终专注于装饰原纸品质的提升，积累了丰富的生产与管理经验。公司的装饰原纸产品种类齐全、质地均匀、性能良好，具有较强的市场竞争力。作为高新技术企业，发行人不断进行研发与创新，拥有多项专利，并获得“中国地板行业科技创新奖”、“中国林业产业创新奖”等荣誉。发行人是“中国林产工业协会装饰纸与饰面板专业委员会”副理事长单位，并参与起草了《人造板饰面专用纸》国家标准。,securities@huawon.cn;hwkjdmb@huawon.cn,"主要从事可印刷装饰原纸和素色装饰原纸的研发,生产和销售业务,以及木浆的贸易业务.",张延成,浙江,28541.34,陈蕾,20091230,www.hwpaper.cn,华旺科技,0,SHSE,SHSE,林业,10140,-,造纸及纸制品,10140020,5167691000,15.58,27.44,¥18.46,基础材料,101,0.0,1120,15000.0,0.0,10000.0,1120,0.0,0.0,1.4,17.37,14.26,15.44,19.56,2020-12-31T05:00:00Z,{1_trade_buy},{trade_buy},2020Q4_1750049
003025,2020Q4_1749987,浙江省宁波市鄞州区江南路1832号,冷成形设备及配件的研发、制造、销售、维修；压铸设备及配件的研发、制造、销售、维修；机械配件的加工及销售；自营或代理各类商品和技术的进出口业务，但国家禁止或限定经营的商品和技术除外。(依法须经批准的项目，经相关部门批准后方可开展经营活动),李忠明,宁波市,公司主要从事多工位高速自动冷成形装备和压铸设备的研发、生产与销售，是一家致力于提升我国冷成形装备技术水平、推动冷成形工艺发展进步、实现紧固件及异形零件产业升级的高新技术企业。公司秉持精益求精的工匠精神，培养了一批敬业、精准、具有创新意识的技术人才，经过多年持续不断的技术创新，掌握了多工位高速自动冷成形装备和压铸设备的系列核心技术，并发展成为国内领先的多工位高速自动冷成形装备供应商，自公司设立至2007年，公司的主营业务为机械加工业务及压铸设备的研发、生产与销售。2007年公司经过市场调查和技术调研，结合市场需求和自身技术储备情况，开始研发冷成形装备，并于2008年研发成功第一台冷成形装备，随后公司加大冷成形装备的市场开拓，业务量逐年提升。目前公司主导产品为各类冷成形装备，压铸设备业务量占比相对较小。,nbsijin@163.com,"公司的主营业务为机械加工业务及压铸设备的研发,生产与销售.主导产品为各类冷成形装备.",李忠明,浙江,11254.6,周慧君,19930115,www.sijin.cc/www.machinesijin.com,思进智能,0,SZSE,SZSE,工业制品,31070,-,特种工业机械,31070020,3010607000,-1.0,7.61,¥26.66,工业,310,0.0,420,10800.0,0.0,10000.0,420,0.0,0.0,1.4,35.35,21.95,27.35,-2.52,2020-12-31T05:00:00Z,{1_trade_buy},{trade_buy},2020Q4_1749987
603179,2020Q4_1750040,江苏省常州市新北区黄河西路555号,汽车内、外饰系统零部件及其模具的设计、制造及销售；自营和代理各类商品及技术的进出口业务(国家限定企业经营或禁止进出口的商品和技术除外；依法须经审批的项目，经相关部门核准后方可开展经营活动)。,唐志华,镇江市,公司专业从事汽车内、外饰件系统零部件及模具的设计、制造及销售；自营和代理各类商品及技术的进出口业务。公司是全国百家优秀汽车零部件供应商之一，是众多汽车品牌的一级配套商，与合资广菲克、上海大众、一汽大众，自主上海汽车、吉利汽车、奇瑞汽车、宝沃汽车及北汽等乘用车配套；和一汽解放、东风、福田戴姆勒、中国重汽、陕重汽等大中型商用车汽车企业也建立了长期稳定的合作关系。　　公司恪守“追求卓越、超越期望”的质量方针，竭力为客户提供优质的产品和服务。2002年通过QS9000认证，2005通过TSl6949认证，2010年通过国家环境体系ISO14000认证，2009年新泉实验室通过国家CNAS认证。,gaohailong@xinquan.cn;chenxueqian@xinquan.cn;xinquantzb@xinquan.cn,"主营业务为提供汽车饰件整体解决方案.主要产品为汽车饰件产品,包括仪表板总成,顶置文件柜总成,门内护板总成,立柱护板总成,流水槽盖板总成和保险杠总成等.",唐志华,江苏,36947.4,高海龙,20010428,www.xinquan.cn,新泉股份,2020,SHSE,SHSE,汽车和配件,10200,-,汽车配件,10200030,11444506000,5.78,-6.64,¥30.90,周期性消费,102,0.0,400,12900.0,0.0,10000.0,400,0.0,0.0,1.0,34.36,20.85,29.11,6.15,2020-12-31T05:00:00Z,{1_trade_buy},{trade_buy},2020Q4_1750040
003020,2020Q4_1749986,安徽省合肥市蜀山区长江西路669号立方厂区,片剂、硬胶囊剂、颗粒剂、软膏剂(含激素类)、小容量注射剂(含抗肿瘤类)、原料药(多西他赛、非洛地平、二巯丁二酸、门冬氨酸鸟氨酸、佐芬普利钙、甲磺酸多沙唑嗪、二巯丙磺钠、丹皮酚、尿素、帕潘立酮、曲克芦丁、罗氟司特、盐酸哌甲酯)、凝胶剂、乳膏剂、滴眼剂、中药前处理、中药饮片、提取车间、制药机械、化工原料(不含危险品)的生产、销售(在许可证有效期内经营)；药品研发、技术转让；经营本企业自产产品的出口业务和本企业所需的机械设备、零配件、原辅材料的进口业务(国家限定除外)；功能性化妆品原料研发、生产、销售、服务；医药中间体的生产、销售；租赁；自营和代理各类商品及技术的进出口业务(国家规定的专营进出口商品和国家禁止进出口的特殊商品除外)。(依法须经批准的项目，经相关部门批准后方可开展经营活动),季俊虬,合肥市,公司是一家集药品制剂及原料药的研发、生产、销售，药品与医疗器械的批发、零售于一体的创新型医药企业，对医药工业及医药商业形成全产业链覆盖，主要产品涉及心血管类用药、消化系统用药、皮肤外用药等领域。并先后取得“国家高新技术企业”、“安徽省创新型企业”等荣誉，拥有安徽省认定企业技术中心、安徽省药物缓控释工程技术研究中心，并设有博士后科研工作站。基于公司核心专利的“难溶药物单层芯渗透泵控释技术研发与产业化应用”获得2018年度安徽省科学技术奖一等奖。,zqb@lifeon.cn,"公司业务主要包括医药工业产品的研发,生产及销售,医药批发配送和医药零售等板块,公司主要产品的剂型包括片剂,口服液剂,软膏剂,胶囊剂等.",邓晓娟,安徽,9264.0,夏军,20020716,www.lifeon.cn,立方制药,0,SZSE,SZSE,生物科技,20610,-,生物科技,20610010,4654067000,46.28,48.2,¥49.67,医疗保健,206,0.0,400,12900.0,0.0,10000.0,400,0.0,0.0,1.0,44.33,33.31,36.61,35.67,2020-12-31T05:00:00Z,{1_trade_buy},{trade_buy},2020Q4_1749986
