symbol,_id,address,business_scope,chairman,city,descrpt,email,main_business,manager,province,reg_capital,secretary,setup_date,website,company,dividend_startyear,exchange,exchange_,group,groupcode,index_stockid,industry,industrycode,mktcap_norm_cny,pchange_12w,pchange_ytd,price,sector,sectorcode,share_percentage,shares,value,position,change,share_change,impact,abs_impact,split_factor,price_max,price_min,price_avg,change_from_average,portdate,action,comment,oid
300529,2020Q4_1749996,广东省珠海市高新区科技六路98号,"医疗器械、仪器设备及其零配件以及与产品相关的软件产品的研发、制造、销售及技术咨询与服务；药品、特殊医学用途配方食品、特殊膳食食品、保健食品、保健用品、医用包装材料、消毒剂、生物培养基、生物制品、生物试剂、化学试剂(不含危险化学品)、卫生材料及医药用品、生物材料、医用高分子材料、特种复合材料及制品、精细化工材料、洗涤用品、电池、化工产品(不含有毒有害、易燃易爆及危险化学品)及相关产品的研发、制造、销售及技术咨询与服务；医用计算机软件产品的开发、销售及系统管理与维护(法律、法规和国务院决定禁止的不得经营;依法须经批准的项目,经相关部门批准后方可开展经营活动)；医疗科技、信息科技、生物科技领域内的技术开发、技术转让、技术推广服务、技术咨询；兼营医疗服务、自有房屋租赁及销售、机械设备租赁、普通货运；货物及技术的进出口业务(不含国家禁止和限制的货物及技术)。",董凡,珠海市,公司是具有创新技术的血液净化产品提供商，主要从事血液灌流相关产品的研发、生产与销售，自主研发的一次性使用血液灌流器、一次性使用血浆胆红素吸附器、DNA免疫吸附柱及血液净化设备等产品广泛应用于尿毒症、中毒、重型肝病、自身免疫性疾病、多器官功能衰竭等领域的治疗，可有效挽救患者生命或提高病患者生活质量。作为手术、药物之外的第三种疗法，血液净化技术正越来越广泛的用于各种疑难危重疾病的临床治疗。公司立足于产品研发及创新，依靠自身专业的营销团队，通过产品技术的学术推广及对各医疗机构的服务支持，为患者提供安全有效的血液净化产品。公司产品已通过CE认证、ISO国际质量管理体系认证，承担两项“国家重点新产品项目”和三项“国家级火炬计划项目”，获批组建广东省血液净化工程技术研究开发中心、省级企业技术中心、博士后科研工作站、院士工作站。,IR@jafron.com,"主要业务为研发,生产及销售具有创新技术的血液净化产品.主要产品:一次性使用血液灌流器,血液灌流机,一次性使用血浆胆红素吸附器,DX-10型血液净化机等.",董凡,广东,80502.9,张明渊,19891219,www.jafron.com,健帆生物,2017,SZSE,SZSE,医疗器械,20650,-,医疗设备,20650010,67237160000,-3.67,25.54,¥80.50,医疗保健,206,0.02,196400,13319800.0,0.7,-83.63,-1003700,-3.79,3.79,1.0,81.5,63.65,71.55,12.51,2020-12-31T05:00:00Z,{4_trade_reduce},{trade_reduce} 83.63 %,2020Q4_1749996
002938,2020Q4_1749983,广东省深圳市宝安区燕罗街道燕川社区松罗路鹏鼎园区,生产经营新型电子元器件、自动化设备及其零配件、精密模具及其零件、各类印刷电路板、电子信息产品板卡。从事电子信息产品及其板卡的批发、进出口及相关配套业务；自有房屋租赁；仓储服务；从事A002-0061宗地(即“鹏鼎时代大厦”)的房地产开发、经营、租赁、销售；物业管理；经营性机动车停车场。(以最终的工商登记为准),沈庆芳,深圳市,公司由原富葵精密组件(深圳)有限公司整体变更设立。公司成立于1999年4月29日，主要从事各类印制电路板的设计、研发、制造与销售业务。多年来，公司以“发展科技、造福人类，精进环保、让地球更美好”为使命，遵循“稳增长、调结构、促创新、控风险”的经营策略，致力于与世界一流客户合作，运用先进的研发技术，配合高效率、低成本的运营手段，构建体系完善、布局合理的产供销体系，打造“效率化、合理化、自动化、无人化”的四个现代化制造工程。目前，公司的制造基地分布于深圳、秦皇岛、淮安及营口，服务半径覆盖中国大陆、中国台湾、日本、韩国、美国及越南等地，可以为全球客户提供快速、高效的优质服务，已成为业内极具影响力的重要厂商之一。,a-h-m@avaryholding.com,"主要从事各类印制电路板的设计,研发,制造与销售业务.专注于为行业领先客户提供全方位PCB产品及服务,根据下游不同终端产品对于PCB的定制化要求,可以为客户提供涵盖PCB产品设计,研发,制造与售后各个环节的整体解决方案.",陈章尧,广东,231143.08,周红,19990429,www.avaryholding.com,鹏鼎控股,2019,SZSE,SZSE,硬件,31120,-,电子元件,31120040,87661167000,20.7,-23.82,¥39.05,科技,311,0.0,200,8000.0,0.0,-99.98,-853800,-2.32,2.32,1.0,58.85,44.35,51.13,-23.63,2020-12-31T05:00:00Z,{4_trade_reduce},{trade_reduce} 99.98 %,2020Q4_1749983
002142,2020Q4_1750066,浙江省宁波市鄞州区宁东路345号,(一)吸收公众存款；(二)发放短期、中期和长期贷款；(三)办理国内外结算；(四)办理票据承兑与贴现；(五)发行金融债券；(六)代理发行、代理兑付、承销政府债券；(七)买卖政府债券、金融债券；(八)从事同业拆借；(九)从事银行卡业务；(十)提供信用证服务及担保；(十一)代理收付款项及代理保险业务；(十二)提供保管箱服务；(十三)经中国银行业监督管理机构、中国人民银行和国家外汇管理机关批准的其他业务。,陆华裕,宁波市,公司成立于1997年4月10日，2007年7月19日成为国内首家在深圳证券交易所挂牌上市的城市商业银行。公司前两大股东分别是宁波市政府和新加坡华侨银行，新加坡华侨银行是东南亚第二大金融服务集团，是国际上具有最高评级的银行之一，拥有穆迪Aa1级评级。公司以“了解的市场，熟悉的客户”为准入原则，坚持“门当户对”的经营策略，以为客户提供多元化金融服务为目标，打造“公司银行、零售公司、个人银行、金融市场、信用卡、票据业务、投资银行、资产托管、资产管理”九大利润中心，初步形成多元化的业务增长模式和良好的品牌形象。,dsh@nbcb.com.cn,"主要产品:公司贷款,个人贷款,房屋贷款是本行个人贷款.",罗孟波,浙江,562832.95,俞罡,19970410,www.nbcb.com.cn,宁波银行,2017,SZSE,SZSE,银行,10320,-,区域性银行,10320020,222110887000,-2.31,5.38,¥36.97,金融服务,103,0.0,0,0.0,0.0,-10000.0,-3943100,-5.5,5.5,1.0,38.0,27.89,33.6,10.03,2020-12-31T05:00:00Z,{5_trade_sell},{trade_sell},2020Q4_1750066
000661,2020Q4_1750065,吉林省长春市同志街2400号火炬大厦5层,高新技术产品的开发、生产、销售及服务基础设施的开发建设、新药开发、技术转让、咨询服务；物业管理；高新成果转让及中介服务；商业供销业(国家有专项限制经营的商品除外)；餐饮、娱乐、旅馆(办时需许可)；培训；集中供热；产业投资(医药产业)(以上各项仅限分公司、子公司持证经营)。绿化景观工程设计、施工及维护、企业营销策划、广告策划、社会经济信息咨询、房地产中介服务、房屋销售代理(仅限分支机构持证经营)；企业管理咨询(以上各项国家法律法规禁止的不得经营；应经专项审批的项目未获得批准之前不得经营)*,马骥,长春市,公司于1993年6月成立，是东北地区最早的一批上市公司之一。公司主营业务以生物制药、中成药生产及销售为主，辅以房地产开发、物业管理等。上市多年来，公司凝炼并秉持“创新、专注、包容、共享”的发展理念，坚持以科技创新为源动力，主导产业成功实现由服务于开发区基础设施建设向生物制药及健康产业的转型，随着医药产业项目的成功孵化并壮大，支撑了经营业绩的快速增长，目前公司已成为国内生物医药领域具有一定技术领先优势的上市公司。,zds000661@163.com;zds@ccht.jl.cn;000661@ccht.jl.cn,"主要产品:基因重组人生长素,血栓心脉宁,冠脉宁.",姜云涛,吉林,40472.03,张德申,19930610,www.ccht.jl.cn,长春高新,2013,SZSE,SZSE,医药制造,20620,-,专用医药制造,20620020,156738684000,-12.65,-12.45,¥379.11,医疗保健,206,0.0,0,0.0,0.0,-10000.0,-222000,-5.25,5.25,1.0,503.22,329.98,412.5,-8.09,2020-12-31T05:00:00Z,{5_trade_sell},{trade_sell},2020Q4_1750065
603517,2020Q4_1750076,湖南省长沙市芙蓉区晚报大道267号晚报大厦1608室,食品、农副产品的生产、加工、销售、技术开发、技术服务；仓储服务；商品配送；(以上限分支机构凭许可证经营)；企业管理咨询；自营和代理各类商品和技术的进出口，但国家限定公司经营和禁止进出口商品技术除外；实业投资。(依法须经批准的项目，经相关部门批准后方可开展经营活动),戴文军,长沙市,公司自成立以来，专注于休闲卤制食品的开发、生产和销售。以综合信息系统及供应链整合体系为支持，通过“以直营连锁为引导、加盟连锁为主体”的方式进行标准化的门店运营管理，打造国内现代化休闲卤制食品连锁企业领先品牌。公司是一家经营自主品牌的休闲卤制食品连锁企业，也是国内规模最大、拥有门店数量最多的休闲卤制食品连锁企业之一。公司已通过ISO9001国际质量管理体系认证、ISO22000食品安全管理体系认证，“绝味”商标被认定为中国驰名商标。,zqb@juewei.cn,"主营业务:专注于休闲卤制食品的研发,生产和销售,致力于为消费者提供美味,新鲜,安全,优质的休闲美食.公司休闲卤制食品主要分为两类:一类是以鸭,鸡,猪等禽畜为原料的休闲卤制肉制品;另一类是以毛豆,萝卜,花生等为原料的休闲卤制素食品.",戴文军,湖南,61422.47,彭刚毅,20081217,www.juewei.cn,绝味食品,2017,SHSE,SHSE,农副加工食品,20525,-,加工食品,20525040,50826592000,7.39,8.28,¥81.34,非周期性消费,205,0.0,0,0.0,0.0,-10000.0,-1111300,-4.27,4.27,1.0,94.2,67.4,79.31,2.56,2020-12-31T05:00:00Z,{5_trade_sell},{trade_sell},2020Q4_1750076
300567,2020Q4_1750074,湖北省武汉市东湖新技术开发区流芳园南路22号,平面显示技术的研发；液晶测试系统、有机发光二极管显示器测试系统、计算机测控系统集成、机电自动化设备的研发、生产、销售及技术服务；太阳能、锂电池及其它新能源测试系统、电源测试系统的研发、生产、销售及技术服务；芯片设计、半导体测试设备的研发、生产、销售及技术服务；相关计量检测服务；货物及技术进出口(国家禁止或限制进出口的货物及技术除外)；电子产品设计、生产、销售。(依法须经审批的项目，经相关部门审批后方可开展经营活动)。,彭骞,武汉市,公司是一家从事TFT-LCD(液晶显示器)\PDP(等离子体显示器)\OLED平面显示信号测试技术的研究、开发、生产与销售为一体的高新技术企业，也是目前国内平面显示信号测试领域的龙头企业。公司在国内平板显示测试领域处于绝对领先地位，产品包括模组检测系统、面板检测系统、OLED检测系统、AOI光学检测系统、Touch Panel检测系统和平板显示自动化设备，并通过ISO9000-2008质量管理体系认证、CE欧盟产品认证。产品已在京东方、三星、LG、夏普、松下、中电熊猫、富士康、友达光电等知名企业批量应用，并大量用于苹果公司的IPhone和IPad系列产品显示测试。公司坚持以“自主创新为核心，以联合研发为两翼”的发展战略，围绕光学检测、自动化控制以及信号检测(光、机、电)技术，开展了一系列的技术攻关和创新工作，拳头产品拥有自主知识产权，其整体技术水平达到国际先进水平。,zqb@wuhanjingce.com;chengjiang@wuhanjingce.com;liubinghua@wuhanjingce.com,"主要产品:模组检测系统,面板检测系统,OLED检测系统,AOI光学检测系统,Touch Panel检测系统和平板显示自动化设备.主营业务:平板显示检测系统的研发,生产与销售.",陈凯,湖北,27813.04,程疆,20060420,www.wuhanjingce.com,精测电子,2020,SZSE,SZSE,硬件,31120,-,科技仪器,31120060,17883555000,16.38,20.42,¥63.50,科技,311,0.0,0,0.0,0.0,-10000.0,-944100,-3.5,3.5,1.0,57.23,46.2,51.3,23.78,2020-12-31T05:00:00Z,{5_trade_sell},{trade_sell},2020Q4_1750074
688020,2020Q4_1750081,广东省广州市高新技术产业开发区开源大道11号A5栋第六层,计算机零部件制造；电子元件及组件制造；印制电路板制造；电子工业专用设备制造；电镀设备及装置制造；电线、电缆制造；试验机制造；电磁屏蔽器材的研究、开发、设计；新材料技术推广服务；电磁屏蔽器材的的销售；货物进出口(专营专控商品除外)；技术进出口；商品批发贸易(许可审批类商品除外)；金属表面处理及热处理加工。,苏陟,广州市,公司是一家高端电子材料及解决方案供应商，主要产品包括电磁屏蔽膜、导电胶膜、极薄挠性覆铜板及超薄铜箔等，均属于高技术含量的产品。公司专注于电磁屏蔽膜等高端电子材料的研究和应用，经过多年的技术攻关和研究试验，已经掌握了聚酰亚胺表面改性处理、精密涂布技术及离型剂配方、聚酰亚胺薄膜离子源处理、卷状真空溅射、连续卷状电镀/解、电沉积加厚和电沉积表面抗高温氧化处理等技术，并不断完善原料配方、产品设计和技术工艺，成为少数掌握超高电磁屏蔽效能、极低插入损耗(即信号传输损耗)技术的电磁屏蔽膜生产厂商之一，完善了我国FPC产业链。公司拥有一支由通讯、机械自动化、材料学和化学等多学科人才组成的研发团队，获得国内外多项专利技术，在高端电子材料领域，特别是电磁屏蔽膜领域，积累了较大的核心技术优势。,dm@fbflex.com,"主营业务为高端电子材料的研发,生产及销售,专注于提供高端电子材料及应用解决方案.产品包括电磁屏蔽膜,导电胶膜,极薄挠性覆铜板及超薄铜箔等.",苏陟,广东,8000.0,佘伟宏,20101215,www.fbflex.com,方邦股份,0,SHSE,SHSE,硬件,31120,-,电子元件,31120040,6874678000,11.25,-9.73,¥88.35,科技,311,0.0,0,0.0,0.0,-10000.0,-523900,-3.3,3.3,1.0,98.1,84.63,92.47,-4.46,2020-12-31T05:00:00Z,{5_trade_sell},{trade_sell},2020Q4_1750081
300253,2020Q4_1750068,上海市静安区寿阳路99弄9号卫宁健康大厦,从事健康科技领域内的技术开发、技术转让、技术咨询、技术服务，医疗器械生产(II类6870影像档案传输、处理系统软件)，医疗器械经营，实业投资，自有房屋租赁；计算机软件的开发、设计和制作，计算机软、硬件及辅助设备的销售，计算机网络信息系统集成的维护，并提供相关的技术咨询和技术服务。【依法须经批准的项目，经相关部门批准后方可开展经营活动】,周炜,上海市,公司是国内第一家专注于医疗健康信息化的上市公司，致力于提供医疗健康卫生信息化解决方案，不断提升人们的就医体验和健康水平。公司通过持续的技术创新，自主研发适应不同应用场景的产品与解决方案，业务覆盖智慧医院、区域卫生、基层卫生、公共卫生、医疗保险、健康服务等领域，是中国医疗健康信息行业最具竞争力的整体产品、解决方案与服务供应商。多年来，公司产品获得了“国家级火炬计划项目”、“国家重点新产品”、“上海市火炬计划项目”、“上海市高新技术成果转化认定项目”、“上海市重点新产品”等诸多殊荣，并获得国家及上海市科技创新基金的资助。,wndsh@winning.com.cn,"主营业务为主要从事医疗软件研究开发,销售与技术服务业务,并为医疗卫生行业信息化提供整体解决方案.公司软件产品主要分为应用于医院内部的医院信息系统以及应用于区域性公共卫生领域的公共卫生信息管理系统等两大产品线,各产品线又分别由功能各异的众多子系统或者功能模块构成.",王涛,上海,214143.29,靳茂,20040407,www.winning.com.cn,卫宁健康,2018,SZSE,SZSE,医疗机构和服务,20645,-,医疗信息服务,20645030,36055052000,-1.31,-2.77,¥16.46,医疗保健,206,0.0,0,0.0,0.0,-10000.0,-2606200,-3.25,3.25,1.0,27.08,14.95,19.78,-16.78,2020-12-31T05:00:00Z,{5_trade_sell},{trade_sell},2020Q4_1750068
300136,2020Q4_1750067,"广东省深圳市宝安区沙井街道西环路1013号A,B栋",移动终端天线、3G终端天线、模组天线、3D精密成型天线、高性能天线连接器、音频模组的设计、技术开发、生产和销售。国内商业、物资供销业，货物及技术进出口，国家法律法规明令禁止项目以外的其他项目。,彭浩,深圳市,公司是国内小型天线行业发展的领跑者，集研发、制造、销售于一体，主要致力于研发和生产移动通信设备终端各类型天线，包括手机天线/GPS/WIFI/手机电视/无线网卡/AP天线等。公司积极围绕射频技术为核心，一方面不断夯实自身产品研发与制造能力；另一方面拓展高性能射频连接器及为解决整机EMC/EMI的精密五金部件、LDS产品、音频产品及音/射频模组等，新材料天线零部件如NFC、无线充电、无线支付模组等新品已批量交货，公司的产品线不断丰富，全方位为客户提供一站式解决方案服务，进一步加强与客户合作广度和深度，提升公司综合的竞争实力。公司拥有具备国家CNAS和国际CTIA认证资质的国际化标准的研发测试中心以及5G毫米波实验室。,ir@sz-sunway.com,"主营业务为研发,生产和销售移动终端天线系统产品并提供相关技术服务.产品主要包括手机天线,蓝牙天线,天线组件,手机电视天线,GPS终端天线等移动终端天线.",彭浩,广东,96756.86,杨明辉,20060427,www.sz-sunway.com.cn,信维通信,2020,SZSE,SZSE,硬件,31120,-,通讯设备,31120010,30318030000,16.49,-11.59,¥30.60,科技,311,0.0,0,0.0,0.0,-10000.0,-1016400,-2.93,2.93,1.0,64.42,35.88,51.55,-40.64,2020-12-31T05:00:00Z,{5_trade_sell},{trade_sell},2020Q4_1750067
300451,2020Q4_1750072,浙江省杭州市滨江区长河街道越达巷92号创业智慧大厦五楼,一般项目：软件开发；物联网技术研发；物联网技术服务；物联网应用服务；物联网设备销售；信息系统集成服务；数据处理和存储支持服务；信息系统运行维护服务；信息技术咨询服务；技术服务、技术开发、技术咨询、技术交流、技术转让、技术推广；大数据服务；区块链技术相关软件和服务；互联网数据服务；人工智能公共服务平台技术咨询服务；人工智能基础资源与技术平台；人工智能行业应用系统集成服务；人工智能公共数据平台；安全技术防范系统设计施工服务；网络与信息安全软件开发；第一类医疗器械销售；第二类医疗器械销售；计算机软硬件及辅助设备零售；计算机软硬件及辅助设备批发；电子专用设备销售；云计算设备销售；网络设备销售；接受金融机构委托从事信息技术和流程外包服务(不含金融信息服务)(除依法须经批准的项目外，凭营业执照依法自主开展经营活动)。许可项目：互联网信息服务；药品互联网信息服务；依托实体医院的互联网医院服务；第二类增值电信业务；第二类医疗器械生产；第三类医疗器械经营；建筑智能化工程施工；消防设施工程施工；建设工程设计；各类工程建设活动；出版物互联网销售；出版物批发；出版物零售；网络文化经营；信息网络传播视听节目；保健食品销售；食品经营(销,葛航,杭州市,公司是国家级高新技术企业、国家规划布局内重点软件企业、国家火炬计划软件产业基地骨干企业、华东医疗行业十佳系统集成商等，是我国医疗卫生行业应用软件发展的重点企业。公司一直专注于医疗卫生行业的信息化建设业务，主要业务分为医疗卫生信息化应用软件和基于信息技术的系统集成业务。公司拥有一支由医疗卫生行业专家领衔，众多相关专业技术人员组成的团队，具有强大的技术研发能力和丰富的项目实施经验。先后承担了国家电子发展基金项目、国家高新技术产业化项目、国家火炬计划项目、国家创新基金项目等40多项国家、省、市级重大技术研发项目。,bsoft@bsoft.com.cn;huy@bsoft.com.cn;xus@bsoft.com.cn,"主营业务:专注于医疗卫生行业的信息化建设业务,主要包括医疗卫生信息化应用软件业务,基于信息技术的系统集成业务.主要产品:为医疗卫生信息化应用软件产品.",张吕峥,浙江,154978.77,胡燕,19971210,www.bsoft.com.cn,创业慧康,2016,SZSE,SZSE,医疗机构和服务,20645,-,医疗信息服务,20645030,13544292000,11.25,-15.23,¥8.63,医疗保健,206,0.0,0,0.0,0.0,-10000.0,-3365830,-2.6,2.6,1.3,14.22,11.05,12.26,-29.61,2020-12-31T05:00:00Z,{5_trade_sell},{trade_sell},2020Q4_1750072
002714,2020Q4_1750070,河南省南阳市卧龙区龙升工业园区,畜禽养殖、购销，粮食购销，良种繁育，饲料加工销售，畜产品加工销售，猪粪处理，经营本企业自产产品及相关技术的进出口业务，但国家限定公司经营或禁止进出口的商品及技术除外。,秦英林,南阳市,公司是集饲料加工、生猪育种、种猪扩繁、商品猪饲养、屠宰加工为一体的农业产业化国家重点龙头企业，是我国最大的自育自繁自养大规模一体化的生猪养殖企业之一，也是我国最大的生猪育种企业之一。主营业务为种猪和商品猪的养殖与销售，主要产品为种猪、商品猪。公司拥有一条集饲料加工、生猪育种、种猪扩繁、商品猪饲养等多个环节于一体的完整生猪产业链，并拥有自动化水平较高的猪舍和饲喂系统、强大的生猪育种技术、独特的饲料配方技术。目前，公司是第一批国家生猪核心育种场、国家级星火计划项目证书、国家现代农业产业技术体系生猪产业综合实验站、国家生猪活体储备基地、国家级原种猪场、国家级青年文明号单位、国家生猪试验站。,myzqb@muyuanfoods.com,"公司主营业务为生猪的养殖与销售,主要产品为仔猪,种猪,商品猪.",秦英林,河南,526306.24,秦军,20000713,www.muyuanfoods.com,牧原股份,2019,SZSE,SZSE,农副加工食品,20525,-,农产品,20525020,298409887000,-22.1,5.31,¥54.38,非周期性消费,205,0.0,0,0.0,0.0,-10000.0,-676900,-2.15,2.15,1.0,69.26,48.65,57.59,-5.57,2020-12-31T05:00:00Z,{5_trade_sell},{trade_sell},2020Q4_1750070
300759,2020Q4_1750079,北京市北京经济技术开发区泰河路6号,药用化合物、化学药、生物制品、生物技术的研究与开发；提供技术开发、技术转让、技术咨询、技术服务、技术培训；货物、技术进出口业务。(涉及配额许可证管理及专项规定管理的商品按照国家有关规定办理)。(企业依法自主选择经营项目，开展经营活动；依法须经批准的项目，经相关部门批准后依批准的内容开展经营活动；不得从事本市产业政策禁止和限制类项目的经营活动。),楼柏良,北京市,公司是一家领先的全流程一体化医药研发服务平台，业务遍及全球，致力于协助客户加速药物创新。根据弗若斯特沙利文的资料，按2018年的总收益计，公司是中国第二大医药研发服务平台及全球三大药物发现服务供应商之一。公司在药物发现、临床前及早期临床开发服务方面处于领先地位，并一直致力于拓展下游业务，包括临床后期开发及商业化生产等服务。公司不断扩大医药研发服务领域，并掌握主要研发学科的专业知识以覆盖各研发阶段的主要里程碑，协助客户加快推进研发计划。作为领先的药物发现医药研发服务供应商，公司对分子已积累深刻的科学见解，并自客户创新药物研发初期起即取得客户信任。,pharmaron@pharmaron-bj.com,"公司的主营业务为药物研究,开发及生产CRMO服务,分为药物发现和药物开发研发服务两部分.",楼柏良,北京,79438.75,李承宗,20040701,www.pharmaron.com；www.pharmaron.cn,康龙化成,2019,SZSE,SZSE,生物科技,20610,-,生物科技,20610010,167691699000,58.35,94.14,¥200.45,医疗保健,206,0.0,0,0.0,0.0,-10000.0,-389200,-2.08,2.08,1.0,120.4,92.3,105.34,90.29,2020-12-31T05:00:00Z,{5_trade_sell},{trade_sell},2020Q4_1750079
