symbol,_id,address,business_scope,chairman,city,descrpt,email,main_business,manager,province,reg_capital,secretary,setup_date,website,company,dividend_startyear,exchange,exchange_,group,groupcode,index_stockid,industry,industrycode,mktcap_norm_cny,pchange_12w,pchange_ytd,price,sector,sectorcode,share_percentage,shares,value,position,change,share_change,impact,abs_impact,split_factor,price_max,price_min,price_avg,change_from_average,portdate,action,comment,oid
300866,2020Q4_1750004,湖南省长沙市岳麓区高新开发区尖山路39号长沙中电软件园有限公司一期七栋7楼701室,电子产品、电源设备、智能化技术、通讯产品、影像设备、人脸识别系统、积分管理软件、智能机器的研发；基础软件、支撑软件、应用软件、地理信息软件的开发；电子产品及配件、智能机器的销售；软件技术转让；软件技术服务；电子商务平台的开发建设；计算机网络平台的开发及建设；软件开发系统集成服务；贸易咨询服务；信息技术咨询服务；电子产品设计服务；电子技术服务；电子产品生产(限分支机构)；智能机器生产(限分支机构)；家用清洁卫生电器具制造(限分支机构)；家用电器零售；投资管理服务(不得从事吸收存款、集资收款、受托贷款、发放贷款等国家金融监管及财政信用业务)；自营和代理各类商品及技术的进出口，但国家限定公司经营或禁止进出口的商品和技术除外。(依法须经批准的项目，经相关部门批准后方可开展经营活动，未经批准不得从事P2P网贷、股权众筹、互联网保险、资管及跨界从事金融、第三方支付、虚拟货币交易、ICO、非法外汇等互联网金融业务),阳萌,长沙市,公司专业从事智能移动周边产品、智能生活周边产品及计算机周边产品的研发和销售，公司“Anker”等品牌的消费电子产品销往全球，在亚马逊等境外大型电子商务平台上占据领先的行业市场份额，拥有很高的知名度和美誉度。此外，公司亦大力拓展线下销售渠道，在北美、欧洲、日本和中东等发达国家和地区市场通过沃尔玛、百思买、塔吉特、日本Canon Marketing等知名渠道的销售快速增长。报告期内，公司主营业务收入97%以上的收入来源于境外销售，公司境外销售主要来自北美、欧洲、日本、中东等经济发达、消费力强、运作规范的市场和地区。公司在全球最大传播集团WPP与Google联合发布的“BrandZ中国出海品牌50强”2017年、2018年榜单中分别位列第8和第7名，并在2017年被评选为“成长最快消费电子品牌”；于2018年荣获知名媒体平台Morketing所颁发的“灵眸奖(Morketing Award)”之“十大全球化领军企业”第三名；并在2017年被美国权威电商研究机构Internet Retailer提名入围年度全球电商奖。,IR@anker.com,"公司主要从事自有品牌的移动设备周边产品,智能硬件产品等消费电子产品的自主研发,设计和销售,是全球消费电子行业知名品牌商,产品主要包括充电类,无线音频类,智能创新类三大系列.",赵东平,湖南,40642.72,张希,20111206,www.anker-in.com,安克创新,0,SZSE,SZSE,硬件,31120,-,消费类电子产品,31120030,55516422000,-15.26,-18.24,¥128.50,科技,311,0.0,8400,1384900.0,0.07,10000.0,8400,0.07,0.07,1.0,195.89,117.33,160.82,-20.1,2020-12-31T05:00:00Z,{1_trade_buy},{trade_buy},2020Q4_1750004
300999,2020Q4_1750024,,,,,,,,,,,,,,金龙鱼,0,SZSE,SZSE,农副加工食品,20525,-,加工食品,20525040,447162200000,14.96,-23.3,¥80.55,非周期性消费,205,0.0,11700,1029400.0000000001,0.05,10000.0,11700,0.05,0.05,1.0,108.32,44.47,68.22,18.07,2020-12-31T05:00:00Z,{1_trade_buy},{trade_buy},2020Q4_1750024
688658,2020Q4_1750063,北京市经济技术开发区宏达中路6号,生产粉针剂(青霉素类、头孢菌素类)、冻干粉针剂(含抗肿瘤药)、小容量注射剂(含抗肿瘤药、最终灭菌、非最终灭菌)、片剂(含头孢菌素类)、硬胶囊剂(含青霉素类、头孢菌素类)、颗粒剂(含青霉素类、头孢菌素类)、散剂、栓剂(含激素类)、软膏剂、乳膏剂(含激素类)、凝胶剂、干混悬剂(头孢菌素类)、精神药品(阿普唑仑片)，中药前处理和中药提取(集团内共用，限外埠从事经营活动)(药品生产许可证有效期至2025年12月08日)；生产具有HDPE隔离干燥功能的药品包装瓶；货物专用运输(冷藏保鲜)(道路运输经营许可证有效期至2022年12月24日)；医药产品的技术开发；货物进出口、技术进出口、代理进出口；销售(不含零售)化工产品(不含危险化学品及一类易制毒化学品)。,于伟仕,北京市,"公司是以高端化学药为主导的大型医药企业集团、以研发创新为驱动的国家级高新技术企业，主营业务涵盖药品研发、制造、流通销售全产业链条，具备注射液、冻干粉针剂、片剂、胶囊剂等多种剂型以及部分原料药的生产能力，产品覆盖心脑血管、消化系统、抗感染、内分泌以及抗肿瘤等12个用药领域,公司定位于高端化学药的研发与生产，产品具有较强的行业竞争能力，公司市场地位突出，2009-2018年连续十年入选工信部医药工业百强，2013-2018年连续六年入选工信部中国医药研发产品线最佳工业企业，并在南方医药经济研究所2018年度中国医药工业百强化药企业TOP100中位居第33位,公司始终秉承创新驱动发展的理念，不断全面提升企业实力，通过不断优化生产技术、生产工艺创新，持续提升药品制剂的质量和疗效水平，并将研发成果运用至现有产品中。公司“奥美拉唑系列产品产业化与国际化的关键技术开发项目”、“化学药物晶型关键技术体系的建立与应用”先后获得国家科学技术进步二等奖。",irm@youcareyk.com,"主营业务涵盖药品研发,制造,流通销售全产业链条,具备注射液,冻干粉针剂,片剂,胶囊剂等多种剂型以及部分原料药的生产能力,产品覆盖心脑血管,消化系统,抗感染,内分泌以及抗肿瘤等12个用药领域.",于飞,北京,45000.0,王成杰,20010814,www.youcareyk.com,悦康药业,0,SHSE,SHSE,生物科技,20610,-,生物科技,20610010,9832511000,0.04,-8.45,¥21.87,医疗保健,206,0.0,16600,404100.0,0.02,10000.0,16600,0.02,0.02,1.0,31.64,24.33,26.24,-16.65,2020-12-31T05:00:00Z,{1_trade_buy},{trade_buy},2020Q4_1750063
688122,2020Q4_1750055,陕西省西安市经济技术开发区明光路12号,低温超导材料、高温超导材料、钛及钛合金材料、高温合金材料、铪材料、机电设备(小轿车除外)及部件的生产、开发、销售和技术咨询；自有房屋租赁；货物及技术的进出口业务(国家禁止或限制进出口的货物、技术除外)。(上述经营范围中涉及许可项目的，凭许可证明文件、证件在有效期内经营，未经许可不得经营),张平祥,西安市,"公司是目前国内唯一实现低温超导线材商业化生产的企业，也是目前国际上唯一的铌钛(NbTi)锭棒及线材全流程生产企业,主要从事高端钛合金材料和低温超导材料的研发、生产和销售，是我国航空用钛合金棒丝材的主要研发生产基地，生产的高端钛合金主要用于航空领域，包括飞机结构件、紧固件和发动机部件等。航空领域用高端钛合金不仅要求组织和性能均匀性要好，而且还具有良好的批次稳定性。公司生产的高端钛合金材料已成为我国航空、航天结构件用主干钛合金，为我国新型战机、运输机的首飞和量产提供了核心材料。公司已成为我国新型飞机用钛合金材料的主要供应商之一。公司生产的产品性能达到了国内先进水平，和国外同类产品的技术水平相当，量产后将补上我国“两机”用高性能高温合金的“短板”,先后被国务院授予“国家科学技术进步奖二等奖”，国家工信部授予“国防科学技术进步奖一等奖”，国家发改委授予“国家高技术产业化十年成就奖”，中航工业集团授予“航空科学技术奖励一等奖”。",zqflb@c-wst.com,"公司主要从事高端钛合金材料,超导产品和高性能高温合金材料的研发,生产和销售.主要产品有三类,第一类是高端钛合金材料,包括棒材,丝材和锻坯等;第二类是超导产品,包括铌钛锭棒,铌钛超导线材,铌三锡超导线材和超导磁体等;第三类是高性能高温合金材料,包括变形高温合金,铸造和粉末高温合金母合金等.",冯勇,陕西,44127.2,周通,20030228,www.c-wst.com,西部超导,0,SHSE,SHSE,工业制品,31070,-,金属加工,31070030,27959141000,22.34,-18.73,¥66.76,工业,310,0.0,5600,446200.0,0.02,10000.0,5600,0.02,0.02,1.0,79.51,30.38,50.95,31.03,2020-12-31T05:00:00Z,{1_trade_buy},{trade_buy},2020Q4_1750055
688418,2020Q4_1750060,"深圳市南山区粤海街道高新南社区科苑南路3176号彩讯科技大厦五层,六层,十一层",计算机软硬件、电子产品的技术开发及购销；通信信息咨询；经济信息咨询(不含证券咨询、人才中介服务和其他限制项目)；计算机系统集成、通信工程、通信设备、工业自动化、光传输设备、防爆电器、安全技术防范工程、水情自动化系统相关工程、建筑机电安装工程、城市及道路照明工程、建筑智能化工程的设计及施工；国内贸易；经营进出口业务(以上所有项目法律、行政法规、国务院决定禁止的项目除外，限制的项目须取得许可后方可经营)。计算机软硬件、电子产品的生产；软交换设备、矿用通信及自动化产品的生产。销售特种车及零部件，销售车辆的售后服务。(依法须经批准的项目，经相关部门批准后依批准的内容开展经营活动),吴闽华,深圳市,公司为专业从事通信网络设备及技术解决方案的综合通信系统供应商。公司自设立以来，一直专注于通信系统领域，致力于为电信运营商、政府、电力、煤矿等多个行业的部门及企业提供通信系统设备的研发、设计和销售，并为客户提供专业完善的定制化通信技术解决方案。公司的业务范围涵盖公网通信领域和专网通信领域的核心层、汇聚层及接入层等各个通信网络层次，其中，公网通信主要是由电信运营商进行统一的网络建设、运营维护和用户管理，并为社会公众用户提供个人通信服务，公司公网通信领域的终端客户主要为海外的电信运营商，包括印度国有电信(BSNL)、印度TATA、日本软银(Softbank)、菲律宾长途电话公司(PLDT)、意大利Tiscali、英国泽西电信(JT)等。专网通信主要是服务于特定部门或群体的通信网络，在公网通信不能满足各行业特殊应用的情况下，为行业系统内部的生产组织、指挥调度及管理等特殊通信需求而建设，公司专网通信客户覆盖的领域主要为政府、电力、煤矿等行业。经过多年的发展，公司的主营产品从专网通信领域扩大到公网运营商领域，已经发展为国内优秀的通信系统设备及技术解决方案的供应商，产品及解决方案获得各行业客户及海外运营商的广泛认可。,ir@genew.com,"公司是专业从事通信系统设备及技术解决方案的综合通信设备供应商,自设立以来,致力于通信系统设备的研发,设计,生产和销售,公司的主营产品包括软交换,接入网,光网络,应急调度及无线宽带通信设备,涵盖通信网络的核心层,汇聚层及接入层.",吴闽华,广东,19361.0,薛梅芳,20050404,www.genew.com,震有科技,0,SHSE,SHSE,硬件,31120,-,通讯设备,31120010,3450033000,-7.41,-30.98,¥17.65,科技,311,0.0,6200,158400.0,0.01,10000.0,6200,0.01,0.01,1.0,58.0,25.54,36.75,-51.97,2020-12-31T05:00:00Z,{1_trade_buy},{trade_buy},2020Q4_1750060
688559,2020Q4_1750061,广东省深圳市龙华区观澜街道君子布社区环观南路26号101,激光设备、自动化设备、激光发生器及相关部件/元件的销售、设计及技术开发，计算机软件的开发和销售；设备租赁及上门维修、上门安装；国内贸易，货物及技术进出口(法律、行政法规、国务院决定规定在登记前须经批准的项目除外)，许可经营项目是：激光设备、自动化设备、激光发生器及相关部件/元件的生产。,赵盛宇,深圳市,"公司是激光及自动化综合解决方案提供商,是国家高新技术企业，主要从事消费电子、动力电池、钣金加工等行业激光及自动化设备的研发、设计、生产及销售，在激光、自动化和智能化综合运用领域已形成较强的优势,公司专注于激光光学及控制技术、与激光系统相配套的自动化技术，并持续强化这两大核心能力,已具备面向多元化应用市场、多层级行业客户的综合产品和解决方案服务能力。凭借公司深厚的研发实力、持续的创新能力，在消费电子、新能源电池等应用领域，公司积累了如Apple、华为、富士康、伟创力、立讯精密、京东方、蓝思科技、特斯拉、CATL、长城汽车、蜂巢能源、中航锂电、亿纬锂能等行业龙头或知名企业客户，实施了多个标杆项目和批量化的交付，并打造出多个应用样板工程,公司现为广东省激光行业协会副会长单位、深圳市先进制造业促进会副会长单位，获得由国家科技部颁发的2014年国家重点新产品奖、2016年度高工锂电创新产品奖、2018年广东省激光行业协会颁发的年度中国杰出进步激光企业奖及中国激光加工系统创新贡献奖等荣誉。",ir@hymson.com,"主要从事消费电子,动力电池,钣金加工等行业激光及自动化设备的研发,设计,生产及销售",赵盛宇,广东,20000.0,钱智龙,20080403,www.hymson.com,海目星,0,SHSE,SHSE,工业制品,31070,-,特种工业机械,31070020,8410417000,113.96,29.65,¥42.34,工业,310,0.0,5900,183500.0,0.01,10000.0,5900,0.01,0.01,1.0,32.99,22.26,25.93,63.29,2020-12-31T05:00:00Z,{1_trade_buy},{trade_buy},2020Q4_1750061
300868,2020Q4_1750006,广东省深圳市龙华区民治街道北站社区汇德大厦1号楼4201,货物及技术进出口；投资兴办实业。(不含法律、行政法规、国务院规定禁止及决定需前置审批的项目)，许可经营项目是：电子产品、通讯产品、智能电子产品、移动智能终端保护套、精密塑胶硅胶及皮具等时尚消费电子配件产品的研发、设计、生产及销售；五金制品、模具的研发、设计、生产及销售；新技术新材料的研发、设计、生产及销售。,黄新,深圳市,公司是一家专业从事移动智能终端配件的研发、设计、生产及销售的高新技术企业，产品类型以智能手机与平板电脑保护类配件为主，涵盖移动电源、数据线等其他配件。公司坚持以ODM/OEM与自有品牌相结合的方式开拓市场，坚持做大ODM/OEM业务、做强自有品牌的思路，为客户提供更优质的产品和服务。公司是国内较早从事移动智能终端配件产品ODM/OEM业务的企业之一，拥有成熟的开发设计团队和专业的制造技术，是业内为数不多的具有“研发设计—模具开发—生产制造—包装入库”全工序以及大规模生产能力的企业之一，能够针对客户需求，提供设计支持、快速样品、规模量产等方面的综合服务。凭借丰富的研发设计、多工艺生产经验，以及稳定、可靠的质量保证，公司与华为等智能终端制造商以及Targus、Pelican等国际知名智能终端配件品牌商建立了良好、稳定的合作关系，产品广泛应用于华为、苹果等品牌终端。公司已取得全球知名的Disney、Hello Kitty商标及卡通形象在其自有品牌产品中应用的授权许可，自有品牌产品系列丰富，主要客户已涵盖沃尔玛、亚马逊、Target、百思买等全球零售百强客户，产品销售遍及美国、欧洲及日本等多个国家或地区。,ir@jamepda.com;zhangyuhan@jamepda.com;zb@jamepda.com,"从事移动智能终端配件的研发,设计,生产及销售,主要产品:主要为智能手机,平板电脑等移动智能终端提供保护套产品.",黄新,广东,12800.0,周波,20060530,www.jamepda.com,杰美特,0,SZSE,SZSE,硬件,31120,-,电子元件,31120040,3791662000,-20.1,-33.93,¥28.91,科技,311,0.0,400,16800.0,0.0,10000.0,400,0.0,0.0,1.0,86.08,42.6,52.07,-44.48,2020-12-31T05:00:00Z,{1_trade_buy},{trade_buy},2020Q4_1750006
300872,2020Q4_1750010,北京市朝阳区阜通东大街1号院3号楼9层2单元121005,软件技术开发、技术转让、技术咨询、技术服务；计算机系统服务；数据处理(数据处理中的银行卡中心、PUE值在1.5以上的云计算数据中心除外)；销售自行开发后的计算机软件产品；销售计算机软硬件及配件；计算机及配件的售后服务；计算机软硬件开发；计算机系统集成；计算机设备租赁。【依法须经批准的项目，经相关部门批准后方可经营该项目】,欧阳建平,拉萨市,公司专注为金融行业客户提供IT解决方案和服务，是金融IT业内颇具规模、成长最快、最具活力和创新精神的企业之一。基于金融IT和业务创新能力，公司正致力于成为国内领先的金融综合服务提供商，提供金融IT服务、金融信息服务和金融运营服务。公司从2003年创立以来，为央行和政策性银行、国有商业银行、股份制商业银行和地方性商业银行等近百家金融客户提供咨询、开发、测试、运维和系统集成等应用于全生命周期的服务。源于客户的业务创新和管理创新需求，公司在专业测试、对公金融(包括信贷、供应链金融、互联网金融、贸易金融和资金监管等)、商业智能与大数据应用、风险管理(信用风险、操作风险和市场风险)、信用卡、协同应用等专业领域研发了多种解决方案，在开发、测试和运行管理领域研发了业内领先的基础技术架构产品，积累了丰富的行业业务、IT技术知识、IT应用解决方案和专业服务人才。公司已拥有了一批优质、稳定的核心战略客户，同时公司也在积极拓展新客户，进一步完善客户和区域布局，创造新的业绩增长点。目前公司已经为两百多家银行客户提供了相关产品和服务，在行业内拥有较高的品牌声誉。,ir@tansun.com.cn,"公司是一家金融业IT解决方案及服务提供商,主要向以银行为主的金融机构提供IT解决方案,咨询服务,专业测试服务,运维服务和系统集成服务.",欧阳建平,西藏,22468.2,张庆勋,20030709,www.tansun.com.cn,天阳科技,0,SZSE,SZSE,软件,31110,-,软件和信息技术服务,31110010,8247458000,4.47,-5.37,¥36.02,科技,311,0.0,900,33000.0,0.0,10000.0,900,0.0,0.0,1.0,82.0,37.36,49.27,-26.89,2020-12-31T05:00:00Z,{1_trade_buy},{trade_buy},2020Q4_1750010
300871,2020Q4_1750009,湖北省武汉市东西湖区新沟街道办事处油纱路52号(107国道与油纱路口),许可项目：兽药生产；兽药经营；饲料添加剂生产。(依法须经批准的项目，经相关部门批准后方可开展经营活动，具体经营项目以相关部门批准文件或许可证件为准)一般项目：饲料添加剂销售；畜牧渔业饲料销售；肥料销售；专用化学产品销售(不含危险化学品)；技术服务、技术开发、技术咨询、技术交流、技术转让、技术推广；(以上经营范围不含特别管理措施)(除依法须经批准的项目外，凭营业执照依法自主开展经营活动),张卫元,武汉市,公司以“致力动保科技，提升生命质量”为使命，主要从事兽用药品(包括化药制剂、原料药、中药制剂)、饲料及添加剂的研发、生产和销售。兽药行业通过多年发展，建立并完善了动物健康成长的保护机制，在预防、治疗和控制各种动物疾病中发挥重要作用，为人类安全和可持续的食物供给提供了坚实保障。公司已建立了完备的产品质量控制体系，产品质量过硬，自2012年起连续6年在农业农村部组织的兽药质量监督抽检中，成为全国一千多家兽药企业中仅有的6家连续保持抽检不合格批次为零的企业之一。公司高度重视技术创新与产品研发在企业发展中的驱动作用，拥有包括7名高级技术职称人员和9名博士组成的研发团队，其中国务院政府特殊津贴专家1人，国家科技部专家库2人，中国兽药典委员1人。公司目前已取得专利35项，其中发明专利28项；已取得3个二类新兽药证书及2个三类新兽药证书；在研项目共计45项，其中一类新兽药项目2项、二类新兽药项目10项、三类及四类新兽药项目共12项；公司科研平台承担了科技部国家重点研发计划、国家科技支撑计划、国家创新基金支持、国家重点研发计划政府间国际科技合作重点专项等项目。,hvsen@whhsyy.com,"主要从事兽用药品(包括化药制剂,原料药,中药制剂),饲料及添加剂的研发,生产和销售.",张卫元,湖北,16576.05,杨凯杰,20020125,www.whhsyy.com,回盛生物,0,SZSE,SZSE,生物科技,20610,-,生物科技,20610010,5917655000,21.33,36.64,¥34.84,医疗保健,206,0.0,900,21500.0,0.0,10000.0,900,0.0,0.0,1.5,52.33,26.11,33.33,4.53,2020-12-31T05:00:00Z,{1_trade_buy},{trade_buy},2020Q4_1750009
300870,2020Q4_1750008,"广东省深圳市宝安区西乡街道固戍二路星辉工业厂区厂房一,二,三(星辉科技园A,B,C栋)",生产经营各类变压器、稳压电源、磁敏传感器及其它电子元器件(不含国家限制项目)、灯具及照明装置。电子数码产品及配件、移动电源、计算机及其周边产品、蓝牙产品、家电音响产品及配件、无线数据传输设备和终端、光传输设备和终端的研发、批发、进出口及相关配套业务(不涉及国营贸易管理商品，涉及配额、许可证管理及其它专项规定管理的商品，按国家有关规定办理申请)。数据传输软件、自动化控制系统、通信技术的研发；计算机软件开发，转让自行开发的技术成果。,王合球,深圳市,"公司是中国大陆南部最大开关电源适配器生产商之一。集开发、生产、销售于一体，集中生产开关电源,开关适配器、充电器、直流转换器、电子变压器、感应器和LED电源等电子消费产品。公司在开关电源领域深耕多年，为国家高新技术企业，并设有深圳市企业技术中心、博士后创新实践基地和广东省高能效智能电源及电源管理工程技术研究中心。公司以客户需求为导向，致力于为客户提供可靠、高效、智能的开关电源产品，并在研发创新、生产工艺等方面积累了丰富的核心技术，截至目前，公司拥有71项专利技术、30项软件著作权和多项专有技术。公司始终高度重视产品质量，已通过了ISO9001:2015质量管理体系证书及QC080000:2017有害物质过程管理体系、ANSI/ESD S20.20：2014静电防护体系认证，并依据体系实施了完善的质量控制。报告期内，公司产品通过中国CCC、新加坡PSB、韩国KC、泰国TISI、墨西哥NOM、南非NRCS、美国UL、美国FCC、欧盟GS、欧盟CE等多国和地区的产品安全及电磁兼容认证。",Ir1@honor-cn.com,"主要从事开关电源产品的研发,生产与销售.公司主要产品包括电源适配器和服务器电源等,公司产品广泛应用于办公电子,机顶盒,网络通信,安防监控,音响,金融POS终端,数据中心等众多领域.",王合球,广东,10120.0,尚韵思,19960529,www.honor-cn.com,欧陆通,0,SZSE,SZSE,工业制品,31070,-,电子器械和零件,31070060,5722230000,-0.04,-17.26,¥54.50,工业,310,0.0,500,31400.0,0.0,10000.0,500,0.0,0.0,1.0,99.3,66.8,82.35,-33.82,2020-12-31T05:00:00Z,{1_trade_buy},{trade_buy},2020Q4_1750008
