symbol,_id,address,business_scope,chairman,city,descrpt,email,main_business,manager,province,reg_capital,secretary,setup_date,website,company,dividend_startyear,exchange,exchange_,group,groupcode,index_stockid,industry,industrycode,mktcap_norm_cny,pchange_12w,pchange_ytd,price,sector,sectorcode,share_percentage,shares,value,position,change,share_change,impact,abs_impact,split_factor,price_max,price_min,price_avg,change_from_average,portdate,action,comment,oid
300881,2020Q4_1751746,江苏省常州市钟楼区邹区镇工业大道工业路48-1号,无缝钢管、不锈钢管、镍基合金制造及销售；自营和代理各类商品及技术的进出口业务(国家限定企业经营或禁止进出口的商品和技术除外)。(依法须经批准的项目，经相关部门批准后方可开展经营活动),周文庆,常州市,公司主要从事各类工业用能源设备类无缝钢管的生产、研发和销售，产品主要应用于电站锅炉设备制造、石油炼化等行业，客户包括上海锅炉厂、哈尔滨锅炉厂、东方锅炉等国内大型电站锅炉制造企业以及中石化、中海油等大型石油炼化企业。公司生产的无缝钢管按照材质分类，主要包括合金钢钢管、不锈钢钢管和碳钢钢管；产品外径覆盖16mm-159mm、长度覆盖6m-18m的各种型号。公司产品主要用于电站锅炉设备领域与石油炼化领域。公司2009年起连续被评为高新技术企业，目前在小口径电站锅炉用合金钢领域拥有很强的行业竞争力。根据中国钢结构协会钢管分会的数据，公司生产的小口径高压锅炉用无缝钢管产量2014年、2015年和2016年连续3年在国内同行业中排名第一。,webmaster@shengdechina.com,"公司主营业务包括研发,生产并销售合金钢,不锈钢和碳素钢无缝钢管以及钢格板类产品.公司生产的无缝钢管按照材质分类,主要包括合金钢钢管,不锈钢钢管和碳钢钢管.",缪一新,江苏,10000.0,周阳益,20011015,www.shengdechina.com,盛德鑫泰,0,SZSE,SZSE,钢铁和焦煤,10160,-,钢铁,10160020,3073659000,-14.54,-9.82,¥30.40,基础材料,101,0.0,300,9400,0.0,10000.0,300,0.0,0.0,1.0,77.99,31.75,42.11,-27.81,2020-12-31T05:00:00Z,{1_trade_buy},{trade_buy},2020Q4_1751746
300879,2020Q4_1751745,浙江省宁波市余姚市锦凤路58号,"园林机械及配件、农业机具、园林机具、电动工具、清洁设备、电器配件、电机、电子元器件、汽油机及模具的制造、加工、测试。自营和代理各类货物和技术的进出口,无进口商品分销业务。(不涉及国营贸易管理商品,涉及配额、许可证管理商品的,按国家有关规定办理申请。)(不涉及外商投资准入特别管理措施范围。)(依法须经批准的项目，经相关部门批准后方可开展经营活动。)",叶晓波,宁波市,公司是国内园林机械行业领先企业，割草机龙头企业，是中国电器工业协会电动工具分会副理事长单位，是浙江省安监局认可的安全生产标准化二级企业(机械)，是中国内燃机工业协会公布的中国内燃机及零部件行业排头兵企业，获得过国际环保署颁发的低碳制造计划铂金奖证书。自2009年起被评为高新技术企业，拥有浙江省企业技术中心、省级工业设计中心，公司实验室为德国TUV南德集团授权认可的目击电气测试实验室。公司的“自走式高效环保园林汽油割草机”和“低排放低噪音轻型化二冲程汽油割灌机”被列入国家火炬计划产业化示范项目，割草机产品是中国林业机械协会“向社会推荐产品”。以自主研发实力和产品质量为基础，公司还致力于推动行业规范健康发展，负责制定或参加起草国家和行业标准8项，是中国林业机械标准化技术委员会委员单位。公司已经成为国际园林机械行业中具有较高知名度的ODM生产商，在生产技术、产品品质、制造规模等方面具有较高的市场地位，产品销往德国、法国、波兰、荷兰、俄罗斯、英国、加拿大、澳大利亚等全球50多个国家和地区，积累了一批优质客户资源，主要客户包括安达屋集团、牧田、富世华集团、翠丰集团、HECHT、百力通等。,zjb01@dayepower.com,"主要从事割草机,打草机/割灌机,其他动力机械及配件的研发设计,生产制造和销售.",叶晓波,浙江,16000.0,吴军,20060217,www.dayepower.com,大叶股份,0,SZSE,SZSE,工业制品,31070,-,工具和配件,31070050,3536212000,-16.73,-21.45,¥21.48,工业,310,0.0,500,12600,0.0,10000.0,500,0.0,0.0,1.0,69.99,27.74,36.43,-41.04,2020-12-31T05:00:00Z,{1_trade_buy},{trade_buy},2020Q4_1751745
300876,2020Q4_1751744,广东省揭阳市揭东区揭东城西片工业区,生产、销售：超细旦纤维丝、高强纤维丝、各种化纤丝、化纤材料及其制品；货物进出口、技术进出口。(以上各项，法律、行政法规和国务院决定禁止的不得经营；法律、行政法规和国务院决定限制的须取得许可方可经营)。(依法须经批准的项目，经相关部门批准后方可开展经营活动)。,郭清海,揭阳市,公司专业从事聚丙烯纤维的研发、生产和销售，聚丙烯纤维商品名为丙纶。公司主要产品为丙纶长丝。凭借公司管理团队在聚丙烯纤维行业二十多年丰富的技术、生产经验和客户资源积累，公司产品应用已广泛覆盖了工业领域和民用领域。目前，公司产品在工业领域应用范围主要为工业滤布、工程土工布等，在民用领域应用范围主要为箱包织带、水管布套、门窗毛条、服装等。公司为高新技术企业，高度重视研发投入，研发了多种差别化丙纶长丝，获得了多项荣誉，具体如下：2018年“蒙泰丝”品牌细旦抑菌聚丙烯纤维入围“中国纤维流行趋势2018/2019”；2017年国家功能性聚丙烯纤维研发生产基地、2017年度中国纺织工业联合会产品开发贡献奖、广东省聚丙烯纤维新材料工程技术研究中心。,zqb@gdmtxw.com,"公司专业从事聚丙烯纤维的研发,生产和销售,聚丙烯纤维商品名为丙纶.公司主要产品为丙纶长丝.",郭清海,广东,9600.0,朱少芬,20130906,www.gdguangdong.com,蒙泰高新,0,SZSE,SZSE,服饰加工,10240,-,纺织加工,10240010,3491436000,9.3,-4.57,¥37.75,周期性消费,102,0.0,400,12800,0.0,10000.0,400,0.0,0.0,1.0,89.92,37.07,49.83,-24.24,2020-12-31T05:00:00Z,{1_trade_buy},{trade_buy},2020Q4_1751744
300864,2020Q4_1751743,江苏省南京市鼓楼区金银街16号科学楼9楼,环境保护与生态修复技术研发、工程设计与咨询、工程总承包与运营；企业管理与咨询；环保设备生产和销售；环境影响评价；环境监理；环境检测；环境规划与设计；环境政策咨询及培训；水利规划、设计与咨询；安全管理咨询与技术服务；环境损害鉴定与评估；危害特性鉴别。(依法须经批准的项目，经相关部门批准后方可开展经营活动),陆朝阳,南京市,公司定位为专业的环境服务商，致力于为政府客户和企业客户提供高效、科学、整体的环境解决方案，主要服务包括环境调查与鉴定、建设项目环评、环境研究与规划、环境工程承包、环境工程设计与监理以及环境污染第三方治理等。公司为南京大学控股的国家级高新技术企业，经营和核心技术团队均为该领域的行业专家，在环境科学与技术领域拥有深厚的积累与沉淀。目前，公司已建有江苏省区域流域环境综合治理工程技术研究中心、南京市挥发性有机废气工程研究中心和“国家级博士后工作站”分站等高水平研发平台，在环境综合治理、污染控制、环境修复等领域拥有多项自主知识产权。同时，作为科技型环境服务类企业，公司高度重视技术研发和人才培养，经过多年的技术研发、业务实践应用积累，培养出了一批行业内优质人才，并打造了基于自身业务案例和项目经验形成的成熟的行业案例数据库，具有较强的竞争优势。,dmb@njuae.cn,"致力于为政府客户和企业客户提供高效,科学,整体的环境解决方案,主要服务包括环境调查与鉴定,建设项目环评,环境研究与规划,环境工程承包,环境工程设计与监理以及环境污染第三方治理等.",陆朝阳,江苏,9120.0,李良,20120803,www.njuae.cn,南大环境,0,SZSE,SZSE,教育,20540,-,教育培训服务,20540010,4780326000,12.81,9.05,¥52.12,非周期性消费,205,0.0,380,15100,0.0,10000.0,380,0.0,0.0,1.9,94.63,47.36,61.84,-15.72,2020-12-31T05:00:00Z,{1_trade_buy},{trade_buy},2020Q4_1751743
300886,2020Q4_1751748,安徽省安庆市潜山市舒州大道42号,香精、香料、油田助剂、炼油助剂、金属加工助剂、纺织助剂、水处理剂、精细化工产品(不含危险化学品)开发、生产、销售(涉及行政许可项目凭有效许可证经营)。,徐基平,安庆市,公司自设立以来，公司一直专注于经营香料业务，主要从事内酯系列合成香料的研发、生产和销售，主营业务突出。公司自设立以来，始终坚持以市场为导向，以客户为目标，以技术创新打造核心竞争力，坚持走“创新、协调、绿色、开放、共享”的发展道路，打造行业高端品牌。公司为国家高新技术企业，拥有省级认定的企业技术中心、安徽省院士工作站。公司通过技术研究、工艺绿色化改造、副产物开发、资源综合利用等集成创新实现了“传统产品+新工艺”，进一步提升了内酯类香料的市场竞争力，产品在国际市场上具有竞争优势。公司为中国香料香精化妆品工业协会副理事长单位，在由中国轻工业联合会发布的2017年度“中国轻工业香料行业十强企业”评选中，公司位列第七名；公司还被中国香化协会授予“中国香料香精化妆品行业优秀企业奖”、“2016年度香料香精优秀品牌企业”等荣誉称号。,info@anhuihuaye.com,"主要产品为丙位内酯,丁位内酯系列合成香料,主要从事内酯系列合成香料的研发,生产和销售.",徐基平,安徽,7455.5,付林,20020712,www.anhuihuaye.com,华业香料,0,SZSE,SZSE,化工,10130,-,化学制品,10130010,2227711000,-13.36,-19.19,¥29.61,基础材料,101,0.0,130,6700,0.0,10000.0,130,0.0,0.0,1.3,70.6,36.04,48.7,-39.2,2020-12-31T05:00:00Z,{1_trade_buy},{trade_buy},2020Q4_1751748
300882,2020Q4_1751747,浙江省台州市天台县福溪街道兴业东三街15号,智能化管理系统开发应用，智能化安装工程服务，架线和管道工程建筑施工，信息技术咨询服务，电子式智能电能表、用电信息采集产品，低压电力成套设备、电力监测及控制设备、配网自动化设备、智能水表、热量表、燃气仪表及设备、暖通仪表及设备、流量仪表、水电气热计量自动化管理终端、云平台的水、电、气、热能源收费服务系统、社会公共安全设备及器材、逆变器、智能电容器及无功补偿装置、电能计量箱、配电箱、计算机、通信和电子设备、充电设备、充电装置检测设备、智能断路器、智能开关、建筑安全用金属制品、智能插头、插座及产品组件的研发、制造、销售，物联网服务、信息系统集成、电力电气工程的安装施工和运维，货物和技术进出口。(依法须经批准的项目，经相关部门批准后方可开展经营活动),邬永强,台州市,公司是国家高新技术企业，主要从事智能电表、用电信息采集系统等产品的研发、生产和销售，致力于为国内外电力等行业客户提供专业化的计量产品，是国内电能仪表计量领域的领先企业之一，并积极进行智能水表、多表合一类产品的研发及应用。公司目前产品主要为包括单相智能表、三相智能表在内的智能电表以及包括集中器、采集器、专变采集终端等在内的用电信息采集系统产品，广泛应用于智能电网建设中的智能用电环节。智能电表是智能电网终端的重要组成部分，除具备传统电能表基本用电量的计量功能外，智能电表还具有多费率计量、用户端控制、预付费、防窃电、负荷记录、多种双向通讯方式等多项功能，实现智能电网和用户之间的双向沟通，并积极助力于国家智能电网实现“全覆盖、全采集、全费控”目标。2018年，公司在国家电网智能电表类产品的中标量总排名进入前五，其中，单相智能表中标量排名第四位。公司自2016年起，持续入围南方电网智能电表招标。发行人经过长期发展，凭借优秀的产品质量、先进的技术实力、良好的服务能力，成为国内智能电表和用电信息采集系统的重要供应商之一，并积极拓展国际市场。,irm@wellsun.com,"产品主要为包括单相智能表,三相智能表在内的智能电表以及包括集中器,采集器,专变采集终端等在内的用电信息采集系统产品,主要从事智能电表,用电信息采集系统等产品的研发,生产和销售.",邬永强,浙江,20442.94,陈东滨,19970721,www.wellsun.com,万胜智能,0,SZSE,SZSE,硬件,31120,-,科技仪器,31120060,3123761000,-9.54,-25.46,¥15.28,科技,311,0.0,520,11300,0.0,10000.0,520,0.0,0.0,1.3,0.0,0.0,0.0,0.0,2020-12-31T05:00:00Z,{1_trade_buy},{trade_buy},2020Q4_1751747
605179,2020Q4_1751794,浙江省温州市平阳县一鸣工业园,一般项目：家用电器销售；日用品销售；厨具卫具及日用杂品批发；玩具销售；塑料制品销售；印刷专用设备制造；塑料加工专用设备制造(除依法须经批准的项目外，凭营业执照依法自主开展经营活动)。许可项目：食品生产；食品经营；食品互联网销售；餐饮服务；包装装潢印刷品印刷；特定印刷品印刷(依法须经批准的项目，经相关部门批准后方可开展经营活动，具体经营项目以审批结果为准)。,朱立科,温州市,公司主要从事新鲜乳品与烘焙食品的研发、生产、销售及连锁经营业务。其中，乳品主要包括低温巴氏杀菌乳、风味发酵乳、低温调制乳及蛋奶、热奶等特色乳饮品，烘焙食品包括各式短保质期的面包、米制品、中式糕点等。公司产品以“新鲜、健康、营养”为定位，乳品保质期通常在15天以内、烘焙食品保质期通常在3天以内，公司产品主要通过“一鸣真鲜奶吧”专业食品连锁门店进行销售。公司以“新鲜健康的食品、真诚永远的服务”为品牌理念，始终专注于各式新鲜乳品与烘焙食品的研发、制造与销售，以及奶吧连锁经营模式的探索与升级。以“牛奶+面包”的“营养早餐”为起点，公司逐步增加各式鲜牛奶、风味酸奶、三明治等产品，如先后开发了满足营养需求的“真鲜蛋奶”、适于国人温热饮食习惯的“热奶”及可加热饮用的“温酸奶”等畅销创新产品。未来，公司将通过在特种菌株上的基础研发、微生物发酵技术上的工艺改良、饮食口味上的产品创新，持续推出新鲜、健康、营养并满足消费升级饮食需求的新产品。,82091418@qq.com;1009363539@qq.com;inmfood@yi-ming.cn,"主要从事新鲜乳品与烘焙食品的研发,生产,销售及连锁经营业务.其中,乳品主要包括低温巴氏杀菌乳,风味发酵乳,低温调制乳及蛋奶,热奶等特色乳饮品,烘焙食品包括各式短保质期的面包,米制品,中式糕点等.",朱立科,浙江,40100.0,林益雷,20050913,www.inm.cn,一鸣食品,0,SHSE,SHSE,农副加工食品,20525,-,加工食品,20525040,6941387000,-13.4,-0.85,¥17.20,非周期性消费,205,0.0,900,16600,0.0,10000.0,900,0.0,0.0,1.0,17.66,14.59,16.1,6.83,2020-12-31T05:00:00Z,{1_trade_buy},{trade_buy},2020Q4_1751794
300902,2020Q4_1751760,福建省厦门市集美区灌口镇后山头路39号,研发、制造、销售：安全应急产品、消防器材、汽车安全制品(以上项目凭资质证书生产经营)、化工产品(不含须经前置许可的项目)；消防工程的设计与施工；经营各类商品和技术的进出口(不另附进出口商品目录)，但国家限定公司经营或禁止进出口的商品及技术除外；消防技术服务、商务信息咨询；企业管理策划、企业营销策划；物业管理。,洪伟艺,厦门市,公司是国内交通运输、电力电网行业自动灭火系统的主要供应商之一，长期专注于火灾早期探测预警、自动灭火技术的研究与应用开发，形成了具有自主知识产权的火灾早期预警与自动灭火技术，已掌握以“超细干粉”、“混合气体”、“水基型灭火剂”为介质及“压缩空气泡沫”等多项核心灭火技术，形成了丰富的技术储备。公司目前主要为客车发动机舱、新能源汽车锂电池箱、客车乘客舱、变电站电缆、新能源发电站、城市电力电缆及通道、城市地下综合管廊等场景提供专业性强、品质优良的安全应急产品，产品能够满足不同领域的消防防护需求。通过创新、前瞻地开展先进技术的研发和布局，公司将研发成果不断转换为市场可应用的产品。目前，公司正在拓展特高压换流站、室内外大型变压器、新能源储能站、石化园区等领域的智慧消防整体解决方案。公司经过多年创新积累，高效自动灭火技术已逐步推广至多个下游需求领域，形成了较为明显的技术与产品领先优势，已成为火灾智能化早期预警和自动灭火的领先企业。,touzibu@gad5119.com,"安全应急产品,消防器材,汽车安全制品的研发,制造以及销售.主要产品:超细干粉自动灭火装置,电池箱专用自动灭火装置,乘客舱固定灭火系统等安全应急产品.",洪伟艺,福建,12798.0,连剑生,20080110,www.gad5119.com,国安达,0,SZSE,SZSE,商业服务,31020,-,安保服务,31020040,2865437000,-18.55,-31.07,¥22.26,工业,310,0.0,600,13400,0.0,10000.0,600,0.0,0.0,1.0,61.8,32.89,46.34,-51.96,2020-12-31T05:00:00Z,{1_trade_buy},{trade_buy},2020Q4_1751760
300918,2020Q4_1751767,山东省烟台市龙口市东江镇南山工业园,高档织物面料的纺、织染及后整理加工和服装、服饰研发、生产(不含国家纺织品配额管理的商品)，羊毛洗毛、制条；特种劳动防护用品(防静电服、酸碱类化学品防护服、阻燃服)的生产；并销售及网上经营公司上述所列自产产品；新材料科技开发、技术开发、技术推广、技术转让；企业管理服务；国内展览展销服务；货物及技术的进出口业务(国家限定或禁止的除外)；仓储服务(不含危险化学品)；纺织原料与纺织品的检测检验。(依法须经批准的项目，经相关部门批准后方可开展经营活动),赵亮,烟台市,公司集纺织服饰智能制造与品牌运营为一体，主营业务为精纺呢绒及正装职业装的研发、设计、生产与销售。公司拥有完善的毛纺织服饰产业链，涵盖了集面料研发、毛条加工、染色、纺纱、织造、后整理于一体的精纺呢绒业务体系，以及集成衣研发、设计、制造、品牌运营于一体的服装业务体系。公司为国内精纺呢绒、正装职业装领军企业，“南山”牌精纺呢绒、“缔尔玛”牌职业装先后被国家工商总局认定为中国驰名商标。公司为精梳毛机织物单项冠军示范企业，“缔尔玛”牌职业装先后获评“中国职业装十大顶级品牌”、“中国服装成长品牌”。公司是国家级高新技术企业、中国纺织工业联合会认定的纺织技术创新示范企业，公司检测中心是中国合格评定国家认可委员会认可的实验室。公司凭借自身的科技实力与市场影响力，多次参与制定了纺织领域国家及行业技术标准。截至本招股说明书签署日，公司已形成专利71项，其中发明专利24项，获得山东省科技进步奖3次、中国纺织行业专利奖优秀奖2次。,zhaohoujie@nanshan.com.cn;rfzzqb@nanshan.com.cn,"主营业务为精纺呢绒及正装职业装的研发,设计,生产与销售.",赵亮,山东,36000.0,赵厚杰,20070429,www.nanshanchina.com,南山智尚,0,SZSE,SZSE,服饰加工,10240,-,纺织加工,10240010,3556793000,-14.77,-16.2,¥9.85,周期性消费,102,0.0,1100,9500,0.0,10000.0,1100,0.0,0.0,1.0,17.6,11.91,14.08,-30.04,2020-12-31T05:00:00Z,{1_trade_buy},{trade_buy},2020Q4_1751767
300892,2020Q4_1751753,上海市普陀区长寿路652号景源时尚产业园10号楼308室,食品流通，日用百货的销售，仓储(除危险品)，企业管理咨询，包装服务，供应链管理，商务信息咨询，企业形象策划、设计，从事货物及技术的进出口业务。【依法须经批准的项目，经相关部门批准后方可开展经营活动】,王牧,上海市,作为国内较早实现进口食品品牌运营的企业，公司始终秉持“通过世界美食，让大众更时尚、更健康”的使命，通过整合全球优质食品资源，全力打造“原装进口食品”的品牌发展战略，致力于将中国美食品牌与全球生产体系嫁接，将全球的健康美食和时尚生活方式带给中国消费者。经过多年发展，公司已成功自主开发和推广“德亚”、“瓦伦丁”、“亨利”、“雅娜”等自有品牌以及“品利”等合作品牌，品牌影响力逐年提升，在消费者中拥有较高的声誉和品牌辨识度。公司已成为国内知名的进口食品品牌运营商。报告期内，公司主要从事自有品牌食品的开发、进口、销售及国外食品的合作代理销售业务。目前，公司产品以自有品牌和合作品牌进口食品为主，主要聚焦于乳品、啤酒、粮油、谷物以及饼干点心类等五大食品品类。截止本招股说明书签署日，公司重点经营的自有品牌5款，合作品牌4款以及代理品牌1款。作为国内知名的进口食品品牌运营商，公司高度重视渠道建设工作，坚持线上渠道与线下渠道同时发展的营销策略，构建了包括大型商超，天猫商城、京东等电商平台以及各地经销商等在内的多元化销售体系。目前，公司销售渠道分为线下渠道和线上渠道。,securities@pinlive.com,"公司主要从事自有品牌食品的开发,进口,销售及国外食品的合作代理销售业务.公司产品以自有品牌和合作品牌进口食品为主,主要聚焦于乳品,啤酒,粮油,谷物以及饼干点心类等五大食品品类.",王牧,上海,10000.0,朱国辉,19970909,www.pinlive.com,品渥食品,0,SZSE,SZSE,零售 - 防守型,20550,-,食品分销,20550020,4554552000,-10.37,-29.67,¥44.56,非周期性消费,205,0.0,300,16300,0.0,10000.0,300,0.0,0.0,1.0,83.5,54.15,65.09,-31.54,2020-12-31T05:00:00Z,{1_trade_buy},{trade_buy},2020Q4_1751753
300891,2020Q4_1751752,广东省云浮市云安区六都镇,生产、销售：钛白粉(二氧化钛)及其相关化工产品(不含危险化学品)、硫酸；蒸汽发电(自用)；货物或技术进出口(国家禁止或涉及行政审批的货物和技术进出口除外)；国内贸易代理；进出口代理(以上项目不涉及外商投资准入特别管理措施)。(依法须经批准的项目，经相关部门批准后方可开展经营活动),何明川,云浮市,公司是一家集钛白粉研发、生产、销售为一体的国家高新技术企业。主要从事钛白粉产品的研发、生产和销售，主要产品为金红石型钛白粉、锐钛型钛白粉系列产品。公司坚持以“发展循环经济，创造绿色未来”为使命，采用清洁联产硫酸法工艺生产钛白粉。公司地处“中国硫都”广东省云浮市，依托当地硫铁矿储量丰富的区位资源优势配套生产硫酸，形成了完整的“硫-钛-铁-钙”循环经济产业链。公司先后被评为“硫酸法钛白粉清洁生产和循环经济产业链示范基地”、“广东省清洁生产企业”和“广东省‘硫-钛-铁-钙’产业工程技术研究中心”等，公司的“白玉莹”商标被认定为“广东省著名商标”。公司持续不断加大投入，围绕钛白粉开展新产品、新工艺及新装备的研发，在节能降耗、清洁生产、资源循环利用、技术改造、产品升级等方面均取得了较为显著的成果。公司生产的钛白粉产品已被广泛应用于塑料、涂料、油墨和橡胶等领域，其中，塑料级金红石型钛白粉产品的性能已达到国际同类产品标准，产品远销葡萄牙、俄罗斯、新加坡、韩国、越南、马来西亚等地。,dsh@gdtitanium.com,"主要从事钛白粉产品的研发,生产和销售,主要产品为金红石型钛白粉,锐钛型钛白粉系列产品.",何明川,广东,40000.0,殷健,20030928,www.gdtitanium.com,惠云钛业,0,SZSE,SZSE,化工,10130,-,特种化学制品,10130020,7589794000,5.98,4.97,¥18.72,基础材料,101,0.0,1100,18700,0.0,10000.0,1100,0.0,0.0,1.0,26.52,16.31,20.72,-9.65,2020-12-31T05:00:00Z,{1_trade_buy},{trade_buy},2020Q4_1751752
