symbol,_id,address,business_scope,chairman,city,descrpt,email,main_business,manager,province,reg_capital,secretary,setup_date,website,company,dividend_startyear,exchange,exchange_,group,groupcode,index_stockid,industry,industrycode,mktcap_norm_cny,pchange_12w,pchange_ytd,price,sector,sectorcode,share_percentage,shares,value,position,change,share_change,impact,abs_impact,split_factor,price_max,price_min,price_avg,change_from_average,portdate,action,comment,oid
300860,2020Q4_1751741,北京市东城区东直门南大街11号中汇广场B座7层,组织文化艺术交流活动；舞台灯光设计；舞台灯光设备租赁；安装、调试舞台设备；施工总承包；专业承包；承办展览展示；技术推广服务；销售机械电器设备、五金交电（不含电动自行车）；经济信息咨询；物业管理；出租商业用房；出租办公用房；工程勘察设计；经营演出及经纪业务（营业性演出许可证有效期至2022年06月21日）。（市场主体依法自主选择经营项目，开展经营活动；经营演出及经纪业务以及依法须经批准的项目，经相关部门批准后依批准的内容开展经营活动；不得从事国家和本市产业政策禁止和限制类项目的经营活动。）,沙晓岚,北京市,公司自成立以来，主要从事国内外文化演艺活动的策划、艺术创意设计、制作；剧院演出场所灯光音响工程设计、制作、器材租赁等业务；其中包括国家级大型活动灯光工程、地标性景观灯光秀、大型项目水秀灯光秀、舞台演出灯光设计和制作、器材租赁。公司于2006年获得ISO9001国际质量管理体系认证；同时公司拥有中国演艺设备技术协会演出场馆设备专业委员会评定的“专业灯光工程综合技术能力等级一级资质”；中国演出行业协会颁布的“舞美工程企业综合技术壹级资质”。,fssj@fssjart.com,"公司以创意设计为核心,业务范围涵盖大型文化演艺活动,文化旅游演艺,景观艺术照明及演绎等多个领域的创意,设计及制作服务.",沙晓岚,北京,13694.07,李勇,20020730,www.fssjart.com,锋尚文化,0,SZSE,SZSE,传媒,30820,-,娱乐,30820040,6974411000,-15.89,-24.85,¥51.07,通信服务,308,0.0,760,48300,0.0,10000.0,760,0.0,0.0,1.9,109.41,66.95,78.47,-34.92,2020-12-31T05:00:00Z,{1_trade_buy},{trade_buy},2020Q4_1751741
605183,2020Q4_1751795,江苏省无锡市锡山区东港镇新材料产业园,研发、生产饲料添加剂(限二氧化硅(I))；研发、生产无机粉体填料(限白炭黑、二氧化硅、纳米二氧化硅)。(依法须经批准的项目，经相关部门批准后方可开展经营活动),阙伟东,无锡市,"公司是全球主要的沉淀水合二氧化硅(白炭黑)专业生产企业之一，拥有无锡东沃化能有限公司和安徽确成硅化学有限公司两个控股子公司,被评为江苏省高新技术企业和无锡市重点工业企业。确成公司通过节能减排、资源回收利用，在生产运营全过程贯彻绿色环保、可持续发展这一理念。确成公司利用制备硫酸所产生的余热生产蒸汽,通过发电机组生产电力。在不增加能源消耗的情况下,低温回收装置每年多生产的蒸汽,相当于减少二氧化碳排放2万吨/年。中国石油和化学工业联合会授予确成公司“十一五”全国石油和化工环保先进单位的称号。",info@quechen.com,"研发,生产饲料添加剂(限二氧化硅(I));研发,生产无机粉体填料(限白炭黑,二氧化硅,纳米二氧化硅)",阙伟东,江苏,41401.8,王今,20030128,www.quechen.com,XD确成股,0,SHSE,SHSE,化工,10130,-,化学制品,10130010,7484290000,10.59,10.79,¥17.80,基础材料,101,0.0,700,12600,0.0,10000.0,700,0.0,0.0,1.0,27.57,16.68,20.36,-12.57,2020-12-31T05:00:00Z,{1_trade_buy},{trade_buy},2020Q4_1751795
300889,2020Q4_1751750,广东省深圳市宝安区松岗街道松岗大道11号健仓科技园一栋,从事LED点光源、LED日光灯、灯光控制器的生产、研发和销售；从事光电产品、太阳能产品、电子产品、半导体、智能控制系统及软件的生产、研发和销售；智能化控制系统、智能照明、软件、计算机领域内的技术研发、咨询、服务；市政工程、园林绿化工程施工；城市及道路照明工程专业承包、智能化工程专业承包；照明工程设计、照明技术的开发；房屋租售、国内贸易(不含专营、专卖、专控商品)；经营进出口业务(法律、行政法规、国务院决定禁止的项目除外，限制的项目须取得许可后方可经营)。,谢明武,深圳市,公司是从事景观照明智能控制系统及LED景观照明灯具的研发、生产和销售的国家级高新技术企业，公司始终以客户需求为导向，致力于为客户提供稳定可靠的LED景观照明产品。公司专注于景观照明领域的技术研发、产品设计与生产制造，在智能控制系统和景观照明产品领域具备较强的产品开发和制造能力，能够满足客户大规模的定制化需求，已成为国内大型景观照明项目所需产品的核心供应商之一。公司产品成功应用于国内诸多大型城市整体亮化项目，包括深圳改革开放40周年庆典主题灯光秀项目、青岛上合组织峰会主题灯光秀项目、厦门金砖会议主题灯光秀项目、杭州G20峰会钱江新城主题灯光秀项目、武汉两江四岸长江灯光秀项目等。公司已被认定为广东省景观LED工程技术研究中心。公司产品被认定为广东省名牌产品，产品通过了CCC认证、CE认证、CQC认证及ROHS认证。,exc@exc-led.com,"从事景观照明智能控制系统及LED景观照明灯具的研发,生产和销售,主要产品为景观照明智能控制系统和LED景观照明灯具系列产品.",张锋斌,广东,15600.0,陈永建,20090918,www.exc-led.com,爱克股份,0,SZSE,SZSE,硬件,31120,-,电子元件,31120040,3528428000,-17.63,-27.32,¥22.33,科技,311,0.0,500,14400,0.0,10000.0,500,0.0,0.0,1.0,64.15,30.53,40.96,-45.48,2020-12-31T05:00:00Z,{1_trade_buy},{trade_buy},2020Q4_1751750
605277,2020Q4_1751796,浙江省温州市乐清市北白象镇温州大桥工业园区,研发、制造、销售：自动化办公设备、智能家居、消费电子精细线材，工业控制线材，精密医疗器械线材，机器人高柔性线材，新能源应用线材，信息设备、通讯传输、计算机及云服务器用高频高速数据线材，汽车和航空航天等行业应用线材；环保高分子材料(塑胶颗粒)；线材性能检测及技术咨询；环保检测、环保检测技术咨询及技术服务；货物进出口、技术进出口。(依法须经批准的项目，经相关部门批准后方可开展经营活动)。,赵战兵,温州市,公司一直致力于精细电子线材的研发、制造和销售。公司隶属于中国电子元件行业协会光电线缆及光器件分会，主要生产消费电子及工业控制线材、汽车电子线材、高频数据线材和特种线材等系列产品。公司主导产品广泛应用于家用电器、计算机、智能化办公、工业控制设备、汽车电子、数据服务器及新能源科技等领域。公司一贯坚持高端市场发展战略，面向国际知名终端客户，凭借自身可靠性优、一致性好和性价比高的产品，以及研发快速响应、持续改进、及时交货、精准服务等综合优势，逐步打破了精细电子线材高端市场由日立、住友、百通等国际品牌垄断的局面，实现进口替代，努力推动高端精细电子线材国产化进程。经过二十多年的发展历程，公司已成为中国消费电子线材细分行业的龙头企业。2018年，公司主导产品荣获中华人民共和国工业和信息化部、中国工业经济联合会颁发的《制造业单项冠军产品证书(2019年-2021年)》。,xyzqb@xinya-cn.com,"致力于精细电子线材的研发,制造和销售.主要生产消费电子及工业控制线材,汽车电子线材,高频数据线材和特种线材等系列产品.",赵战兵,浙江,13344.0,黄娟,19870407,www.xinya-cn.com,新亚电子,0,SHSE,SHSE,工业制品,31070,-,电子器械和零件,31070060,2700827000,-10.12,0.0,¥20.24,工业,310,0.0,500,8600,0.0,10000.0,500,0.0,0.0,1.0,0.0,0.0,0.0,0.0,2020-12-31T05:00:00Z,{1_trade_buy},{trade_buy},2020Q4_1751796
003029,2020Q4_1751735,吉林省长春市高新区博才路与学府街交汇栖乐荟写字楼10号楼15-17层,电子计算机及计算机网络的技术开发技术服务，经销电子计算机及配件、文化办公机械、机房装修(经营范围中未取得专项审批许可的项目除外)；自营和代理各类商品及技术的进出口业务(国家规定的专营进出口商品和国家禁止进出口等特殊商品除外)；技术咨询，计算机系统集成，建筑智能化工程、综合布线工程，信息安全工程，安防监控工程(以上各项凭资质证书经营)(依法须经批准的项目，经相关部门批准后方可开展经营活动),于逢良,长春市,"公司是国内知名的信息安全产品、服务及解决方案提供商，是电子认证领域的领先企业。公司以密码技术为核心，开展信息安全软件的研发、生产和销售及服务，面向政府、军队、军工、金融、能源、电信等重点行业和领域提供基于密码的可信身份认证及可信数据保障等多层次、全方位的综合性安全解决方案，为其信息系统提供关键的安全支撑与保障。公司通过持续技术研发，公司积累了数字证书、数字加密、数字签名、身份认证、访问控制等关键技术，实现了电子认证领域的多项突破，为云计算、大数据、物联网、移动互联、智能计算等领域提供安全技术支撑与保障。公司是国家高新技术企业、国家火炬计划软件产业基地骨干企业，是国家信息安全行业电子认证领域诸多重要科研课题及产业化项目的主要承担者之一，公司自成立以来曾经为40个以上中央国家机关及部委提供信息安全解决方案或服务，承担了1,000多个国内知名的大中型信息化项目的安全支持与保障工作，包括国家“金盾工程”、“金财工程”、“金水工程”、“金质工程”等金字工程及北京2008奥运会、“天宫一号”、“神州九号”、“神州十号”等众多具有重大社会、政治影响的大型项目。",ir@jit.com.cn,"以密码技术为核心,开展信息安全软件的研发,生产和销售及服务",王连彬,吉林,18040.0,张凤阁,19990212,www.jit.com.cn,吉大正元,0,SZSE,SZSE,软件,31110,-,软件和信息技术服务,31110010,4574818000,-9.37,-2.23,¥24.76,科技,311,0.0,700,18700,0.0,10000.0,700,0.0,0.0,1.0,26.14,16.23,20.87,18.64,2020-12-31T05:00:00Z,{1_trade_buy},{trade_buy},2020Q4_1751735
688571,2020Q4_1751808,浙江省杭州市江干区经济技术开发区白杨街道5号大街(南)2号,生产各类油墨及专用树脂；销售本公司生产的产品以及与本公司产品相配套的产品。(依法须经批准的项目，经相关部门批准后方可开展经营活动),邱克家,杭州市,公司作为国内领先的综合性油墨产品及印刷解决方案服务商，公司产品已覆盖国内市场的主要节能环保型油墨品种，报告期内市场占有率始终保持在同行业前列；尤其是在UV油墨方面，公司是国内少数拥有完整全套核心技术的生产企业，引领国内UV油墨行业的技术进步。公司已培养出各个层次的技术人才和管理人才，拥有多项发明专利并掌握UV油墨、胶印油墨、液体油墨的核心技术，以及行业内首家印刷技术研究室和行业领先的国家CNAS认证的分析检测中心，共主持/参与起草油墨产品相关国家/行业标准三十余项。2020年3月，公司入选浙江省科学技术厅评定的“2019年度浙江省创新型领军企业培育名单”，符合《浙江省创新型领军企业培育工作方案》中要求的“创新能力强、引领作用大、研发水平高、发展潜力好”的特点。,stock@hhink.com,"主要从事符合国家环保战略方向的节能环保型油墨产品及数码材料,功能材料的研发,生产和销售,为客户提供完整的油墨相关产品和印刷解决方案.",三輪達也,浙江,32000.0,陈建新,19881205,www.hhink.com,杭华股份,0,SHSE,SHSE,化工,10130,-,特种化学制品,10130020,2844843000,-3.1,-10.3,¥8.92,基础材料,101,0.0,8200,82800,0.0,10000.0,8200,0.0,0.0,1.0,14.62,9.8,11.04,-19.2,2020-12-31T05:00:00Z,{1_trade_buy},{trade_buy},2020Q4_1751808
300919,2020Q4_1751768,贵州省铜仁市玉屏侗族自治县大龙经济开发区2号干道与1号干道交汇处,法律、法规、国务院决定规定禁止的不得经营；法律、法规、国务院决定规定应当许可(审批)的，经审批机关批准后凭许可(审批)文件经营;法律、法规、国务院决定规定无需许可(审批)的，市场主体自主选择经营。(新材料、电池及新能源的研发、生产、加工与销售，从事货物及技术的进出口业务。),邓伟明,铜仁市,公司主要从事锂电池正极材料前驱体的研发、生产、加工及销售，主要产品包括三元前驱体、四氧化三钴，分别用于生产三元正极材料、钴酸锂正极材料。三元正极材料、钴酸锂正极材料进一步加工制造成锂电池，最终应用于新能源汽车、储能及消费电子等领域。公司所属产业为战略性新兴产业。为进一步增强锂电池正极材料前驱体主要原材料的保障能力，公司向产业链上游延伸，已形成了镍、钴中间品湿法加工硫酸镍、硫酸钴以及锂离子电池循环回收产能，与前驱体产业形成了良好的产业链协同优势。公司凭借优异的技术研发实力、严苛的品质管控要求、快速的产业化能力，前驱体产销量稳居全球前三，与LG化学、厦门钨业、当升科技、振华新材、天津巴莫、北大先行等国内外一流正极材料客户建立了稳定合作关系。,cngrir@cngrgf.com.cn,"主要从事锂电池正极材料前驱体的研发,生产,加工及销售,主要产品包括三元前驱体,四氧化三钴,分别用于生产三元正极材料,钴酸锂正极材料.",邓伟明,贵州,56965.0,廖恒星,20140915,www.cngrgf.com.cn,中伟股份,0,SZSE,SZSE,化工,10130,-,特种化学制品,10130020,81834653000,77.03,79.43,¥152.95,基础材料,101,0.0,600,37500,0.0,10000.0,600,0.0,0.0,1.0,86.12,73.25,80.15,90.83,2020-12-31T05:00:00Z,{1_trade_buy},{trade_buy},2020Q4_1751768
688569,2020Q4_1751807,北京市昌平区沙河镇沙阳路南24号,技术推广；销售建筑材料；货物进出口；技术进出口；代理进出口；生产铁路扣件系统、低松弛预应力钢棒、预应力钢丝、桥梁支座；普通货运；产品质量检验；专业承包。(企业依法自主选择经营项目，开展经营活动；依法须经批准的项目，经相关部门批准后依批准的内容开展经营活动；不得从事本市产业政策禁止和限制类项目的经营活动。),韩自力,北京市,公司一直致力于高铁工务工程领域尤其是高铁扣件技术的研究，并建立了高效的研发体系，已具备相应的持续创新能力和突破关键核心技术的潜力。通过持续不断的研发投入，公司已掌握了高铁扣件设计、制造和检测等核心技术，该技术打破了国外厂商对高铁轨道核心部件的垄断局面，并充分考虑到了我国沿海、多山、风沙、高寒等特殊环境的影响，为我国高铁安全运营奠定了坚实的技术基础。公司坚持以高铁扣件为核心产品，以高铁工务工程为主要应用领域，在不断丰富产品种类的同时，基于自身的技术和经验积累，公司还向重载铁路提供工务工程产品。未来，公司将秉承“引领轨道科技，创造交通未来”的理念和使命，立足于行业发展需要，始终坚持技术创新，为高铁、重载、城市轨道等高端轨道交通领域提供优质的工务工程产品。,tkgdir@bjtkgd.com;bjtkgd@163.com,"公司轨道扣件产品主要为高铁扣件和重载扣件,主营业务是以高铁扣件为核心的高铁工务工程产品的研发,生产和销售,致力于为高铁运营提供安全,稳定,可靠的工务工程产品.",张松琦,北京,21066.67,张远庆,20061030,www.bjtkgd.com,铁科轨道,0,SHSE,SHSE,交通运输,31080,-,铁路运输,31080030,3838549000,1.65,-10.18,¥18.38,工业,310,0.0,6800,137500,0.0,10000.0,6800,0.0,0.0,1.0,34.34,20.49,24.0,-23.42,2020-12-31T05:00:00Z,{1_trade_buy},{trade_buy},2020Q4_1751807
688056,2020Q4_1751800,北京市顺义区天竺空港工业区B区安庆大街6号,生产实验室仪器、设备、零配件、实验室应用软件、远程监控系统软件；研究、开发实验室仪器、设备、零配件、实验室应用软件、远程监控系统软件；自有实验室解决方案和实验室技术的转让；实验室内部设计与制作；技术咨询、技术服务；自产产品的维修服务；销售自产产品；零售和维修仪器仪表；零售计算机及实验室管理软件和仪器仪表的应用软件,胡克,北京市,公司是专业从事实验分析仪器的研发、生产和销售的科技型公司，是全球范围内能将多种类和多功能的样品前处理技术与全自动实验分析检测平台组合成全自动实验分析仪器系统的主要实验分析仪器供应商之一。公司主要产品包括全自动多功能高通量热裂解仪器、全自动高通量固相萃取系列仪器、全自动和高通量压力萃取系列仪器、全自动和高通量凝胶净化仪器、全自动高通量多功能组合仪器系列、全自动和高通量样品消解仪器系列、全自动和高通量浓缩产品系列、全自动紫外可见分光光谱仪系列、全自动液相色谱仪系列、全自动核素分离仪器系列、放射性元素富集系列、循环水冷却设备、制冷加热循环器(RH40-25A)、微控数显电热板(EG系列)等，公司拥有LabTech、CDS、Empore等行业知名品牌，在中国和美国设有研发和生产基地，并在中国内地主要城市、中国香港、美国马萨诸塞州和宾夕法尼亚州等地设有产品营销和服务中心。近年来，公司坚持以国家产业政策导向，建立了实验分析仪器研发创新体系，积累了较为雄厚的技术实力和研发成果，拥有60余项专利和20项软件著作权，核心技术人员在国内外相关期刊杂志中发表多篇SCI文章。公司产品已销往全球90多个国家和地区，累计服务客户近3万余,zqtzb@labtechgroup.com,"专业从事实验分析仪器的研发,生产和销售",胡克,北京,6700.0,于浩,20020108,www.labtechgroup.com,莱伯泰科,0,SHSE,SHSE,硬件,31120,-,科技仪器,31120060,3783551000,71.79,80.62,¥54.80,科技,311,0.0,2000,61400,0.0,10000.0,2000,0.0,0.0,1.0,47.4,30.64,37.63,45.63,2020-12-31T05:00:00Z,{1_trade_buy},{trade_buy},2020Q4_1751800
003026,2020Q4_1751732,浙江省湖州市长兴县太湖街道陆汇路59号,晶体硅、电子元器件制造、销售，晶体硅及其制品、电子元器件及新型节能材料的开发、技术咨询及技术转让，电气机械设备设计及销售；货物进出口、技术进出口。(依法须经批准的项目，经相关部门批准后方可开展经营活动),徐一俊,湖州市,公司是一家专业从事硅材料研发、生产和销售的电子信息产业国家级高新技术企业。发行人是国家高新技术企业、全国半导体设备和材料标准化技术委员会成员单位，是中国半导体行业协会、中国电子材料行业协会会员单位，在半导体硅材料制造领域拥有多项核心技术和专利。发行人核心管理团队拥有二十多年的半导体行业从业经验，长期致力于半导体硅材料的研发与生产，在研发、生产工艺、质量控制等方面拥有完善的技术储备和强大的技术创新能力。经过近十年的发展，目前发行人在分立器件用半导体硅材料领域尤其是硅研磨片细分领域已具有领先的市场地位。,ir@mtcn.net,"主营业务为半导体硅材料的研发,生产和销售,主要产品为半导体硅片及半导体硅棒.",徐一俊,浙江,9976.0,李志萍,20100125,www.mtcn.net,中晶科技,0,SZSE,SZSE,半导体,31130,-,半导体仪器和材料,31130010,8265662000,2.22,81.91,¥82.82,科技,311,0.0,500,21700,0.0,10000.0,500,0.0,0.0,1.0,47.16,20.0,31.87,159.87,2020-12-31T05:00:00Z,{1_trade_buy},{trade_buy},2020Q4_1751732
300917,2020Q4_1751766,广东省深圳市福田区香蜜湖街道侨香路1010号特发文创广场五楼,一般经营项目：物业管理；水电工程；国内贸易；经济信息咨询；房地产经纪；为酒店提供管理服务；汽车零配件及汽车饰品的购销；自有物业租赁；园林绿化服务；绿化养护服务；花卉租摆；清洁服务；从事物业管理范围内的二次供水设施清洗消毒业务；建筑工程；投资兴办实业(具体项目另行申报)；经营电子商务。许可经营项目：游泳池经营；停车场经营；劳务派遣；餐饮服务；人力资源输出；人力资源开发与管理咨询；人才资源培训服务；企业人才的交流咨询；人力资源服务外包；人力资源管理软件；垃圾清运；道路清扫；园林设计；市政工程管理；“四害”防治；白蚁防治；环境消杀服务。,陈宝杰,深圳市,公司一直以综合设施管理服务为核心业务，致力于成为中国高端物业服务品牌供应商。公司所从事的服务内容包括综合设施管理、空间管理、安全保障、环境管理、高端接待、会议服务等，管理的项目涵盖高新科技园区、商业综合体、政府机关、学校、住宅等多种类型，主要客户包括华为、阿里巴巴、中国移动、国家电网等知名企业。公司相关业务已从珠三角经济圈辐射至国内的环渤海经济圈、长三角经济圈、西南经济圈、华中城市经济圈及海外的非洲等地。近年来，公司在提供物业管理服务的同时，还陆续拓展了政务服务、资产经营等业务，设立了特发楼宇、特发政务、特发商务、特发资产经营等子公司。凭借优质的服务质量，公司与主要客户建立了长期、稳定的服务关系。报告期内，公司多次受到核心客户及行业协会等相关单位的嘉奖，具体情况如下：2018年度深圳市物业管理行业协会优秀企业、2017年物业服务百强企业、中国企业信用评价AAA等。,sdgs@tefafuwu.com,"公司所从事的服务内容包括综合设施管理,空间管理,安全保障,环境管理,高端接待,会议服务等,管理的项目涵盖高新科技园区,商业综合体,政府机关,学校,住宅等多种类型.",崔平,广东,13000.0,陈宝杰,19930531,www.tefafuwu.com,特发服务,0,SZSE,SZSE,房地产,10410,-,房地产服务,10410020,3331872000,-8.92,-16.55,¥25.67,房地产,104,0.0,390,9000,0.0,10000.0,390,0.0,0.0,1.3,41.48,29.92,34.39,-25.36,2020-12-31T05:00:00Z,{1_trade_buy},{trade_buy},2020Q4_1751766
300003,2020Q4_1751738,北京市昌平区超前路37号,医疗器械及其配件的技术开发、生产；销售自产产品；提供自产产品的技术咨询服务；上述产品的进出口；技术进出口；佣金代理(不含拍卖，涉及配额许可证管理、专项规定管理的商品按国家有关规定办理)。,蒲忠杰,北京市,公司是一家专业从事冠脉支架、PTCA球囊导管、中心静脉导管及压力传感器的研发、生产和销售的企业，国内高端医疗器械领域能够与国外产品形成强有力竞争的为数较少的企业之一。自成立以来，相继完成了支架、导管等多项介入医疗核心产品的研制开发和产业化工作，在业内第一个获得国家药监局颁发的“冠状动脉支架输送系统”产品注册证(III类)、第一个研发并试制成功抗感染“药物中心静脉导管”。公司具备了心血管介入、麻醉监护产品的工业化生产能力，PARTNER药物支架成功上市使公司为拥有雷帕霉素药物支架生产技术的公司。,zqb@lepumedical.com,"公司的主营业务包括医疗器械业务(含心脏病治疗产品,新型介入诊疗业务,体外诊断试剂和医疗产品代理配送),药品业务及海外业务三大板块.公司主要产品包括血管内药物(雷帕霉素)洗脱支架系统,冠脉支架输送系统,PTCA球囊扩张导管,药物中心静脉导管等.",张志斌,北京,180458.11,蒲忠杰,19990611,www.lepumedical.com,乐普医疗,2014,SZSE,SZSE,医疗器械,20650,-,医疗设备,20650010,54283121000,8.77,11.29,¥29.45,医疗保健,206,0.1,1836800,49923000,0.88,410.22,1476800,0.71,0.71,1.0,35.43,26.3,29.88,-1.44,2020-12-31T05:00:00Z,{2_trade_add},{trade_add} 410.22 %,2020Q4_1751738
