symbol,_id,address,business_scope,chairman,city,descrpt,email,main_business,manager,province,reg_capital,secretary,setup_date,website,company,dividend_startyear,exchange,exchange_,group,groupcode,index_stockid,industry,industrycode,mktcap_norm_cny,pchange_12w,pchange_ytd,price,sector,sectorcode,share_percentage,shares,value,position,change,share_change,impact,abs_impact,split_factor,price_max,price_min,price_avg,change_from_average,portdate,action,comment,oid
600059,2020Q4_1751776,浙江省绍兴市北海桥,许可经营项目：黄酒、白酒、食用酒精(不含化学危险品)、调味料(液体)的制造、销售。一般经营项目：黄酒、白酒、饮料、食用酒精(不含化学危险品)、调味料(液体)、副食品及食品原辅料、玻璃制品的技术开发；玻璃制品的制造、销售；经营本企业或成员企业自产产品及相关技术出口业务；经营本企业或本企业成员企业生产科研所需原辅材料、机械设备、仪器仪表、零配件等商品及相关技术的进口业务；承办中外合资经营、合作生产及开展“三来一补”业务；房屋租赁、汽车租赁、机器设备租赁；陶、瓷制品的销售。(上述经营范围不含国家法律法规规定禁止、限制和许可经营的项目。),孙爱保,绍兴市,公司是我国最大的黄酒生产、经营、出口企业，拥有国内一流的黄酒生产工艺设备和全国唯一的省级黄酒技术中心，聚集多名国家级评酒大师，黄酒年生产能力11万吨。主要产品“古越龙山”、“沈永和”、“状元红”、“鉴湖”、“古纤道”牌绍兴酒是国家优质产品，多次荣获国际国内金奖，是中国首批原产地域保护产品。“古越龙山”是黄酒行业唯一集中国名牌、中国驰名商标、国宴专用黄酒于一身的品牌；具有300多年历史的“沈永和”老字号和“鉴湖”是浙江省著名商标。公司产品畅销全国各大城市，远销日本、东南亚、欧美等三十多个国家和地区，享有“东方名酒之冠”的美誉。,hjjt@shaoxingwine.com.cn;zjy@shaoxingwine.com.cn,"主要产品:绍兴加饭酒,绍兴元红酒,绍兴香雪酒,绍兴善酿酒和绍兴花雕酒等.",徐东良,浙江,80852.42,吴晓钧,19970508,www.shaoxingwine.com.cn,古越龙山,2017,SHSE,SHSE,酒精饮料,20510,-,其他酒类,20510020,11504284000,12.97,-25.75,¥12.43,非周期性消费,205,0.64,5806800,98774300,1.75,-47.42,-5236200,-1.34,1.34,1.0,17.25,8.87,11.26,10.39,2020-12-31T05:00:00Z,{4_trade_reduce},{trade_reduce} 47.42 %,2020Q4_1751776
300601,2020Q4_1751740,广东省深圳市光明区马田街道薯田埔路18号,开发、生产经营乙肝疫苗及其它医用生物制品；进出口业务(具体按资格证书办理)；投资兴办医药项目及其它实业(具体项目另行申报)；医药技术开发、信息咨询服务、自有房屋、设备租赁服务(不含限制项目)；普通货运；货物专用运输(冷藏保鲜)。,杜伟民,深圳市,公司是一家集生物制品研发、生产、销售于一体的上市企业，中国主要的乙肝疫苗生产企业之一。公司主营业务为人用疫苗的研发、生产和销售，产品种类涵盖一类和二类疫苗，目前主要产品有重组乙型肝炎疫苗(酿酒酵母)、b型流感嗜血杆菌结合疫苗、麻疹风疹联合减毒活疫苗、无细胞百白破b型流感嗜血杆菌联合疫苗等产品。自成立以来，康泰生物承担了多项国家、省、市级重点科研项目及技术开发任务，已具备多联多价疫苗、基因工程疫苗等新技术研发及产业化核心竞争力。其中自主研发的无细胞百白破b型流感嗜血杆菌联合疫苗为国内独家创新的“四联疫苗”，专门针对无应答人群的60微克乙肝疫苗拥有“国家重点新产品”称号。通过多年的不懈努力，康泰生物已经发展成为研发品种齐全、产品线丰富、技术优势明显的国家级高新技术企业，在国家计划免疫战线上有着举足轻重的地位。,office@biokangtai.com,"主要产品:重组乙型肝炎疫苗(酿酒酵母)(10μg,20μg,60μg三种规格),b型流感嗜血杆菌结合疫苗,麻疹风疹联合减毒活疫苗,无细胞百白破b型流感嗜血杆菌联合疫苗等产品.主营业务;为人用疫苗的研发,生产和销售,",杜伟民,广东,68641.33,苗向,19920908,www.biokangtai.com,康泰生物,2017,SZSE,SZSE,医药制造,20620,-,专用医药制造,20620020,102401803000,13.05,-14.29,¥147.09,医疗保健,206,0.0,8700,1521500,0.03,-91.35,-91900,-0.41,0.41,1.0,247.49,133.99,180.27,-18.41,2020-12-31T05:00:00Z,{4_trade_reduce},{trade_reduce} 91.35 %,2020Q4_1751740
000858,2020Q4_1751816,四川省宜宾市翠屏区岷江西路150号,主营：酒类产品及相关辅助产品(瓶盖、商标、标识及包装制品)的生产经营；兼营：饮料、药品、水果种植、农业种植、进出口业务、物业管理、投资管理等。,曾从钦,宜宾市,公司是以五粮液及其系列酒的生产、销售为主要产业，同时生产经营精密塑胶制品、大中小高精尖注射和冲压模具现代制造产业，以及生物工程为发展产业，药业工业、印刷业、电子器件产业、物流运输和相关的服务业的具有深厚企业文化的现代化企业集团。公司现已系统研制开发了五粮春、五粮神、五粮醇等几十种不同档次、不同口味，满足不同区域、不同文化背景、不同层次消费者需求的系列产品。数年来“五粮液”品牌连续在中国白酒制造业和食品行业“最有价值品牌”中排位居前，具有领导市场的影响力。目前公司根据消费者的个性化需求，进一步细分、微分市场，新设计开发国宝五粮液、人民大会堂国宴五粮液等，丰富和完善产品线，加快新产品开发步伐，有效地支持了公司经营业绩持续增长。,000858-wly@sohu.com;lixinyi@wuliangye.com.cn,主要产品:五粮液系列酒.,,四川,388160.8,彭智辅,19980421,www.wuliangye.com.cn,五粮液,2015,SZSE,SZSE,酒精饮料,20510,-,其他酒类,20510020,1079600995000,10.79,-2.89,¥277.48,非周期性消费,205,0.0,0,0,0.0,-10000.0,-808600,-3.8,3.8,1.0,291.85,188.73,238.44,16.37,2020-12-31T05:00:00Z,{5_trade_sell},{trade_sell},2020Q4_1751816
000333,2020Q4_1751821,广东省佛山市顺德区北滘镇美的大道6号美的总部大楼,生产经营家用电器、电机及其零部件；从事家用电器、家电原材料及零配件的进出口、批发及加工业务(不设店铺，不涉及国营贸易管理商品，涉及配额、许可证管理商品的按国家规定办理)；信息技术服务；为企业提供投资顾问及管理服务；计算机软件、硬件开发；家电产品的安装、维修及售后服务；工业产品设计；酒店管理；广告代理；物业管理；企业所需的工程和技术研究、开发及其销售和推广；对金融业进行投资。(经营范围涉及行政许可的项目须凭有效许可证或批准证明经营),方洪波,佛山市,公司是一家消费电器、暖通空调、机器人与自动化系统、智能供应链(物流)的科技集团，提供多元化的产品种类与服务，包括以厨房家电、冰箱、洗衣机、及各类小家电为核心的消费电器业务；以家用空调、中央空调、供暖及通风系统为核心的暖通空调业务；以库卡集团、美的机器人公司等为核心的机器人及自动化系统业务;以安得智联为集成解决方案服务平台的智能供应链业务。公司以“科技尽善，生活尽美”为企业愿景，将“联动人与万物，启迪美的世界”作为使命，恪守“敢知未来——志存高远、务实奋进、包容共协、变革创新”的价值观，整合全球资源，推动技术创新，每年为全球超过3亿用户、及各领域的重要客户与战略合作伙伴提供满意的产品和服务，致力创造美好生活。,IR@midea.com,"以家电产业为主,涉足电机,物流等领域,旗下分为四大业务板块,分别为大家电,小家电,电机及物流",方洪波,广东,704515.93,江鹏,20000407,www.midea.com,美的集团,2014,SZSE,SZSE,家具制造,10220,-,家具制造,10220010,504918392000,-9.25,-26.09,¥69.80,周期性消费,102,0.0,0,0,0.0,-10000.0,-1566100,-2.57,2.57,1.0,98.44,61.19,76.9,-9.23,2020-12-31T05:00:00Z,{5_trade_sell},{trade_sell},2020Q4_1751821
600309,2020Q4_1751814,山东省烟台市经济技术开发区三亚路3号,安全生产许可证范围内危险化学品的生产；食品添加剂的研发、生产和销售；许可证范围内铁路专用线经营；丙烷、正丁烷的带有存储设施的经营、仓储经营(以上经营项目有效期限以许可证为准)；聚氨酯及助剂、异氰酸酯及衍生产品的开发、技术服务及相关技术人员培训；批准范围内的自营进出口业务；化工产品(仅限化工园区内经营)(不含危险化学品)的研发、生产、销售及技术服务咨询。(依法须经批准的项目，经相关部门批准后方可开展经营活动)。,廖增太,烟台市,公司是一家全球化运营的化工新材料公司，依托不断创新的核心技术、产业化装置及高效的运营模式，为客户提供更具竞争力的产品及解决方案。公司业务涵盖MDI、TDI、聚醚多元醇等聚氨酯产业集群，丙烯酸及酯、环氧丙烷等石化产业集群，水性PUD、PA乳液、TPU、ADI系列等功能化学品及材料产业集群。所服务的行业主要包括：生活家居、运动休闲、汽车交通、建筑工业和电子电器等。在生产领域，国内烟台、宁波、珠海等地生产基地稳定运营。在研发领域，烟台、北京、佛山、上海等地的研发中心已逐渐成型，北美技术中心在休斯敦正式投入使用。另外，万华化学在欧洲、美国、日本等多个国家和地区均设有公司和办事处。公司将“为客户创造价值”作为第一使命，致力于为客户提供稳定的、高质量的、有竞争力的产品和快速高效的服务，做负责任的供应商和行业领袖。,stocks@whchem.com;lmli@whchem.com;mhxiao@whchem.com,"主要产品:纯MDI,聚合MDI.",寇光武,山东,313974.66,李立民,19981216,www.whchem.com,万华化学,2020,SHSE,SHSE,化工,10130,-,化学制品,10130010,397911266000,25.1,43.62,¥124.70,基础材料,101,0.0,0,0,0.0,-10000.0,-1829200,-2.51,2.51,1.0,91.95,53.6,75.35,65.49,2020-12-31T05:00:00Z,{5_trade_sell},{trade_sell},2020Q4_1751814
601818,2020Q4_1751819,"北京市西城区太平桥大街25号,甲25号中国光大中心",吸收公众存款；发放短期、中期和长期贷款；办理国内外结算；办理票据承兑与贴现；发行金融债券；代理发行、代理兑付、承销政府债券；买卖政府债券、金融债券；从事同业拆借；买卖、代理买卖外汇；从事银行卡业务；提供信用证服务及担保；代理收付款项及代理保险业务；提供保管箱服务；经中国银监会批准的其他业务。,李晓鹏,北京市,公司成立于1992年8月，总部设在北京，是经国务院批复并经人民银行批准设立的金融企业，为客户提供全面的商业银行产品与服务。主要业务为经中国银行业监督管理委员会批准的包括对公及对私存款、贷款、支付结算、资金业务及其他金融业务。公司坚持“走出去”战略，境外机构建设步伐加快，中国香港分行、首尔分行、光银国际已开业运营，光银欧洲、卢森堡分行正在筹建；社会责任日益彰显，持续多年支持“母亲水窖”公益活动在社会上产生较大影响。多年来，伴随中国经济和金融业的发展进程，公司品牌形象和市场价值不断提升，在为广大客户和社会公众提供优质金融服务的同时，实现了良好的经营业绩，已成为一家运作规范、颇具影响力的上市银行。,IR@cebbank.com,"主营业务为商业银行业务.主要产品为公司贷款产品,票据贴现,公司存款产品,中间业务产品与服务,借记卡,信用卡,个人存款等.",付万军,北京,5403191.48,李嘉焱,19920618,www.cebbank.com,光大银行,2019,SHSE,SHSE,银行,10320,-,区域性银行,10320020,179947489000,-6.17,-8.52,¥3.65,金融服务,103,0.0,0,0,0.0,-10000.0,-20000000,-1.97,1.97,1.0,4.5,3.6,3.97,-8.06,2020-12-31T05:00:00Z,{5_trade_sell},{trade_sell},2020Q4_1751819
600690,2020Q4_1751815,山东省青岛市崂山区海尔信息产业园内,电器、电子产品、机械产品、通讯设备及相关配件、工业自动化控制设备、计算机软硬件及辅助设备的研发与制造；家用电器及电子产品技术咨询服务；进出口业务(按外经贸部核准范围经营)；批发零售：国内商业(国家禁止商品除外)；从事数字科技、智能科技、软件科技；技术开发、技术咨询、技术转让、技术服务(包含工业互联网及家电产品等)；数据处理；应用软件开发及服务；先进控制与优化技术的开发与应用研究；矿泉水制造、饮食、旅游服务(限分支机构经营)；企业管理服务及咨询、信息技术服务。(依法须经批准的项目，经相关部门批准后方可开展经营活动)。,梁海山,青岛市,海尔智家股份有限公司成立于1984年，1993年11月19日，海尔智家在上海证券交易所上市，是中国最早上市的公司之一，也是最早入选上证180成分股指数的蓝筹股公司之一，并于2019年被纳入MSCI全球指数。2018年10月24日，海尔智家成功在德国法兰克福交易所主板发行D股。2020年12月23日，海尔智家成功在香港主板上市。至此，海尔智家实现“A+D+H”三地上市，构建与全球化运营同步的全球资本平台。公司始终秉承“以用户为是，以自己为非”的理念，坚持创业、创新精神，不断适应时代的发展。公司坚持海外自主创牌，通过自身的持续耕耘与行业整合，先后收购日本三洋白电业、美国GE家电业务、新西兰Fisher&Paykel业务，持股墨西哥MABE48.41%股权、收购意大利Candy公司，构建“研发、制造、营销”三位一体的全球化竞争力，通过不断优化资源整合能力、发挥全球战略协同优势，实现“海尔、卡萨帝、统帅、美国GE Appliances、新西兰Fisher&Paykel、日本AQUA、意大利Candy”七大世界级品牌布局与全球化运营。面对物联网时代的机遇和挑战，海尔智家坚持智慧家庭战略，紧跟时代脚步，推进物联网生态转型,finance@haier.com;Y.sun@haier.de;ir@haier.hk,"主要产品:电冰箱,空调器.",李华刚,山东,940892.9,明国珍,19940331,smart-home.haier.com,海尔智家,2016,SHSE,SHSE,硬件,31120,-,消费类电子产品,31120030,240716903000,-13.46,-6.71,¥26.79,科技,311,0.0,0,0,0.0,-10000.0,-3906600,-1.9,1.9,1.0,30.4,16.26,23.49,14.05,2020-12-31T05:00:00Z,{5_trade_sell},{trade_sell},2020Q4_1751815
300144,2020Q4_1751820,浙江省杭州市之江路148号,许可经营项目：歌舞表演、杂技表演、戏曲表演、音乐表演、综合文艺表演(凭《营业性演出许可证》经营)，经营演出及经纪业务(凭《营业性演出许可证》经营)，餐饮服务(范围详见《餐饮服务许可证》)，停车服务。一般经营项目：旅游服务，主题公园开发经营，文化活动策划、组织，文化传播策划，动漫设计，会展组织，休闲产业投资开发，实业投资，旅游电子商务，设计、制作、代理、发布国内各类广告，影视项目的投资管理，旅游用品及工艺美术品(不含金饰品)、百货、土特产品(不含食品)的销售；出版物批发、零售(凭许可证经营)；含下属分支机构的经营范围。具体经营范围以工商登记机关核定内容为准。,张娴,杭州市,公司是中国演艺第一股，全球主题公园集团十强企业，连续多届获得“全国文化企业30强”称号，是全国文化体制改革工作先进单位。公司主营业务为主题公园和文化演艺的投资、开发、经营。目前宋城演艺正以“演艺宋城，旅游宋城，国际宋城，科技宋城，IP宋城，网红宋城”为战略指引，已建成和在建杭州、三亚、丽江、九寨、桂林、张家界、西安、上海、龙泉山、澳大利亚等数十大旅游区、三十大主题公园、上百台千古情及演艺秀，并拥有六间房、中国演艺谷等数十个文化娱乐项目。,zqb@chinascyy.com;hl@songcn.com,"主营业务为主题公园和旅游文化演艺的投资,开发和经营.目前主要经营杭州宋城,杭州乐园,烂苹果乐园和三亚千古情四个景区.",张娴,浙江,261469.4,侯丽,19940921,www.chinascyy.com,宋城演艺,2014,SZSE,SZSE,旅游和娱乐,10290,-,娱乐,10290020,41752002000,-19.53,-8.63,¥16.71,周期性消费,102,0.0,0,0,0.0,-10000.0,-3887500,-1.85,1.85,1.0,20.56,15.93,18.03,-7.32,2020-12-31T05:00:00Z,{5_trade_sell},{trade_sell},2020Q4_1751820
600926,2020Q4_1751822,浙江省杭州市下城区庆春路46号,吸收公众存款；发放短期、中期和长期贷款；办理国内外结算；办理票据承兑与贴现；发行金融债券；代理发行、代理兑付、承销政府债券；买卖政府债券、金融债券；从事同业拆借；买卖、代理买卖外汇；从事银行卡业务；提供信用证服务及担保；代理收付款项及代理保险业务；提供保管箱服务；经中国人民银行批准，经营结汇、售汇业务；经银行业监督管理机构批准的其他业务。本行的经营范围最终以银行业监督管理机构核准的范围为准。,陈震山,杭州市,公司成立于1996年9月，自成立以来，始终坚持服务区域经济、中小企业和城乡居民的市场定位，致力于为客户提供专业、便捷、亲和的金融服务，经过多年的努力，现已发展成为一家资产质量良好、经营业绩优良、综合实力跻身全国城市商业银行前列的区域性股份制银行。近年来，公司获得了“最佳城市商业银行”、“最佳科技金融服务城商行”、“全国支持中小企业发展十佳商业银行”等荣誉。目前，公司正在积极应对利率市场化等带来的挑战，聚焦六大业务发展战略，发力六大能力提升战略，加快向“轻、新、精、合”的品质银行转型。,ir@hzbank.com.cn;xuguomin@hzbank.com.cn;wangzhisen@hzbank.com.cn,"主营业务:致力于为城乡中小企业与居民家庭提供专业,便捷,亲和,全面的金融服务.主要服务:公司金融业务,小微金融业务,零售金融业务,金融市场业务",宋剑斌,浙江,513020.04,徐国民,19960925,www.hzbank.com.cn,杭州银行,2017,SHSE,SHSE,银行,10320,-,区域性银行,10320020,79109949000,-10.55,-8.51,¥13.25,金融服务,103,0.0,0,0,0.0,-10000.0,-5001400,-1.23,1.23,1.0,15.2,11.72,13.95,-5.02,2020-12-31T05:00:00Z,{5_trade_sell},{trade_sell},2020Q4_1751822
300747,2020Q4_1751823,湖北省武汉市东湖开发区高新大道999号,大功率脉冲及连续光纤激光器、大功率半导体激光器、固体激光器、光学及光电子元器件的研究、开发、生产、批发兼零售、维修服务、技术咨询；激光精密加工设备的研发、生产、批发兼零售、维修服务；激光器控制软件设计、开发、批发兼零售、维修服务；单位自有房屋租赁；货物进出口、技术进出口、代理进出口(不含国家禁止或限制进口的货物或技术)。(依法须经审批的项目，经相关部门审批后方可展开经营活动),伍晓峰,武汉市,公司是一家专业从事光纤激光器及其关键器件与材料的研发、生产和销售的国家火炬计划重点高新技术企业，拥有高功率光纤激光器国家重点领域创新团队和光纤激光器技术国家地方联合工程研究中心，是全球有影响力的具有从材料、器件到整机垂直集成能力的光纤激光器研发、生产和服务供应商。公司主营业务包括为激光制造装备集成商提供各类光纤激光器产品和应用解决方案，并为客户提供技术研发服务和定制化产品。经过多年的自主研发和创新，公司开发出一系列拥有自主知识产权的专利技术，目前拥有专利108项，其中境内发明专利24项，境内实用新型专利68项，境内外观设计专利15项，境外专利1项，软件著作权7项。,stock@raycuslaser.com;lxl@raycuslaser.com,"主要产品:10W至200W的脉冲光纤激光器;10W至12,000W的连续光纤激光器;75W至450W准连续光纤激光器;80W至3,000W直接半导体激光器.主营业务:为激光制造装备集成商提供各类光纤激光器产品和应用解决方案,并为客户提供技术研发服务和定制化产品.",吕卫民,湖北,28800.0,卢昆忠,20070406,www.raycuslaser.com,锐科激光,2020,SZSE,SZSE,硬件,31120,-,科技仪器,31120060,28977764000,24.74,15.63,¥101.82,科技,311,0.0,0,0,0.0,-10000.0,-458400,-0.91,0.91,1.0,89.96,62.99,77.41,31.53,2020-12-31T05:00:00Z,{5_trade_sell},{trade_sell},2020Q4_1751823
601628,2020Q4_1751817,北京市西城区金融大街16号,人寿保险、健康保险、意外伤害保险等各类人身保险业务；人身保险的再保险业务；国家法律、法规允许或国务院批准的资金运用业务；各类人身保险服务、咨询和代理业务；证券投资基金销售业务；国家保险监督管理部门批准的其他业务。,王滨,北京市,公司是国内寿险行业的龙头企业。公司作为《财富》世界500强和世界品牌500强企业的核心成员，公司以悠久的历史、雄厚的实力、专业领先的竞争优势及世界知名的品牌赢得了社会最广泛客户的信赖，始终占据国内保险市场领导者的地位，被誉为中国保险业的“中流砥柱”。公司是中国最大的人寿保险公司，拥有由保险营销员、团险销售人员以及专业和兼业代理机构组成的中国最广泛的分销网络。公司提供个人人寿保险、团体人寿保险、意外险和健康险等产品与服务，是中国领先的个人和团体人寿保险与年金产品、意外险和健康险供应商。,ir@e-chinalife.com;liyh@e-chinalife.com,"主营业务:在中国境内向个人和团体提供人寿保险,意外伤害保险和健康保险等产品与服务.同时,本公司还经营保险资产管理业务,主要通过本公司控股60%的资产管理公司进行.",苏恒轩,北京,2826470.5,利明光,20030630,www.e-chinalife.com,中国人寿,2019,SHSE,SHSE,保险,10340,-,人身保险,10340010,734582982000,6.31,-17.06,¥30.99,金融服务,103,0.0,0,0,0.0,-10000.0,-1200000,-0.9,0.9,1.0,51.96,30.04,42.09,-26.37,2020-12-31T05:00:00Z,{5_trade_sell},{trade_sell},2020Q4_1751817
688278,2020Q4_1751826,福建省厦门市海沧新阳工业区翁角路330号,"生物药品制造;其他未列明专业技术服务业(不含需经许可审批的事项);其他未列明制造业(不含须经许可审批的项目);生物技术推广服务;经营本企业自产产品的出口业务和本企业所需的机械设备、零配件、原辅材料的进口业务(不另附进出口商品目录),但国家限定公司经营或禁止进出口的商品及技术除外;经营各类商品和技术的进出口(不另附进出口商品目录),但国家限定公司经营或禁止进出口的商品及技术除外;其他未列明批发业(不含需经许可审批的经营项目)。",兰春,厦门市,公司是专业从事重组蛋白质及其长效修饰药物研发、生产及销售的创新型生物医药企业。围绕病毒性肝炎、恶性肿瘤等重大疾病和免疫治疗领域，布局涵盖多种蛋白质药物的创新平台，拥有从基础研究到产业化的生物医药体系化创新能力。主打四大重组蛋白商业化产品——派格宾、特尔立、特尔津、特尔康，用于慢性肝炎、中性粒细胞减少、白细胞减少和血小板减少。旗下创新药物研发团队，入选国家科技部“重点领域创新团队”，共计承担了9项“重大新药创制”国家科技重大专项，已有5个聚乙二醇蛋白质长效药物获准开展临床研究，其中1个药物获准上市。作为国产长效干扰素龙头，有望受益于进口替代，2018年公司产品已占据接近30%市场份额。,ir@amoytop.com,"上市产品包括生物制品国家1类新药——聚乙二醇干扰素α-2b注射液(商品名称:“派格宾”),注射用重组人粒细胞巨噬细胞刺激因子(商品名称:“特尔立”),重组人粒细胞刺激因子注射液(商品名称:“特尔津”)和注射用重组人白介素-11(商品名称:“特尔康”).是一家主要从事重组蛋白质及其长效修饰药物研发,生产及销售的创新型生物医药企业.",孙黎,福建,40680.0,孙志里,19960807,www.amoytop.com,特宝生物,0,SHSE,SHSE,生物科技,20610,-,生物科技,20610010,16406396000,25.48,17.98,¥40.16,医疗保健,206,0.0,0,0,0.0,-10000.0,-378900,-0.74,0.74,1.0,55.01,33.45,43.72,-8.14,2020-12-31T05:00:00Z,{5_trade_sell},{trade_sell},2020Q4_1751826
