symbol,_id,address,business_scope,chairman,city,descrpt,email,main_business,manager,province,reg_capital,secretary,setup_date,website,company,dividend_startyear,exchange,exchange_,group,groupcode,index_stockid,industry,industrycode,mktcap_norm_cny,pchange_12w,pchange_ytd,price,sector,sectorcode,share_percentage,shares,value,position,change,share_change,impact,abs_impact,split_factor,price_max,price_min,price_avg,change_from_average,portdate,action,comment,oid
300917,2020Q4_1751249,广东省深圳市福田区香蜜湖街道侨香路1010号特发文创广场五楼,一般经营项目：物业管理；水电工程；国内贸易；经济信息咨询；房地产经纪；为酒店提供管理服务；汽车零配件及汽车饰品的购销；自有物业租赁；园林绿化服务；绿化养护服务；花卉租摆；清洁服务；从事物业管理范围内的二次供水设施清洗消毒业务；建筑工程；投资兴办实业(具体项目另行申报)；经营电子商务。许可经营项目：游泳池经营；停车场经营；劳务派遣；餐饮服务；人力资源输出；人力资源开发与管理咨询；人才资源培训服务；企业人才的交流咨询；人力资源服务外包；人力资源管理软件；垃圾清运；道路清扫；园林设计；市政工程管理；“四害”防治；白蚁防治；环境消杀服务。,陈宝杰,深圳市,公司一直以综合设施管理服务为核心业务，致力于成为中国高端物业服务品牌供应商。公司所从事的服务内容包括综合设施管理、空间管理、安全保障、环境管理、高端接待、会议服务等，管理的项目涵盖高新科技园区、商业综合体、政府机关、学校、住宅等多种类型，主要客户包括华为、阿里巴巴、中国移动、国家电网等知名企业。公司相关业务已从珠三角经济圈辐射至国内的环渤海经济圈、长三角经济圈、西南经济圈、华中城市经济圈及海外的非洲等地。近年来，公司在提供物业管理服务的同时，还陆续拓展了政务服务、资产经营等业务，设立了特发楼宇、特发政务、特发商务、特发资产经营等子公司。凭借优质的服务质量，公司与主要客户建立了长期、稳定的服务关系。报告期内，公司多次受到核心客户及行业协会等相关单位的嘉奖，具体情况如下：2018年度深圳市物业管理行业协会优秀企业、2017年物业服务百强企业、中国企业信用评价AAA等。,sdgs@tefafuwu.com,"公司所从事的服务内容包括综合设施管理,空间管理,安全保障,环境管理,高端接待,会议服务等,管理的项目涵盖高新科技园区,商业综合体,政府机关,学校,住宅等多种类型.",崔平,广东,13000.0,陈宝杰,19930531,www.tefafuwu.com,特发服务,0,SZSE,SZSE,房地产,10410,-,房地产服务,10410020,3331872000,-8.92,-16.55,¥25.65,房地产,104,0.0,390,9000.0,0.0,10000.0,390,0.0,0.0,1.3,41.48,29.92,34.39,-25.41,2020-12-31T05:00:00Z,{1_trade_buy},{trade_buy},2020Q4_1751249
300891,2020Q4_1751237,广东省云浮市云安区六都镇,生产、销售：钛白粉(二氧化钛)及其相关化工产品(不含危险化学品)、硫酸；蒸汽发电(自用)；货物或技术进出口(国家禁止或涉及行政审批的货物和技术进出口除外)；国内贸易代理；进出口代理(以上项目不涉及外商投资准入特别管理措施)。(依法须经批准的项目，经相关部门批准后方可开展经营活动),何明川,云浮市,公司是一家集钛白粉研发、生产、销售为一体的国家高新技术企业。主要从事钛白粉产品的研发、生产和销售，主要产品为金红石型钛白粉、锐钛型钛白粉系列产品。公司坚持以“发展循环经济，创造绿色未来”为使命，采用清洁联产硫酸法工艺生产钛白粉。公司地处“中国硫都”广东省云浮市，依托当地硫铁矿储量丰富的区位资源优势配套生产硫酸，形成了完整的“硫-钛-铁-钙”循环经济产业链。公司先后被评为“硫酸法钛白粉清洁生产和循环经济产业链示范基地”、“广东省清洁生产企业”和“广东省‘硫-钛-铁-钙’产业工程技术研究中心”等，公司的“白玉莹”商标被认定为“广东省著名商标”。公司持续不断加大投入，围绕钛白粉开展新产品、新工艺及新装备的研发，在节能降耗、清洁生产、资源循环利用、技术改造、产品升级等方面均取得了较为显著的成果。公司生产的钛白粉产品已被广泛应用于塑料、涂料、油墨和橡胶等领域，其中，塑料级金红石型钛白粉产品的性能已达到国际同类产品标准，产品远销葡萄牙、俄罗斯、新加坡、韩国、越南、马来西亚等地。,dsh@gdtitanium.com,"主要从事钛白粉产品的研发,生产和销售,主要产品为金红石型钛白粉,锐钛型钛白粉系列产品.",何明川,广东,40000.0,殷健,20030928,www.gdtitanium.com,惠云钛业,0,SZSE,SZSE,化工,10130,-,特种化学制品,10130020,7589794000,5.98,4.97,¥18.69,基础材料,101,0.0,1100,18700.0,0.0,10000.0,1100,0.0,0.0,1.0,26.52,16.31,20.72,-9.8,2020-12-31T05:00:00Z,{1_trade_buy},{trade_buy},2020Q4_1751237
300879,2020Q4_1751230,浙江省宁波市余姚市锦凤路58号,"园林机械及配件、农业机具、园林机具、电动工具、清洁设备、电器配件、电机、电子元器件、汽油机及模具的制造、加工、测试。自营和代理各类货物和技术的进出口,无进口商品分销业务。(不涉及国营贸易管理商品,涉及配额、许可证管理商品的,按国家有关规定办理申请。)(不涉及外商投资准入特别管理措施范围。)(依法须经批准的项目，经相关部门批准后方可开展经营活动。)",叶晓波,宁波市,公司是国内园林机械行业领先企业，割草机龙头企业，是中国电器工业协会电动工具分会副理事长单位，是浙江省安监局认可的安全生产标准化二级企业(机械)，是中国内燃机工业协会公布的中国内燃机及零部件行业排头兵企业，获得过国际环保署颁发的低碳制造计划铂金奖证书。自2009年起被评为高新技术企业，拥有浙江省企业技术中心、省级工业设计中心，公司实验室为德国TUV南德集团授权认可的目击电气测试实验室。公司的“自走式高效环保园林汽油割草机”和“低排放低噪音轻型化二冲程汽油割灌机”被列入国家火炬计划产业化示范项目，割草机产品是中国林业机械协会“向社会推荐产品”。以自主研发实力和产品质量为基础，公司还致力于推动行业规范健康发展，负责制定或参加起草国家和行业标准8项，是中国林业机械标准化技术委员会委员单位。公司已经成为国际园林机械行业中具有较高知名度的ODM生产商，在生产技术、产品品质、制造规模等方面具有较高的市场地位，产品销往德国、法国、波兰、荷兰、俄罗斯、英国、加拿大、澳大利亚等全球50多个国家和地区，积累了一批优质客户资源，主要客户包括安达屋集团、牧田、富世华集团、翠丰集团、HECHT、百力通等。,zjb01@dayepower.com,"主要从事割草机,打草机/割灌机,其他动力机械及配件的研发设计,生产制造和销售.",叶晓波,浙江,16000.0,吴军,20060217,www.dayepower.com,大叶股份,0,SZSE,SZSE,工业制品,31070,-,工具和配件,31070050,3536212000,-16.73,-21.45,¥21.45,工业,310,0.0,500,12600.0,0.0,10000.0,500,0.0,0.0,1.0,69.99,27.74,36.43,-41.12,2020-12-31T05:00:00Z,{1_trade_buy},{trade_buy},2020Q4_1751230
300922,2020Q4_1751252,河北省秦皇岛市海港区经济技术开发区雪山路5号,机电设备、电子专用设备生产与技术开发、打印机、海水淡化设备、水处理及环保专用设备、金属及非金属材料、复合材料的技术开发、技术咨询、技术服务、技术转让与生产；塑料制品、金属制品、复合材料制品及包装制品、计算机辅助设备的技术开发与生产、销售；打印机用墨水、墨粉、墨盒、硒鼓、打印丝的生产；模具设计、制造及维修、机械零配件的生产；水处理工程设计及施工；计算机外围设备、办公用机械、其他化工产品、五金产品、建材的销售；货物及技术进出口；帐篷及附属设备、睡袋、充气垫、饮水囊、软体储水罐、携行具、野营装备、伪装网、防护伪装器材、体育用品及器材、救生衣、救生圈、家具、货架、安防用具、取暖炉、机械零部件、箱包、冲锋舟配件、油桶、滑油注入器、无人机配件、金属箱的加工、设计、销售；金属丝绳及其制品、绳、索、缆制造、销售；计算机及软件、计算机辅助设备、电子产品、通讯终端设备、其他机械设备、发电机及发电机组、装卸搬运设备、通风除湿设备的销售；安全技术防范系统的设计、安装、维修；消防工程**(依法须经批准的项目，经相关部门批准后方可开展经营活动),宋金锁,秦皇岛市,公司立足防护装置的研发制造，始终坚持自主创新和高端制造的发展战略，积极响应国家“中国制造2025”、“军民融合”等战略规划，公司主要从事以高分子复合材料的新型加工和应用技术为核心的军用防护装置及装备零部件的研发、生产和销售，系军品防护领域的核心供应商，发行人所属行业为国家重点扶持的战略新兴产业。报告期内，公司主要收入来源于军品，主要产品及服务包括专用防护装置、装备零部件、技术服务及其他等，其中专用防护装置是公司最主要的产品。公司产品不仅广泛服务于陆、海、空及火箭军等多军种军工装备领域，也可应用于民用防护领域，属军民两用产品。公司为国家高新技术企业，且已获得军方及行业主管部门对从事军工配套业务相关的许可和认证。2015年，凭借对多项大口径弹药防护装置的技术攻关，公司被河北省国防科学技术协会、河北省兵工协会评为“兵工行业先进单位”；2016年，凭借公司研发团队多年的科研成果及公司整体在国防科技工业协作配套工作中的贡献，获得河北省总工会授予的“河北省五一劳动奖章”。,qhdtqgs@163.com,"主要从事高性能工程塑料及其制品,树脂基复合材料及其制品的设计,开发,生产与销售;主要产品包括专用防护装置和装备零部件.",张澎,河北,11200.8,王素荣,19960321,www.tianqin.net.cn,天秦装备,0,SZSE,SZSE,化工,10130,-,特种化学制品,10130020,3675734000,-8.29,-14.94,¥34.69,基础材料,101,0.0,300,9100.0,0.0,10000.0,300,0.0,0.0,1.0,40.32,35.8,38.07,-8.88,2020-12-31T05:00:00Z,{1_trade_buy},{trade_buy},2020Q4_1751252
300892,2020Q4_1751238,上海市普陀区长寿路652号景源时尚产业园10号楼308室,食品流通，日用百货的销售，仓储(除危险品)，企业管理咨询，包装服务，供应链管理，商务信息咨询，企业形象策划、设计，从事货物及技术的进出口业务。【依法须经批准的项目，经相关部门批准后方可开展经营活动】,王牧,上海市,作为国内较早实现进口食品品牌运营的企业，公司始终秉持“通过世界美食，让大众更时尚、更健康”的使命，通过整合全球优质食品资源，全力打造“原装进口食品”的品牌发展战略，致力于将中国美食品牌与全球生产体系嫁接，将全球的健康美食和时尚生活方式带给中国消费者。经过多年发展，公司已成功自主开发和推广“德亚”、“瓦伦丁”、“亨利”、“雅娜”等自有品牌以及“品利”等合作品牌，品牌影响力逐年提升，在消费者中拥有较高的声誉和品牌辨识度。公司已成为国内知名的进口食品品牌运营商。报告期内，公司主要从事自有品牌食品的开发、进口、销售及国外食品的合作代理销售业务。目前，公司产品以自有品牌和合作品牌进口食品为主，主要聚焦于乳品、啤酒、粮油、谷物以及饼干点心类等五大食品品类。截止本招股说明书签署日，公司重点经营的自有品牌5款，合作品牌4款以及代理品牌1款。作为国内知名的进口食品品牌运营商，公司高度重视渠道建设工作，坚持线上渠道与线下渠道同时发展的营销策略，构建了包括大型商超，天猫商城、京东等电商平台以及各地经销商等在内的多元化销售体系。目前，公司销售渠道分为线下渠道和线上渠道。,securities@pinlive.com,"公司主要从事自有品牌食品的开发,进口,销售及国外食品的合作代理销售业务.公司产品以自有品牌和合作品牌进口食品为主,主要聚焦于乳品,啤酒,粮油,谷物以及饼干点心类等五大食品品类.",王牧,上海,10000.0,朱国辉,19970909,www.pinlive.com,品渥食品,0,SZSE,SZSE,零售 - 防守型,20550,-,食品分销,20550020,4554552000,-10.37,-29.67,¥44.42,非周期性消费,205,0.0,300,16300.0,0.0,10000.0,300,0.0,0.0,1.0,83.5,54.15,65.09,-31.76,2020-12-31T05:00:00Z,{1_trade_buy},{trade_buy},2020Q4_1751238
300876,2020Q4_1751227,广东省揭阳市揭东区揭东城西片工业区,生产、销售：超细旦纤维丝、高强纤维丝、各种化纤丝、化纤材料及其制品；货物进出口、技术进出口。(以上各项，法律、行政法规和国务院决定禁止的不得经营；法律、行政法规和国务院决定限制的须取得许可方可经营)。(依法须经批准的项目，经相关部门批准后方可开展经营活动)。,郭清海,揭阳市,公司专业从事聚丙烯纤维的研发、生产和销售，聚丙烯纤维商品名为丙纶。公司主要产品为丙纶长丝。凭借公司管理团队在聚丙烯纤维行业二十多年丰富的技术、生产经验和客户资源积累，公司产品应用已广泛覆盖了工业领域和民用领域。目前，公司产品在工业领域应用范围主要为工业滤布、工程土工布等，在民用领域应用范围主要为箱包织带、水管布套、门窗毛条、服装等。公司为高新技术企业，高度重视研发投入，研发了多种差别化丙纶长丝，获得了多项荣誉，具体如下：2018年“蒙泰丝”品牌细旦抑菌聚丙烯纤维入围“中国纤维流行趋势2018/2019”；2017年国家功能性聚丙烯纤维研发生产基地、2017年度中国纺织工业联合会产品开发贡献奖、广东省聚丙烯纤维新材料工程技术研究中心。,zqb@gdmtxw.com,"公司专业从事聚丙烯纤维的研发,生产和销售,聚丙烯纤维商品名为丙纶.公司主要产品为丙纶长丝.",郭清海,广东,9600.0,朱少芬,20130906,www.gdguangdong.com,蒙泰高新,0,SZSE,SZSE,服饰加工,10240,-,纺织加工,10240010,3491436000,9.3,-4.57,¥37.98,周期性消费,102,0.0,400,12800.0,0.0,10000.0,400,0.0,0.0,1.0,89.92,37.07,49.83,-23.78,2020-12-31T05:00:00Z,{1_trade_buy},{trade_buy},2020Q4_1751227
003026,2020Q4_1751209,浙江省湖州市长兴县太湖街道陆汇路59号,晶体硅、电子元器件制造、销售，晶体硅及其制品、电子元器件及新型节能材料的开发、技术咨询及技术转让，电气机械设备设计及销售；货物进出口、技术进出口。(依法须经批准的项目，经相关部门批准后方可开展经营活动),徐一俊,湖州市,公司是一家专业从事硅材料研发、生产和销售的电子信息产业国家级高新技术企业。发行人是国家高新技术企业、全国半导体设备和材料标准化技术委员会成员单位，是中国半导体行业协会、中国电子材料行业协会会员单位，在半导体硅材料制造领域拥有多项核心技术和专利。发行人核心管理团队拥有二十多年的半导体行业从业经验，长期致力于半导体硅材料的研发与生产，在研发、生产工艺、质量控制等方面拥有完善的技术储备和强大的技术创新能力。经过近十年的发展，目前发行人在分立器件用半导体硅材料领域尤其是硅研磨片细分领域已具有领先的市场地位。,ir@mtcn.net,"主营业务为半导体硅材料的研发,生产和销售,主要产品为半导体硅片及半导体硅棒.",徐一俊,浙江,9976.0,李志萍,20100125,www.mtcn.net,中晶科技,0,SZSE,SZSE,半导体,31130,-,半导体仪器和材料,31130010,8265662000,2.22,81.91,¥82.95,科技,311,0.0,500,21700.0,0.0,10000.0,500,0.0,0.0,1.0,47.16,20.0,31.87,160.28,2020-12-31T05:00:00Z,{1_trade_buy},{trade_buy},2020Q4_1751209
300886,2020Q4_1751233,安徽省安庆市潜山市舒州大道42号,香精、香料、油田助剂、炼油助剂、金属加工助剂、纺织助剂、水处理剂、精细化工产品(不含危险化学品)开发、生产、销售(涉及行政许可项目凭有效许可证经营)。,徐基平,安庆市,公司自设立以来，公司一直专注于经营香料业务，主要从事内酯系列合成香料的研发、生产和销售，主营业务突出。公司自设立以来，始终坚持以市场为导向，以客户为目标，以技术创新打造核心竞争力，坚持走“创新、协调、绿色、开放、共享”的发展道路，打造行业高端品牌。公司为国家高新技术企业，拥有省级认定的企业技术中心、安徽省院士工作站。公司通过技术研究、工艺绿色化改造、副产物开发、资源综合利用等集成创新实现了“传统产品+新工艺”，进一步提升了内酯类香料的市场竞争力，产品在国际市场上具有竞争优势。公司为中国香料香精化妆品工业协会副理事长单位，在由中国轻工业联合会发布的2017年度“中国轻工业香料行业十强企业”评选中，公司位列第七名；公司还被中国香化协会授予“中国香料香精化妆品行业优秀企业奖”、“2016年度香料香精优秀品牌企业”等荣誉称号。,info@anhuihuaye.com,"主要产品为丙位内酯,丁位内酯系列合成香料,主要从事内酯系列合成香料的研发,生产和销售.",徐基平,安徽,7455.5,付林,20020712,www.anhuihuaye.com,华业香料,0,SZSE,SZSE,化工,10130,-,化学制品,10130010,2227711000,-13.36,-19.19,¥29.61,基础材料,101,0.0,130,6700.0,0.0,10000.0,130,0.0,0.0,1.3,70.6,36.04,48.7,-39.2,2020-12-31T05:00:00Z,{1_trade_buy},{trade_buy},2020Q4_1751233
300882,2020Q4_1751232,浙江省台州市天台县福溪街道兴业东三街15号,智能化管理系统开发应用，智能化安装工程服务，架线和管道工程建筑施工，信息技术咨询服务，电子式智能电能表、用电信息采集产品，低压电力成套设备、电力监测及控制设备、配网自动化设备、智能水表、热量表、燃气仪表及设备、暖通仪表及设备、流量仪表、水电气热计量自动化管理终端、云平台的水、电、气、热能源收费服务系统、社会公共安全设备及器材、逆变器、智能电容器及无功补偿装置、电能计量箱、配电箱、计算机、通信和电子设备、充电设备、充电装置检测设备、智能断路器、智能开关、建筑安全用金属制品、智能插头、插座及产品组件的研发、制造、销售，物联网服务、信息系统集成、电力电气工程的安装施工和运维，货物和技术进出口。(依法须经批准的项目，经相关部门批准后方可开展经营活动),邬永强,台州市,公司是国家高新技术企业，主要从事智能电表、用电信息采集系统等产品的研发、生产和销售，致力于为国内外电力等行业客户提供专业化的计量产品，是国内电能仪表计量领域的领先企业之一，并积极进行智能水表、多表合一类产品的研发及应用。公司目前产品主要为包括单相智能表、三相智能表在内的智能电表以及包括集中器、采集器、专变采集终端等在内的用电信息采集系统产品，广泛应用于智能电网建设中的智能用电环节。智能电表是智能电网终端的重要组成部分，除具备传统电能表基本用电量的计量功能外，智能电表还具有多费率计量、用户端控制、预付费、防窃电、负荷记录、多种双向通讯方式等多项功能，实现智能电网和用户之间的双向沟通，并积极助力于国家智能电网实现“全覆盖、全采集、全费控”目标。2018年，公司在国家电网智能电表类产品的中标量总排名进入前五，其中，单相智能表中标量排名第四位。公司自2016年起，持续入围南方电网智能电表招标。发行人经过长期发展，凭借优秀的产品质量、先进的技术实力、良好的服务能力，成为国内智能电表和用电信息采集系统的重要供应商之一，并积极拓展国际市场。,irm@wellsun.com,"产品主要为包括单相智能表,三相智能表在内的智能电表以及包括集中器,采集器,专变采集终端等在内的用电信息采集系统产品,主要从事智能电表,用电信息采集系统等产品的研发,生产和销售.",邬永强,浙江,20442.94,陈东滨,19970721,www.wellsun.com,万胜智能,0,SZSE,SZSE,硬件,31120,-,科技仪器,31120060,3123761000,-9.54,-25.46,¥15.23,科技,311,0.0,520,11300.0,0.0,10000.0,520,0.0,0.0,1.3,0.0,0.0,0.0,0.0,2020-12-31T05:00:00Z,{1_trade_buy},{trade_buy},2020Q4_1751232
003028,2020Q4_1751210,广东省深圳市光明区玉塘街道根玉路与南明路交汇处华宏信通工业园4栋1-6楼,电子产品、各类电子智能控制器、汽车电子产品、医疗电子产品、电机及其智能控制器、变频器、LED照明、开关电源、高压电源、电子自动化设备的研发及销售(不含限制项目)；动力电池产品、各类家电、电力设备、软件的技术开发、技术服务与销售(不含限制项目)；电子产品的信息咨询(不含限制项目)；国内贸易(不含专营、专卖、专控商品)；经营进出口业务(法律、行政法规、国务院决定禁止的项目除外，限制的项目须取得许可后方可经营)；兴办实业(具体项目另行申报)。(以上项目法律、行政法规、国务院决定禁止的项目除外，限制的项目须取得许可后方可经营)电子产品、各类电子智能控制器、汽车电子产品、医疗电子产品、电机及其智能控制器、变频器、LED照明、开关电源、高压电源、电子自动化设备的生产。,陈志杰,深圳市,公司是国家高新技术企业、深圳市自主创新百强中小企业、深圳市南山区领军企业。公司始终坚持以技术创新作为发展核心驱动力，积极发展高技术附加值、高品质附加值、节能环保、智能物联的产品，不断提升公司核心竞争力。公司研发中心拥有多个专业技术开发平台以及多个现代化实验室，建立了高效的研发组织架构和技术创新机制，培养了一批技术水平高、创新能力强、经验丰富的专业研发团队，形成了一系列先进的平台化技术，处于行业领先水平。2016年，公司“冰箱变频控制技术工程实验室”项目经深圳市政府批准，列入深圳市战略性新兴产业和未来产业发展专项资金扶持计划(节能环保产业类)；2018年，公司研发中心被广东省科技厅认定为嵌入式控制系统及电机变频控制器工程技术研究中心。,genbyte@genbytech.com,"公司系行业内知名的高端智能控制器,变频驱动器,数字电源以及智能物联模块供应商,产品主要用于终端设备中的电能变换,控制及应用.",唐娟,广东,10960.0,夏群波,19990715,www.genbytech.com,振邦智能,0,SZSE,SZSE,硬件,31120,-,电子元件,31120040,4616472000,-15.42,1.54,¥41.35,科技,311,0.0,400,18000.0,0.0,10000.0,400,0.0,0.0,1.0,41.69,31.32,36.34,13.79,2020-12-31T05:00:00Z,{1_trade_buy},{trade_buy},2020Q4_1751210
