symbol,_id,address,business_scope,chairman,city,descrpt,email,main_business,manager,province,reg_capital,secretary,setup_date,website,company,dividend_startyear,exchange,exchange_,group,groupcode,index_stockid,industry,industrycode,mktcap_norm_cny,pchange_12w,pchange_ytd,price,sector,sectorcode,share_percentage,shares,value,position,change,share_change,impact,abs_impact,split_factor,price_max,price_min,price_avg,change_from_average,portdate,action,comment,oid
300860,2020Q4_1751871,北京市东城区东直门南大街11号中汇广场B座7层,组织文化艺术交流活动；舞台灯光设计；舞台灯光设备租赁；安装、调试舞台设备；施工总承包；专业承包；承办展览展示；技术推广服务；销售机械电器设备、五金交电（不含电动自行车）；经济信息咨询；物业管理；出租商业用房；出租办公用房；工程勘察设计；经营演出及经纪业务（营业性演出许可证有效期至2022年06月21日）。（市场主体依法自主选择经营项目，开展经营活动；经营演出及经纪业务以及依法须经批准的项目，经相关部门批准后依批准的内容开展经营活动；不得从事国家和本市产业政策禁止和限制类项目的经营活动。）,沙晓岚,北京市,公司自成立以来，主要从事国内外文化演艺活动的策划、艺术创意设计、制作；剧院演出场所灯光音响工程设计、制作、器材租赁等业务；其中包括国家级大型活动灯光工程、地标性景观灯光秀、大型项目水秀灯光秀、舞台演出灯光设计和制作、器材租赁。公司于2006年获得ISO9001国际质量管理体系认证；同时公司拥有中国演艺设备技术协会演出场馆设备专业委员会评定的“专业灯光工程综合技术能力等级一级资质”；中国演出行业协会颁布的“舞美工程企业综合技术壹级资质”。,fssj@fssjart.com,"公司以创意设计为核心,业务范围涵盖大型文化演艺活动,文化旅游演艺,景观艺术照明及演绎等多个领域的创意,设计及制作服务.",沙晓岚,北京,13694.07,李勇,20020730,www.fssjart.com,锋尚文化,0,SZSE,SZSE,传媒,30820,-,娱乐,30820040,6974411000,-15.89,-24.85,¥51.07,通信服务,308,0.0,760,48300,0.0,10000.0,760,0.0,0.0,1.9,109.41,66.95,78.47,-34.92,2020-12-31T05:00:00Z,{1_trade_buy},{trade_buy},2020Q4_1751871
300879,2020Q4_1751878,浙江省宁波市余姚市锦凤路58号,"园林机械及配件、农业机具、园林机具、电动工具、清洁设备、电器配件、电机、电子元器件、汽油机及模具的制造、加工、测试。自营和代理各类货物和技术的进出口,无进口商品分销业务。(不涉及国营贸易管理商品,涉及配额、许可证管理商品的,按国家有关规定办理申请。)(不涉及外商投资准入特别管理措施范围。)(依法须经批准的项目，经相关部门批准后方可开展经营活动。)",叶晓波,宁波市,公司是国内园林机械行业领先企业，割草机龙头企业，是中国电器工业协会电动工具分会副理事长单位，是浙江省安监局认可的安全生产标准化二级企业(机械)，是中国内燃机工业协会公布的中国内燃机及零部件行业排头兵企业，获得过国际环保署颁发的低碳制造计划铂金奖证书。自2009年起被评为高新技术企业，拥有浙江省企业技术中心、省级工业设计中心，公司实验室为德国TUV南德集团授权认可的目击电气测试实验室。公司的“自走式高效环保园林汽油割草机”和“低排放低噪音轻型化二冲程汽油割灌机”被列入国家火炬计划产业化示范项目，割草机产品是中国林业机械协会“向社会推荐产品”。以自主研发实力和产品质量为基础，公司还致力于推动行业规范健康发展，负责制定或参加起草国家和行业标准8项，是中国林业机械标准化技术委员会委员单位。公司已经成为国际园林机械行业中具有较高知名度的ODM生产商，在生产技术、产品品质、制造规模等方面具有较高的市场地位，产品销往德国、法国、波兰、荷兰、俄罗斯、英国、加拿大、澳大利亚等全球50多个国家和地区，积累了一批优质客户资源，主要客户包括安达屋集团、牧田、富世华集团、翠丰集团、HECHT、百力通等。,zjb01@dayepower.com,"主要从事割草机,打草机/割灌机,其他动力机械及配件的研发设计,生产制造和销售.",叶晓波,浙江,16000.0,吴军,20060217,www.dayepower.com,大叶股份,0,SZSE,SZSE,工业制品,31070,-,工具和配件,31070050,3536212000,-16.73,-21.45,¥21.48,工业,310,0.0,500,12600,0.0,10000.0,500,0.0,0.0,1.0,69.99,27.74,36.43,-41.04,2020-12-31T05:00:00Z,{1_trade_buy},{trade_buy},2020Q4_1751878
688571,2020Q4_1751940,浙江省杭州市江干区经济技术开发区白杨街道5号大街(南)2号,生产各类油墨及专用树脂；销售本公司生产的产品以及与本公司产品相配套的产品。(依法须经批准的项目，经相关部门批准后方可开展经营活动),邱克家,杭州市,公司作为国内领先的综合性油墨产品及印刷解决方案服务商，公司产品已覆盖国内市场的主要节能环保型油墨品种，报告期内市场占有率始终保持在同行业前列；尤其是在UV油墨方面，公司是国内少数拥有完整全套核心技术的生产企业，引领国内UV油墨行业的技术进步。公司已培养出各个层次的技术人才和管理人才，拥有多项发明专利并掌握UV油墨、胶印油墨、液体油墨的核心技术，以及行业内首家印刷技术研究室和行业领先的国家CNAS认证的分析检测中心，共主持/参与起草油墨产品相关国家/行业标准三十余项。2020年3月，公司入选浙江省科学技术厅评定的“2019年度浙江省创新型领军企业培育名单”，符合《浙江省创新型领军企业培育工作方案》中要求的“创新能力强、引领作用大、研发水平高、发展潜力好”的特点。,stock@hhink.com,"主要从事符合国家环保战略方向的节能环保型油墨产品及数码材料,功能材料的研发,生产和销售,为客户提供完整的油墨相关产品和印刷解决方案.",三輪達也,浙江,32000.0,陈建新,19881205,www.hhink.com,杭华股份,0,SHSE,SHSE,化工,10130,-,特种化学制品,10130020,2844843000,-3.1,-10.3,¥8.92,基础材料,101,0.0,8200,82800,0.0,10000.0,8200,0.0,0.0,1.0,14.62,9.8,11.04,-19.2,2020-12-31T05:00:00Z,{1_trade_buy},{trade_buy},2020Q4_1751940
688500,2020Q4_1751937,,,,,,,,,,,,,,慧辰资讯,0,SHSE,SHSE,软件,31110,-,软件和信息技术服务,31110010,2684041000,-0.22,-7.19,¥35.37,科技,311,0.0,3400,132300,0.0,10000.0,3400,0.0,0.0,1.0,109.01,38.3,54.38,-34.96,2020-12-31T05:00:00Z,{1_trade_buy},{trade_buy},2020Q4_1751937
688069,2020Q4_1751931,江苏省无锡市滨湖区梅梁路88号,蓝藻治理技术系统集成；蓝藻治理成套设备、环境保护专用设备的研发、设计、制造、销售、安装、调试、运行维护；水污染治理；水利相关咨询服务；水土流失防治服务；对外承包工程；卫星遥感应用系统集成；水资源专用机械设备制造；环境保护专用设备制造；环境保护专用设备销售；环保咨询服务；资源再生利用技术研发；农林废物资源化无害化利用技术研发；物联网应用服务；市政设施管理；工程管理服务；各类工程建设活动；房屋建筑和市政基础设施项目工程总承包；草及相关制品制造；污泥处理装备制造；环境监测专用仪器仪表制造；环境监测专用仪器仪表销售；新材料技术推广服务；技术服务、技术开发、技术咨询、技术交流、技术转让、技术推广；新材料技术研发；环境应急治理服务；环境应急检测仪器仪表制造；环境应急检测仪器仪表销售；生态环境材料销售；生态环境监测及检测仪器仪表制造；环境应急技术装备制造；水环境污染防治服务；土壤环境污染防治服务；环境应急技术装备销售；环境保护监测；生态环境材料制造；生态环境监测及检测仪器仪表销售；水质污染物监测及检测仪器仪表制造；基础地质勘查；自然生态系统保护管理；生态资源监测。(依法须经批准的项目，经相关部门批准后方可开展经营活动),胡明明,无锡市,"公司是集关键技术开发、解决方案、系统设计、整装集成、运行维护、监测预警于一体的蓝藻治理综合服务商,主要从事以湖库蓝藻水华灾害应急处置以及蓝藻水华的预防和控制为重点的蓝藻治理业务,先后在一体化二级强化气浮、高效可调式涡井取藻、蓝藻囊团破壁、加压控藻等多项核心、关键技术上取得重大突破，开发出以岸上站点藻水分离系统集成、车载式藻水分离装置、加压控藻船以及深井加压控藻平台等为重点的蓝藻水华防控及灾害应急处置成套化、一体化新型技术装备，在国内蓝藻治理行业占据领军、主导地位，系国内外目前唯一一家在“三大湖”(太湖、巢湖、滇池)以及多个具有重要影响、大型湖库上成功进行大规模、工厂化、无害化灾害应急处置与防控的专业化蓝藻治理企业，亦系唯一一家被江苏省环境保护产业协会评定为环境污染治理工程设计能力甲级(评价类别：生态修复)和环境污染治理能力甲级(评价类别：水污染治理、生态修复)，以及首家制定并执行藻水分离站企业标准(标准号Q/320211JFV01-2018)的专业化蓝藻治理企业,技术成果鉴定为国际领先。",wxdlh@wxdlh.com;lixiaolei@wxdlh.com;shaoling@wxdlh.com,"主要从事以湖库蓝藻水华灾害应急处置以及蓝藻水华的预防和控制为重点的蓝藻治理业务,具体包括根据湖库蓝藻治理的政府二元公共需求,开发,销售一体化,成套化蓝藻治理先进整装技术装备以及提供藻水分离站等蓝藻治理技术装备的专业化运行维护服务.",胡明明,江苏,5947.0,李晓磊,20091210,www.wxdlh.com,德林海,0,SHSE,SHSE,工业制品,31070,-,环境治理,31070040,3416077000,-10.43,-8.72,¥58.03,工业,310,0.0,2300,140700,0.0,10000.0,2300,0.0,0.0,1.0,135.74,61.86,91.88,-36.84,2020-12-31T05:00:00Z,{1_trade_buy},{trade_buy},2020Q4_1751931
605183,2020Q4_1751927,江苏省无锡市锡山区东港镇新材料产业园,研发、生产饲料添加剂(限二氧化硅(I))；研发、生产无机粉体填料(限白炭黑、二氧化硅、纳米二氧化硅)。(依法须经批准的项目，经相关部门批准后方可开展经营活动),阙伟东,无锡市,"公司是全球主要的沉淀水合二氧化硅(白炭黑)专业生产企业之一，拥有无锡东沃化能有限公司和安徽确成硅化学有限公司两个控股子公司,被评为江苏省高新技术企业和无锡市重点工业企业。确成公司通过节能减排、资源回收利用，在生产运营全过程贯彻绿色环保、可持续发展这一理念。确成公司利用制备硫酸所产生的余热生产蒸汽,通过发电机组生产电力。在不增加能源消耗的情况下,低温回收装置每年多生产的蒸汽,相当于减少二氧化碳排放2万吨/年。中国石油和化学工业联合会授予确成公司“十一五”全国石油和化工环保先进单位的称号。",info@quechen.com,"研发,生产饲料添加剂(限二氧化硅(I));研发,生产无机粉体填料(限白炭黑,二氧化硅,纳米二氧化硅)",阙伟东,江苏,41401.8,王今,20030128,www.quechen.com,XD确成股,0,SHSE,SHSE,化工,10130,-,化学制品,10130010,7484290000,10.59,10.79,¥17.80,基础材料,101,0.0,700,12600,0.0,10000.0,700,0.0,0.0,1.0,27.57,16.68,20.36,-12.57,2020-12-31T05:00:00Z,{1_trade_buy},{trade_buy},2020Q4_1751927
003027,2020Q4_1751860,安徽省合肥市包河区滨湖金融港B10栋,环保科技研发；除尘、脱硫、脱硝、污水处理、节能工程承包；除尘、脱硫、脱硝、输送设备的设计、制造、安装、调试；低压成套开关设备的生产及销售。(依法需经批准的项目经相关部门批准后方可经营),郑光明,马鞍山市,公司是国内知名的非电行业烟气治理综合服务商，主要为钢铁、焦化、建材等非电行业工业企业提供超低排放整体解决方案，包括除尘、脱硫、脱硝项目总承包及低温SCR脱硝催化剂。从工艺设计、设备开发与制造、组织施工、安装调试服务，到配套脱硝催化剂的生产等，公司业务涵盖了烟气治理全过程，是国内为数不多的能够同时提供烟气治理工程服务和低温脱硝催化剂、关键除尘、脱硫及脱硝系统设备的烟气治理综合服务商。公司低温SCR脱硝催化剂整体技术达到国际先进水平，制备技术达到国际领先水平，低温SCR脱硝工艺与装备技术达到国内领先水平。公司已成长成为国内知名的非电行业烟气治理综合服务商，在非电行业烟气治理市场占据领先地位。,1160815071@qq.com;txhbzqb@ahtxhb.com,"主要为钢铁,焦化,建材等非电行业工业企业提供超低排放整体解决方案,包括除尘,脱硫,脱硝项目总承包及低温SCR脱硝催化剂.",朱宁,安徽,13000.5,曾兴生,20060619,www.ahtxhb.com,同兴环保,0,SZSE,SZSE,垃圾处理,31090,-,垃圾处理,31090010,3472383000,-6.76,1.69,¥26.62,工业,310,0.0,450,14000,0.0,10000.0,450,0.0,0.0,1.5,38.51,26.68,29.74,-10.49,2020-12-31T05:00:00Z,{1_trade_buy},{trade_buy},2020Q4_1751860
688617,2020Q4_1751942,广东省深圳市南山区西丽街道松坪山社区松坪山朗山路11号同方信息港B栋601,一般经营项目是：计算机软件开发与自主开发软件的销售；医疗器械产品的技术开发、咨询(不含限制项目)、并提供上述产品的批发、进出口及相关配套业务；设备租赁；I类医疗器械的批发、进出口及销售(不涉及国营贸易管理商品，涉及配额、许可证管理及其他专项规定管理的商品，按国家有关规定办理申请)。，许可经营项目是：III类6821医用电子仪器设备、III类6825医用高频仪器设备、III类6866医用高分子材料及制品、III类6877介入器材的生产、自产产品的销售(由分公司生产)；II类、III类医疗器械的批发、进出口及销售。,成正辉,深圳市,公司是国产电生理和血管介入医疗器械品种品类齐全、规模领先、具有较强市场竞争力的企业之一，也是能够与国外产品形成强有力竞争的为数不多的企业之一。公司在电生理、血管介入医疗器械的研发和生产领域拥有丰富的技术积累和人才储备，攻关并掌握了“钢丝网加强挤出”、“亲水涂层”、“异种合金对接”等多种国外垄断的通路类产品必备产业化技术，同时具备独立生产导管、球囊、导丝等多种血管介入产品的高端生产制造能力。公司坚持自主研发创新，同时积极发掘临床需求，利用公司在行业内领先的生产制造能力实现可充分满足临床需求产品的产业化。截至2020年3月31日，公司共拥有国内外专利证书60项，其中国内发明专利39项，国外发明专利2项。经过多年的发展，公司已在境内外建立了完善的销售网络，覆盖全国31个省、自治区和直辖市的700余家三甲医院及680余家县市级二甲医院，并出口至欧洲、美洲、东南亚的80多个国家和地区。,ir@aptmed.com,"已上市的产品包括电生理,冠脉通路和外周血管介入医疗器械,专注于电生理和血管介入医疗器械的研发,生产和销售.",成正辉,广东,6667.0,戴振华,20020617,www.aptmed.com,惠泰医疗,0,SHSE,SHSE,医疗器械,20650,-,医疗设备,20650010,26974581000,85.05,0.0,¥393.80,医疗保健,206,0.0,1700,124600,0.0,10000.0,1700,0.0,0.0,1.0,0.0,0.0,0.0,0.0,2020-12-31T05:00:00Z,{1_trade_buy},{trade_buy},2020Q4_1751942
605179,2020Q4_1751926,浙江省温州市平阳县一鸣工业园,一般项目：家用电器销售；日用品销售；厨具卫具及日用杂品批发；玩具销售；塑料制品销售；印刷专用设备制造；塑料加工专用设备制造(除依法须经批准的项目外，凭营业执照依法自主开展经营活动)。许可项目：食品生产；食品经营；食品互联网销售；餐饮服务；包装装潢印刷品印刷；特定印刷品印刷(依法须经批准的项目，经相关部门批准后方可开展经营活动，具体经营项目以审批结果为准)。,朱立科,温州市,公司主要从事新鲜乳品与烘焙食品的研发、生产、销售及连锁经营业务。其中，乳品主要包括低温巴氏杀菌乳、风味发酵乳、低温调制乳及蛋奶、热奶等特色乳饮品，烘焙食品包括各式短保质期的面包、米制品、中式糕点等。公司产品以“新鲜、健康、营养”为定位，乳品保质期通常在15天以内、烘焙食品保质期通常在3天以内，公司产品主要通过“一鸣真鲜奶吧”专业食品连锁门店进行销售。公司以“新鲜健康的食品、真诚永远的服务”为品牌理念，始终专注于各式新鲜乳品与烘焙食品的研发、制造与销售，以及奶吧连锁经营模式的探索与升级。以“牛奶+面包”的“营养早餐”为起点，公司逐步增加各式鲜牛奶、风味酸奶、三明治等产品，如先后开发了满足营养需求的“真鲜蛋奶”、适于国人温热饮食习惯的“热奶”及可加热饮用的“温酸奶”等畅销创新产品。未来，公司将通过在特种菌株上的基础研发、微生物发酵技术上的工艺改良、饮食口味上的产品创新，持续推出新鲜、健康、营养并满足消费升级饮食需求的新产品。,82091418@qq.com;1009363539@qq.com;inmfood@yi-ming.cn,"主要从事新鲜乳品与烘焙食品的研发,生产,销售及连锁经营业务.其中,乳品主要包括低温巴氏杀菌乳,风味发酵乳,低温调制乳及蛋奶,热奶等特色乳饮品,烘焙食品包括各式短保质期的面包,米制品,中式糕点等.",朱立科,浙江,40100.0,林益雷,20050913,www.inm.cn,一鸣食品,0,SHSE,SHSE,农副加工食品,20525,-,加工食品,20525040,6941387000,-13.4,-0.85,¥17.20,非周期性消费,205,0.0,900,16600,0.0,10000.0,900,0.0,0.0,1.0,17.66,14.59,16.1,6.83,2020-12-31T05:00:00Z,{1_trade_buy},{trade_buy},2020Q4_1751926
688618,2020Q4_1751943,广东省深圳市南山区西丽街道百旺信高科技工业园1区3栋,一般经营项目是：计算机产品、集成电路、数据通信产品、计算机软件的技术开发与购销；国内贸易；经营进出口业务。(法律、行政法规、国务院决定禁止的项目除外，限制的项目须取得许可后方可经营)，许可经营项目是：计算机产品、集成电路、数据通信产品、计算机软件的生产。,熊伟,深圳市,"公司是专注于工业互联网的高新技术企业，面向工业经济数字化、网络化、智能化的基础设施需求，致力于工业互联网通信产品的研发、生产和销售,公司是国内较早从事工业互联网通信产品的公司之一，拥有较为齐全的产品体系，主要产品为工业以太网交换机、嵌入式工业以太网模块、设备联网产品、工业无线产品等。公司聚焦工业级产品的可靠性、实时性、安全性及下游行业应用需求，自主研发了电磁兼容、环境适应、环网冗余、精密时钟同步等一批核心技术，较好地解决了高低温、高粉尘、高电压、潮湿、腐蚀、无人值守、剧烈振动冲击、极强电磁干扰等严酷工业环境中的通信应用问题，产品应用已覆盖智慧城市、智慧矿山、轨道交通、电力及新能源、智能制造等领域,公司通过了高新技术企业认证、软件企业认证、国家规划布局内重点软件企业认证。公司获广东省科技厅评为“广东省工业网络传输设备工程技术研究中心”，入选了广东省工业和信息化厅“广东省工业互联网产业生态供给资源池企业”名录，先后被深圳市工业总会评为“第十五届深圳企业创新纪录自主创新新锐企业”、“第十八届深圳企业创新纪录自主创新标杆企业”。",XYY-SW@3onedata.com;688618public@3onedata.com,"致力于工业互联网通信产品的研发,生产和销售.",熊伟,广东,5052.75,熊莹莹,20010906,www.3onedata.com.cn,三旺通信,0,SHSE,SHSE,硬件,31120,-,通讯设备,31120010,1976251000,-10.91,-27.12,¥38.81,科技,311,0.0,1100,59900,0.0,10000.0,1100,0.0,0.0,1.0,53.66,53.66,53.66,-27.67,2020-12-31T05:00:00Z,{1_trade_buy},{trade_buy},2020Q4_1751943
003031,2020Q4_1751864,河北省石家庄市鹿泉经济开发区昌盛大街21号,电子封装及精细陶瓷的研发、生产、销售；电子元器件、半导体元器件、集成电路、汽车电子部件、零部件的研发、生产及销售；陶瓷材料、电子专用材料、金属制品的研发、生产及销售；半导体器件专用设备、电子专用设备的制造及销售；软件设计、技术咨询、技术服务、技术转让及进出口业务。,王强,石家庄市,公司是专业从事电子陶瓷系列产品研发、生产和销售的高新技术企业，致力于成为世界一流的电子陶瓷产品供应商，为客户提供创新、高品质、有竞争力的电子陶瓷产品。经过十年来的发展，公司已成为国内领先的电子陶瓷高新技术企业，拥有河北省企业技术中心、河北省工程技术中心，作为牵头单位承担国家科技重大专项、工业强基等多项国家和省市电子陶瓷领域的重大科技攻关和产业化项目，在国内电子陶瓷行业具有重要影响力。公司定位为高端的电子陶瓷外壳产品供应商，产品质量可靠，行业知名度较高。经过多年的积累，公司已成为大批国内外电子行业领先企业的供应商，甚至是核心供应商，并与其建立了长期、稳定的合作关系。在光通信领域，全球多家著名的光电器件厂商均是公司客户；在无线通信领域，NXP、Infineon等世界知名的半导体公司为公司客户；公司业与国内著名的通信厂商华为、中兴建立了合作关系，合作范围不断扩大。,zcdzzqb@sinopack.cc;dan.wang@sinopack.cc;hui.dong@sinopack.cc,"主要产品为电子陶瓷系列产品,分为四大系列:通信器件用电子陶瓷外壳,工业激光器用电子陶瓷外壳,消费电子陶瓷外壳及基板,汽车电子件,专业从事电子陶瓷系列产品研发,生产和销售.",付花亮,河北,14933.33,董惠,20090806,www.sinopack.com.cn,中瓷电子,0,SZSE,SZSE,工业制品,31070,-,电子器械和零件,31070060,7794265000,16.36,0.0,¥52.80,工业,310,0.0,400,5900,0.0,10000.0,400,0.0,0.0,1.0,0.0,0.0,0.0,0.0,2020-12-31T05:00:00Z,{1_trade_buy},{trade_buy},2020Q4_1751864
603489,2020Q4_1751923,江苏省苏州市工业园区娄葑镇和顺路9号,研发组装生产电动车电机、办公自动化设备电机、家用电器设备电机、电瓶车控制器、显示器、传感器、刹把、调速把、后衣架、磁盘；销售电机、电器产品、机械设备、电动车配件，控制器、充电器、动力电池；从事生产所需零配件的进口和自产产品及电动自行车配件的出口。(依法须经批准的项目，经相关部门批准后方可开展经营活动),王清华,苏州市,"公司成立于2003年7月28日,是专业从事电踏车电机及配套电气系统的研发、生产、销售和技术服务的高新技术企业,经过多年的发展，已形成包括轮毂电机、中置电机两大类型共计80余种产品型号的电机产品系列，并具备控制器、传感器、仪表、电池等电气系统产品的配套供应能力，能够为山地车、公路车、城市休闲车、城市代步车等不同类型的电踏车提供全套适配电气方案,共有68项境内专利，其中发明专利13项，实用新型专利53项，外观设计专利2项。此外，还拥有1项欧洲专利。目前，公司是江苏省自行车电动车协会理事单位，苏州市企业技术中心、江苏省企业技术中心的依托单位,被苏州市人民政府认定为2016年度苏州市专精特新百强企业，“BAFANG”、“8FUN”品牌被苏州市商务局认定为“苏州市出口名牌”。",security@bafang-e.com,"电踏车电机及其配套系统的研发,生产,销售和技术服务",王清华,江苏,12031.5,周琴,20030728,www.bafang-e.com,八方股份,0,SHSE,SHSE,汽车和配件,10200,-,汽车配件,10200030,27056132000,24.33,20.15,¥221.99,周期性消费,102,0.28,334200,63602600,1.97,701.44,292500,1.72,1.72,1.0,207.85,136.99,173.95,27.62,2020-12-31T05:00:00Z,{2_trade_add},{trade_add} 701.44 %,2020Q4_1751923
