symbol,_id,address,business_scope,chairman,city,descrpt,email,main_business,manager,province,reg_capital,secretary,setup_date,website,company,dividend_startyear,exchange,exchange_,group,groupcode,index_stockid,industry,industrycode,mktcap_norm_cny,pchange_12w,pchange_ytd,price,sector,sectorcode,share_percentage,shares,value,position,change,share_change,impact,abs_impact,split_factor,price_max,price_min,price_avg,change_from_average,portdate,action,comment,oid
300882,2020Q4_1751880,浙江省台州市天台县福溪街道兴业东三街15号,智能化管理系统开发应用，智能化安装工程服务，架线和管道工程建筑施工，信息技术咨询服务，电子式智能电能表、用电信息采集产品，低压电力成套设备、电力监测及控制设备、配网自动化设备、智能水表、热量表、燃气仪表及设备、暖通仪表及设备、流量仪表、水电气热计量自动化管理终端、云平台的水、电、气、热能源收费服务系统、社会公共安全设备及器材、逆变器、智能电容器及无功补偿装置、电能计量箱、配电箱、计算机、通信和电子设备、充电设备、充电装置检测设备、智能断路器、智能开关、建筑安全用金属制品、智能插头、插座及产品组件的研发、制造、销售，物联网服务、信息系统集成、电力电气工程的安装施工和运维，货物和技术进出口。(依法须经批准的项目，经相关部门批准后方可开展经营活动),邬永强,台州市,公司是国家高新技术企业，主要从事智能电表、用电信息采集系统等产品的研发、生产和销售，致力于为国内外电力等行业客户提供专业化的计量产品，是国内电能仪表计量领域的领先企业之一，并积极进行智能水表、多表合一类产品的研发及应用。公司目前产品主要为包括单相智能表、三相智能表在内的智能电表以及包括集中器、采集器、专变采集终端等在内的用电信息采集系统产品，广泛应用于智能电网建设中的智能用电环节。智能电表是智能电网终端的重要组成部分，除具备传统电能表基本用电量的计量功能外，智能电表还具有多费率计量、用户端控制、预付费、防窃电、负荷记录、多种双向通讯方式等多项功能，实现智能电网和用户之间的双向沟通，并积极助力于国家智能电网实现“全覆盖、全采集、全费控”目标。2018年，公司在国家电网智能电表类产品的中标量总排名进入前五，其中，单相智能表中标量排名第四位。公司自2016年起，持续入围南方电网智能电表招标。发行人经过长期发展，凭借优秀的产品质量、先进的技术实力、良好的服务能力，成为国内智能电表和用电信息采集系统的重要供应商之一，并积极拓展国际市场。,irm@wellsun.com,"产品主要为包括单相智能表,三相智能表在内的智能电表以及包括集中器,采集器,专变采集终端等在内的用电信息采集系统产品,主要从事智能电表,用电信息采集系统等产品的研发,生产和销售.",邬永强,浙江,20442.94,陈东滨,19970721,www.wellsun.com,万胜智能,0,SZSE,SZSE,硬件,31120,-,科技仪器,31120060,3123761000,-9.54,-25.46,¥15.28,科技,311,0.0,520,11300,0.0,10000.0,520,0.0,0.0,1.3,0.0,0.0,0.0,0.0,2020-12-31T05:00:00Z,{1_trade_buy},{trade_buy},2020Q4_1751880
003030,2020Q4_1751863,浙江省杭州市滨江区江陵路77号,生产：豆制品(非发酵性豆制品、其他豆制品)，饮料(蛋白饮料类)，蛋制品(其他类)，果冻，淀粉及淀粉制品(淀粉制品)，罐头(其他罐头)；批发、零售(含网上销售)：食品，初级食用农产品(除药品)；服务：豆制品、豆制品设备的技术开发、技术咨询、成果转让，豆制品检测；收购本企业生产所需的原辅材料(限直接向第一产业的原始生产者收购)；货物进出口(法律、行政法规禁止经营的项目除外，法律、行政法规限制经营的项目取得许可后方可经营)；其他无需报经审批的一切合法项目。(依法须经批准的项目，经相关部门批准后方可开展经营活动),蔡祖明,杭州市,公司从创建至今，一直秉持“做健康食品，关注人类健康”的理念，凭借优质的产品和完善的服务，产品深耕江浙沪地区并且覆盖国内绝大多数省、自治区和直辖市，客户涵盖大润发、欧尚、永辉、世纪联华、华润万家、物美、三江超市、家乐福等大中型超市，海底捞、外婆家、老娘舅、杨国福等知名餐饮机构，盒马鲜生、叮咚买菜、每日优鲜等生鲜专营新零售平台，赢得了消费者和市场的高度认可。公司是江浙沪地区的豆制品领导品牌之一，是CAC国际标准以及国家标准、多个行业标准起草单位之一。近年来，公司先后获得下列主要荣誉或称号：“中国驰名商标”“浙江省著名商标”“中国绿色食品博览会金奖”“中国豆制品质量安全示范单位”“浙江省名牌产品”“浙江省知名商号”“浙江农博十大企业知名品牌农产品”“G20杭州峰会食材总仓供应企业”公司产品先后获得下列主要荣誉或称号：“第十四届、第十六届中国国际农产品交易会参展农产品金奖”“中国豆制品行业科技进步奖一等奖”“长江三角洲地区名优食品”。,zumingzqb@chinazuming.cn,"主营业务为豆制品的研发,生产和销售,主要产品为生鲜豆制品,植物蛋白饮品,休闲豆制品等",蔡祖明,浙江,12478.0,高锋,20000218,www.chinazuming.cn,祖名股份,0,SZSE,SZSE,农副加工食品,20525,-,加工食品,20525040,3430347000,-19.94,0.0,¥27.66,非周期性消费,205,0.0,500,7300,0.0,10000.0,500,0.0,0.0,1.0,0.0,0.0,0.0,0.0,2020-12-31T05:00:00Z,{1_trade_buy},{trade_buy},2020Q4_1751863
300918,2020Q4_1751901,山东省烟台市龙口市东江镇南山工业园,高档织物面料的纺、织染及后整理加工和服装、服饰研发、生产(不含国家纺织品配额管理的商品)，羊毛洗毛、制条；特种劳动防护用品(防静电服、酸碱类化学品防护服、阻燃服)的生产；并销售及网上经营公司上述所列自产产品；新材料科技开发、技术开发、技术推广、技术转让；企业管理服务；国内展览展销服务；货物及技术的进出口业务(国家限定或禁止的除外)；仓储服务(不含危险化学品)；纺织原料与纺织品的检测检验。(依法须经批准的项目，经相关部门批准后方可开展经营活动),赵亮,烟台市,公司集纺织服饰智能制造与品牌运营为一体，主营业务为精纺呢绒及正装职业装的研发、设计、生产与销售。公司拥有完善的毛纺织服饰产业链，涵盖了集面料研发、毛条加工、染色、纺纱、织造、后整理于一体的精纺呢绒业务体系，以及集成衣研发、设计、制造、品牌运营于一体的服装业务体系。公司为国内精纺呢绒、正装职业装领军企业，“南山”牌精纺呢绒、“缔尔玛”牌职业装先后被国家工商总局认定为中国驰名商标。公司为精梳毛机织物单项冠军示范企业，“缔尔玛”牌职业装先后获评“中国职业装十大顶级品牌”、“中国服装成长品牌”。公司是国家级高新技术企业、中国纺织工业联合会认定的纺织技术创新示范企业，公司检测中心是中国合格评定国家认可委员会认可的实验室。公司凭借自身的科技实力与市场影响力，多次参与制定了纺织领域国家及行业技术标准。截至本招股说明书签署日，公司已形成专利71项，其中发明专利24项，获得山东省科技进步奖3次、中国纺织行业专利奖优秀奖2次。,zhaohoujie@nanshan.com.cn;rfzzqb@nanshan.com.cn,"主营业务为精纺呢绒及正装职业装的研发,设计,生产与销售.",赵亮,山东,36000.0,赵厚杰,20070429,www.nanshanchina.com,南山智尚,0,SZSE,SZSE,服饰加工,10240,-,纺织加工,10240010,3556793000,-14.77,-16.2,¥9.85,周期性消费,102,0.0,1100,9500,0.0,10000.0,1100,0.0,0.0,1.0,17.6,11.91,14.08,-30.04,2020-12-31T05:00:00Z,{1_trade_buy},{trade_buy},2020Q4_1751901
300913,2020Q4_1751899,浙江省湖州市德清县新市镇士林工业区,一般项目：新材料技术研发；物联网技术研发；信息系统集成服务；技术服务、技术开发、技术咨询、技术交流、技术转让、技术推广；电子元器件制造；机械电气设备制造；通讯设备制造；计算机软硬件及外围设备制造；云计算设备制造；网络设备制造；光通信设备制造；智能车载设备制造；电子元器件零售；电线、电缆经营；光缆销售(除依法须经批准的项目外，凭营业执照依法自主开展经营活动)。许可项目：电线、电缆制造；发电、输电、供电业务；货物进出口；技术进出口(依法须经批准的项目，经相关部门批准后方可开展经营活动，具体经营项目以审批结果为准)。,姚金龙,湖州市,公司是专业从事数据电缆、专用电缆和连接产品设计、制造与销售的高新技术企业。自成立以来，公司凭借自身的技术沉淀、设计能力及品质优势，为境内外客户提供各类产品。公司产品销售覆盖中国大陆、欧洲、北美、中东、东南亚、澳大利亚等多个国家和地区，被广泛应用于网络结构化布线、智能安防、通信设备、数据中心、工业互联网、工业机器视觉、轨交机车和医疗器械等领域。根据中国机电产品进出口商会统计，2015年度、2016年度、2017年度、2018年度，公司产品出口额在全国同类产品的出口企业中连续4年排名第1位。,dmb@zhaolong.com.cn,"专业从事数据电缆,专用电缆和连接产品设计,制造与销售,主要产品为数据电缆,专用电缆及连接产品.",姚金龙,浙江,12250.0,姚云萍,19950821,www.zhaolong.com.cn,兆龙互连,0,SZSE,SZSE,工业制品,31070,-,电子器械和零件,31070060,3211185000,-3.05,-15.91,¥25.05,工业,310,0.0,600,15100,0.0,10000.0,600,0.0,0.0,1.0,49.56,30.26,37.11,-32.5,2020-12-31T05:00:00Z,{1_trade_buy},{trade_buy},2020Q4_1751899
605500,2020Q4_1751929,浙江省台州市温岭市大溪镇大洋城工业区,出版物、包装装潢、其他印刷品印刷。纸箱、纸板(不含造纸)加工、销售；设计、制作、发布国内外各类广告。(依法须经批准的项目，经相关部门批准后方可开展经营活动),林启军,台州市,公司是一家从事包装用纸及其制品研发、生产、销售的高新技术企业，主营业务系原纸、瓦楞纸板、瓦楞纸箱的研发、生产及销售，主要产品包括原纸、瓦楞纸板、瓦楞纸箱。公司产品广泛应用于包装物制造及工业品、消费品包装。公司通过了ISO9001、ISO14001体系认证、劳氏/GMI认证、FSC认证等资格，连续获得中国包装印刷企业百强，是一家集废纸利用、热电联产、生态造纸、绿色包装为一体的高新技术企业。,forestpackaging@126.com,"主营业务系原纸,瓦楞纸板,瓦楞纸箱的研发,生产及销售,主要产品包括原纸,瓦楞纸板,瓦楞纸箱.",林启军,浙江,20000.0,陈清贤,19980903,www.forestpacking.com,森林包装,0,SHSE,SHSE,包装和容器,10250,-,包装和容器,10250010,3568003000,-5.01,-7.43,¥17.86,周期性消费,102,0.0,800,15000,0.0,10000.0,800,0.0,0.0,1.0,24.59,19.66,21.37,-16.42,2020-12-31T05:00:00Z,{1_trade_buy},{trade_buy},2020Q4_1751929
300908,2020Q4_1751895,河南省南阳市西峡县工业大道北段211号,调味品、食品添加剂【辣椒油树脂、食品用香精、食品用天然香料】、水果制品(果酱)、蔬菜制品【食用菌制品(干制食用菌)】、食用植物油、方便食品、罐头制品生产、销售；农业初级产品种植、加工、储存、购销；自营和代理各类货物和技术的进出口业务*(依法需经批准的项目，经相关部门批准后方可开展经营活动),孙耀志,南阳市,公司自2002年成立以来，持续进行调味配料的研发、生产和销售，是国内采用超临界CO2萃取技术生产调味配料的主要生产商之一。公司主营业务为研发、生产、销售调味配料和调味食品。调味配料以花椒、辣椒等香辛植物提取物为代表，调味食品以仲景香菇酱、劲道牛肉酱、仲景调味油为代表。公司以“让健康有滋有味”为使命，以产品差异化为竞争策略，通过不断的品类创新和风味技术创新，实现企业的发展壮大。公司坚持走技术创新、产品创新之路。先后获批建立了“河南省香菇加工工程技术研究中心”、“食品风味物质提取技术河南省工程实验室”、“河南省企业技术中心”。经中国食品科学技术学会鉴评，公司仲景香菇酱系列产品属国内首创，整体技术达到国内领先水平；香菇调味料关键技术研究和产业化应用项目具有原始创新特征；新型香辛料加工关键技术集成与产业化项目整体技术达到国内领先水平。,zhongjing@zhongjing.com.cn,"公司主营业务为研发,生产,销售调味配料和调味食品..主要产品;仲景香菇酱系列,超临界香辛食品配料系列.主要产品为以花椒,辣椒系列为代表的调味配料和以仲景香菇酱,劲道牛肉酱,仲景调味油为代表的调味食品.",朱新成,河南,10000.0,王飞,20020929,www.zhongjing.com.cn,仲景食品,0,SZSE,SZSE,农副加工食品,20525,-,加工食品,20525040,6315599000,-2.59,-19.57,¥61.03,非周期性消费,205,0.0,300,17200,0.0,10000.0,300,0.0,0.0,1.0,120.8,77.3,95.68,-36.21,2020-12-31T05:00:00Z,{1_trade_buy},{trade_buy},2020Q4_1751895
300901,2020Q4_1751893,浙江省温州市鹿城区丰叶路180号,一般项目：专业设计服务；工业设计服务；平面设计；技术服务、技术开发、技术咨询、技术交流、技术转让、技术推广；服装服饰零售；服装服饰批发；鞋帽零售；鞋帽批发；制鞋原辅材料销售；皮革制品销售；针纺织品及原料销售；文具用品零售；文具用品批发；塑料制品销售；日用百货销售。(除依法须经批准的项目外，凭营业执照依法自主开展经营活动)。许可项目：货物进出口；技术进出口。(依法须经批准的项目，经相关部门批准后方可开展经营活动，具体经营项目以相关部门批准文件或许可证件为准)。,倪秀华,温州市,公司是一家以时尚产品设计为核心业务的创意设计企业，目前发行人时尚产品设计主要应用于鞋履设计，同时其应用于各类消费品外观的图案设计业务亦快速发展；基于行业特点及客户需求，公司在提供鞋履设计服务的同时亦向客户提供鞋履供应链整合服务。公司量贩式的设计能力及较强的供应链整合能力恰好契合了大众品牌鞋企尤其是女鞋品牌所具有的上新数量多、设计款式丰富、响应速度快的行业特点，发行人形成了一批以波兰CCC、阿根廷Lady Stork、匹克为代表的国内外知名鞋企客户，在业内形成了良好的口碑，成为越来越多大众鞋履品牌的产品设计合作伙伴。同时，发行人亦向国内广大传统鞋履OEM制造企业、贸易企业输出时尚产品设计，以自主创新助力于传统鞋履产业的转型升级。,zoenn800@zoenn.com,业务主要分为设计业务与供应链整合业务.设计业务又分为鞋履设计业务和图案设计业务.,倪秀华,浙江,24000.0,潘威敏,20111021,www.zoenn.com,中胤时尚,0,SZSE,SZSE,服饰加工,10240,-,鞋类和饰品,10240030,3731894000,-10.01,-25.16,¥15.39,周期性消费,102,0.0,9600,144200,0.0,10000.0,9600,0.0,0.0,1.0,41.2,20.61,29.34,-47.55,2020-12-31T05:00:00Z,{1_trade_buy},{trade_buy},2020Q4_1751893
300922,2020Q4_1751903,河北省秦皇岛市海港区经济技术开发区雪山路5号,机电设备、电子专用设备生产与技术开发、打印机、海水淡化设备、水处理及环保专用设备、金属及非金属材料、复合材料的技术开发、技术咨询、技术服务、技术转让与生产；塑料制品、金属制品、复合材料制品及包装制品、计算机辅助设备的技术开发与生产、销售；打印机用墨水、墨粉、墨盒、硒鼓、打印丝的生产；模具设计、制造及维修、机械零配件的生产；水处理工程设计及施工；计算机外围设备、办公用机械、其他化工产品、五金产品、建材的销售；货物及技术进出口；帐篷及附属设备、睡袋、充气垫、饮水囊、软体储水罐、携行具、野营装备、伪装网、防护伪装器材、体育用品及器材、救生衣、救生圈、家具、货架、安防用具、取暖炉、机械零部件、箱包、冲锋舟配件、油桶、滑油注入器、无人机配件、金属箱的加工、设计、销售；金属丝绳及其制品、绳、索、缆制造、销售；计算机及软件、计算机辅助设备、电子产品、通讯终端设备、其他机械设备、发电机及发电机组、装卸搬运设备、通风除湿设备的销售；安全技术防范系统的设计、安装、维修；消防工程**(依法须经批准的项目，经相关部门批准后方可开展经营活动),宋金锁,秦皇岛市,公司立足防护装置的研发制造，始终坚持自主创新和高端制造的发展战略，积极响应国家“中国制造2025”、“军民融合”等战略规划，公司主要从事以高分子复合材料的新型加工和应用技术为核心的军用防护装置及装备零部件的研发、生产和销售，系军品防护领域的核心供应商，发行人所属行业为国家重点扶持的战略新兴产业。报告期内，公司主要收入来源于军品，主要产品及服务包括专用防护装置、装备零部件、技术服务及其他等，其中专用防护装置是公司最主要的产品。公司产品不仅广泛服务于陆、海、空及火箭军等多军种军工装备领域，也可应用于民用防护领域，属军民两用产品。公司为国家高新技术企业，且已获得军方及行业主管部门对从事军工配套业务相关的许可和认证。2015年，凭借对多项大口径弹药防护装置的技术攻关，公司被河北省国防科学技术协会、河北省兵工协会评为“兵工行业先进单位”；2016年，凭借公司研发团队多年的科研成果及公司整体在国防科技工业协作配套工作中的贡献，获得河北省总工会授予的“河北省五一劳动奖章”。,qhdtqgs@163.com,"主要从事高性能工程塑料及其制品,树脂基复合材料及其制品的设计,开发,生产与销售;主要产品包括专用防护装置和装备零部件.",张澎,河北,11200.8,王素荣,19960321,www.tianqin.net.cn,天秦装备,0,SZSE,SZSE,化工,10130,-,特种化学制品,10130020,3675734000,-8.29,-14.94,¥34.70,基础材料,101,0.0,300,9100,0.0,10000.0,300,0.0,0.0,1.0,40.32,35.8,38.07,-8.85,2020-12-31T05:00:00Z,{1_trade_buy},{trade_buy},2020Q4_1751903
300890,2020Q4_1751884,广东省深圳市龙华新区龙华街道清祥路1号宝能科技园9栋C座20楼J单元,改性石墨负极材料、锂离子电池负极材料的技术开发及销售，其它国内贸易(以上均不含法律、行政法规、国务院决定规定需前置审批和禁止的项目)；经营进出口业务(法律、行政法规、国务院决定禁止的项目除外，限制的项目须取得许可后方可经营)；新能源行业投资(具体投资项目另行申报)。,周鹏伟,深圳市,"公司是一家从事锂离子电池负极材料的研发、生产和销售的高新技术企业，是国内先进的锂电池负极材料供应商，主要产品分为天然石墨和人造石墨两大类，产品应用于包括动力(电动交通工具，如新能源汽车、电动自行车等)、3C消费电子和工业储能等锂离子电池领域。经过多年发展，公司建立了一支高素质的研发团队和专家顾问团队，主要成员来源于清华大学、中科院等高等院所，并成为清华大学、重庆大学等知名院校的研究生联合培养基地和产学研合作基地,公司“动力电池用新型高性能微膨石墨负极材料的研发项目”获得“深圳市科学技术奖——技术发明二等奖”；“动力电池长循环硅/碳复合负极材料的研发与产业化项目”被深圳市经信委列为2018年第一批战略性新兴产业和未来产业发展专项资金中的“创新链+产业链”融合专项扶持计划(直接资助类)；获批广东省科技型中小企业技术创新基金项目等多项荣誉。",public@xfhinc.com,"主要从事锂离子电池负极材料的研发,生产和销售的高新技术企业,是国内先进的锂电池负极材料供应商,主要产品分为天然石墨和人造石墨两大类,产品应用于包括动力(电动交通工具,如新能源汽车,电动自行车等),3C消费电子和工业储能等锂离子电池领域.",赵东辉,广东,10000.0,叶文国,20090612,www.xiangfenghua.com,翔丰华,0,SZSE,SZSE,化工,10130,-,特种化学制品,10130020,5684329000,36.22,7.33,¥58.82,基础材料,101,0.0,300,14000,0.0,10000.0,300,0.0,0.0,1.0,71.5,47.3,59.33,-0.86,2020-12-31T05:00:00Z,{1_trade_buy},{trade_buy},2020Q4_1751884
300926,2020Q4_1751905,江苏省苏州市昆山开发区龙江路88号,汽车用精密模具及高精密零部件等相关产品的研发、生产、销售；模具制造；冲压零部件、金属材料、五金交电、电子产品、塑料制品的销售；激光拼焊汽车转向支架、落料件、汽车天窗用包塑件、汽车门锁用包塑件的生产、销售，并提供售后技术支持和服务；道路普通货物运输(按许可证核定内容经营)；从事货物及技术的进出口业务。(前述经营项目中法律、行政法规规定前置许可经营、限制经营、禁止经营的除外)(依法须经批准的项目，经相关部门批准后方可开展经营活动),伍亚林,苏州市,公司是汽车精密零部件和精密模具的专业制造企业，主要从事汽车精密零部件和精密模具的研发、设计、生产和销售。公司注重技术研发与创新，掌握了模具设计与制造、冲压、激光焊接、注塑及装配等关键生产工艺和环节的技术。公司具有较强的精密模具开发、制造与销售能力，零部件产品种类丰富，覆盖了框架类、传动类、其他类等。公司是国家高新技术企业，通过了IATF16949:2016质量管理体系认证(认证范围：金属冲压件、金属焊接件和注塑件的制造，除8.3产品设计)、GB/T24001-2016/IOS14001:2015环境管理体系认证(认证范围：汽车零件的冲压、焊接、注塑生产)以及邓白氏注册认证。公司是“江苏省认定企业技术中心”、“江苏省民营科技企业”、“昆山市科技研发机构”和“苏州市博俊高精密汽车冲压模具工程技术研究中心”、“江苏省企业研究生工作站”。公司拥有严格的质量控制体系、完整的研发设计体系，致力于为客户提供高性能、专业化的精密零部件和精密模具。经过多年的发展和积累，公司在精密零部件和精密模具行业形成了一定的竞争优势。,ir@sh-bojun.com,"主要从事汽车精密零部件和精密模具的研发,设计,生产和销售.主要产品冲压零部件,模具盈利能力均较强.",伍亚林,江苏,14213.34,李晶,20110329,www.sh-bojun.com,博俊科技,0,SZSE,SZSE,汽车和配件,10200,-,汽车配件,10200030,2987783000,-8.6,0.0,¥21.33,周期性消费,102,0.0,3600,38600,0.0,10000.0,3600,0.0,0.0,1.0,0.0,0.0,0.0,0.0,2020-12-31T05:00:00Z,{1_trade_buy},{trade_buy},2020Q4_1751905
