symbol,_id,address,business_scope,chairman,city,descrpt,email,main_business,manager,province,reg_capital,secretary,setup_date,website,company,dividend_startyear,exchange,exchange_,group,groupcode,index_stockid,industry,industrycode,mktcap_norm_cny,pchange_12w,pchange_ytd,price,sector,sectorcode,share_percentage,shares,value,position,change,share_change,impact,abs_impact,split_factor,price_max,price_min,price_avg,change_from_average,portdate,action,comment,oid
600690,2020Q4_1751911,山东省青岛市崂山区海尔信息产业园内,电器、电子产品、机械产品、通讯设备及相关配件、工业自动化控制设备、计算机软硬件及辅助设备的研发与制造；家用电器及电子产品技术咨询服务；进出口业务(按外经贸部核准范围经营)；批发零售：国内商业(国家禁止商品除外)；从事数字科技、智能科技、软件科技；技术开发、技术咨询、技术转让、技术服务(包含工业互联网及家电产品等)；数据处理；应用软件开发及服务；先进控制与优化技术的开发与应用研究；矿泉水制造、饮食、旅游服务(限分支机构经营)；企业管理服务及咨询、信息技术服务。(依法须经批准的项目，经相关部门批准后方可开展经营活动)。,梁海山,青岛市,海尔智家股份有限公司成立于1984年，1993年11月19日，海尔智家在上海证券交易所上市，是中国最早上市的公司之一，也是最早入选上证180成分股指数的蓝筹股公司之一，并于2019年被纳入MSCI全球指数。2018年10月24日，海尔智家成功在德国法兰克福交易所主板发行D股。2020年12月23日，海尔智家成功在香港主板上市。至此，海尔智家实现“A+D+H”三地上市，构建与全球化运营同步的全球资本平台。公司始终秉承“以用户为是，以自己为非”的理念，坚持创业、创新精神，不断适应时代的发展。公司坚持海外自主创牌，通过自身的持续耕耘与行业整合，先后收购日本三洋白电业、美国GE家电业务、新西兰Fisher&Paykel业务，持股墨西哥MABE48.41%股权、收购意大利Candy公司，构建“研发、制造、营销”三位一体的全球化竞争力，通过不断优化资源整合能力、发挥全球战略协同优势，实现“海尔、卡萨帝、统帅、美国GE Appliances、新西兰Fisher&Paykel、日本AQUA、意大利Candy”七大世界级品牌布局与全球化运营。面对物联网时代的机遇和挑战，海尔智家坚持智慧家庭战略，紧跟时代脚步，推进物联网生态转型,finance@haier.com;Y.sun@haier.de;ir@haier.hk,"主要产品:电冰箱,空调器.",李华刚,山东,940892.9,明国珍,19940331,smart-home.haier.com,海尔智家,2016,SHSE,SHSE,硬件,31120,-,消费类电子产品,31120030,240716903000,-13.46,-6.71,¥26.79,科技,311,0.04,3820300,111590500,3.45,-30.8,-1700000,-1.2,1.2,1.0,30.4,16.26,23.49,14.05,2020-12-31T05:00:00Z,{4_trade_reduce},{trade_reduce} 30.80 %,2020Q4_1751911
601012,2020Q4_1751916,陕西省西安市西安经济技术开发区尚苑路8369号,半导体材料、太阳能电池与组件、电子元器件、半导体设备的开发、制造和销售；商品进出口业务；光伏电站项目的开发及工程总承包；光伏电站系统运行维护；LED照明灯具、储能节能产品的销售、技术服务、售后服务；合同能源管理。(以上经营范围国家法律法规规定的专控及前置许可项目除外，国家法律法规另有规定的，从其规定),李振国,西安市,公司是全球最大的单晶硅生产制造商。公司始终专注于单晶硅棒、硅片的研发、生产和销售，经过十多年的发展，目前已成为*全球最大的太阳能单晶硅光伏产品制造商。产业覆盖隆基单晶硅、隆基乐叶光伏、隆基新能源、隆基清洁能源光伏全产业链。自创立以来，始终秉承“可靠、增值、愉悦”的企业文化理念，持续为社会提供优秀的能源与服务，依托长期积累形成的规模化生产优势、全产业链优势、创新优势、品牌优势和人才优势，致力于领先的光伏发电技术和产业，促进光伏发电“平价时代”的早日到来，从而改变人类利用能源的方式，改变世界能源的格局，改变人类的生活方式，实现世界文明可持续发展。,longi-board@longigroup.com,"主营业务为单晶硅棒,硅片的研发,生产,销售,主要产品包括6英寸,6.5英寸,8英寸的单晶硅棒,单晶硅片.",李振国,陕西,541295.27,刘晓东,20000214,www.longigroup.com,隆基股份,2019,SHSE,SHSE,半导体,31130,-,半导体仪器和材料,31130010,497043154000,50.53,41.68,¥89.77,科技,311,0.03,1515780,99826000,3.09,-38.92,-965999,-1.12,1.12,1.4,41.63,23.88,30.94,190.14,2020-12-31T05:00:00Z,{4_trade_reduce},{trade_reduce} 38.92 %,2020Q4_1751916
002352,2020Q4_1751857,广东省深圳市福田区新洲十一街万基商务大厦,投资兴办实业(具体项目另行申报)；市场营销策划、投资咨询及其它信息咨询(不含人才中介服务、证券及限制项目)；供应链管理；资产管理、资本管理、投资管理(不得从事信托、金融资产管理、证券资产管理等业务)；道路普通货物运输；汽车租赁；总部管理。,王卫,深圳市,公司是国内领先的快递物流综合服务商，经过多年发展，已初步建立为客户提供一体化综合物流解决方案的能力，不仅提供配送端的高质量物流服务，还延伸至价值链前端的产、供、销、配等环节，以消费者需求出发，利用大数据分析和云计算技术，为客户提供仓储管理、销售预测、大数据分析、金融管理等一揽子解决方案。公司的物流产品主要包含：时效快递、经济快递、同城配送、仓储服务、国际快递等多种快递服务，物流普运、重货快运等快运服务，以及为生鲜、食品和医药领域的客户提供冷链运输服务。此外，公司还提供保价、代收货款等增值服务，以满足客户个性化需求。经过多年潜心经营和前瞻性战略布局，公司已形成拥有“天网+地网+信息网”三网合一、可覆盖国内外的综合物流服务网络。公司荣获中国物流与采购联合会“AAAAA”物流企业，中国物流与采购联合会“中国物流改革开放30年旗帜企业”，中国快递物流示范基地，十佳电子商务物流创新企业等荣誉。,sfir@sf-express.com,"主要业务:为客户提供仓储管理,销售预测,大数据分析,金融管理等一揽子解决方案.物流产品主要包含:时效快递,经济快递,同城配送,仓储服务,国际快递等多种快递服务,物流普运,重货快运等快运服务,以及为生鲜,食品和医药领域的客户提供冷链运输服务.",王卫,广东,441458.53,甘玲,20030522,www.sf-express.com,顺丰控股,2019,SZSE,SZSE,交通运输,31080,-,装卸搬运和其他运输代理,31080060,297125608000,1.58,-25.64,¥65.27,工业,310,0.02,882300,77846000,2.41,-43.88,-690000,-1.51,1.51,1.0,92.99,55.5,77.39,-15.66,2020-12-31T05:00:00Z,{4_trade_reduce},{trade_reduce} 43.88 %,2020Q4_1751857
002304,2020Q4_1751856,江苏省宿迁市洋河中大街118号,酒类的生产、销售，预包装食品的批发与零售，粮食收购，自营和代理各类商品和技术的进出口(国家限定公司经营或禁止进出口的商品和技术除外)，国内贸易，电子商务平台建设，商品的网上销售。,张联东,宿迁市,公司是国有大型酿酒企业，公司主导产品洋河大曲已有500多年的历史，早在明清时代就享有盛名。洋河大曲属浓香型大曲酒，以优质高粱为原料，以小麦、大麦、豌豆制成的高温火曲为发酵剂，辅以闻名遐迩的美人泉水精工酿制而成，形成了“甜、绵、软、净、香”的独特风格，被专家和广大消费者誉为浓香型大曲酒的正宗代表。“洋河”商标被国家工商总局评定为“中国驰名商标”，产品获“江苏省重点名牌产品”。全力打造的“绵柔型”白酒经典之作洋河蓝色经典，面市以来销售增长迅猛，“蓝色风暴”愈刮愈猛，“蓝色魅力”已征服了越来越多的白酒消费者，并已成为竞争激烈的白酒市场中颇受关注的成功营销范例。,yanghe002304@vip.163.com,"主营业务:洋河蓝色经典,洋河大曲,敦煌古酿等系列品牌浓香型白酒的生产,加工和销售",钟雨,江苏,150698.8,陆红珍,20021227,www.chinayanghe.com,洋河股份,2020,SZSE,SZSE,酒精饮料,20510,-,其他酒类,20510020,293542177000,32.14,-15.75,¥207.20,非周期性消费,205,0.06,889600,209948300,6.49,-44.41,-710800,-2.98,2.98,1.0,235.99,122.01,157.43,31.61,2020-12-31T05:00:00Z,{4_trade_reduce},{trade_reduce} 44.41 %,2020Q4_1751856
601336,2020Q4_1751918,北京市朝阳区建国门外大街甲12号新华保险大厦,1、人民币、外币的人身保险(包括各类人寿保险、健康保险、意外伤害保险)；2、为境内外的保险机构代理保险、检验、理赔等业务；3、保险咨询；4、依照有关法规从事资金运用业务；5、经中国保监会批准的其他业务。公司的经营范围以中国保监会批准和公司登记机关核准的项目为准。,李全,北京市,公司是一家全国性的大型寿险企业，目前拥有新华资产管理股份有限公司、新华家园养老企业管理(北京)有限公司等子公司。2011年，公司在中国香港联合交易所和上海证券交易所同步上市。公司建立了几乎覆盖全国各省、市、自治区的机构网络和多元化的销售渠道，为客户提供各类便捷、优质的人寿保险、健康保险、人身意外伤害保险及养老保险服务。公司围绕“转型发展”和“自主经营”两大主题，确定了以续期拉动增长的转型发展路径，并以预算管理为抓手，引导机构增强自主经营能力。通过环环相扣的系列举措，有效提升了经营管理水平，激发了健康、持续、快速发展的动力。,ir@newchinalife.com;kenneth.lee@tmf-group.com,"人民币,外币的人身保险(包括各类人身保险,健康保险,意外伤害保险);为境内外的保险机构代理保险,检验,理赔等业务;保险咨询;依照有关法规从事资金运用业务;经中国保监会批准的其他业务.目前,本公司在中国境内向个人和团体提供人寿保险,意外伤害保险和健康保险等产品与服务.同时,本公司还经营保险资产管理业务,主要通过本公司控股的资产管理公司进行.本公司设立以来,主营业务没有发生重大变化.",李全,北京,311954.66,龚兴峰,19960928,www.newchinalife.com,新华保险,2014,SHSE,SHSE,保险,10340,-,人身保险,10340010,115267662000,-0.35,-21.77,¥44.59,金融服务,103,0.02,508000,29450300,0.91,-49.6,-500000,-0.88,0.88,1.0,69.5,48.46,60.11,-25.82,2020-12-31T05:00:00Z,{4_trade_reduce},{trade_reduce} 49.60 %,2020Q4_1751918
600926,2020Q4_1751913,浙江省杭州市下城区庆春路46号,吸收公众存款；发放短期、中期和长期贷款；办理国内外结算；办理票据承兑与贴现；发行金融债券；代理发行、代理兑付、承销政府债券；买卖政府债券、金融债券；从事同业拆借；买卖、代理买卖外汇；从事银行卡业务；提供信用证服务及担保；代理收付款项及代理保险业务；提供保管箱服务；经中国人民银行批准，经营结汇、售汇业务；经银行业监督管理机构批准的其他业务。本行的经营范围最终以银行业监督管理机构核准的范围为准。,陈震山,杭州市,公司成立于1996年9月，自成立以来，始终坚持服务区域经济、中小企业和城乡居民的市场定位，致力于为客户提供专业、便捷、亲和的金融服务，经过多年的努力，现已发展成为一家资产质量良好、经营业绩优良、综合实力跻身全国城市商业银行前列的区域性股份制银行。近年来，公司获得了“最佳城市商业银行”、“最佳科技金融服务城商行”、“全国支持中小企业发展十佳商业银行”等荣誉。目前，公司正在积极应对利率市场化等带来的挑战，聚焦六大业务发展战略，发力六大能力提升战略，加快向“轻、新、精、合”的品质银行转型。,ir@hzbank.com.cn;xuguomin@hzbank.com.cn;wangzhisen@hzbank.com.cn,"主营业务:致力于为城乡中小企业与居民家庭提供专业,便捷,亲和,全面的金融服务.主要服务:公司金融业务,小微金融业务,零售金融业务,金融市场业务",宋剑斌,浙江,513020.04,徐国民,19960925,www.hzbank.com.cn,杭州银行,2017,SHSE,SHSE,银行,10320,-,区域性银行,10320020,79109949000,-10.55,-8.51,¥13.27,金融服务,103,0.05,2734700,40801700,1.26,-50.28,-2765300,-0.99,0.99,1.0,15.2,11.72,13.95,-4.87,2020-12-31T05:00:00Z,{4_trade_reduce},{trade_reduce} 50.28 %,2020Q4_1751913
600059,2020Q4_1751908,浙江省绍兴市北海桥,许可经营项目：黄酒、白酒、食用酒精(不含化学危险品)、调味料(液体)的制造、销售。一般经营项目：黄酒、白酒、饮料、食用酒精(不含化学危险品)、调味料(液体)、副食品及食品原辅料、玻璃制品的技术开发；玻璃制品的制造、销售；经营本企业或成员企业自产产品及相关技术出口业务；经营本企业或本企业成员企业生产科研所需原辅材料、机械设备、仪器仪表、零配件等商品及相关技术的进口业务；承办中外合资经营、合作生产及开展“三来一补”业务；房屋租赁、汽车租赁、机器设备租赁；陶、瓷制品的销售。(上述经营范围不含国家法律法规规定禁止、限制和许可经营的项目。),孙爱保,绍兴市,公司是我国最大的黄酒生产、经营、出口企业，拥有国内一流的黄酒生产工艺设备和全国唯一的省级黄酒技术中心，聚集多名国家级评酒大师，黄酒年生产能力11万吨。主要产品“古越龙山”、“沈永和”、“状元红”、“鉴湖”、“古纤道”牌绍兴酒是国家优质产品，多次荣获国际国内金奖，是中国首批原产地域保护产品。“古越龙山”是黄酒行业唯一集中国名牌、中国驰名商标、国宴专用黄酒于一身的品牌；具有300多年历史的“沈永和”老字号和“鉴湖”是浙江省著名商标。公司产品畅销全国各大城市，远销日本、东南亚、欧美等三十多个国家和地区，享有“东方名酒之冠”的美誉。,hjjt@shaoxingwine.com.cn;zjy@shaoxingwine.com.cn,"主要产品:绍兴加饭酒,绍兴元红酒,绍兴香雪酒,绍兴善酿酒和绍兴花雕酒等.",徐东良,浙江,80852.42,吴晓钧,19970508,www.shaoxingwine.com.cn,古越龙山,2017,SHSE,SHSE,酒精饮料,20510,-,其他酒类,20510020,11504284000,12.97,-25.75,¥12.43,非周期性消费,205,0.28,2563500,43605100,1.35,-62.44,-4262400,-1.59,1.59,1.0,17.25,8.87,11.26,10.39,2020-12-31T05:00:00Z,{4_trade_reduce},{trade_reduce} 62.44 %,2020Q4_1751908
300357,2020Q4_1751868,浙江省湖州市德清县武康镇志远北路636号,许可经营项目:生产销售变态反应原制品、体内诊断试剂。二类:医用化验和基础设备器具的销售。一般经营项目:研究开发口服脱敏药、生物及化学制剂药品、生物及化学医药原料、医药包装材料、保健食品以及研究开发上述产品所需的机械设备、仪器仪表；并提供相关技术咨询、技术服务；经营进出口业务。(上述经营范围不含国家法律法规规定禁止、限制和许可经营的项目。),胡赓熙,湖州市,公司是一家专业从事过敏性疾病诊断及治疗产品的研发、生产和销售的高科技生物制药企业。公司主营创新药物，拥有国际领先水平的生物制药技术。公司自主研发的产品曾获得国家高新技术产业化项目、省重点高新技术产品计划等项目支持。脱敏药物系列产品的开发，不仅给过敏患者带来安全有效的舌下脱敏治疗方式，更填补了舌下脱敏药物及过敏原皮肤点刺诊断试剂在国内市场的空白；同时公司已经启动了向全球各个主要经济地区成药出口的法律注册程序。,invest@wolwobiotech.com,"主营业务:研发,生产和销售变应原制品.主要产品包括“粉尘螨滴剂”(商品名:畅迪)和“粉尘螨皮肤点刺诊断试剂盒”(商品名:畅点).",胡赓熙,浙江,52358.4,胡赓熙,20020919,www.wolwobiotech.com,我武生物,2020,SZSE,SZSE,医药制造,20620,-,通用医药制造,20620010,35140685000,4.45,-13.39,¥70.69,医疗保健,206,0.02,100400,7698500,0.24,-66.58,-200000,-0.5,0.5,1.0,76.7,54.9,62.98,12.24,2020-12-31T05:00:00Z,{4_trade_reduce},{trade_reduce} 66.58 %,2020Q4_1751868
000568,2020Q4_1751849,四川省泸州市南光路泸州老窖营销网络指挥中心,酒类产品的生产、销售(白酒、葡萄酒及果酒、啤酒、其他酒等)。进出口经营业务；技术推广服务；发酵制品生产及销售；销售：汽车配件、建材及化工原料。,刘淼,泸州市,公司是具有400多年酿酒历史的国有控股上市公司。公司以专业化白酒产品设计、生产、销售为主要经营模式，主营“国窖1573”、“泸州老窖”等系列白酒的研发、生产和销售，主要综合指标位于白酒行业前列。公司实施“双品牌塑造，多品牌运作”的品牌战略，构建起五大战略单品的金字塔品牌结构：国窖1573定位为中国白酒超高端品牌是塔尖，百年泸州老窖窖龄酒、泸州老窖特曲定位为商务与宴会用酒第一品牌组成塔柱，泸州老窖头曲和二曲为大众市场覆盖的第一品牌构筑塔基，并积极拓展养生酒产品和预调酒产品，开展以消费者需求为主导的定制酒业务。公司坚持以“全心全意酿酒、一心一意奉献”为宗旨，敬人敬业，创新卓越，努力实现市场占有领先、公司治理领先、品牌文化领先、质量技术领先、人才资源领先，酿造世界最好的白酒，为客户提供最优质的服务，把泸州老窖建成全球酒类市场中的航空母舰，形成融入经济全球化的大型现代企业，追求“在中国灿烂名酒文化熏陶中，全人类共享幸福美满的生活”。,lzlj@lzlj.com;dsb@lzlj.com,主要产品:“泸州老窖”系列酒.,林锋,四川,146475.25,王洪波,19950503,www.lzlj.com,泸州老窖,2015,SZSE,SZSE,酒精饮料,20510,-,其他酒类,20510020,330221395000,-1.44,0.88,¥222.36,非周期性消费,205,0.01,181000,40936500,1.27,-71.94,-464100,-1.69,1.69,1.0,226.16,107.48,156.17,42.38,2020-12-31T05:00:00Z,{4_trade_reduce},{trade_reduce} 71.94 %,2020Q4_1751849
300601,2020Q4_1751870,广东省深圳市光明区马田街道薯田埔路18号,开发、生产经营乙肝疫苗及其它医用生物制品；进出口业务(具体按资格证书办理)；投资兴办医药项目及其它实业(具体项目另行申报)；医药技术开发、信息咨询服务、自有房屋、设备租赁服务(不含限制项目)；普通货运；货物专用运输(冷藏保鲜)。,杜伟民,深圳市,公司是一家集生物制品研发、生产、销售于一体的上市企业，中国主要的乙肝疫苗生产企业之一。公司主营业务为人用疫苗的研发、生产和销售，产品种类涵盖一类和二类疫苗，目前主要产品有重组乙型肝炎疫苗(酿酒酵母)、b型流感嗜血杆菌结合疫苗、麻疹风疹联合减毒活疫苗、无细胞百白破b型流感嗜血杆菌联合疫苗等产品。自成立以来，康泰生物承担了多项国家、省、市级重点科研项目及技术开发任务，已具备多联多价疫苗、基因工程疫苗等新技术研发及产业化核心竞争力。其中自主研发的无细胞百白破b型流感嗜血杆菌联合疫苗为国内独家创新的“四联疫苗”，专门针对无应答人群的60微克乙肝疫苗拥有“国家重点新产品”称号。通过多年的不懈努力，康泰生物已经发展成为研发品种齐全、产品线丰富、技术优势明显的国家级高新技术企业，在国家计划免疫战线上有着举足轻重的地位。,office@biokangtai.com,"主要产品:重组乙型肝炎疫苗(酿酒酵母)(10μg,20μg,60μg三种规格),b型流感嗜血杆菌结合疫苗,麻疹风疹联合减毒活疫苗,无细胞百白破b型流感嗜血杆菌联合疫苗等产品.主营业务;为人用疫苗的研发,生产和销售,",杜伟民,广东,68641.33,苗向,19920908,www.biokangtai.com,康泰生物,2017,SZSE,SZSE,医药制造,20620,-,专用医药制造,20620020,102401803000,13.05,-14.29,¥147.08,医疗保健,206,0.0,8200,1428500,0.04,-91.9,-93000,-0.6,0.6,1.0,247.49,133.99,180.27,-18.41,2020-12-31T05:00:00Z,{4_trade_reduce},{trade_reduce} 91.90 %,2020Q4_1751870
002475,2020Q4_1751948,广东省东莞市清溪镇北环路313号,生产经营连接线、连接器、电脑周边设备、塑胶五金制品。,王来春,深圳市,"公司是一家技术导向公司，公司专注于连接线、连接器的研发、生产和销售，产品主要应用于3C(计算机、通讯、消费电子)和汽车、医疗等领域。产品主要应用于3C(电脑、通讯、消费电子)、汽车和通讯等领域，核心产品电脑连接器已树立了优势地位，台式电脑连接器覆盖全球20%以上的台式电脑，并快速扩大笔记本电脑连接器的生产，公司已经开发出DP、eDP、USB3.0、ESATA等新产品，同时公司正逐步进入汽车连接器、通讯连接器和高端消费电子连接器领域，拓展新的产品市场,确立了自身的竞争优势。公司是USB、HDMI、SATA等协会的会员。公司拥有自主产品的核心技术和知识产权，已申请多项发明专利，实用新型专利及外观设计专利超过百项。后公司实验室通过国家认可委认证，并获“深圳市测试平台”称号。",David.Huang@luxshare-ict.com;Public@luxshare-ict.com;Ray.Li@luxshare-ict.com,"公司专注于连接器的研发,生产和销售,产品主要应用于3C(电脑,通讯,消费电子),汽车和通讯设备等领域.主要生产电脑连接器产品,包括台式电脑连接器及笔记本电脑连接器,并专注于生产附加价值高的电脑内部连接器.",王来春,广东,703542.64,黄大伟,20040524,www.luxshare-ict.com,立讯精密,2014,SZSE,SZSE,硬件,31120,-,电子元件,31120040,292233670000,26.58,-24.47,¥41.39,科技,311,0.0,0,0,0.0,-10000.0,-1388600,-2.84,2.84,1.0,61.99,49.81,55.11,-24.9,2020-12-31T05:00:00Z,{5_trade_sell},{trade_sell},2020Q4_1751948
002127,2020Q4_1751946,上海市杨浦区江湾城路99号尚浦中心3号楼7-10楼,从事互联网零售、对外贸易；对外投资、投资管理及咨询、企业管理信息咨询；电子商务技术支持及信息咨询、商务咨询、市场营销策划；会务服务，品牌设计，品牌管理，公关活动策划，文化艺术交流活动策划，企业形象策划，展览展示服务，摄影服务，文化教育信息咨询；农产品加工与销售；网络技术、信息技术及纺织技术的开发、转让、咨询及服务；质量管理咨询及技术服务；针纺织品、服装服饰、皮革制品、箱包、鞋帽、床上用品、工艺礼品、洗涤用品、宠物用品、化妆品、护肤用品、摄影器材、玩具、音响设备及器材、劳防用品、金属制品、家具、家用电器、厨房用品、通讯设备、电子产品、水处理净化设备、五金交电、文教用品、办公用品、服装面料、服装辅料的销售；预包装食品(不含冷藏冷冻食品)销售；设计、制作、代理、发布各类广告；软件研发。(依法须经批准的项目，经相关部门批准后方可开展经营活动),张玉祥,苏州市,公司原是以化纤纺丝、织造为主业，印染、服装、纺织助剂、贸易等多元发展的综合性股份制企业。2015年通过重大资产重组，公司将原有盈利能力较弱、未来增长乏力的织造业务出售，注入盈利能力较强、发展前景广阔的电商生态综合服务业务，公司主营业务转变为向千万家小微电商及供应商提供品牌授权服务、电商生态综合服务、柔性供应链园区服务，并经营货品销售业务。坚持“互联网思维颠覆传统”的理念，提供品牌授权服务，打造专业的电商生态综合服务平台、一站通柔性供应链平台，并积极开拓专业电商增值服务、O2O零售连锁终端业务和明星港商城市场。,nanjids@nanjids.com;shiyuting@nanjids.com;zhangyuxiang@nanjids.com,"主营业务:品牌综合服务业务,货品销售,园区平台服务业务,经销商品牌授权业务.",张玉祥,江苏,245487.04,张玉祥,19990712,www.nanjids.com,南极电商,2020,SZSE,SZSE,交互式媒体,30830,-,互联网和相关服务,30830010,29702190000,34.57,-9.89,¥11.99,通信服务,308,0.0,0,0,0.0,-10000.0,-3322300,-2.81,2.81,1.0,20.64,13.66,17.24,-30.45,2020-12-31T05:00:00Z,{5_trade_sell},{trade_sell},2020Q4_1751946
