symbol,_id,address,business_scope,chairman,city,descrpt,email,main_business,manager,province,reg_capital,secretary,setup_date,website,company,dividend_startyear,exchange,exchange_,group,groupcode,index_stockid,industry,industrycode,mktcap_norm_cny,pchange_12w,pchange_ytd,price,sector,sectorcode,share_percentage,shares,value,position,change,share_change,impact,abs_impact,split_factor,price_max,price_min,price_avg,change_from_average,portdate,action,comment,oid
003022,2020Q4_1749020,山东省枣庄市滕州市木石镇驻地(木石工业园区),先进高分子材料(具体为：乙烯-醋酸乙烯共聚物、聚丙烯、聚乙烯)、特种化学品(具体为：聚醚、减水剂母液(不含危险化学品)、表面活性剂及其延伸品)、环氧乙烷、乙烯、丙烯、丙烷、混合碳四、混合碳五、液氧、液氮、液氩、乙二醇、重醇、石膏、粗丁烷、粗戊烷、混合重烯烃、二乙二醇的研发、生产制造和销售；储罐租赁；经营本企业生产所需的相关设备的销售和进出口业务以及投资、投资管理、资产管理、化工技术推广服务。(依法须经批准的项目，经相关部门批准后方可开展经营活动)。,郑月明,枣庄市,公司是一家从事先进高分子材料及特种化学品的研发、生产与销售的高新技术企业。公司立足“以市场为导向、产销研一体化”的创新体系，现已建成国内领先的烷氧基化合成与应用实验室以及先进高分子材料研发实验室。经过多年的技术创新和生产实践，公司在先进高分子材料和特种化学品领域掌握了多项核心技术与核心生产工艺，拥有多项具有国际先进水平和国内领先水平的技术成果。截至本招股说明书签署之日，公司累计申请并获得发明专利15项，实用新型专利11项，正在申请的发明专利37项。报告期内，公司获评“高新技术企业”、“中国石油和化工民营企业百强”、“山东省化工新材料十强”、“山东省新材料领军企业50强”、“山东省企业技术中心”、“山东省特种精细化学品工程技术研究中心”等。公司为中国石化联合会新材料专业委员会副主任委员单位、中国科学院化工新材料技术创新与产业化联盟理事长单位，承担并参与了乙烯-醋酸乙烯酯(EVAC)树脂、混凝土外加剂用聚醚及其衍生物等多项新材料和新产品的国家和行业标准的起草和制订，为我国化工新材料行业的发展做出了积极贡献。,levima@levima.cn,"主要产品为聚丙烯专用料,乙烯-醋酸乙烯共聚物,环氧乙烷及环氧乙烷衍生物.",郑月明,山东,133556.8,蔡文权,20090521,www.levima.cn,联泓新科,0,SZSE,SZSE,化工,10130,-,化学制品,10130010,45941059000,48.76,195.98,¥33.55,基础材料,101,0.0,2990,35700.0,0.0,10000.0,2990,0.0,0.0,1.3,15.36,11.65,12.86,160.89,2020-12-31T05:00:00Z,{1_trade_buy},{trade_buy},2020Q4_1749020
688526,2020Q4_1749086,湖北省武汉市东湖新技术开发区高新二路419号,生物制品的开发、研制；动物传染病诊断咨询及技术服务；兽药生产、销售(凭许可证在核定期限内经营)；实验室仪器设备、化学生物试剂销售；货物进出口、技术进出口、代理进出口(不含国家禁止或限制进出口的货物或技术)。(依法须经批准的项目，经相关部门批准后方可开展经营活动)。,陈焕春,武汉市,公司是一家专注于兽用生物制品研发、生产、销售及动物防疫技术服务的生物医药企业。构建了兽用生物制品的完整产业链，完成了涵盖畜用疫苗、禽用疫苗、宠物疫苗等产品布局。目前可生产47个兽用生物制品类产品，也是国内少有的能同时提供猪伪狂犬病活疫苗和灭活疫苗的企业，能为生猪养殖企业提供猪伪狂犬病整套净化方案。以创始股东陈焕春院士、金梅林教授为首的160人自主研发技术团队，与华中农大、哈兽研等高校进行产学研合作。下游畜牧业发展带动疫苗需求增长，或使公司成为生猪产业生物安全防疫产品和技术服务的重要服务商。2017年销售收入在国内非国家强制免疫兽用生物制品、非国家强制免疫猪用生物制品市场中排名第二和第一。,wuhankqbio@kqbio.com,"兽用生物制品研发,生产,销售及动物防疫技术服务,主要产品是猪用疫苗和禽用疫苗.",陈慕琳,湖北,46500.0,陈慕琳,20010111,www.kqbio.com,科前生物,0,SHSE,SHSE,生物科技,20610,-,生物科技,20610010,15967734000,-12.28,-15.65,¥32.38,医疗保健,206,0.0,14600,573700.0,0.0,10000.0,14600,0.0,0.0,1.0,49.7,30.71,41.74,-22.42,2020-12-31T05:00:00Z,{1_trade_buy},{trade_buy},2020Q4_1749086
300925,2020Q4_1749058,广东省深圳市南山区西丽街道松坪山社区高新北六道15号昱大顺科技园B座1层-6层,一般经营项目：计算机软硬件、程序编制；互联网软件的技术开发、技术咨询、技术服务、技术转让；硬件嵌入式软件及系统周边的技术研发与系统集成、技术咨询；技术服务进出口；数据处理服务、企业管理服务；翻译咨询、翻译服务。许可经营项目：增值电信业务。,严华,深圳市,公司是一家致力于为客户提供专业的信息技术外包(ITO)服务的提供商。公司基于对信息技术的研究与开发，结合客户的业务场景，为客户在信息化和数字化进程中的不同需求提供软件技术外包服务。公司自设立以来，主营业务未发生重大变化。经过多年的研发技术积累、行业经验沉淀、组织管理优化和业务市场开拓，结合强有力的客户管理能力，公司已经与金融、互联网、软件、通信、房地产、航空物流、制造业、批发零售等多个行业的客户形成长期而稳定的合作关系。,zqtz@farben.com.cn,"公司基于对信息技术的研究与开发,结合客户的业务场景,为客户在信息化和数字化进程中的不同需求提供软件技术外包服务.",严华,广东,22009.92,黄照程,20061108,www.farben.com.cn,法本信息,0,SZSE,SZSE,软件,31110,-,软件和信息技术服务,31110010,5436166000,16.57,-7.54,¥24.36,科技,311,0.0,5950,162700.0,0.0,10000.0,5950,0.0,0.0,1.7,31.18,27.71,29.44,-17.26,2020-12-31T05:00:00Z,{1_trade_buy},{trade_buy},2020Q4_1749058
300917,2020Q4_1749054,广东省深圳市福田区香蜜湖街道侨香路1010号特发文创广场五楼,一般经营项目：物业管理；水电工程；国内贸易；经济信息咨询；房地产经纪；为酒店提供管理服务；汽车零配件及汽车饰品的购销；自有物业租赁；园林绿化服务；绿化养护服务；花卉租摆；清洁服务；从事物业管理范围内的二次供水设施清洗消毒业务；建筑工程；投资兴办实业(具体项目另行申报)；经营电子商务。许可经营项目：游泳池经营；停车场经营；劳务派遣；餐饮服务；人力资源输出；人力资源开发与管理咨询；人才资源培训服务；企业人才的交流咨询；人力资源服务外包；人力资源管理软件；垃圾清运；道路清扫；园林设计；市政工程管理；“四害”防治；白蚁防治；环境消杀服务。,陈宝杰,深圳市,公司一直以综合设施管理服务为核心业务，致力于成为中国高端物业服务品牌供应商。公司所从事的服务内容包括综合设施管理、空间管理、安全保障、环境管理、高端接待、会议服务等，管理的项目涵盖高新科技园区、商业综合体、政府机关、学校、住宅等多种类型，主要客户包括华为、阿里巴巴、中国移动、国家电网等知名企业。公司相关业务已从珠三角经济圈辐射至国内的环渤海经济圈、长三角经济圈、西南经济圈、华中城市经济圈及海外的非洲等地。近年来，公司在提供物业管理服务的同时，还陆续拓展了政务服务、资产经营等业务，设立了特发楼宇、特发政务、特发商务、特发资产经营等子公司。凭借优质的服务质量，公司与主要客户建立了长期、稳定的服务关系。报告期内，公司多次受到核心客户及行业协会等相关单位的嘉奖，具体情况如下：2018年度深圳市物业管理行业协会优秀企业、2017年物业服务百强企业、中国企业信用评价AAA等。,sdgs@tefafuwu.com,"公司所从事的服务内容包括综合设施管理,空间管理,安全保障,环境管理,高端接待,会议服务等,管理的项目涵盖高新科技园区,商业综合体,政府机关,学校,住宅等多种类型.",崔平,广东,13000.0,陈宝杰,19930531,www.tefafuwu.com,特发服务,0,SZSE,SZSE,房地产,10410,-,房地产服务,10410020,3331872000,-8.92,-16.55,¥25.77,房地产,104,0.0,390,9000.0,0.0,10000.0,390,0.0,0.0,1.3,41.48,29.92,34.39,-25.07,2020-12-31T05:00:00Z,{1_trade_buy},{trade_buy},2020Q4_1749054
688686,2020Q4_1749092,广东省东莞市长安镇锦厦社区河南工业区锦升路8号,研发、产销：自动化系统、自动化软件、机器配件、影像系统、工业控制设备；货物进出口、技术进出口。(依法须经批准的项目，经相关部门批准后方可开展经营活动),卢治临,东莞市,公司是我国国内较早进入机器视觉领域的企业之一。在成立之初，以机器视觉核心部件中的光源产品为突破口，奥普特进入了当时主要为国际品牌所垄断的机器视觉市场。在十几年的发展过程中，公司坚持“深耕优势、以点带面、以面促点、逐个突破”的发展路径，将产品线逐步拓展至其他机器视觉部件，现已经形成覆盖机器视觉系统主要部件的产品体系。同时，奥普特以产品核心技术为基础，建立了成像和视觉分析两大技术平台，结合多年积累的机器视觉在各下游行业应用的专有技术(Know-How)，形成了多层次的技术体系。以此为基础，公司能够向下游客户提供各种机器视觉解决方案，协助客户在智能装备中实现视觉功能，提高机器视觉系统的准确性、稳定性和可靠性，从而带动公司产品的销售。公司提供的机器视觉产品已广泛应用于各类高端装备中，服务于3C电子、新能源、半导体、汽车、医药及食品加工等多个行业及一些科研教学等领域，并得到苹果、富士康、欧姆龙、安世半导体、安费诺、博世、大族激光等世界500强、中国500强和行业龙头企业的认可。,info@optmv.com,"主要生产和销售的产品包括光源,光源控制器,镜头,相机,视觉控制系统等机器视觉核心软硬件,并通过向下游客户提供专业的机器视觉解决方案带动产品的销售.从事机器视觉核心软硬件产品的研发,生产和销售.",卢治临,广东,8247.57,许学亮,20060324,www.optmv.com,奥普特,0,SHSE,SHSE,硬件,31120,-,电子元件,31120040,27773224000,36.12,60.52,¥327.93,科技,311,0.0,2300,505100.0,0.0,10000.0,2300,0.0,0.0,1.0,216.8,216.8,216.8,51.26,2020-12-31T05:00:00Z,{1_trade_buy},{trade_buy},2020Q4_1749092
300918,2020Q4_1749055,山东省烟台市龙口市东江镇南山工业园,高档织物面料的纺、织染及后整理加工和服装、服饰研发、生产(不含国家纺织品配额管理的商品)，羊毛洗毛、制条；特种劳动防护用品(防静电服、酸碱类化学品防护服、阻燃服)的生产；并销售及网上经营公司上述所列自产产品；新材料科技开发、技术开发、技术推广、技术转让；企业管理服务；国内展览展销服务；货物及技术的进出口业务(国家限定或禁止的除外)；仓储服务(不含危险化学品)；纺织原料与纺织品的检测检验。(依法须经批准的项目，经相关部门批准后方可开展经营活动),赵亮,烟台市,公司集纺织服饰智能制造与品牌运营为一体，主营业务为精纺呢绒及正装职业装的研发、设计、生产与销售。公司拥有完善的毛纺织服饰产业链，涵盖了集面料研发、毛条加工、染色、纺纱、织造、后整理于一体的精纺呢绒业务体系，以及集成衣研发、设计、制造、品牌运营于一体的服装业务体系。公司为国内精纺呢绒、正装职业装领军企业，“南山”牌精纺呢绒、“缔尔玛”牌职业装先后被国家工商总局认定为中国驰名商标。公司为精梳毛机织物单项冠军示范企业，“缔尔玛”牌职业装先后获评“中国职业装十大顶级品牌”、“中国服装成长品牌”。公司是国家级高新技术企业、中国纺织工业联合会认定的纺织技术创新示范企业，公司检测中心是中国合格评定国家认可委员会认可的实验室。公司凭借自身的科技实力与市场影响力，多次参与制定了纺织领域国家及行业技术标准。截至本招股说明书签署日，公司已形成专利71项，其中发明专利24项，获得山东省科技进步奖3次、中国纺织行业专利奖优秀奖2次。,zhaohoujie@nanshan.com.cn;rfzzqb@nanshan.com.cn,"主营业务为精纺呢绒及正装职业装的研发,设计,生产与销售.",赵亮,山东,36000.0,赵厚杰,20070429,www.nanshanchina.com,南山智尚,0,SZSE,SZSE,服饰加工,10240,-,纺织加工,10240010,3556793000,-14.77,-16.2,¥9.84,周期性消费,102,0.0,1100,9500.0,0.0,10000.0,1100,0.0,0.0,1.0,17.6,11.91,14.08,-30.11,2020-12-31T05:00:00Z,{1_trade_buy},{trade_buy},2020Q4_1749055
688513,2020Q4_1749085,四川省成都市高新区西源大道8号,生产：硬胶囊剂、片剂、片剂(抗肿瘤类)、小容量注射剂、冻干粉针剂、精神药品、颗粒剂、散剂；生物及化学技术咨询；生物技术开发服务；医药技术研发；医药技术咨询；医药技术转让；医药技术服务；信息咨询(投资咨询、中介服务除外)；企业管理咨询；货物、技术进出口(国家禁止或涉及行政审批的货物和技术进出口除外)。(依法须经批准的项目，经相关部门批准后方可开展经营活动)。(凭药品生产许可证在有效期内经营)。,王颖,成都市,"公司是一家以化学原料药和化学药制剂的研发、生产与销售为主营业务的国家级高新技术企业。具备注射液、冻干粉针剂、片剂、胶囊剂等多种剂型和化学原料药的生产能力，涵盖抗肿瘤、心血管、消化、麻醉镇痛、儿童用药等重点领域。并已布局生物药领域,公司专注于高端化学药的研发、生产与销售。公司拥有多项市场占有率排名靠前的产品，包括乌苯美司胶囊，布洛芬注射液等。公司通过销售原料药给化学制剂制造商，以及销售化学制剂产品给医疗机构及零售终端盈利。公司研发体系完善，核心技术突出，产品储备丰富，市场竞争力强。公司形成了化学原料药和制剂一体化的研发生产能力，质量成本优势明显。并且拥有覆盖全国的营销网络，并与深耕区域市场的经销商建立了战略合作关系。",ydsw@eastonpharma.cn,"化学原料药和化学药制剂的研发,生产与销售",袁明旭,四川,12009.0,王武平,20090601,www.eastonpharma.cn,苑东生物,0,SHSE,SHSE,生物科技,20610,-,生物科技,20610010,5362118000,4.51,-5.02,¥44.90,医疗保健,206,0.0,3800,177900.0,0.0,10000.0,3800,0.0,0.0,1.0,74.72,46.55,54.14,-17.07,2020-12-31T05:00:00Z,{1_trade_buy},{trade_buy},2020Q4_1749085
688699,2020Q4_1749094,广东省深圳市南山区高新技术产业园南区高新南一道015号国微研发大楼三层,一般经营项目是：集成电路的生产；集成电路及相关电子应用产品、电子信息产品的设计、技术开发和相关技术服务(不含限制项目)；国内商业、物资供销业(不含专营、专控、专卖商品)；经营进出口业务(须取得主管部门的资格证书后方可经营)。,王乐康,深圳市,"公司是一家主要从事集成电路研发设计、封装测试和销售的高新技术企业。公司一直专注于数模混合及模拟集成电路领域，产品主要包括LED显示驱动芯片、LED照明驱动芯片、电源管理芯片等，产品广泛应用于LED显示屏、智能景观、照明、家电等领域,公司自主研发的恒流精度控制技术、SM-PWM协议控制技术、LED状态侦测技术、消除耦合技术、OUT开关时序控制技术、消影技术、节能控制技术、高压自启动和供电技术、线性全电压驱动技术、开关调光调色技术、并联写码技术、自适应设置芯片参数技术、恒功率控制技术、多段开关控制技术、可控硅检测技术等多项技术具有显著优势，在集成电路领域竞争实力突出。公司拥有一个省级工程技术中心、一个省部级产学研基地和一个市级工程实验室，自成立以来获得了“国家知识产权优势企业”、“国家级高新技术企业”、“国家规划布局内重点集成电路设计企业”、“广东省知识产权示范企业”、“广东省知识产权优势企业”、“广东省创新型企业”、“广东省软件和集成电路设计产业百强培育企业”等荣誉。",ir@chinaasic.com,"主要从事集成电路研发设计,封装测试和销售,产品主要包括LED显示驱动芯片,LED照明驱动芯片,电源管理芯片等,产品广泛应用于LED显示屏,智能景观,照明,家电等领域.",李照华,广东,7436.8,郭王洁,20031030,www.chinaasic.com,明微电子,0,SHSE,SHSE,硬件,31120,-,电子元件,31120040,23271446000,275.14,490.36,¥334.73,科技,311,0.0,1900,84600.0,0.0,10000.0,1900,0.0,0.0,1.0,71.11,54.01,59.66,461.06,2020-12-31T05:00:00Z,{1_trade_buy},{trade_buy},2020Q4_1749094
605068,2020Q4_1749071,浙江省嘉兴市南湖区大桥镇明新路188号,一般项目：新材料技术研发；皮革制品制造、皮革制品销售；塑料制品制造、塑料制品销售(除依法须经批准的项目外，凭营业执照依法自主开展经营活动)许可项目：货物进出口(依法经批准的项目，经相关部门批准后方可开展经营活动，具体经营项目以审批结果为准)。,庄君新,嘉兴市,公司是一家专注于汽车革研发、清洁生产和销售的高新技术企业。公司自设立以来一直专注于汽车革业务，经过不断的技术研究、新品开发和市场拓展，采用绿色制革技术，生产出一系列符合安全环保要求且舒适美观的汽车内饰用天然皮革，形成了从材料研究、工艺开发、清洁生产到销售推广和终端应用的汽车革一体化业务体系。截目前，公司已进入美国Chrysler、德国大众、法国PSA等国际主流车厂和一汽大众、上汽通用、上汽大众、神龙汽车、上汽通用五菱、广汽菲亚特、吉利、长城、长安、宝沃、比亚迪、奇瑞、一汽轿车、广汽等国内主流整车制造企业供应商体系，并与麦格纳(墨西哥)、富维安道拓、延锋安道拓、国利真皮饰件、吉中汽车内饰、李尔、奥托立夫、延锋百利得等国内外知名汽车一级零部件供应商保持长期合作，为整车制造商及其配套企业供应高品质的汽车内饰真皮。公司已成功为T-ROC(德国大众)、RT Minivan(美国Chrysler)、宝来、速腾、奥迪Q3、奥迪Q5L、探岳、探歌、传祺、高尔夫嘉旅、帝豪、博越、VV5(长城)、秦(比亚迪)、昂科拉、科帕奇等国内外多款主流车型批量供货，并已成为上述主流整车制造企业多款新车型定点供应商。,mxauto@mingxinleather.com,"主要产品为汽车内饰皮革,专注于汽车革研发,清洁生产和销售",庄君新,浙江,16600.0,胥兴春,20051207,www.mingxinleather.com,明新旭腾,0,SHSE,SHSE,汽车和配件,10200,-,汽车配件,10200030,5586374000,1.87,4.1,¥32.83,周期性消费,102,0.0,600,21100.0,0.0,10000.0,600,0.0,0.0,1.0,44.41,32.51,36.28,-9.51,2020-12-31T05:00:00Z,{1_trade_buy},{trade_buy},2020Q4_1749071
300922,2020Q4_1749057,河北省秦皇岛市海港区经济技术开发区雪山路5号,机电设备、电子专用设备生产与技术开发、打印机、海水淡化设备、水处理及环保专用设备、金属及非金属材料、复合材料的技术开发、技术咨询、技术服务、技术转让与生产；塑料制品、金属制品、复合材料制品及包装制品、计算机辅助设备的技术开发与生产、销售；打印机用墨水、墨粉、墨盒、硒鼓、打印丝的生产；模具设计、制造及维修、机械零配件的生产；水处理工程设计及施工；计算机外围设备、办公用机械、其他化工产品、五金产品、建材的销售；货物及技术进出口；帐篷及附属设备、睡袋、充气垫、饮水囊、软体储水罐、携行具、野营装备、伪装网、防护伪装器材、体育用品及器材、救生衣、救生圈、家具、货架、安防用具、取暖炉、机械零部件、箱包、冲锋舟配件、油桶、滑油注入器、无人机配件、金属箱的加工、设计、销售；金属丝绳及其制品、绳、索、缆制造、销售；计算机及软件、计算机辅助设备、电子产品、通讯终端设备、其他机械设备、发电机及发电机组、装卸搬运设备、通风除湿设备的销售；安全技术防范系统的设计、安装、维修；消防工程**(依法须经批准的项目，经相关部门批准后方可开展经营活动),宋金锁,秦皇岛市,公司立足防护装置的研发制造，始终坚持自主创新和高端制造的发展战略，积极响应国家“中国制造2025”、“军民融合”等战略规划，公司主要从事以高分子复合材料的新型加工和应用技术为核心的军用防护装置及装备零部件的研发、生产和销售，系军品防护领域的核心供应商，发行人所属行业为国家重点扶持的战略新兴产业。报告期内，公司主要收入来源于军品，主要产品及服务包括专用防护装置、装备零部件、技术服务及其他等，其中专用防护装置是公司最主要的产品。公司产品不仅广泛服务于陆、海、空及火箭军等多军种军工装备领域，也可应用于民用防护领域，属军民两用产品。公司为国家高新技术企业，且已获得军方及行业主管部门对从事军工配套业务相关的许可和认证。2015年，凭借对多项大口径弹药防护装置的技术攻关，公司被河北省国防科学技术协会、河北省兵工协会评为“兵工行业先进单位”；2016年，凭借公司研发团队多年的科研成果及公司整体在国防科技工业协作配套工作中的贡献，获得河北省总工会授予的“河北省五一劳动奖章”。,qhdtqgs@163.com,"主要从事高性能工程塑料及其制品,树脂基复合材料及其制品的设计,开发,生产与销售;主要产品包括专用防护装置和装备零部件.",张澎,河北,11200.8,王素荣,19960321,www.tianqin.net.cn,天秦装备,0,SZSE,SZSE,化工,10130,-,特种化学制品,10130020,3675734000,-8.29,-14.94,¥34.70,基础材料,101,0.0,300,9100.0,0.0,10000.0,300,0.0,0.0,1.0,40.32,35.8,38.07,-8.85,2020-12-31T05:00:00Z,{1_trade_buy},{trade_buy},2020Q4_1749057
003029,2020Q4_1749023,吉林省长春市高新区博才路与学府街交汇栖乐荟写字楼10号楼15-17层,电子计算机及计算机网络的技术开发技术服务，经销电子计算机及配件、文化办公机械、机房装修(经营范围中未取得专项审批许可的项目除外)；自营和代理各类商品及技术的进出口业务(国家规定的专营进出口商品和国家禁止进出口等特殊商品除外)；技术咨询，计算机系统集成，建筑智能化工程、综合布线工程，信息安全工程，安防监控工程(以上各项凭资质证书经营)(依法须经批准的项目，经相关部门批准后方可开展经营活动),于逢良,长春市,"公司是国内知名的信息安全产品、服务及解决方案提供商，是电子认证领域的领先企业。公司以密码技术为核心，开展信息安全软件的研发、生产和销售及服务，面向政府、军队、军工、金融、能源、电信等重点行业和领域提供基于密码的可信身份认证及可信数据保障等多层次、全方位的综合性安全解决方案，为其信息系统提供关键的安全支撑与保障。公司通过持续技术研发，公司积累了数字证书、数字加密、数字签名、身份认证、访问控制等关键技术，实现了电子认证领域的多项突破，为云计算、大数据、物联网、移动互联、智能计算等领域提供安全技术支撑与保障。公司是国家高新技术企业、国家火炬计划软件产业基地骨干企业，是国家信息安全行业电子认证领域诸多重要科研课题及产业化项目的主要承担者之一，公司自成立以来曾经为40个以上中央国家机关及部委提供信息安全解决方案或服务，承担了1,000多个国内知名的大中型信息化项目的安全支持与保障工作，包括国家“金盾工程”、“金财工程”、“金水工程”、“金质工程”等金字工程及北京2008奥运会、“天宫一号”、“神州九号”、“神州十号”等众多具有重大社会、政治影响的大型项目。",ir@jit.com.cn,"以密码技术为核心,开展信息安全软件的研发,生产和销售及服务",王连彬,吉林,18040.0,张凤阁,19990212,www.jit.com.cn,吉大正元,0,SZSE,SZSE,软件,31110,-,软件和信息技术服务,31110010,4574818000,-9.37,-2.23,¥24.70,科技,311,0.0,700,18700.0,0.0,10000.0,700,0.0,0.0,1.0,26.14,16.23,20.87,18.35,2020-12-31T05:00:00Z,{1_trade_buy},{trade_buy},2020Q4_1749023
