symbol,_id,address,business_scope,chairman,city,descrpt,email,main_business,manager,province,reg_capital,secretary,setup_date,website,company,dividend_startyear,exchange,exchange_,group,groupcode,index_stockid,industry,industrycode,mktcap_norm_cny,pchange_12w,pchange_ytd,price,sector,sectorcode,share_percentage,shares,value,position,change,share_change,impact,abs_impact,split_factor,price_max,price_min,price_avg,change_from_average,portdate,action,comment,oid
300872,2020Q4_1749033,北京市朝阳区阜通东大街1号院3号楼9层2单元121005,软件技术开发、技术转让、技术咨询、技术服务；计算机系统服务；数据处理(数据处理中的银行卡中心、PUE值在1.5以上的云计算数据中心除外)；销售自行开发后的计算机软件产品；销售计算机软硬件及配件；计算机及配件的售后服务；计算机软硬件开发；计算机系统集成；计算机设备租赁。【依法须经批准的项目，经相关部门批准后方可经营该项目】,欧阳建平,拉萨市,公司专注为金融行业客户提供IT解决方案和服务，是金融IT业内颇具规模、成长最快、最具活力和创新精神的企业之一。基于金融IT和业务创新能力，公司正致力于成为国内领先的金融综合服务提供商，提供金融IT服务、金融信息服务和金融运营服务。公司从2003年创立以来，为央行和政策性银行、国有商业银行、股份制商业银行和地方性商业银行等近百家金融客户提供咨询、开发、测试、运维和系统集成等应用于全生命周期的服务。源于客户的业务创新和管理创新需求，公司在专业测试、对公金融(包括信贷、供应链金融、互联网金融、贸易金融和资金监管等)、商业智能与大数据应用、风险管理(信用风险、操作风险和市场风险)、信用卡、协同应用等专业领域研发了多种解决方案，在开发、测试和运行管理领域研发了业内领先的基础技术架构产品，积累了丰富的行业业务、IT技术知识、IT应用解决方案和专业服务人才。公司已拥有了一批优质、稳定的核心战略客户，同时公司也在积极拓展新客户，进一步完善客户和区域布局，创造新的业绩增长点。目前公司已经为两百多家银行客户提供了相关产品和服务，在行业内拥有较高的品牌声誉。,ir@tansun.com.cn,"公司是一家金融业IT解决方案及服务提供商,主要向以银行为主的金融机构提供IT解决方案,咨询服务,专业测试服务,运维服务和系统集成服务.",欧阳建平,西藏,22468.2,张庆勋,20030709,www.tansun.com.cn,天阳科技,0,SZSE,SZSE,软件,31110,-,软件和信息技术服务,31110010,8247458000,4.47,-5.37,¥36.09,科技,311,0.0,900,33000.0,0.0,10000.0,900,0.0,0.0,1.0,82.0,37.36,49.27,-26.75,2020-12-31T05:00:00Z,{1_trade_buy},{trade_buy},2020Q4_1749033
605179,2020Q4_1749074,浙江省温州市平阳县一鸣工业园,一般项目：家用电器销售；日用品销售；厨具卫具及日用杂品批发；玩具销售；塑料制品销售；印刷专用设备制造；塑料加工专用设备制造(除依法须经批准的项目外，凭营业执照依法自主开展经营活动)。许可项目：食品生产；食品经营；食品互联网销售；餐饮服务；包装装潢印刷品印刷；特定印刷品印刷(依法须经批准的项目，经相关部门批准后方可开展经营活动，具体经营项目以审批结果为准)。,朱立科,温州市,公司主要从事新鲜乳品与烘焙食品的研发、生产、销售及连锁经营业务。其中，乳品主要包括低温巴氏杀菌乳、风味发酵乳、低温调制乳及蛋奶、热奶等特色乳饮品，烘焙食品包括各式短保质期的面包、米制品、中式糕点等。公司产品以“新鲜、健康、营养”为定位，乳品保质期通常在15天以内、烘焙食品保质期通常在3天以内，公司产品主要通过“一鸣真鲜奶吧”专业食品连锁门店进行销售。公司以“新鲜健康的食品、真诚永远的服务”为品牌理念，始终专注于各式新鲜乳品与烘焙食品的研发、制造与销售，以及奶吧连锁经营模式的探索与升级。以“牛奶+面包”的“营养早餐”为起点，公司逐步增加各式鲜牛奶、风味酸奶、三明治等产品，如先后开发了满足营养需求的“真鲜蛋奶”、适于国人温热饮食习惯的“热奶”及可加热饮用的“温酸奶”等畅销创新产品。未来，公司将通过在特种菌株上的基础研发、微生物发酵技术上的工艺改良、饮食口味上的产品创新，持续推出新鲜、健康、营养并满足消费升级饮食需求的新产品。,82091418@qq.com;1009363539@qq.com;inmfood@yi-ming.cn,"主要从事新鲜乳品与烘焙食品的研发,生产,销售及连锁经营业务.其中,乳品主要包括低温巴氏杀菌乳,风味发酵乳,低温调制乳及蛋奶,热奶等特色乳饮品,烘焙食品包括各式短保质期的面包,米制品,中式糕点等.",朱立科,浙江,40100.0,林益雷,20050913,www.inm.cn,一鸣食品,0,SHSE,SHSE,农副加工食品,20525,-,加工食品,20525040,6941387000,-13.4,-0.85,¥17.17,非周期性消费,205,0.0,900,16600.0,0.0,10000.0,900,0.0,0.0,1.0,17.66,14.59,16.1,6.65,2020-12-31T05:00:00Z,{1_trade_buy},{trade_buy},2020Q4_1749074
300919,2020Q4_1749056,贵州省铜仁市玉屏侗族自治县大龙经济开发区2号干道与1号干道交汇处,法律、法规、国务院决定规定禁止的不得经营；法律、法规、国务院决定规定应当许可(审批)的，经审批机关批准后凭许可(审批)文件经营;法律、法规、国务院决定规定无需许可(审批)的，市场主体自主选择经营。(新材料、电池及新能源的研发、生产、加工与销售，从事货物及技术的进出口业务。),邓伟明,铜仁市,公司主要从事锂电池正极材料前驱体的研发、生产、加工及销售，主要产品包括三元前驱体、四氧化三钴，分别用于生产三元正极材料、钴酸锂正极材料。三元正极材料、钴酸锂正极材料进一步加工制造成锂电池，最终应用于新能源汽车、储能及消费电子等领域。公司所属产业为战略性新兴产业。为进一步增强锂电池正极材料前驱体主要原材料的保障能力，公司向产业链上游延伸，已形成了镍、钴中间品湿法加工硫酸镍、硫酸钴以及锂离子电池循环回收产能，与前驱体产业形成了良好的产业链协同优势。公司凭借优异的技术研发实力、严苛的品质管控要求、快速的产业化能力，前驱体产销量稳居全球前三，与LG化学、厦门钨业、当升科技、振华新材、天津巴莫、北大先行等国内外一流正极材料客户建立了稳定合作关系。,cngrir@cngrgf.com.cn,"主要从事锂电池正极材料前驱体的研发,生产,加工及销售,主要产品包括三元前驱体,四氧化三钴,分别用于生产三元正极材料,钴酸锂正极材料.",邓伟明,贵州,56965.0,廖恒星,20140915,www.cngrgf.com.cn,中伟股份,0,SZSE,SZSE,化工,10130,-,特种化学制品,10130020,81834653000,77.03,79.43,¥152.00,基础材料,101,0.0,600,37500.0,0.0,10000.0,600,0.0,0.0,1.0,86.12,73.25,80.15,89.64,2020-12-31T05:00:00Z,{1_trade_buy},{trade_buy},2020Q4_1749056
300889,2020Q4_1749040,广东省深圳市宝安区松岗街道松岗大道11号健仓科技园一栋,从事LED点光源、LED日光灯、灯光控制器的生产、研发和销售；从事光电产品、太阳能产品、电子产品、半导体、智能控制系统及软件的生产、研发和销售；智能化控制系统、智能照明、软件、计算机领域内的技术研发、咨询、服务；市政工程、园林绿化工程施工；城市及道路照明工程专业承包、智能化工程专业承包；照明工程设计、照明技术的开发；房屋租售、国内贸易(不含专营、专卖、专控商品)；经营进出口业务(法律、行政法规、国务院决定禁止的项目除外，限制的项目须取得许可后方可经营)。,谢明武,深圳市,公司是从事景观照明智能控制系统及LED景观照明灯具的研发、生产和销售的国家级高新技术企业，公司始终以客户需求为导向，致力于为客户提供稳定可靠的LED景观照明产品。公司专注于景观照明领域的技术研发、产品设计与生产制造，在智能控制系统和景观照明产品领域具备较强的产品开发和制造能力，能够满足客户大规模的定制化需求，已成为国内大型景观照明项目所需产品的核心供应商之一。公司产品成功应用于国内诸多大型城市整体亮化项目，包括深圳改革开放40周年庆典主题灯光秀项目、青岛上合组织峰会主题灯光秀项目、厦门金砖会议主题灯光秀项目、杭州G20峰会钱江新城主题灯光秀项目、武汉两江四岸长江灯光秀项目等。公司已被认定为广东省景观LED工程技术研究中心。公司产品被认定为广东省名牌产品，产品通过了CCC认证、CE认证、CQC认证及ROHS认证。,exc@exc-led.com,"从事景观照明智能控制系统及LED景观照明灯具的研发,生产和销售,主要产品为景观照明智能控制系统和LED景观照明灯具系列产品.",张锋斌,广东,15600.0,陈永建,20090918,www.exc-led.com,爱克股份,0,SZSE,SZSE,硬件,31120,-,电子元件,31120040,3528428000,-17.63,-27.32,¥22.39,科技,311,0.0,500,14400.0,0.0,10000.0,500,0.0,0.0,1.0,64.15,30.53,40.96,-45.34,2020-12-31T05:00:00Z,{1_trade_buy},{trade_buy},2020Q4_1749040
300887,2020Q4_1749039,北京市海淀区锦带路66号院1号楼4层至5层101,"技术开发、技术推广；技术检测；检验、检疫、验货、医疗器械检验的技术服务；计量服务；计量仪器与设备的技术咨询；货物进出口、技术进出口、代理进出口；环境监测；计算机技术培训；出租商业用房；出租办公用房；技术咨询、技术交流；清洁服务；认证服务；货物专用运输(冷藏保鲜)(道路运输经营许可证有效期至2021年09月11日)。(市场主体依法自主选择经营项目,开展经营活动；依法须经批准的项目,经相关部门批准后依批准的内容开展经营活动；不得从事国家和本市产业政策禁止和限制类项目的经营活动。)。",张英杰,北京市,公司是大型综合性检测机构，具备为客户提供综合化、一站式检测服务的能力，检测报告得到美国、英国、德国等71个国家和地区互认，具有国际公信力。公司可提供的检测服务范围涵盖健康与环保、贸易符合性、商品质量鉴定及安全保障等四大领域，涉及农林牧渔业，食品医药业，采矿业，制造业，电力、燃气及水的生产和供应业，建筑业，交通运输业，住宿和餐饮业，水利、环境和公共设施管理业等众多行业。公司为宝洁、摩托罗拉、三星、戴尔、可口可乐、肯德基、麦当劳等众多国际知名企业提供检测服务。公司是中国电子信息产品污染防治标准工作组成员，参与了多项国内RoHS检测方法、国家标准及行业标准的制定及修订工作，连续四年荣膺德勤“高科技、高成长中国50强”及“亚太区高科技、高成长500强”。,IR@ponytest.com,"主营业务为:检验检测,计量,认证及相关技术服务,业务范围涵盖健康与环保,电子及安规,消费品质量鉴定,安全保障等.",张英杰,北京,13680.0,李小冬,20020610,www.ponytest.com,谱尼测试,0,SZSE,SZSE,商业服务,31020,-,特种商业服务,31020010,10978843000,56.33,87.04,¥81.15,工业,310,0.0,360,15600.0,0.0,10000.0,360,0.0,0.0,1.8,65.72,42.11,53.06,52.94,2020-12-31T05:00:00Z,{1_trade_buy},{trade_buy},2020Q4_1749039
300900,2020Q4_1749049,黑龙江省哈尔滨市哈南工业新城核心区哈南三路3号,飞机部段、飞机零部件、飞机内饰、飞机机载设备和地随设备、燃气轮机零部件、卫星零部件、工业机器人、机械电气设备、自动化装备、自动化系统和自动化生产线的开发、生产、销售、维修及相关技术服务；工艺装备、模具、夹具和复合材料制品的开发、生产、销售、维修及相关技术服务；机械零部件的开发、生产、销售、维修及相关技术服务；机械加工、钣金、金属表面处理及热处理加工；飞机、飞机发动机、航天器、航天器零部件及相关设备的设计、制造、维修、加装、改装、销售及相关技术服务（取得相关许可或资质后方可经营）；船舶、船用配套设备、航标器材的设计、制造、维修、改装、销售及相关技术服务（以上涉及国家禁止产能过剩的项目除外）；自有房屋租赁；计算机软件开发及相关技术服务；技术咨询、技术开发、技术服务、技术推广及技术转让；货物进出口、技术进出口。民用航空器制造及维修。,王增夺,哈尔滨市,公司是专业从事航空工业相关产品设计、研发、制造的国家级高新技术企业。公司以具有突出优势的航空工装业务为基础，积极开拓了航空零部件和部段、无人机等业务，产品覆盖军用和民用航空工业各领域，成为专业化程度高、技术积累丰富、广受认可的航空工业相关产品供应商。公司的客户主要为中航工业、中国商飞等国内航空工业核心制造商旗下的各飞机主机制造厂商，航天科工、中国兵装等军工央企集团下属科研院所及科研生产单位，军队研究所等军方单位。目前，公司已获得开展业务所需的航空、军工相关资质，包括AS9100航空航天质量管理体系认证、ISO9001:2015质量管理体系认证以及GJB9001C-2017国军标质量管理体系认证证书、武器装备科研生产单位三级保密资格证书、装备承制单位注册证书等。,ir@glavi.cn,"专业从事航空工业相关产品设计,研发,制造",杨怀忠,黑龙江,21024.0,吴铁华,20110225,www.guanglianhangkong.com/www.glavi.cn,广联航空,0,SZSE,SZSE,航空航天和国防,31010,-,航空航天和国防,31010010,6571090000,-10.37,-29.54,¥32.60,工业,310,0.0,900,29100.0,0.0,10000.0,900,0.0,0.0,1.0,72.29,42.99,57.32,-43.13,2020-12-31T05:00:00Z,{1_trade_buy},{trade_buy},2020Q4_1749049
300879,2020Q4_1749037,浙江省宁波市余姚市锦凤路58号,"园林机械及配件、农业机具、园林机具、电动工具、清洁设备、电器配件、电机、电子元器件、汽油机及模具的制造、加工、测试。自营和代理各类货物和技术的进出口,无进口商品分销业务。(不涉及国营贸易管理商品,涉及配额、许可证管理商品的,按国家有关规定办理申请。)(不涉及外商投资准入特别管理措施范围。)(依法须经批准的项目，经相关部门批准后方可开展经营活动。)",叶晓波,宁波市,公司是国内园林机械行业领先企业，割草机龙头企业，是中国电器工业协会电动工具分会副理事长单位，是浙江省安监局认可的安全生产标准化二级企业(机械)，是中国内燃机工业协会公布的中国内燃机及零部件行业排头兵企业，获得过国际环保署颁发的低碳制造计划铂金奖证书。自2009年起被评为高新技术企业，拥有浙江省企业技术中心、省级工业设计中心，公司实验室为德国TUV南德集团授权认可的目击电气测试实验室。公司的“自走式高效环保园林汽油割草机”和“低排放低噪音轻型化二冲程汽油割灌机”被列入国家火炬计划产业化示范项目，割草机产品是中国林业机械协会“向社会推荐产品”。以自主研发实力和产品质量为基础，公司还致力于推动行业规范健康发展，负责制定或参加起草国家和行业标准8项，是中国林业机械标准化技术委员会委员单位。公司已经成为国际园林机械行业中具有较高知名度的ODM生产商，在生产技术、产品品质、制造规模等方面具有较高的市场地位，产品销往德国、法国、波兰、荷兰、俄罗斯、英国、加拿大、澳大利亚等全球50多个国家和地区，积累了一批优质客户资源，主要客户包括安达屋集团、牧田、富世华集团、翠丰集团、HECHT、百力通等。,zjb01@dayepower.com,"主要从事割草机,打草机/割灌机,其他动力机械及配件的研发设计,生产制造和销售.",叶晓波,浙江,16000.0,吴军,20060217,www.dayepower.com,大叶股份,0,SZSE,SZSE,工业制品,31070,-,工具和配件,31070050,3536212000,-16.73,-21.45,¥21.44,工业,310,0.0,500,12600.0,0.0,10000.0,500,0.0,0.0,1.0,69.99,27.74,36.43,-41.15,2020-12-31T05:00:00Z,{1_trade_buy},{trade_buy},2020Q4_1749037
300898,2020Q4_1749048,浙江省温州市苍南县灵溪镇建兴东路650-668号,食品生产销售、食品经营(含销售预包装)、乳制品生产销售、食品添加剂生产销售、饮料生产、农副产品销售、金属包装容器及材料制造、金属材料销售、货物进出口、道路货物运输、技术服务、技术开发、技术咨询、技术交流、技术转让、技术推广。,李作恭,温州市,公司自成立以来一直运营“熊猫”牌系列炼乳产品，经过多年的发展，公司目前已成为国内炼乳领域的领军企业，公司的“熊猫”牌炼乳最早于2006年获评为“浙江名牌产品”，公司“熊猫”品牌于2010年获评为“浙江老字号”，于2015年被认定为“浙江省著名商标”，于2016年被认定为“驰名商标”，在国内乳制品行业具有较高的影响力和知名度。公司的炼乳产品获得了国内众多知名食品生产企业的认可，公司与香飘飘、蒙牛乳业、达能乳业、江中食疗等公司建立并保持了良好的业务关系。根据中国乳制品工业协会统计，2016年公司炼乳产品销售规模仅次于雀巢，是国内市场第二大炼乳品牌。,300898@pandairy.com,"浓缩乳制品的研发,生产,销售",李锡安,浙江,12400.0,徐笑宇,19960103,www.pandadairy.com,熊猫乳品,0,SZSE,SZSE,农副加工食品,20525,-,加工食品,20525040,4508399000,-3.81,-22.6,¥35.83,非周期性消费,205,0.0,500,16400.0,0.0,10000.0,500,0.0,0.0,1.0,77.68,46.71,57.99,-38.21,2020-12-31T05:00:00Z,{1_trade_buy},{trade_buy},2020Q4_1749048
300896,2020Q4_1749047,北京市朝阳区建国路甲92号世茂大厦C座21层,药品、生物制品、医疗器械、化妆品的技术开发、转让；新型药用辅料的开发、生产；生产化妆品；货物进出口、技术进出口、代理进出口；企业管理咨询(不含中介服务)；销售(含网上销售)医疗器械、化妆品；批发、零售(含网上销售)食品；批发(含网上销售)药品。生产医疗器械III类：III-6846-1植入器材。(该公司2018年10月17日前为内资企业，于2018年10月17日变更为外商投资企业；批发、零售(含网上销售)食品、批发(含网上销售)药品以及依法须经批准的项目，经相关部门批准后依批准的内容开展经营活动)(经营场所：北京市平谷区中关村科技园区平谷园马坊工业园区马坊镇金平西路20号院)。,简军,北京市,公司是国内生物医用软组织修复材料领域的创新型领先企业。公司立足于生物医用材料的研发和转化，致力于重组蛋白和多肽等生物医药的开发，已成功实现注射类透明质酸钠系列产品及聚对二氧环己酮面部埋植线的产业化，并建立了医用几丁糖、聚乳酸等生物医用材料的产品技术转化平台，产品临床应用涵盖医疗美容、外科修复以及代谢疾病治疗等领域。公司是首家取得国家药监局批准用于面部软组织修复的注射用透明质酸钠医疗器械产品注册证书的国内企业。截至报告期末，公司已拥有五款获国家药监局批准的III类注射用透明质酸钠系列产品，为获得国家药监局批准的同类产品最多的企业。公司五款产品在配方组份、注射部位、注射体验等方面有所不同，能够满足多个细分市场的消费需求。此外，公司已于2019年5月取得聚对二氧环己酮面部埋植线的III类医疗器械注册证书，为首款取得国家药监局批准的面部埋植线产品。公司重视研发投入和产品开发，是国家级高新技术企业，建有生物可降解新材料北京市工程实验室。公司作为牵头单位参与了国家科学技术部“十三五”规划国家重点研发计划“新型颌面软硬组织修复材料研发”项目。截至报告期末，公司拥有32项专利，其中发明专利18项。,ir@imeik.com,"公司立足于生物医用材料的研发和转化,致力于重组蛋白和多肽等生物医药的开发,公司自主研发的产品主要针对面部,颈部褶皱皮肤的修复.",石毅峰,北京,21636.0,简勇,20040609,www.imeik.net,爱美客,0,SZSE,SZSE,医疗器械,20650,-,医疗器械和供给,20650020,172349410000,57.0,121.06,¥773.15,医疗保健,206,0.0,900,285400.0,0.0,10000.0,900,0.0,0.0,1.8,363.9,183.33,295.83,161.35,2020-12-31T05:00:00Z,{1_trade_buy},{trade_buy},2020Q4_1749047
300890,2020Q4_1749041,广东省深圳市龙华新区龙华街道清祥路1号宝能科技园9栋C座20楼J单元,改性石墨负极材料、锂离子电池负极材料的技术开发及销售，其它国内贸易(以上均不含法律、行政法规、国务院决定规定需前置审批和禁止的项目)；经营进出口业务(法律、行政法规、国务院决定禁止的项目除外，限制的项目须取得许可后方可经营)；新能源行业投资(具体投资项目另行申报)。,周鹏伟,深圳市,"公司是一家从事锂离子电池负极材料的研发、生产和销售的高新技术企业，是国内先进的锂电池负极材料供应商，主要产品分为天然石墨和人造石墨两大类，产品应用于包括动力(电动交通工具，如新能源汽车、电动自行车等)、3C消费电子和工业储能等锂离子电池领域。经过多年发展，公司建立了一支高素质的研发团队和专家顾问团队，主要成员来源于清华大学、中科院等高等院所，并成为清华大学、重庆大学等知名院校的研究生联合培养基地和产学研合作基地,公司“动力电池用新型高性能微膨石墨负极材料的研发项目”获得“深圳市科学技术奖——技术发明二等奖”；“动力电池长循环硅/碳复合负极材料的研发与产业化项目”被深圳市经信委列为2018年第一批战略性新兴产业和未来产业发展专项资金中的“创新链+产业链”融合专项扶持计划(直接资助类)；获批广东省科技型中小企业技术创新基金项目等多项荣誉。",public@xfhinc.com,"主要从事锂离子电池负极材料的研发,生产和销售的高新技术企业,是国内先进的锂电池负极材料供应商,主要产品分为天然石墨和人造石墨两大类,产品应用于包括动力(电动交通工具,如新能源汽车,电动自行车等),3C消费电子和工业储能等锂离子电池领域.",赵东辉,广东,10000.0,叶文国,20090612,www.xiangfenghua.com,翔丰华,0,SZSE,SZSE,化工,10130,-,特种化学制品,10130020,5684329000,36.22,7.33,¥58.75,基础材料,101,0.0,300,14000.0,0.0,10000.0,300,0.0,0.0,1.0,71.5,47.3,59.33,-0.98,2020-12-31T05:00:00Z,{1_trade_buy},{trade_buy},2020Q4_1749041
300894,2020Q4_1749045,浙江省嘉兴市海宁市尖山新区新城路366号,许可项目：电热食品加工设备生产；货物进出口；第二类增值电信业务(依法须经批准的项目，经相关部门批准后方可开展经营活动，具体经营项目以审批结果为准)。一般项目：家用电器研发；家用电器制造；家用电器销售；非电力家用器具销售；非电力家用器具制造；机械电气设备制造；家具制造；家具销售；家居用品制造；家居用品销售；互联网销售(除销售需要许可的商品)(除依法须经批准的项目外，凭营业执照依法自主开展经营活动)。,黄卫斌,嘉兴市,火星人厨具股份有限公司是一家立志解决厨房油烟的高科技公司，火星人集成灶是其核心产品，凭借核心技术，油烟净化率达到99.95%；成立短短6年时间，优质的产品质量积累下了良好的口碑，全国专卖店达一千多家，销售额每年以翻倍的速度增长，发展速度和行业规模位居行业前列。火星人自成立起，就在行业内崭露头角，产品X7获得世界级工业设计大奖：德国IF设计金奖；央视纪录片《工匠精神》指定入选的集成灶企业；售后服务获得国家五星级认证服务企业；行业内首推蒸箱集成灶，是第三代集成灶的代表；火星人坚持投入巨资自主研发，大部分产品获得原创性设计大奖，目前产品系列有消毒柜款X7、X2、X5、Q5、E3(天猫电商款)，蒸箱款X7Z、X2Z、Q5Z、X3Z(京东电商款)，集成水槽A2、A3、A5、K2。,dongshiban@marssenger.com;maoweiping@marssenger.com,"公司专业从事新型中高端厨房电器产品的研发,设计,生产与销售业务,主要产品包括集成灶,集成水槽,集成洗碗机等系列产品.",黄卫斌,浙江,40500.0,毛伟平,20100408,www.marssenger.com,火星人,0,SZSE,SZSE,家具制造,10220,-,家具制造,10220010,29425439000,53.38,56.22,¥74.21,周期性消费,102,0.0,6300,300100.0,0.0,10000.0,6300,0.0,0.0,1.0,49.0,49.0,49.0,51.45,2020-12-31T05:00:00Z,{1_trade_buy},{trade_buy},2020Q4_1749045
