symbol,_id,address,business_scope,chairman,city,descrpt,email,main_business,manager,province,reg_capital,secretary,setup_date,website,company,dividend_startyear,exchange,exchange_,group,groupcode,index_stockid,industry,industrycode,mktcap_norm_cny,pchange_12w,pchange_ytd,price,sector,sectorcode,share_percentage,shares,value,position,change,share_change,impact,abs_impact,split_factor,price_max,price_min,price_avg,change_from_average,portdate,action,comment,oid
300760,2020Q4_1749027,广东省深圳市南山区高新技术产业园区科技南十二路迈瑞大厦1-4层,生产经营医疗电子仪器及其配套试剂及产品的软件开发(不含国家限制项目)；自产产品售后服务，自有房屋租赁。,李西廷,深圳市,公司是中国领先的高科技医疗设备研发制造厂商，为全球市场提供医疗器械产品。公司的主营业务覆盖生命信息与支持、体外诊断、医学影像三大领域，通过前沿技术创新，提供更完善的产品解决方案，帮助世界改善医疗条件、提高诊疗效率。公司始终致力于临床医疗设备的研发和制造，产品涵盖生命信息与支持、临床检验及试剂、数字超声、放射影像四大领域，将性能与价格完美平衡的医疗电子产品带到世界每一角落。,ir@mindray.com,"主营业务:公司主要从事医疗器械的研发,制造,营销及服务,主要产品涵盖三大领域:生命信息与支持,体外诊断以及医学影像,目前已拥有丰富的产品品类.",吴昊,广东,121569.13,李文楣,19990125,www.mindray.com,迈瑞医疗,2019,SZSE,SZSE,医疗器械,20650,-,医疗设备,20650010,548906596000,15.47,7.75,¥433.99,医疗保健,206,0.21,2519800,1073448000.0,8.49,575.73,2146900,7.23,7.23,1.0,426.0,290.82,347.05,25.05,2020-12-31T05:00:00Z,{2_trade_add},{trade_add} 575.73 %,2020Q4_1749027
603288,2020Q4_1749066,广东省佛山市文沙路16号,生产经营调味品、豆制品、食品、饮料、包装材料；农副产品的加工；其他电信服务；货物、技术进出口；信息咨询服务；批发兼零售预包装食品。,庞康,佛山市,公司是中国调味品行业的龙头企业，专业的调味品生产和营销企业，溯源于清代中叶乾隆年间开始鼎盛的佛山酱园，距今己有300多年的历史，是中华人民共和国商务部公布的首批“中华老字号”企业之一。目前生产的产品涵盖酱油、蚝油、酱、醋、料酒、调味汁、鸡精、鸡粉、腐乳等几大系列百余品种300多规格，年产值过百亿元。以“传扬美味事业，酿造美满生活”为己任，海天一直致力于用现代科研技术对传统酿造工艺的传承和创新，建有规模超大的玻璃晒池和发酵大罐，专门用于高品质酱油的阳光酿晒。拥有多条世界领先的全自动包装生产线，以及行业领先的国家认可实验室，更严格地执行质量标准。并从国外引进成套科研检测设备，努力打造具有世界领先水平的调味品生产基地。,OBD@haday.cn,"主营业务为一直专注于调味品的生产和销售,调味品主要用于增加菜肴的色,香,味以满足人的感官需要,促进人体进食的食欲并增进人体健康,是一种有益于人体健康的辅助食品.公司目前生产的调味品涵盖了酱油,调味酱,蚝油,鸡精鸡粉,味精,调味汁等多个系列,其中酱油,调味酱,蚝油是目前公司最主要的产品.",庞康,广东,421257.62,张欣,20000408,www.haitian-food.com,海天味业,2014,SHSE,SHSE,农副加工食品,20525,-,加工食品,20525040,537213375000,0.94,-14.81,¥123.21,非周期性消费,205,0.07,2932512,445519500.0,3.52,270.27,2140512,2.57,2.57,1.32,152.27,120.61,132.15,-6.77,2020-12-31T05:00:00Z,{2_trade_add},{trade_add} 270.27 %,2020Q4_1749066
002415,2020Q4_1749016,浙江省杭州市滨江区物联网街518号,一般项目：数字视频监控系统制造；数字视频监控系统销售；安防设备制造；安防设备销售；物联网设备制造；物联网设备销售；智能无人飞行器制造；智能无人飞行器销售；服务消费机器人制造；工业机器人制造；特殊作业机器人制造；智能机器人销售；计算机软硬件及外围设备制造；计算机软硬件及辅助设备批发；通信设备制造；通信设备销售；网络设备制造；网络设备销售；显示器件制造；显示器件销售；智能车载设备制造；智能车载设备销售；汽车零部件及配件制造；汽车零配件批发；电气信号设备装置制造；电气信号设备装置销售；机械电气设备制造；电气机械设备销售；特种劳动防护用品生产；特种劳动防护用品销售；电子产品销售；数字文化创意技术装备销售；技术服务、技术开发、技术咨询、技术交流、技术转让、技术推广；软件开发；信息系统集成服务；计算机系统服务；物联网技术研发；物联网技术服务；物联网应用服务；大数据服务；数据处理和存储支持服务；安全系统监控服务；安全技术防范系统设计施工服务；电子、机械设备维护(不含特种设备)；停车场服务；数字文化创意内容应用服务；环境保护监测；从事科技培训的营利性民办培训机构(除面向中小学生开展的学科类、语言类文化教育培训)。(除依法须经,陈宗年,杭州市,公司是领先的视频产品和内容服务提供商，面向全球提供领先的视频产品、专业的行业解决方案与内容服务。公司积极布局新兴市场和新兴业务，基于互联网推出了面向家庭和小微企业的相关产品及云服务平台；进入智能制造领域，推出了一系列机器视觉产品及解决方案。公司产品已涵盖视频监控系统的所有主要设备，包括前端采集设备、后端存储及集中控制、显示、管理及储存设备。典型视频监控系统的前端设备主要包括摄像机(采集视音频信号)及DVS(压缩及编码视音频信号)；典型视频监控系统的后端设备主要包括录像机(记录及存储视音频信号)；典型视频监控系统的中心控制设备主要包括集中控制设备(控制、检索及显示视音频信号)、VMS软件及中心储存设备。此外，公司拥有门禁、报警、可视对讲等系列大安防领域的产品。,hikvision@hikvision.com;market@hikvision.com;ir@hikvision.com,"主营业务:安防视频监控产品研发,生产和销售,产品包括硬盘录像机(DVR),视音频编解码卡等数据存储及处理设备,以及监控摄像机,监控球机,视频服务器(DVS)等视音频信息采集处理设备.本公司产品主要包括后端数据存储及处理设备中的核心设备DVR,视音频编解码卡;前端视音频信息采集处理设备中的监控摄像机,监控球机,视频服务器(DVS)等,其中硬盘录像机,视音频编解码卡是目前公司的核心产品.",胡扬忠,浙江,934341.72,黄方红,20011130,www.hikvision.com,海康威视,2010,SZSE,SZSE,硬件,31120,-,计算机硬件,31120020,592935295000,13.8,32.22,¥62.49,科技,311,0.1,9742100,472589300.0,3.74,165.53,6073200,2.33,2.33,1.0,49.11,38.15,44.85,39.33,2020-12-31T05:00:00Z,{2_trade_add},{trade_add} 165.53 %,2020Q4_1749016
600276,2020Q4_1749061,江苏省连云港市经济技术开发区昆仑山路7号,片剂(含抗肿瘤药)、口服溶液剂、混悬剂、无菌原料药(抗肿瘤药)、原料药(含抗肿瘤药)、精神药品、软胶囊剂(含抗肿瘤药)、冻干粉针剂(含抗肿瘤药)、粉针剂(抗肿瘤药、头孢菌素类)、吸入粉雾剂、口服混悬剂、口服乳剂、大容量注射剂(含多层共挤输液袋、含抗肿瘤药)、小容量注射剂(含抗肿瘤药、含非最终灭菌)，生物工程制品(聚乙二醇重组人粒细胞刺激因子注射液)、硬胶囊剂(含抗肿瘤药)、颗粒剂(抗肿瘤药)、粉雾剂、膜剂、凝胶剂、乳膏剂的制造；中药前处理及提取；医疗器械的研发、制造与销售；一般化工产品的销售；自营和代理各类商品及技术的进出口业务，但国家限定公司经营或禁止进出口的商品和技术除外。,周云曙,连云港市,公司是一家从事医药创新和高品质药品研发、生产及推广的医药健康企业，致力于在抗肿瘤药、手术用药、内分泌治疗药、心血管药及抗感染药等领域的创新发展，并逐步形成品牌优势。公司是国内知名的抗肿瘤药、手术用药和造影剂的供应商，也是国家抗肿瘤药技术创新产学研联盟牵头单位，建有国家靶向药物工程技术研究中心、博士后科研工作站。公司先后被评为“全国医药系统先进集体”、“国家重点高新技术企业”，国家火炬计划新医药研究开发及产业化基地的骨干企业之一，“国家863计划成果产业化基地”，连续多年被国家统计局列为全国化学制药行业十佳效益企业。,ir@hengrui.com,"主要产品:抗肿瘤药,抗感染药.",周云曙,江苏,639747.76,刘笑含,19970428,www.hrs.com.cn,恒瑞医药,2019,SHSE,SHSE,医药制造,20620,-,通用医药制造,20620010,387988678000,-11.75,-34.93,¥60.09,医疗保健,206,0.12,7906440,734375800.0,5.8,102.19,3996000,2.93,2.93,1.2,95.84,71.25,77.59,-22.55,2020-12-31T05:00:00Z,{2_trade_add},{trade_add} 102.19 %,2020Q4_1749061
600887,2020Q4_1749064,内蒙古自治区呼和浩特市金山开发区金山大街1号,乳制品(含婴幼儿配方乳粉)制造；特殊医学用途配方食品的生产、销售(取得许可证后方可经营)；食品、饮料加工；牲畜，家禽饲养；汽车货物运输；饮食服务(仅限集体食堂)；本企业产的乳制品、食品，饮料；乳制品及乳品原料；预包装食品的销售。农畜产品及饲料加工，经销食品、饮料加工设备、生产销售包装材料及包装用品、五金工具、化工产品(专营除外)、农副产品，日用百货，畜禽产品，饲料；进口：本企业生产、科研所需的原辅材料，机械设备，仪器仪表及零配件；经营本企业自产产品及相关技术的出口业务；机器设备修理劳务(除专营)和设备备件销售(除专营)业务；玩具的生产与销售；宋体复配食品添加剂的制造和销售(取得许可证后方可经营)；互联网销售(除销售需要许可的商品)。(依法须经批准的项目，经相关部门批准后方可开展经营活动),潘刚,呼和浩特市,公司一直为消费者提供健康、营养的乳制品，规模大、产品线健全，是符合奥运会标准，为2008年北京奥运会提供服务的乳制品企业；也是符合世博会标准，为2010年上海世博会提供服务的乳制品企业。目前，伊利在亚洲、欧洲、美洲、大洋洲等乳业发达地区构建了一张覆盖全球资源体系、全球创新体系、全球市场体系的骨干大网。伊利一直坚持和推动创新战略，经过多年发展，已经建立了多个领先的技术研发和产学研合作平台，持续推动行业创新。其中，国家认定企业技术中心、乳品深加工技术国家和地方联合工程研究中心、全国冷冻饮品标准化技术委员会秘书处、国家乳制品加工技术研发专业分中心、国家乳肉检测中心的乳品检测研究室等都属于国家级别的研发创新平台。,info@yili.com;qxm@yili.com;ytnliuyanan@yili.com,"液体乳系列,冷饮产品系列,奶粉及奶食品系列,混和饲料,方便食品",潘刚,内蒙古,606512.56,邱向敏,19930604,www.yili.com,伊利股份,2012,SHSE,SHSE,农副加工食品,20525,-,加工食品,20525040,217200092000,-5.64,-17.47,¥35.08,非周期性消费,205,0.24,14899000,661068600.0,5.23,65.54,5899000,2.07,2.07,1.0,44.37,31.59,38.42,-8.69,2020-12-31T05:00:00Z,{2_trade_add},{trade_add} 65.54 %,2020Q4_1749064
600519,2020Q4_1749062,贵州省仁怀市茅台镇,茅台酒系列产品的生产与销售；饮料、食品、包装材料的生产、销售；防伪技术开发、信息产业相关产品的研制、开发；酒店经营管理、住宿、餐饮、娱乐、洗浴及停车场管理服务(具体内容以工商核定登记为准)。,高卫东,遵义市,公司是国内白酒行业的标志性企业，主要生产销售世界三大名酒之一的茅台酒，同时进行饮料、食品、包装材料的生产和销售，防伪技术开发，信息产业相关产品的研制开发。茅台酒历史悠久，源远流长，是酱香型白酒的典型代表，享有“国酒”的美称。目前，公司茅台酒年生产量已突破一万吨，43°、38°、33°茅台酒拓展了茅台酒家族低度酒的发展空间，茅台王子酒、茅台迎宾酒满足了中低档消费者的需求，15年、30年、50年、80年陈年茅台酒填补了我国极品酒、年份酒、陈年老窖的空白，在国内独创年代梯级式的产品开发模式。公司产品形成了低度、高中低档、极品三大系列70多个规格品种，全方位跻身市场，从而占据了白酒市场制高点，称雄于中国极品酒市场。,mtdm@moutaichina.com,"主要产品:高度茅台酒(含陈年茅台酒),低度茅台酒.",李静仁,贵州,125619.78,刘刚,19991120,www.moutaichina.com,贵州茅台,2014,SHSE,SHSE,酒精饮料,20510,-,其他酒类,20510020,2482710431000,0.08,0.97,¥1955.34,非周期性消费,205,0.04,545800,1090524400.0,8.62,44.77,168800,2.67,2.67,1.0,1998.0,1541.79,1721.71,13.57,2020-12-31T05:00:00Z,{2_trade_add},{trade_add} 44.77 %,2020Q4_1749062
000333,2020Q4_1749010,广东省佛山市顺德区北滘镇美的大道6号美的总部大楼,生产经营家用电器、电机及其零部件；从事家用电器、家电原材料及零配件的进出口、批发及加工业务(不设店铺，不涉及国营贸易管理商品，涉及配额、许可证管理商品的按国家规定办理)；信息技术服务；为企业提供投资顾问及管理服务；计算机软件、硬件开发；家电产品的安装、维修及售后服务；工业产品设计；酒店管理；广告代理；物业管理；企业所需的工程和技术研究、开发及其销售和推广；对金融业进行投资。(经营范围涉及行政许可的项目须凭有效许可证或批准证明经营),方洪波,佛山市,公司是一家消费电器、暖通空调、机器人与自动化系统、智能供应链(物流)的科技集团，提供多元化的产品种类与服务，包括以厨房家电、冰箱、洗衣机、及各类小家电为核心的消费电器业务；以家用空调、中央空调、供暖及通风系统为核心的暖通空调业务；以库卡集团、美的机器人公司等为核心的机器人及自动化系统业务;以安得智联为集成解决方案服务平台的智能供应链业务。公司以“科技尽善，生活尽美”为企业愿景，将“联动人与万物，启迪美的世界”作为使命，恪守“敢知未来——志存高远、务实奋进、包容共协、变革创新”的价值观，整合全球资源，推动技术创新，每年为全球超过3亿用户、及各领域的重要客户与战略合作伙伴提供满意的产品和服务，致力创造美好生活。,IR@midea.com,"以家电产业为主,涉足电机,物流等领域,旗下分为四大业务板块,分别为大家电,小家电,电机及物流",方洪波,广东,704515.93,江鹏,20000407,www.midea.com,美的集团,2014,SZSE,SZSE,家具制造,10220,-,家具制造,10220010,504918392000,-9.25,-26.09,¥69.70,周期性消费,102,0.09,6625200,652185400.0,5.16,32.5,1625200,1.27,1.27,1.0,98.44,61.19,76.9,-9.36,2020-12-31T05:00:00Z,{2_trade_add},{trade_add} 32.50 %,2020Q4_1749010
601888,2020Q4_1749065,北京市东城区东直门外小街甲2号A座8层,旅游服务及旅游商品相关项目的投资与管理，旅游服务配套设施的开发、改造与经营，旅游产业研究与咨询服务等。,彭辉,北京市,公司所属行业为旅游业，目前主要从事旅行社业务和免税业务，其中旅行社业务主要包括入境游、出境游、国内游、会奖旅游、签证服务、商旅服务、航空服务、电子商务等业务；免税业务主要包括烟酒、香化等免税商品的批发、零售等业务。此外，公司还从事旅游综合项目开发业务，主要包括旅游综合项目投资开发、旅游景区景点投资开发和旅游股权投资等业务。公司下属全资子公司国旅总社、中免公司及国旅投资公司分别负责公司的旅行社业务、免税业务、旅游综合项目投资开发业务。,citszq@citsgroup.com.cn,旅行社业务和免税业务.,陈国强,北京,195247.55,常筑军,20080328,www.citsgroup.net,中国中免,2011,SHSE,SHSE,旅游和娱乐,10290,-,旅游服务,10290050,554230378000,1.01,1.23,¥275.18,周期性消费,102,0.22,4258800,1202898300.0,9.51,28.67,948900,2.12,2.12,1.0,282.45,166.14,207.58,32.57,2020-12-31T05:00:00Z,{2_trade_add},{trade_add} 28.67 %,2020Q4_1749065
002311,2020Q4_1749015,广东省广州市番禺区南村镇万博四路42号海大大厦2座701,饲料、添加剂的生产和技术开发、技术服务，畜牧、水产品的养殖、加工和技术开发、技术服务；以上产品及饲料原料、农副产品的批发、佣金代理(拍卖除外)及进出口业务(涉及配额许可证管理、专项规定管理的商品按照国家有关规定办理)，粮食收购。,薛华,广州市,公司是一家集研发、生产和销售水产饲料、畜禽饲料和水产饲料预混料以及健康养殖为主营业务的高科技型上市公司，核心业务是水产饲料、水产苗种和动保产品。公司已经实现了在全国重点水产养殖区域的生产和销售。公司资金充足，银行信誉评级为AAA级。集团积极倡导绿色健康养殖，所属分子公司均通过了ISO9000、HACCP认证。多年来，公司先后获得“中国名牌”、“广东省著名商标”、“广东省名牌产品”等殊荣，海大集团被认定为“农业产业化国家重点龙头企业”、“国家农产品加工技术研发专业分中心”、“高新技术企业”等。,zqbgs@haid.com.cn,"水产预混料,水产配合饲料和畜禽配合饲料的研发,生产和销售.",薛华,广东,166116.11,黄志健,20040108,www.haid.com.cn,海大集团,2018,SZSE,SZSE,农副加工食品,20525,-,加工食品,20525040,122002694000,-2.07,13.66,¥71.91,非周期性消费,205,0.72,11999900,785996300.0,6.21,22.45,2199900,1.14,1.14,1.0,74.0,47.31,61.33,17.25,2020-12-31T05:00:00Z,{2_trade_add},{trade_add} 22.45 %,2020Q4_1749015
000858,2020Q4_1749014,四川省宜宾市翠屏区岷江西路150号,主营：酒类产品及相关辅助产品(瓶盖、商标、标识及包装制品)的生产经营；兼营：饮料、药品、水果种植、农业种植、进出口业务、物业管理、投资管理等。,曾从钦,宜宾市,公司是以五粮液及其系列酒的生产、销售为主要产业，同时生产经营精密塑胶制品、大中小高精尖注射和冲压模具现代制造产业，以及生物工程为发展产业，药业工业、印刷业、电子器件产业、物流运输和相关的服务业的具有深厚企业文化的现代化企业集团。公司现已系统研制开发了五粮春、五粮神、五粮醇等几十种不同档次、不同口味，满足不同区域、不同文化背景、不同层次消费者需求的系列产品。数年来“五粮液”品牌连续在中国白酒制造业和食品行业“最有价值品牌”中排位居前，具有领导市场的影响力。目前公司根据消费者的个性化需求，进一步细分、微分市场，新设计开发国宝五粮液、人民大会堂国宴五粮液等，丰富和完善产品线，加快新产品开发步伐，有效地支持了公司经营业绩持续增长。,000858-wly@sohu.com;lixinyi@wuliangye.com.cn,主要产品:五粮液系列酒.,,四川,388160.8,彭智辅,19980421,www.wuliangye.com.cn,五粮液,2015,SZSE,SZSE,酒精饮料,20510,-,其他酒类,20510020,1079600995000,10.79,-2.89,¥277.45,非周期性消费,205,0.09,3677100,1073159300.0,8.48,12.79,417100,0.96,0.96,1.0,291.85,188.73,238.44,16.36,2020-12-31T05:00:00Z,{2_trade_add},{trade_add} 12.79 %,2020Q4_1749014
000596,2020Q4_1749012,安徽省亳州市谯城区古井镇,粮食收购(凭许可证经营)、生产白酒、酿酒设备、包装材料、玻璃瓶、酒精、油脂(限于酒精生产的副产品)、高新技术开发、生物技术开发、农副产品深加工，销售自产产品。,梁金辉,亳州市,公司是中国老八大名酒企业，中国制造业500强企业，是以中国第一家同时发行A、B两支股票的白酒类上市公司安徽古井贡酒股份有限公司为核心的国家大型一档企业，坐落在历史名人曹操与华佗故里、世界十大烈酒产区之一的安徽省亳州市。公司致力于打造以白酒主业为核心的“制造业平台”，以地产和商旅为主的“实业平台”，以金融集团为主的“金融平台”和以酒文化、酒生态、酒产业、酒旅游为核心的“文旅平台”。古井贡酒先后获得中国地理标志产品、国家重点文物保护单位、国家非物质文化遗产保护项目、安徽省政府质量奖、全国质量标杆等荣誉，被世人誉为“酒中牡丹”“东方神水”“中华第一贡”。,gjzqb@gujing.com.cn,主要产品:白酒.,周庆伍,安徽,50360.0,叶长青,19990305,www.gujing.com,古井贡酒,2016,SZSE,SZSE,酒精饮料,20510,-,其他酒类,20510020,100568650000,2.62,-13.55,¥227.72,非周期性消费,205,0.44,2222400,604480800.0,4.78,11.12,222400,0.48,0.48,1.0,278.5,163.8,222.27,2.45,2020-12-31T05:00:00Z,{2_trade_add},{trade_add} 11.12 %,2020Q4_1749012
600809,2020Q4_1749063,山西省汾阳市杏花村,主营：汾酒、竹叶青酒及其系列酒的生产、销售。兼营：酒类高新技术及产品研究、开发、生产、应用；投资办企业及相关咨询服务；副产品酒糟、生产用原辅材料和包装材料等的销售；道路普通货物运输。,李秋喜,吕梁市,公司是生产国家名酒汾酒、竹叶青酒、玫瑰汾酒、白玉汾酒等系列产品的大型一档企业。公司主要遵循研-产-供-销一体化发展模式。根据市场需求研发新酒体并制定采购计划和生产计划，原粮实现100%基地供应。汾酒在山西市场拥有领导地位。在山西市场上，公司建立了完善的营销网络，是当之无愧的市场领袖。公司是白酒行业唯一拥有“汾”、“竹叶青”、“杏花村”三大中国驰名商标的企业。公司主导产品汾酒是中国传统的历史名酒，清香型白酒的典型代表，工艺精湛，源远流长，素以入口绵、落口甜、饮后余香、回味悠长特色而著称，在国内外消费者中享有较高的知名度、美誉度和忠诚度。公司拥有全国一流的酿酒技术队伍和酿酒勾贮设备，拥有系统完善的ISO9001：2000质量保证体系，是全国食品饮料业、全国轻工业最佳企业之一，是山西省农业产业化的龙头企业，也是山西省食品产业调整和振兴规划中的重点龙头企业，是山西省综改实验的排头兵。,sxfj@fenjiu.com.cn;wpx@fenjiu.com.cn;Wang.tao@fenjiu.com.cn,"主要产品:白酒,配制酒",谭忠豹,山西,87151.03,王涛,19851225,www.fenjiu.com.cn,山西汾酒,2016,SHSE,SHSE,酒精饮料,20510,-,其他酒类,20510020,453996106000,48.87,39.63,¥369.89,非周期性消费,205,0.25,3065300,821697500.0,6.5,0.0,0,0.0,0.0,1.4,108.04,64.85,83.7,341.92,2020-12-31T05:00:00Z,{3_not_change},-,2020Q4_1749063
